,start_text,start_index,end_text,end_index,text,timestamp
1,S T E N O G R A M A,0,şedinţei Senatului din 2 martie 2022,21, ,"(120.0, 7676.94)"
2,şedinţei Senatului din 2 martie 2022,21,S U M A R,61, ,"(120.0, 7676.94)"
3,S U M A R,61,S T E N O G R A M A,2893, unu intrebari si interpelari trei o mie sase sute treizeci si cinci patruzeci si doi doi declaratii politice saisprezece trei mii patru sute patruzeci si doi trei nota pentru exercitarea de catre senatori a dreptului de sesizare a curtii patruzeci si doi patruzeci si patru constitutionale asupra legilor depuse la secretarul general al senatului conform optzeci si trei optzeci si patru prevederilor art cincisprezece alin saptezeci si doi treisprezece apel nominal telefonic saptezeci si doi ,"(5771.94, 5917.94)"
4,S T E N O G R A M A,2893,şedinţei Senatului din 2 martie 2022,2914, ,"(120.0, 7676.94)"
5,şedinţei Senatului din 2 martie 2022,2914,Domnul Virgil Guran:,3244, sedinta a inceput la ora noua treizeci si doi lucrarile sedintei au fost conduse de domnul virgil guran inlocuit de doamna alina stefania gorghiu vicepresedinti ai senatului asistati de domnul ion mocioalca inlocuit de domnul ion narcis mircescu si domnul sorin lavric secretari ai senatului ,"(120.0, 7676.94)"
6,Domnul Virgil Guran:,3244,Domnul Maricel Popa:,3838, buna dimineata stimati colegi declar deschisa sesiunea de intrebari interpelari de astazi doi martie doua mii douazeci si doi conducerea fiind asigurata de subsemnatul senator virgil guran vicepresedinte al senatului asistat de domnul senator ion mocioalca si domnul senator sorin lavric secretari ai senatului conform programului aprobat timpul alocat pentru sesiunea de intrebari interpelari este de saizeci de minute repartizat pe grupuri parlamentare potrivit ponderii acestora dau cuvantul domnului senator popa maricel si l rog sa prezinte si intrebarea si interpelarea ,"(5660.7, 5664.7)"
7,Domnul Maricel Popa:,3838,Domnul Virgil Guran:,7170, buna ziua domnule presedinte buna ziua stimati colegi am o interpelare adresata domnului ministru dan vilceanu ministrul investitiilor si proiectelor europene proiecte finantate din fonduri europene in exercitiul financiar doua mii paisprezece doua mii douazeci domnule ministru iasiul este unul dintre judetele care au accesat foarte multe fonduri europene in exercitiul financiar doua mii paisprezece doua mii douazeci in special datorita preocuparii deosebite a administratiei social democrate de la consiliul judetean conform datelor publicate pe site ul ministerului judetul iasi este pe locul trei intr un clasament al sumelor contractate cu sapte sase sute nouazeci si unu de miliarde de lei sunt in total trei sute paisprezece proiecte care au fost deja finalizate sau sunt in derulare dintre acestea optsprezece sunt contractate prin programul operational pentru infrastructura mare si daca da va rog sa transmiteti cand se va intampla acest lucru de asemenea daca raspunsul va fi negativ va rog sa detaliati care sunt motivele pentru care se mentine decizia adoptata la sfarsitul anului precedent solicit raspuns scris cu deosebita consideratie senator psd de iasi maricel popa va multumesc ,"(5660.7, 7038.94)"
8,Domnul Virgil Guran:,7170,Domnul Dorinel Cosma:,7284, multumesc domnule senator invit la microfon pe domnul senator cosma dorinel ,"(492.0, 7238.94)"
9,Domnul Dorinel Cosma:,7284,Domnul Virgil Guran:,9811, buna ziua domnule presedinte de sedinta buna ziua stimati colegi astazi voi prezenta o interpelare catre domnul prim ministru nicolae ionel ciuca obiectul interpelarii situatia refugiatilor ucraineni in romania domnule prim ministru in contextul agresiunii ruse aflate in plina desfasurare a razboiului de agresiune declansat de rusia impotriva vecinilor nostri ucraineni razboi care se desfasoara in proximitatea frontierelor tarii noastre si care produce o adevarata drama umanitara aproximativ patru sute de civili fiind ucisi pana in prezent multi cetateni ai ucrainei atat ucraineni cat si de alte nationalitati se refugiaza in romania pentru a fugi din calea acestui conflict militar nedrept si pentru a si salva viata in acest sens guvernul pe care l conduceti trebuie sa se mobilizeze pentru a facilita accesul refugiatilor ucraineni pe teritoriul romaniei si pentru a le oferi suportul necesar conform organizatiei natiunilor unite din data de douazeci si patru februarie pana in prezent au fugit din calea razboiului aproximativ cinci sute douazeci zero de persoane iar numarul acestora este in continua crestere estimandu se ca se va ajunge la patru milioane de refugiati romania este tara nato cu cea mai lunga frontiera cu ucraina sase sute patruzeci si noua patru kilometri astfel de la inceputul invaziei armatei ruse in ucraina saptezeci zero de persoane s au refugiat in tara noastra la punctele de trecere a frontierei de stat din ucraina catre romania formandu se cozi kilometrice de refugiati la vama siret fluxul foarte mare de persoane care vor sa paraseasca teritoriul ucrainei a generat intarzieri semnificative si chiar blocaje astfel societatea civila a reclamat ca sute de ucraineni majoritatea femei si copii sunt tinuti ore intregi pentru formalitati si a solicitat guvernului sa infiinteze de urgenta centre mobile de inregistrare pentru refugiatii din ucraina avand in vedere cele expuse mai sus va rog sa mi raspundeti cu celeritate la urmatoarele intrebari unu care sunt masurile concrete pe care guvernul romaniei le va intreprinde pentru ca refugiatii sa primeasca cu promptitudine suportul necesar si pentru facilitarea accesului acestora pe teritoriul romaniei doi cand preconizati ca vor fi infiintate centrele mobile de inregistrare pentru refugiatii din ucraina trei cate centre pentru refugiati exista in momentul actual pe teritoriul romaniei va solicit raspuns scris cu deosebita consideratie senator cosma dorinel botosani va multumesc ,"(2058.0, 7038.94)"
10,Domnul Virgil Guran:,9811,Domnul Dănuț Bica:,9934, va multumesc si eu domnule senator il invit la microfon pe domnul senator bica danut ,"(492.0, 7238.94)"
11,Domnul Dănuț Bica:,9934,Domnul Virgil Guran:,14618, multumesc domnule presedinte de sedinta intrebare adresata domnului barna tanczos ministrul mediului apelor si padurilor obiectul intrebarii regularizarea paraielor bascov budeasa si carcinov din judetul arges stimate domnule ministru lucrarile de regularizare a paraielor bascov budeasa si carcinov reprezinta cateva dintre urgentele investitionale din domeniul hidrografic la nivelul judetului arges cu impact major in ceea ce priveste protectia constructiilor si terenurilor agricole si siguranta populatiei din zonele respective pentru sustinerea celor mentionate anterior va informez ca in luna iulie doua mii paisprezece pe teritoriul comunei bascov situata in vecinatatea municipiului pitesti ca urmare a ploilor abundente apele au inundat circa trei sute saizeci de gospodarii iar viitura a determinat deraierea unui tren de persoane comuna bascov a fost afectata de inundatii si in anii doua mii cinci si doua mii nouasprezece iar gospodariile cetatenilor din localitatile strabatute de aceste cursuri de apa sunt puse in pericol de fiecare data cand in zona se inregistreaza ploi torentiale in consecinta avand in vedere importanta deosebita a obiectivelor de investitii mentionate anterior va rog ca in completare la raspunsurile pe care le am primit din partea ministerului mediului apelor si padurilor la intrebarile mele pe aceeasi tema din ultimii cinci ani sa mi comunicati care este stadiul executiei lucrarilor raportat la calendarul asumat din ce motive a fost intarziata realizarea acestora si care este termenul prevazut pentru finalizarea proiectelor respective solicit raspuns scris va multumesc cu deosebita consideratie danut bica senator pnl de arges interpelare adresata domnului alexandru rafila ministrul sanatatii obiectul interpelarii posibilitatea majorarii cifrelor de scolarizare pentru studii de licenta la universitatile de medicina si a numarului de posturi de rezidentiat incepand cu anul de invatamant doua mii douazeci si doi doua mii douazeci si trei stimate domnule ministru de la aderarea tarii noastre la uniunea europeana si pana in prezent numarul medicilor si asistentilor medicali care au parasit romania si profeseaza in alte state ale uniunii a ajuns potrivit evaluarilor colegiului medicilor din romania la nivelul zecilor de mii chiar daca adoptarea legii cadru nr o suta cincizeci si trei doua mii saptesprezece privind salarizarea personalului platit din fonduri publice a avut ca efect o majorare substantiala a castigurilor salariale din sistemul public de sanatate migratia medicilor bine pregatiti nu a incetat ci doar s a atenuat drept urmare romania a ajuns in situatia de a se confrunta cu un deficit major atat de medici specialisti cat si de medici de familie deficit care risca sa ia amploare in urmatorii ani totodata incepand cu anul doua mii douazeci guvernele liberale au deblocat si accelerat construirea spitalelor regionale de mare capacitate precum si extinderea unor sectii ale spitalelor deja existente unitati sanitare care odata finalizate vor trebui incadrate cu personal de specialitate in concluzie intregul sistem public de sanatate din tara noastra va avea nevoie de personal medical suplimentar pe termen mediu si lung care nu va putea fi asigurat decat prin majorarea cifrelor de scolarizare numarul semnificativ de absolventi din ultimii ani ai universitatilor de medicina din romania nu poate compensa acest necesar in conditiile in care ponderea studentilor straini care se pregatesc in cadrul acestora este una semnificativa iar cei mai multi dintre ei se intorc in tarile de origine dupa finalizarea studiilor avand in vedere cele prezentate anterior va solicit urmatoarele precizari unu cati medici romani au plecat din tara in ultimii cincisprezece ani doi care era deficitul de personal medical la nivel national la data de treizeci si unu decembrie doua mii douazeci si unu pe fiecare tip de specializare medicala in parte dar la nivelul judetului arges trei care era deficitul de medici de familie la nivel national la data de treizeci si unu decembrie doua mii douazeci si unu si cate localitati erau afectate de aceasta situatie nedorita dar la nivelul judetului arges patru pentru acoperirea necesarului de medici din sistemul sanitar romanesc ati luat in considerare posibilitatea de a propune majorarea cifrelor de scolarizare repartizate universitatilor de medicina si a numarului de posturi pentru rezidenti incepand cu anul de invatamant doua mii douazeci si doi doua mii douazeci si trei cinci cum intentionati sa stimulati absolventii universitatilor de medicina pentru a se orienta in cariera catre specializarile la care sistemul nostru sanitar inregistreaza deficit de personal solicit raspuns in scris va multumesc cu deosebita consideratie danut bica senator pnl de arges ,"(492.0, 7676.94)"
12,Domnul Virgil Guran:,14618,Domnul Ion Mocioalcă:,14724, si eu va multumesc domnule senator dau cuvantul domnului senator mocioalca ion ,"(492.0, 7238.94)"
13,Domnul Ion Mocioalcă:,14724,Domnul Virgil Guran:,15828, multumesc domnule presedinte dragi colegi intrebarea mea este adresata doamnei gabriela firea ministrul familiei tineretului si egalitatii de sanse stimata doamna ministru in contextul determinat de izbucnirea razboiului din ucraina zeci de mii de cetateni ucraineni au intrat pe teritoriul tarii noastre din data de douazeci si patru februarie si pana in prezent dintre acestia peste sapte sute de ucraineni au aplicat pentru procedura de azil trebuie mentionat faptul ca in toate aceste zile au trecut granita mii de femei singure ori in grupuri insotite de copii si parinti varstnici au fost situatii greu de imaginat in care mamele au parcurs kilometri intregi pe jos cu copii in brate aceste familii au trecut prin momente traumatizante in ultimele zile tinand cont de cele expuse mai sus va rog doamna ministru sa mi spuneti ce masuri ati luat si veti lua in continuare pentru sprijinirea familiilor de refugiati ucraineni care fug din calea razboiului va multumesc solicit raspuns in scris senator psd de caras severin ion mocioalca ,"(492.0, 7238.94)"
14,Domnul Virgil Guran:,15828,Doamna Laura Georgescu:,15926, multumesc domnule senator dau cuvantul doamnei senator georgescu laura ,"(492.0, 7238.94)"
15,Doamna Laura Georgescu:,15926,Domnul Virgil Guran:,20424, va multumesc domnule presedinte interpelare adresata domnului nicolae ciuca prim ministrul romaniei obiectul acestei interpelari solicitarea ajutorului din partea uniunii europene stimate domnule prim ministru invadarea ucrainei a provocat o criza sociala de proportii in acelasi timp vorbim despre o criza umanitara romania este in prima linie a rezistentei efortul nostru trebuie completat de efortul comun al tarilor uniunii europene intr o interventie recenta liderul delegatiei psd din parlamentul european dan nica a solicitat presedintei comisiei europene ursula von der leyen mobilizarea urgenta a asistentei necesare pentru gestionarea cat mai eficienta de catre romania a iminentei crize a refugiatilor din ucraina eurodeputatul roman a solicitat trimiterea de suport financiar adaposturi provizorii material medical si personal calificat catre flancul estic al uniunii europene consider ca este necesar ca romania sa fie ajutata de tarile membre ue avand in vedere numarul mare de refugiati este nevoie ca uniunea europeana sa mobilizeze toate tipurile de asistenta necesara si de expertiza pentru a ajuta romania si celelalte state din regiune sa faca fata unei crize a refugiatilor prin urmare stimate domnule prim ministru va rog sa ne precizati care vor fi demersurile pe care le veti face pentru a cere uniunii europene orice tip de sprijin inclusiv logistic este foarte important sa comunicati toate demersurile pe care le intreprindeti in acest sens va multumesc solicit raspuns scris cu deosebit respect senator psd de galati laura georgescu si tot o interpelare adresata domnului nicolae ciuca obiectul acestei interpelari este legat tot de refugiatii din ucraina stimate domnul prim ministru asistam de aproape o saptamana la un exod al ucrainenilor in romania in principal femei si copii dupa ce mai multe orase importante din ucraina precum kiev harkov mariupol sau odessa au fost bombardate mii de cetateni ai ucrainei au trecut granitele in tarile vecine in special in republica moldova si romania mass media a titrat faptul ca autoritatile romane s au mobilizat intr un efort fara precedent oferind ajutor cetatenilor ucraineni refugiati de razboi saptamana trecuta ministrul apararii vasile dincu a precizat ca romania poate primi cinci sute zero de refugiati ucraineni si ca acestia vor fi gazduiti in taberele amplasate in patru judete inca de acum doua saptamani a fost finalizat planul de actiune al tarii pentru gestionarea unui flux mare de refugiati potrivit declaratiilor oficiale taberele au fost amplasate in judetele maramures suceava botosani si iasi exista cateva conditii care trebuie respectate atunci cand se alege un loc in care sa fie ridicate aceste tabere ele trebuie sa asigure accesul la servicii medicale si sociale si sa aiba utilitatile in apropiere pana duminica intrasera in romania peste patruzeci si sapte zero de ucraineni din care aproape jumatate parasisera tara doar cativa solicitasera azil cei care nu au facut aceasta solicitare pot ramane in tara noastra maximum nouazeci de zile in decursul oricarei perioade de o suta optzeci de zile romania a pregatit si tabere unde cei fugiti din calea razboiului pot ramane saptezeci si doi de ore trebuie sa mentionam in context si sprijinul dat de societatea civila care s a mobilizat in grupuri de voluntari pentru a oferi ajutor domnule premier la nivelul guvernului ati reusit sa infiintati un grup de lucru la nivel central dar si celule de lucru la nivel teritorial in zonele aflate in proximitatea punctelor strategice situate in nordul si nord estul tarii noastre toate aceste actiuni concertate sunt de laudat pentru ca in aceste conditii vitrege pentru un popor vecin noua este firesc sa acordam ajutorul cuvenit si asistenta umanitara adecvata alimente produse necesare de subzistenta servicii de sprijin persoanelor refugiate inclusiv asistenta juridica totusi stim foarte bine ca taberele pregatite sunt insuficiente pentru refugiati prin urmare trebuie revazuta situatia in ansamblu cati refugiati putem primi in total care sunt localitatile care pot primi si cati cum ii vor ajuta autoritatile locale pe refugiati si ce materiale si echipamente le vor oferi din ce fonduri vor avea autoritatile locale bani pentru toate acestea va multumesc solicit raspuns scris cu deosebit respect senator psd de galati laura georgescu ,"(2058.0, 7234.94)"
16,Domnul Virgil Guran:,20424,Doamna Rodica Boancă:,20526, multumesc doamna senator invit la microfon pe doamna senator boanca rodica ,"(492.0, 7238.94)"
17,Doamna Rodica Boancă:,20526,Domnul Virgil Guran:,26425, multumesc domnule presedinte de sedinta stimati colegi onorat prezidiu am pentru astazi o interpelare si doua intrebari as dori sa dau citire mai intai interpelarii interpelarea este adresata domnului ministru al afacerilor interne lucian nicolae bode si vizeaza redeschiderea celor cinci puncte de trecere a frontierei din sectorul suceava botosani stimate domnule ministru lucian nicolae bode pe fondul incalcarii suveranitatii si independentei ucrainei de catre armata rusa valuri de refugiati intra in romania zi si noapte oameni disperati fug din calea razboiului merg de multe ori pe drumuri laturalnice ca sa se fereasca de atacuri aeriene si terestre si evita orasele mari pana la granita au de infruntat teroare si foarte multa oboseala iar cand ajung la frontiera si speranta li se intrezareste in ochi mai au un hop sa treaca de cozile kilometrice colegii mei parlamentari sunt la granitele din nordul tarii inca din prima zi a invaziei trupelor in ucraina si vreau sa i felicit pe aceasta cale suntem in contact cu dansii si primim constant informatii in timp real de la granita coada de refugiati de la punctul de trecere a frontierei siret este deja de douazeci de kilometri iar oamenii stau si cate optsprezece ore la rand in conditiile in care de doua zile ninge numarul refugiatilor este in crestere si in zilele urmatoare se va ajunge la un numar record de refugiati care doresc sa treaca in tara noastra de aceea este important sa redeschideti cat mai multe puncte de trecere a frontierei pentru a salva si ajuta cat mai multi oameni mai ales ca un numar semnificativ al refugiatilor este reprezentat de cetateni romani din zonele istorice romanesti din bucovina de nord si nu numai astfel va supun atentiei posibilitatea de a redeschide cele cinci puncte de trecere din sectorul suceava botosani care stau cu lacatul pe poarta in prezent iar conform prerogativelor dumneavoastra si in baza atributiilor conferite de functia pe care o detineti va solicit raspuns la urmatoarele intrebari aveti in vedere deschiderea unor puncte de frontiera suplimentare s a suplimentat numarul personalului mai din punctele de frontiera va multumesc solicit raspuns scris cu respect senator aur rodica boanca iar cele doua intrebari vizeaza tot problema zilelor noastre prima intrebare este adresata domnului ministru al afacerilor externe bogdan aurescu si vizeaza romanii din ucraina care fug din calea razboiului stimate domnule ministru bogdan aurescu pe douazeci si opt iunie o mie noua sute patruzeci romania a primit un ultimatum din partea uniunii sovietice prin care se cerea evacuarea administratiei civile si a armatei de pe teritoriul dintre prut si nistru si din partea nordica a regiunii bucovina in cazul in care retragerea nu s ar fi facut in termenul impus de patru zile romania era amenintata cu razboiul din cauza presiunilor venite de la moscova si de la berlin si in contextul geopolitic mai larg in care prin pactul expansionist ribbentrop molotov din douazeci si trei august o mie noua sute treizeci si noua sferele de influenta teritoriala din europa rasariteana au fost impartite administratia si armata romana s au retras pentru a evita razboiul de atunci romanii din bucovina de nord isi striga suferinta cu atat mai mult in aceste zile fratii nostri striga dupa ajutor si este datoria morala a romaniei sa le asigure drumul spre tara mama in contextul actualului razboi si al necesitatii asigurarii protectiei etnicilor romani din ucraina in concordanta cu prerogativele dumneavoastra conferite de functia pe care o detineti va solicit raspuns la urmatoarele intrebari la nivel general cati cetateni de etnie romana traiesc in ucraina si in mod particular in regiunea istorica bucovina de nord este tinuta o legatura oficiala cu cetatenii de etnie romana care traiesc in ucraina cati dintre refugiatii care au trecut in aceasta perioada granita in romania sunt etnici romani va multumesc solicit raspuns scris cu respect senator aur rodica boanca si ultima intrebare este adresata domnului ministru al educatiei sorin mihai cimpeanu stimate domnule ministru sorin mihai cimpeanu obiectul intrebarii il reprezinta integrarea elevilor refugiati in sistemul romanesc de invatamant zilnic sute si mii de refugiati trec granita de stat si fug efectiv in romania din calea razboiului si a mortii dintre acestia o buna parte sunt copii care si au lasat tatal sa lupte contra invadatorului rus atacul rusiei asupra ucrainei va lasa urme adanci iar cel mai mult vor avea de suferit copiii suferinta lor este dubla pentru ca in primul rand cei mai multi urmeaza sa petreaca o perioada de timp fara tata si apoi pentru faptul ca educational vor avea lipsuri mari fata de alti copii de varsta lor in acest context este foarte important ca statul roman sa le asigure si accesul la educatie si sa i integreze in colectivul format de scolari de varsta lor desi suntem convinsi ca intregul sistemul educational romanesc are mari lacune este esential sa se faca eforturi pentru cooptarea elevilor sau studentilor veniti din ucraina in randul scolilor romanesti mai ales in cazul celor de etnie romana astfel conform prerogativelor dumneavoastra si in baza atributiilor conferite de functia pe care o detineti va solicit raspuns la urmatoarele intrebari ati primit informari referitoare la numarul de copii care au trecut granita in aceasta perioada au fost primite cereri din partea parintilor sau a tutorilor pentru asistenta in materie de educatie pentru copiii refugiati are sistemul educational romanesc capacitatea sa asigure un mediu propice educatiei pentru elevii sau studentii care trec granita din ucraina va multumesc solicit raspuns scris cu respect senator aur rodica boanca ,"(5904.94, 5910.94)"
18,Domnul Virgil Guran:,26425,Domnul Călin-Gheorghe Matieș:,26537, va multumesc si eu doamna senator are cuvantul domnul senator maties calin gheorghe ,"(492.0, 7238.94)"
