,start_text,start_index,end_text,end_index,text,timestamp
94,Doamna Diana Iovanovici-Șoșoacă:,138675,Doamna Alina-Ștefania Gorghiu:,139074, conchid in acest context va rog frumos nu e vorba de mine nu i vorba de conspiratii aici sunt date tehnice stiintifice care n au fost avute in vedere la aceasta initiativa legislativa si de aceea va rog constiinta sa va spuna sa nu votati aceasta initiativa avand in vedere ca i vorba si de viata noastra si mai ales a copiilor nostri va multumesc ,"(2315.0, 2333.0)"
95,Doamna Alina-Ștefania Gorghiu:,139074,Domnul Ioan-Cristian Chirteş:,139184, va multumesc frumos il invit la microfon pe domnul senator cristi chirtes ,"(492.0, 7238.94)"
96,Domnul Ioan-Cristian Chirteş:,139184,Doamna Alina-Ștefania Gorghiu:,140727, multumesc doamna presedinte de sedinta as dori sa fiu scurt si clar sa o completez pe colega mea doamna presedinte iulia scantei dragi colegi cred ca vedeti cu totii ca ne aflam intr un razboi un razboi in europa un razboi la granitele romaniei ei bine cu totii stiti si ati aflat ca razboiul de astazi se duce pe multiple planuri este un razboi hibrid iar componenta cibernetica a acestui razboi hibrid este de multe ori mult mai importanta decat o componenta militara ceea ce am facut noi in acest cod al comunicatiilor si ma refer la art o suta doi a fost sa reglementam o infrastructura cibernetica care se afla in romania astazi care poate constitui o baza de utilizare a ei de catre elemente teroriste sau chiar de catre rusia stiti bine inainte de atacul din douazeci si patru ucraina a fost atacata cibernetic institutiile statului au fost atacate cibernetic si multe indicii duc ca au fost folosite infrastructuri existente si in romania care astazi nu sunt reglementate nu are nimeni nicio legatura cu interceptarea whatsapp ului cu interceptarea mesajelor ba mai mult orice solicitare de date se face sub autoritate judecatoreasca cu mandat judecatoresc dragi colegi cred ca daca s a vorbit de securitatea ucrainei pot sa va spun cu siguranta ca aceasta securitate a tarii vecine depinde si de proiectul pe care noi il aprobam astazi aici in parlament partidul national liberal va vota acest cod al comunicatiilor multumesc ,"(2351.0, 2479.0)"
97,Doamna Alina-Ștefania Gorghiu:,140727,Domnul Mircea Dăneasă:,140916, multumesc domnule senator chirtes il invit la microfon pe domnul daneasa si va inchide dezbaterile generale liderul de grup usr radu mihail va rog ,"(492.0, 7238.94)"
98,Domnul Mircea Dăneasă:,140916,Doamna Alina-Ștefania Gorghiu:,142731, va multumesc doamna prezident intr adevar reglementarea infrastructurii telecomunicatiilor existente cunoscute din punct de vedere tehnologic pana astazi nu este nicio problema care sa ne afecteze mai mult decat atat cat se cunoaste in schimb 5g este o tehnologie exponential mai periculoasa din punct de vedere al radiatilor datorita faptului ca este prima tehnologie de comunicare care foloseste inalta frecventa pe microunde microundele au o proprietate diferita de celelalte frecvente schimba polaritatea moleculara a apei pe baza acestui principiu se incalzeste mancarea in cuptoarele cu microunde a face o impanzire cu o anumita infrastructura tehnologica a undelor de inalta frecventa fara a se cunoaste studiile de impact care s au facut pana la ora actuala pe terra de catre state cu un inalt potential tehnologic si cu o inalta tinuta academica este o greseala ce m a impresionat in cele patru consfatuiri publice dar de fapt au fost prezenti oameni din mediul academic din mediul universitar si de la ong uri specializate exact in tehnologia 5g au fost amintite patru zero sau sase zero dar nu conteaza sa spunem patru zero de studii internationale despre care nimeni din cei care au reprezentat institutiile statului roman nu stia si s a propus sa aducem in fata senatului aceasta propunere asteptarea pana se clarifica si se edifica ministerul invatamantului ministerul mediului vizavi de studiile existente intrucat dumnealor s au edificat doar din recomandarile comisiei europene acum trebuie sa decideti dumneavoastra e necesara interventia mediului academic mediului universitar si a societatii civile in decizia unor probleme care depasesc oricum si in mod evident competentele noastre ,"(2495.0, 2678.0)"
99,Doamna Alina-Ștefania Gorghiu:,142731,Domnul Mircea Dăneasă:,142791, multumim domnule senator ,"(5708.76, 7216.94)"
100,Domnul Mircea Dăneasă:,142791,Doamna Alina-Ștefania Gorghiu:,142830, va multumesc ,"(4579.0, 4601.0)"
101,Doamna Alina-Ștefania Gorghiu:,142830,Domnul Radu-Mihai Mihail:,142932, il invit la microfon pe senatorul radu mihail liderul grupului usr ,"(120.0, 7676.94)"
102,Domnul Radu-Mihai Mihail:,142932,Doamna Alina-Ștefania Gorghiu:,144451, multumesc doamna presedinta usr spune un da hotarat pentru ca cetatenii tarii sa beneficieze de tehnologii moderne inclusiv 5g usr spune un nu hotarat incercarii de a lasa ambiguitate neclaritate si la mana serviciilor interceptari ascultari ale cetatenilor romani de aceea nu putem vota pentru aceasta lege este clar dar pe de alta parte sunt colegi aici in sala care evident vor sa ne vada in evul mediu pentru ca stim ca un stat slab nu poate rezista in fata presiunii sunt trimisi aici de prieteni de la est sa ne faca slabi cum sa renuntam la progres tehnologic doar pentru ca cineva inventeaza pseudostiinta si vine in acest for cu minciuni sfruntate asa cum au invatat poate de la propaganda rusa pe care o promoveaza cu obstinatie de ani si ani problema pe care o avem este ca ne aflam in fata unei situatii in care o lege care ar fi trebuit sa fie utila care este necesara sa nu poata fi votata de oamenii care au cu adevarat interes pentru cetateanul roman pentru ca dupa bunul model pesedist care a fost adoptat vad de pnl a aparut din ea o soparla domnilor haideti sa facem legiferare cum trebuie ce e necesar ce este cu adevarat necesar si util cetateanului sa treaca si ce este doar relaxare a modului in care putem fi ascultati si interceptati sa fie tratat separat si cu mare mare grija pentru ca nu vrem sa ne indreptam catre o dictatura sub umbra situatiei neclare in care ne aflam acum geopolitic multumesc ,"(2678.0, 2802.0)"
103,Doamna Alina-Ștefania Gorghiu:,144451,Domnul Cristinel-Gabriel Berea:,145299, multumesc frumos stimati colegi inchidem dezbaterile generale asupra acestui punct al ordinii de zi initiativa legislativa ramane la vot final la punctul doi avem propunerea legislativa privind stabilirea anumitor prevederi referitoare la certificarea istoricului vehiculelor rutiere utilizate in vederea inmatricularii acestora in romania raportul suplimentar al comisiei pentru transporturi si infrastructura e de admitere cu amendamente admise a propunerii legislative propunerea legislativa face parte din categoria legilor organice si se adopta cu votul majoritatii senatorilor suntem prima camera sesizata incepem dezbaterile daca din partea grupurilor parlamentare exista inscrieri la cuvant exista domnule senator va invit la cuvant ,"(2809.0, 2842.0)"
104,Domnul Cristinel-Gabriel Berea:,145299,Doamna Alina-Ștefania Gorghiu:,145605, va multumesc doamna presedinta de sedinta si totodata presedinta de facto a senatului pentru ca excelenta sa domnul citu nu prea serveste sedintele noastre asta cu excelenta sa domnul citu o am de la sedintele comune da excelenta sa domnul citu domnul ciolacu ,"(2849.0, 2868.0)"
105,Doamna Alina-Ștefania Gorghiu:,145605,Domnul Cristinel-Gabriel Berea:,145704, pe procedura va invit totusi sa treceti la dezbaterile generale ,"(2872.0, 2872.0)"
106,Domnul Cristinel-Gabriel Berea:,145704,Doamna Alina-Ștefania Gorghiu:,145759, trecem la dezbatere ,"(120.0, 7676.94)"
107,Doamna Alina-Ștefania Gorghiu:,145759,Domnul Cristinel-Gabriel Berea:,145843, v as invita sa respectam regulamentul multumesc ,"(492.0, 7238.94)"
108,Domnul Cristinel-Gabriel Berea:,145843,Doamna Alina-Ștefania Gorghiu:,146525, proiectul de fata isi propune sa vina in intampinarea cumparatorilor de autoturisme second hand din romania si in principiu este un proiect bun culmea venind de la psd scuze pnl tot aia este un proiect bun doar ca nu este suficient si am sa va spun de ce nu e suficient pentru ca marea majoritate a masinilor tranzactionate in romania nu sunt cumparate de noi din romania sunt aduse din alte tari ale uniunii europene tocmai de aia am sa vorbesc cu colegii nostri de la bruxelles din renew europe sa propuna un proiect similar la nivelul intregii uniuni europene doar asa cumparatorul roman va fi si el protejat multumesc ,"(2879.0, 2915.0)"
109,Doamna Alina-Ștefania Gorghiu:,146525,Doamna Diana Iovanovici-Șoșoacă:,147670, mai exista din partea grupurilor cineva care doreste sa ia cuvantul daca nu am incheiat dezbaterile generale lasam acest punct la vot final la punctul trei al ordinii de zi propunerea legislativa privind imbunatatirea sigurantei rutiere prin limitarea circulatiei pe drumurile publice a autovehiculelor inmatriculate sau inregistrate in romania care au postul de conducere situat pe partea dreapta in raport cu planul median longitudinal al autovehiculului raportul comun al comisiei juridice de numiri disciplina imunitati si validari si comisiei pentru aparare ordine publica si siguranta nationala este de admitere cu amendamente admise a propunerii legislative propunerea legislativa face parte din categoria legilor ordinare se adopta cu votul majoritatii senatorilor prezenti senatul e prima camera sesizata incepem dezbaterile daca din partea grupurilor parlamentare exista inscrieri la cuvant doamna senator va invit la cuvant doamna sosoaca altcineva nu exista din partea grupurilor va rog da da la microfonul de acolo ,"(2961.0, 2969.0)"
110,Doamna Diana Iovanovici-Șoșoacă:,147670,Doamna Alina-Ștefania Gorghiu:,149010, multumesc frumos da este o initiativa buna intr un alt context si intr o alta tara avand in vedere ca nivelul de trai din romania este cel pe care l avem saptezeci oameni saraci cei care au fost fortati mai ales de un presedinte fost presedinte al romaniei sa plece afara din tara ca asa le a spus sa plece afara din tara oamenii s au dus foarte multi romani sunt in marea britanie acolo unde volanul este pe partea dreapta in acest context cand oamenii au inceput sa se repatrieze si au luat si masinile pentru ca acolo au gasit niste masini ieftine foarte bune ieftine si usor de intretinut dumneavoastra veniti cu o astfel de lege intr o tara in care intr adevar foarte multe masini au volanul pe dreapta dar saptezeci din romani sunt saraci si n au alta solutie ce fac acesti oameni au muncit ani de zile au pus niste bani deoparte au reusit sa si aduca niste masini asa cum au putut ei pe dreapta dumneavoastra acum le faceti aceasta initiativa prin care ii mai si amendati e contraventie daca nu cumva daca nu probabil ca o s o faceti si infractiune ca nu e nimic imposibil in tara asta insa atunci cand faceti astfel de legi ganditi va la majoritatea poporului roman care nu si permite luxul pe care dumneavoastra ca parlamentari il aveti va multumesc ,"(2977.0, 3057.0)"
111,Doamna Alina-Ștefania Gorghiu:,149010,Domnul Mihai-Cătălin Botez – deputat:,150397, multumesc doamna senator daca nu mai exista din partea grupurilor inscrieri la cuvant inchid dezbaterile generale asupra acestui punct al ordinii de zi si initiativa legislativa ramane la vot final comitetul liderilor a stabilit ora treisprezece zero pentru vot final o sa va rog sa prelungim programul de vot pe celelalte doua initiative programul de dezbatere pe celelalte doua initiative pana la epuizarea lor cine este de acord cu aceasta propunere impotriva nu exista abtineri o abtinere din partea doamnei sosoaca aceasta propunere a fost adoptata vom continua dezbaterile cu celelalte doua puncte la punctul patru al ordinii de zi avem propunerea legislativa pentru modificarea si completarea ordonantei de urgenta a guvernului nr o suta nouazeci si cinci doua mii doi privind circulatia pe drumurile publice republicata si pentru modificarea legii nr doua sute optzeci si sase doua mii noua privind codul penal raportul comisiei juridice de numiri disciplina imunitati si validari e de respingere a propunerii legislative propunerea face parte din categoria legilor organice si se adopta cu votul majoritatii senatorilor senatul e prima camera sesizata incepem dezbaterile din partea grupurilor parlamentare va rog frumos din partea initiatorilor aveti cuvantul puteti sa veniti si la microfonul central daca va este mai usor ,"(3071.0, 3148.0)"
112,Domnul Mihai-Cătălin Botez – deputat:,150397,Doamna Alina-Ștefania Gorghiu:,152516, va multumesc doamna presedinte am initiat acest proiect de lege care presupune de fapt acordarea politistilor a dreptului de a da a emite procese verbale de contraventie pe baza inregistrarilor video care ar veni de la participantii la trafic de ce am facut lucrul acesta pentru ca de zece ani daca ne uitam pe statistici vedem ca murim foarte mult pe strazi in romania se moare cel mai mult din europa daca ne uitam pe o harta a europei o sa vedem ca romania este singura tara rosie asa pentru ca avem optzeci si cinci nouazeci si doi de morti la milionul de locuitori se moare foarte mult in romania si nu facem nimic eu am scos si un grafic chiar din raportul din doua mii douazeci si unu al politiei romane nu stiu cat de relevant e sau daca o sa vedeti ceva dar unu sase sute unu opt sute de cetateni romani mor anual pe strazile din romania exista o astfel de prevedere un astfel de sistem care functioneaza si in alte tari europene in marea britanie spre exemplu exista un sistem un site pe care participantii la trafic pot incarca clipuri in care sa mentioneze ce contraventie s a petrecut sa mentioneze de asemenea ca sunt dispusi sa mearga in instanta si sa probeze cele declarate iar in baza acestor inregistrari video un politist care se afla intr un birou sa constate cu propriile simturi sa spunem asa daca acolo e vorba de contraventie sau nu si apoi sa inceapa demersurile pentru a trimite procesul verbal avem nevoie ca acest instrument sa fie facut public cetatenii participantii la trafic de fapt sa cunoasca acest instrument si in felul acesta sa se corecteze pentru ca in acest moment politia are personal redus are nevoie foarte mare de personal si nu se intrevede prea curand ca va creste numarul de politisti pe strada nu exista nici alte instrumente prin care sa asiguram disciplina in trafic si atunci cred ca acest instrument pe care l am propus prin acest proiect de lege ne ar ajuta sa salvam vieti despre asta este vorba si va rog tare mult sa cititi cu atentie ce presupune proiectul si sa dati un vot pentru va multumesc mult ,"(3154.0, 3314.0)"
113,Doamna Alina-Ștefania Gorghiu:,152516,Doamna Nicoleta Pauliuc:,152657, multumesc initiatorului o invit la microfon pe doamna presedinta a comisiei de aparare nicoleta pauliuc ,"(492.0, 7238.94)"
114,Doamna Nicoleta Pauliuc:,152657,Doamna Alina-Ștefania Gorghiu:,154914, stimati colegi mi as dori foarte mult de cate ori veniti la tribuna parlamentului sa incercati sa nu mai fiti atat de populisti spuneati stimati colegi ca noi nu facem nimic ba facem ne indeplinim prerogativele date de constitutie si anume facem legi daca argumentele dumneavoastra in momentul in care concepeti un proiect de lege nu sunt atat de concludente nu sunt atat de bine sustinute atunci se intampla ce se intampla si ce s a intamplat si cu proiectul dumneavoastra ca in comisia de aparare comisia raportoare sa nu intruneasca numarul de voturi astfel incat el sa fie adoptat de plen avem obligatia sa scadem numarul victimelor da pana in doua mii douazeci si patru avem obligatia ca in romania sa adoptam acele masuri care vor duce la scaderea numarului victimelor rezultate din accidente rutiere dar stimati colegi acest lucru nu putem sa l facem introducand anumite propuneri legislative adica anumite modificari la legislatia existenta prin care noi sa sporim riscul producerii de accidente stim foarte bine poate colegii din legislatura trecuta isi aduc aminte cat de mult am discutat problema folosirii telefonului in momentul in care tu esti la volan dumneavoastra ce ne spuneti acum vreti sa reintroducem posibilitatea ca in momentul in care conduci un autovehicul si asta este una dintre situatii sa poti sa folosesti telefonul mobil sa poti sa inregistrezi ce se intampla in al doilea rand dumneavoastra si asa daca stiti poate ca era bine sa va si aplecati un pic sa vedeti ca exista la nivelul ministerului de interne o lipsa acuta de personal prin ceea ce ati propus dumneavoastra i am transforma pe politisti i am duce intr un birou si ar sta de dimineata pana seara sa faca evaluari asupra filmuletelor care le sunt adresate pentru a stabili daca este sau nu este contraventie deci din punctul nostru de vedere al celor din comisia de aparare acest proiect de lege n a trecut majoritatea n a intrunit numarul de voturi sa mearga mai departe cu un raport de admitere tocmai pentru ca nu exista nu era o solutie sau nu este o solutie care sa duca la indeplinirea obiectivului si anume scaderea numarului de victime in circulatie ,"(3322.0, 3470.0)"
115,Doamna Alina-Ștefania Gorghiu:,154914,Domnul Cătălin-Daniel Fenechiu:,155142, il invit la cuvant pe domnul lider al grupului pnl daniel fenechiu daca mai exista solicitari din partea celorlalte grupuri va rog sa va domnul radu mihail l am vazut multumesc imediat ,"(3482.0, 3493.0)"
116,Domnul Cătălin-Daniel Fenechiu:,155142,Doamna Alina-Ștefania Gorghiu:,158196, multumesc doamna presedinta dezbaterea in comisia juridica a fost o dezbatere extrem de serioasa si va marturisesc ca senatorii grupului pnl s au gandit mult cum sa se pozitioneze fata de aceasta dezbatere datorita faptului ca argumentele aduse in discutie erau argumente care nu puteau fi pur si simplu ignorate adica ideea de a stopa anumite contraventii ideea de a aduce mai multa siguranta in trafic sunt lucruri laudabile si cu siguranta ele trebuie avute in vedere din pacate pentru initiator care a facut foarte multe demersuri sa ne convinga ii laud atat insistenta cat si elocinta existau niste probleme care din pacate s au ridicat peste putinta de a ne oferi niste solutii pe de o parte pentru cei care cunosc putin drept contraventional ei stiu ca procesul verbal de contraventie are prezumtia de legalitate pana la proba contrarie in situatia in care am fi mers pe varianta ca agentul constatator sa aplice o sanctiune in baza unei inregistrari video provenite de la cineva pe de o parte sarcina probei s ar fi rasturnat pe de alta parte era nevoie de a gasi garantii privind veridicitatea respectivei inregistrari asumarea respectivei inregistrari si ar fi fost de natura sa schimbe foarte multe in procesul contraventional romanesc pe de alta parte a mai fost o idee care s a adus in discutie si avem multi colegi care au impartasit o si anume faptul ca o asemenea masura ar fi putut sa fie pe de o parte o invitatie la delatiune pe de alta parte ar fi putut in sine sa genereze alte fapte antisociale contraventii pe drumurile publice spunea colega mea nicoleta pauliuc de la comisia de aparare presedinta comisiei de aparare cum ar fi de exemplu ca cineva care constata ceva isi scoate telefonul pe geam si te urmareste ce faci in momentul ala deci reactia pe care ar putea sa o aiba o persoana care se simte urmarita ar putea sa intre in zona de activitate in zona de actiune care in sine ar fi putut sa genereze alte lucruri pe care dorim sa le evitam dar cel mai important lucru este cel cu prezumtia de legalitate a procesului verbal si intoarcerea sarcinii probei ni s a spus ca in marea britanie ar exista acest sistem e adevarat poate sa existe cu siguranta insa sistemul de drept anglo saxon pentru cunoscatori este usor diferit de sistemul de drept romanesc am certitudinea ca intr un viitor nu stiu cat de repede peste zece cincisprezece douazeci de ani poate mai repede o asemenea propunere legislativa va fi privita cu mai multa simpatie si cu siguranta ar putea sa fie sustinuta astazi insa din pacate atat sistemul de drept romanesc cat si logistica ministerului de interne sunt clar impotriva unei asemenea masuri care ar fi total inaplicabila si n ar fi altceva decat o invitatie la delatiune grupul partidului national liberal va vota pentru raportul de respingere repet nu datorita faptului ca ne ar deranja in sine o asemenea masura ci pentru ca este inaplicabila in romania multumesc ,"(3496.0, 3617.0)"
117,Doamna Alina-Ștefania Gorghiu:,158196,Domnul Radu-Mihai Mihail:,158376, multumesc domnule senator il invit pe colegul de la usr radu mihail era inscris la cuvant dupa care il invit pe domnul senator cristescu ,"(492.0, 7238.94)"
118,Domnul Radu-Mihai Mihail:,158376,Doamna Alina-Ștefania Gorghiu:,160061, multumesc doamna presedinta doua elemente am retinut din luarile de cuvant anterioare primul este faptul ca exista un pericol pentru siguranta in circulatie pentru ca am avea participanti la trafic soferi care si ar lua telefonul si ar incepe sa filmeze cu el pentru cei care au circulat in state si chiar si la noi unde oamenii sunt atenti la ce se intampla sunt echipamente dedicate acestei utilizari care sunt foarte simplu de utilizat nu implica in niciun caz interventia unui operator sau a soferului deci nu au nimic de a face cu a impiedica sau a impieta siguranta in trafic al doilea argument pe care l am auzit si mi se pare un contraargument pentru pozitia vorbitoarei este ca nu avem suficiente cadre nu avem suficienti politisti care sa poata sa studieze filmuletele care vor fi produse ca dovezi intr adevar nu avem suficient de multi politai care sa fie in strada si atunci avem nevoie sa compensam acest lucru sa putem sa avem claritate din inregistrari pe care cetatenii le pot face foarte foarte simplu este pacat ca nu exista sustinere pentru proiect acum pentru ca ar fi scutit cred multi oameni de necazuri in a demonstra ceea ce s a intamplat cu adevarat la accidente in perioada care urmeaza dar am retinut faptul ca exista deschidere pentru a avea o varianta de legislatie in acest sens care sa fie adoptata in continuare de aceea vom reveni si colegul mihai botez va reveni cu o propunere ajustata pe acest subiect si sper ca nu respingem o astfel de propunere doar pentru ca sunt oameni care nu vor sa fie usor reperati cand incalca legea multumesc ,"(3692.0, 3794.0)"
119,Doamna Alina-Ștefania Gorghiu:,160061,Domnul Ionel-Dănuț Cristescu:,160181, multumesc domnule senator cristescu sunteti invitat la microfonul central va rog ,"(492.0, 7238.94)"
120,Domnul Ionel-Dănuț Cristescu:,160181,Doamna Alina-Ștefania Gorghiu:,162764, multumesc doamna presedinta de sedinta intr adevar initiativa este una nobila avem probleme cu privire la aspectele semnalate dar vreau sa fac mentiunea ca au existat sanctiuni contraventionale in urma cu zece ani aplicate de agenti constatatori politisti din cadrul politiei rutiere cu filmari video ale administratiei publice locale dar ati vazut si in initiativa se face mentiunea ca ar trebui sa existe o declaratie pe proprie raspundere nu va spun eu cum se desfasoara tot acest proces administratia publica locala pune la dispozitie politiei aceste filmari politistul agentul constatator identifica autovehiculul si proprietarul autovehiculului si ii solicita sa spuna daca la data si ora respectiva se afla la volanul autovehiculului ce credeti ca se intampla o sa spuna conducatorul auto care s a aflat la volanul autovehiculului ca a fost el sau o sa transmita ca a fost un vecin un prieten sau soferul lui deci s au intamplat astfel de lucruri si efectiv sanctiunea respectiva nu o va primi conducatorul auto care a incalcat legislatia rutiera asta este un prim aspect al doilea aspect este legat de faptul ca oricine poate cu telefonul in mana sa faca o filmare si sa o puna la dispozitia unui agent constatator care ulterior sa intocmeasca procesul verbal nu mai vorbim de faptul ca in initiativa se stabileste faptul ca poate intocmi procesul verbal fara martori si asa mai departe nu prevederile astea se regasesc in ordonanta de guvern nr doi privind regimul contraventiilor bun deci din punctul nostru de vedere si am discutat cu colegii initiativa este nobila doar ca are foarte multe probleme din punct de vedere tehnic pe de alta parte daca vorbim de conduita conducatorilor auto in trafic ar trebui sa ne uitam la legislatia cu privire la scolile de conducatori auto stimati colegi acolo trebuie sa lucram si va invit pe toti sa lucram la treaba asta pentru ca treizeci de ore treizeci de ore pentru categoria b ca sa obtina permisul de conducere auto sunt total insuficiente daca facem un calcul si eu stiu foarte bine peste saptezeci din elevii care trec prin filtrul scolilor de conducatori auto solicita sa faca ore suplimentare pentru ca cu cele treizeci de ore nu vor fi in stare sa obtina permisul de conducere la proba practica noi vom vota pentru raportul de respingere suntem dispusi sa colaboram si sa lucram intr adevar la initiative legislative care sa aduca plusvaloare si care sa stabileasca clar contravenientul in trafic multumesc ,"(3826.0, 4020.0)"
121,Doamna Alina-Ștefania Gorghiu:,162764,Domnul Mircea Dăneasă:,162874, multumesc din partea grupului aur il invit la microfon pe domnul daneasa ,"(4020.0, 4022.0)"
