,start_text,start_index,end_text,end_index,text,timestamp
29,Doamna Anca Dana Dragu:,51386,Domnul Virgil Guran:,55819, multumesc domnule presedinte stimati colegi declaratia mea politica se intituleaza pacea isi are izvorul in respectarea si apararea drepturilor si libertatilor fundamentale ale omului carta onu si declaratia universala a drepturilor omului au fost concepute ca urmare a holocaustului si a celor doua razboaie mondiale tocmai pentru a preveni ca asemenea orori sa se repete in aceste doua documente fondatoare liderii lumii au recunoscut ca dreptatea si respectul pentru demnitatea umana egalitatea si drepturile omului sunt esentiale pentru mentinerea pacii si ca notiunea de suveranitate a statului nu trebuie niciodata folosita ca argument pentru incalcarea drepturilor omului de aceea art doi din tratatul uniunii europene itereaza fara niciun drept de apel ca uniunea se intemeiaza pe valorile respectarii demnitatii umane libertatii democratiei egalitatii statului de drept precum si pe respectarea drepturilor omului inclusiv a drepturilor persoanelor care apartin minoritatilor uniunea europeana recunoaste drepturile libertatile si principiile prevazute in carta drepturilor fundamentale a uniunii europene care are aceeasi valoare juridica cu cea a tratatelor nu intamplator in art optsprezece din carta se declara ca dreptul de azil este garantat cu respectarea normelor prevazute de conventia din o mie noua sute cincizeci si unu si in conformitate cu tratatul privind uniunea europeana si cu tratatul privind functionarea uniunii europene si tot nu intamplator conventia de la geneva privind statutul refugiatilor a fost aprobata in iulie o mie noua sute cincizeci si unu in cadrul unei conferinte speciale a organizatiei natiunilor unite intrand in vigoare in aprilie o mie noua sute cincizeci si patru astfel completata printr un protocol adoptat in saizeci si sapte care i a extins domeniul de aplicare limitat initial la refugiatii aparuti ca urmare a celui de al doilea razboi mondial conventia defineste notiunea refugiat si stabileste drepturile si obligatiile legate de statutul de refugiat stimati colegi doamnelor si domnilor era cat se poate de necesar ca mai ales in aceste momente sa luam act de importanta si continutul acestor acte care nu doar reglementeaza ci instituie pentru orice stat civilizat fundamentul drepturilor si libertatilor fiintei umane toate aceste acte normative prevad drepturi ce includ protectia impotriva returnarii fortate informatii privind drepturile si obligatiile legate de statutul lor mentinerea unitatii familiei dreptul de a primi un permis de sedere libertatea de circulatie in interiorul statului membru accesul la locuri de munca accesul la educatie accesul la procedurile de recunoastere a calificarilor si validarea competentelor securitatea sociala si asistenta sociala asistenta medicala drepturile aferente minorilor neinsotiti accesul la locuinte accesul la masuri de integrare si asistenta la repatriere este de datoria noastra sa identificam si sa folosim mijloacele adecvate stimularii unui dialog deschis privind consolidarea eforturilor de implicare a autoritatilor nationale si a reprezentantilor societatii civile in gestionarea crizei fara precedent din ucraina este stringenta necesitatea crearii unui sistem de monitorizare eficient la fel cum este cat se poate de importanta consolidarea privind actiunea responsabila la granite in domeniul migratiei precum si suprematia drepturilor omului si obligativitatea protejarii acestora fara nicio discriminare sa nu uitam doamnelor si domnilor stimati colegi ca mesajele de indemn la pace si la umanitate vor avea intotdeauna un efect puternic in gestionarea acestei situatii tensionate ca ele ar trebui si trebuie sa aiba ca element central pacea ca principala premisa a protejarii drepturilor omului si solidaritatea fata de persoanele vulnerabile stimati colegi doamnelor si domnilor apararea si garantarea drepturilor omului nu reprezinta o optiune ele sunt si trebuie sa fie originea si baza tuturor actiunilor si deciziilor noastre sa le tratam atunci ca atare pentru ca pacea siguranta umanitatea prezentul si viitorul democratiei in lume au un singur raspuns si o singura solutie drepturile si libertatile omului ridicate la rang de forma fireasca de a fi va multumesc senator anca dragu presedinta comisiei pentru drepturile omului egalitate de sanse culte si minoritati ,"(492.0, 7254.94)"
30,Domnul Virgil Guran:,55819,Domnul Andrei Hangan:,55914, multumim doamna senator dau cuvantul domnului senator hangan andrei ,"(5708.76, 7216.94)"
31,Domnul Andrei Hangan:,55914,Domnul Virgil Guran:,59204, multumesc domnule presedinte de sedinta declaratia de azi are ca titlu invazia rusiei trebuie oprita asistam in zilele acestea la dezmembrarea celui de al doilea stat din europa ca suprafata un stat unde traiesc patruzeci si cinci de milioane de oameni este supus unei agresiuni fara precedent in europa ultimelor decenii astfel rusia continua sa ne socheze pe zi ce trece iar actiunile presedintelui rus sunt inumane si deloc justificate anului in care traim dupa cum stim bine pe douazeci si patru februarie federatia rusa a atacat barbar ucraina pe intreg perimetrul ei zeci de orase bombardate cu rachete si oameni nevinovati ucisi o situatie de neacceptat anului doua mii douazeci si doi in care rusia este agresorul dragi colegi rusia da cartile pe fata acum odata cu invazia ucrainei invazia anterioara a georgiei a crimeii a regiunilor donetk si lugansk contureaza si ne prezinta o strategie clara pentru rusia de a recuceri zone cheie care au fost candva detinute de uniunea sovietica astfel se doreste refacerea acesteia stim cu totii ca in schimbul renuntarii ucrainei la arsenalul nuclear pe care l detinea dupa destramarea urss rusia s a angajat in o mie noua sute nouazeci si patru prin memorandumul de la budapesta sa respecte independenta integritatea suveranitatea in frontierele la zi ale ucrainei astazi vedem cum acest tratat international este facut bucati aceasta ticalosie trebuie sa aiba repercusiuni concrete uniunea sovietica a esuat cu multi ani in urma iar lumea nu a uitat brutalitatea acelui regim am totusi un mesaj pentru cel care a creat acest haos oamenii lumii vor rezista la fiecare pas iar acesta nu este un razboi care poate fi castigat de catre rusia indiferent cat de puternic se crede a fi protagonistul atat eu cat si colegii mei condamnam ferm si categoric invazia militara a rusiei in ucraina ne preocupa si suntem ingrijorati de soarta tuturor locuitorilor din aceasta tara inclusiv de etnicii romani vom sprijini in totalitate orice actiune fie nationala sau internationala care vizeaza restaurarea dreptului international cat si integritatea si suveranitatea teritoriala a ucrainei vreau sa ma adresez si presedintelui putin opriti va pana nu este prea tarziu din nefericire intotdeauna oamenii nevinovati mor in aceste vremuri de razboi desi acestia vor doar un singur lucru sa traiasca in pace sa aiba locuinte sa aiba hrana si sa fie linistiti de ce mereu acesti oameni nevinovati trebuie sa plateasca costul teribil al propriei vieti pentru decizia unei singure persoane care persista in logica unor politici externe din trecut din pacate pare ca nu se invata nimic din situatiile similare intamplate in trecut moartea oamenilor nevinovati este o actiune care trebuie cu prioritate oprita condamnata la cel mai inalt nivel traducerea in limba romana a discursului sustinut de domnul andrei hangan in limba rusa vreau sa le spun ucrainenilor dragi ucraineni astazi va aparati nu numai tara ci intreaga europa sunteti adevarati eroi eroi ai poporului vostru eroi ai europei avem incredere in victoria voastra pentru ca sunteti acasa pentru ca va aparati pamantul copiii si parintii slava ucrainei eroilor slava va multumesc ,"(6920.94, 6921.94)"
32,Domnul Virgil Guran:,59204,Doamna Silvia-Monica Dinică:,59305, multumim domnule senator are cuvantul doamna senator dinica silvia monica ,"(5708.76, 7216.94)"
33,Doamna Silvia-Monica Dinică:,59305,Domnul Virgil Guran:,61739, multumesc domnule presedinte de sedinta stimati colegi declaratia mea politica de astazi se intituleaza vulnerabilitatea scolilor si abandonul scolar in anul doua mii optsprezece doua mii nouasprezece peste treizeci si cinci zero de elevi din ciclurile primar si gimnazial au abandonat scoala sunt date din raportul realizat de catre ministerul educatiei raportul privind starea invatamantului din romania avem lansat de catre ministerul educatiei mecanismul de avertizare timpurie in educatie care face parte din programul national pentru reducerea abandonului scolar proiect finantat din pnrr si care are o valoare de cinci sute patruzeci si trei de milioane de euro nerambursabila prin acest proiect doi cinci sute de scoli pot beneficia de sume pana la doua sute zero de euro pentru a sprijini elevii aflati in risc de abandon scolar iar acest program are o durata de implementare de trei ani s a facut apelul de proiect si s au inscris mai mult de doi cinci sute de scoli s au inscris mai precis trei patru sute optzeci si noua de scoli care si au exprimat intentia de participare la acest program pana in martie luna aceasta sapte sute cincizeci dintre ele ar trebui sa beneficieze de finantare dar cred ca ce este important in acest moment este sa ne uitam la cele mai vulnerabile dintre acestea astfel incat acesti bani sa ajunga la scolile care au cea mai mare nevoie si in urma acestui proces nu este evident ca cele mai dezavantajate scoli din romania vor avea sansa obtinerii acestor bani am urmarit lista unitatilor de invatamant care au raspuns la invitatia de participare la acest program unitati precum liceul timotei cipariu din dumbraveni sau scoala gimnaziala mihaileni sunt doar cateva dintre exemplele de scoli care au inregistrat un risc ridicat de abandon scolar inca din anul doua mii nouasprezece si care ar trebui sa se afle printre scolile care vor beneficia prioritar de aceste fonduri insa ele sunt undeva pe locuri mai indepartate in lista e nevoie si de elaborarea unui ghid al beneficiarului cu prevederi clare privind drepturile si obligatiile scolilor care aplica pentru program dar mai mult decat atat de materiale de informare si instruire pentru aceste scoli pentru cadrele didactice pentru directorii scolilor precum si de o monitorizare permanenta a cheltuirii acestor bani astfel incat sa ne atingem tinta de reducere a abandonului scolar multumesc silvia dinica senator circumscriptia nr patruzeci si doi bucuresti ,"(492.0, 7238.94)"
34,Domnul Virgil Guran:,61739,Domnul Costel Vicol:,61822, multumesc si eu are cuvantul domnul senator vicol costel ,"(492.0, 7238.94)"
35,Domnul Costel Vicol:,61822,Domnul Virgil Guran:,65650, multumesc domnule presedinte doamnelor si domnilor senatori declaratie politica despre guvernul romanilor guvernul romanilor umiliti impovarati si saraciti sa intelegem ca asta va este planul de guvernare daca nu ar fi atat de tragic v as fi felicitat ironic desigur pentru rezultatele remarcabile in noua formula de guvernare observam cu totii ca ati reusit intr un timp scurt de la instalarea in conducerea guvernului sa generati haos si disperare in societate deciziile si strategia politica pe care ati adoptat o ne conduc in mod evident pe noi toti in colaps se cunoaste foarte bine de mai multi ani incoace problema majora a romaniei tara europeana cu cele mai mici venituri cu cele mai mici salarii si cu cele mai mici pensii al caror cuantum nepermis de mic ii condamna pe oameni la foame neajunsuri si disperare asta in contextul in care potrivit constitutiei si legislatiei incidente obligatia guvernului romaniei este de a lua masuri de dezvoltare economica si de protectie sociala de natura sa asigure cetatenilor un nivel de trai decent de a asigura functionarea echilibrata si dezvoltarea sistemului national economic si social de a satisface nevoile societatii ce primesc romanii in schimb sa aruncam o privire salarii si pensii mizere insotite de un sistem social in moarte clinica cresterea preturilor in doua mii douazeci si doi se va accelera bnr estimeaza ca in aprilie iunie va fi cea mai mare inflatie de unsprezece doi preturile carburantilor au explodat romanii platesc cu cateva zeci de lei in plus pentru alimentarea autoturismului benzina premium a ajuns sa coste aproximativ opt lei iar cresterile nu se opresc aici specialistii spun ca in perioada urmatoare vor mai fi scumpiri la pompa cresterea pretului la carburant si la utilitati va insemna o marire exponentiala a pretului alimentelor la raft specialistii in industrie alimentara preconizeaza majorari ale tarifelor finale in timp ce pretul benzinei a depasit acum sapte lei antreprenorii sunt trantiti la pamant anul doua mii douazeci si doi nu este unul bun nici pentru antreprenorii ce detin afaceri mici sau mijlocii caci profitul lor este conditionat si de distribuirea marfii catre punctele de desfacere piata asigurarilor auto a explodat fara precedent salariile si pensiile romanilor sunt aceleasi sau inexistente avand in vedere ca multi si au pierdut locurile de munca in pandemia covid nouasprezece indatorarea excesiva a cetatenilor romani prin imprumuturile statului roman la bei berd si banca mondiala fara precedent sume colosale imprumutate de guvern robor creste si atinge cele mai ridicate valori din februarie doua mii paisprezece pentru indicele robor 3m si din octombrie doua mii treisprezece si pana acum pentru robor 6m si da dragi guvernanti asta afecteaza semnificativ vietile a milioane de romani cu credite dragi guvernanti este socant ca nu simtiti nevoia sa aparati romanii pe niciun segment legea fundamentala constitutia garanteaza tuturor romanilor un trai decent specifica foarte clar ca statul este obligat sa ia masuri de dezvoltare economica si de protectie sociala de natura sa asigure romanilor un trai decent da noi uniunea salvati romania stim ca romanii merita respect stim ca exista solutii si mai stim ca daca nu constiinta constitutia va obliga prin tot ceea ce faceti sa asigurati romanilor un nivel de trai decent va recomandam doar sa respectati un principiu atat de simplu in slujba cetateanului roman prin tot ce faceti si prin toate deciziile pe care le luati si asta pentru ca valoarea politica a actualului guvern se regaseste in calitatea vietii cetatenilor la care tocmai am facut referire cu ingrijorare senator de tulcea costel vicol va multumesc ,"(5967.94, 6223.94)"
36,Domnul Virgil Guran:,65650,Domnul Cristinel-Gabriel Berea:,65756, multumesc domnule senator dau cuvantul domnului senator berea cristian gabriel ,"(492.0, 7238.94)"
37,Domnul Cristinel-Gabriel Berea:,65756,Domnul Virgil Guran:,68422, va multumesc domnule presedinte de sedinta titlul declaratiei mele de astazi este romanii sunt cei care au salvat ziua nu guvernul stimati colegi doamnelor si domnilor in ultima saptamana fie ca am fost la munca acasa sau in oras cu totii am vorbit despre ucraina razboi refugiati sanctiuni si ajutor stam cu ochii constant pe toate canalele de stiri si retelele de socializare asteptam orice veste oricat de neinsemnata despre ce s a intamplat in ultimele ore fiecare noutate este intampinata cu un amalgam de emotii de catre noi toti multe dintre cele intamplate au fost devastatoare mii de victime in randul militarilor si civililor orase distruse familii care au fost nevoite sa si paraseasca locuintele si un sentiment de nesiguranta cumplita in aceste zile intunecate ma inclin in fata cetatenilor romani pentru organizarea in timp de criza mobilizarea de care societatea civila a dat dovada in ultimele zile este o fila rupta dintr o carte de povesti miile daca nu zecile de mii de oameni care au contribuit in toate modalitatile posibile pentru a i ajuta pe refugiatii ucraineni sunt unul dintre motivele pentru care pot sa afirm ca sunt mandru ca sunt roman le multumesc pentru asta uitandu ne acum in cealalta parte departe de povestile impresionante care au loc la granita romaniei ce au facut guvernantii nostri referitor la aceasta situatie de criza care este actiunea strategica exista tarile nato au luat masuri de urgenta acestea s au asezat la masa inca din primele zile de razboi si au trimis imediat echipament militar necesar in ucraina in romania cu pasi inceti si dupa cateva sedinte de urgenta intarziate s a luat decizia de a trimite medicamente trimiterea armamentului a fost anuntata la aproape o saptamana dupa inceperea razboiului similara este si situatia primirii refugiatilor in tara lipsa unei mobilizari eficiente obliga ucrainenii sa astepte cu orele la cozi de kilometri pentru a putea intra in tara polonia a primit pana in prezent doua sute optzeci si unu zero de refugiati iar noi doar optzeci si noua zero am sa depun o interpelare catre primul ministru ca sa aflu mai in detaliu despre motivele mobilizarii ineficiente a resurselor intr o situatie de criza este foarte important sa i ajutam pe vecinii nostri ucraineni in continuare dar trebuie sa ne intrebam si de ce statul a intarziat in a face acest lucru oare rotile chiar s ar invarti mai repede in situatia in care cetatenii romani ar putea sa devina victimele razboiului sau vom fi nevoiti sa asteptam ajutorul tarilor europene cristi berea usr slava ucrainei ,"(492.0, 7308.94)"
38,Domnul Virgil Guran:,68422,Domnul Cristian Bordei:,68502, multumesc are cuvantul domnul senator bordei cristian ,"(492.0, 7238.94)"
39,Domnul Cristian Bordei:,68502,Domnul Virgil Guran:,72285, multumesc domnule presedinte de sedinta titlul declaratiei mele politice de astazi este propaganda pentru idioti utili romania trebuie sa ia atitudine in fata presei mincinoase a agentilor de dezinformare a manipularilor grosolane practicate sistematic de ani de zile uniunea europeana a anuntat suspendarea activitatii a doua mari institutii de presa rusesti din cauza raspandirii in mod repetat de informatii false este evident sincronul acestor entitati cu regimul de la moscova si transformarea lor in arme pentru un regim care se opune valorilor democratice la prima vedere masura pare sa fie excesiva si s ar putea spune ca rezolvarea consta intr un set nou de legi care sa reglementeze astfel de situatii dar legile exista si sunt clare pentru toate institutiile de presa doar ca sputnik si russia today nu au tinut cont de ele si au incercat in permanenta sa le ocoleasca ofensiva pe plan ideologic a devenit evidenta de la brexit incoace un eveniment care a socat lumea si a determinat analize profunde in urma carora a iesit la iveala amestecul regimului de la moscova dupa ce kremlinul a influentat si alegerile prezidentiale din sua folosind aceleasi tehnici de radicalizare si manipulare lumea democratica si a dat seama de planul lui putin dezbina si cucereste insa abia dupa atacul din ucraina ue a decis sa l lase pe putin fara armele principale pe care le a folosit pe scara larga impotriva occidentului si a valorilor democratice inclusiv in romania nu este vorba despre o limitare a dreptului la libera exprimare ci este vorba despre dreptul legitim de aparare atunci cand o entitate ostila se foloseste de libertatile garantate de o democratie pentru a o distruge din interior cand o institutie presupus de presa actioneaza astfel nu mai face presa ci este o arma de atac proiectata in laboratoarele fostului kgb cum ne au afectat aceste manipulari la noi in tara in primul rand au bagat in mintea tot mai multor romani ideea naiva ca romania s ar putea descurca singura ca n are nevoie de nato si ue care nu fac decat sa ne colonizeze ca tot raul vine doar de la acesti straini si ca oricum nu ne ataca nimeni vazand acum ce se intampla in ucraina sper ca cei care au cazut prada acestor teorii sa realizeze ca au fost manipulati de un dusman perfid care si pregatea terenul incercand sa ne lase fara aparare apoi calarind exact aceste manipulari a intrat in parlament un partid extremist care s a folosit de aceste narative false infasurat in jurul unui sambure de adevar si anume nemultumirile reale cauzate de gestionarea pandemiei si de decalajele dezvoltarii interne insa acest partid a canalizat de fapt aceste nemultumiri reale tocmai catre inamicii celor care conduc romania de peste treizeci de ani si care sunt principalii responsabili sper ca si suporterii acestui partid sa inteleaga acum care este adevarul moscova a incercat sa foloseasca un instrument democratic pentru a ataca valorile democratiei a incercat raspandirea retoricii si sua si nato au gresit drept urmare nu e nicio diferenta intre cele doua tabere fals sa nu confundam coruptia din sistemele democratice cu autocratia sau oligarhia chiar in aceste momente poporul rus este mintit cu nonsalanta de presa din rusia cu privire la invazia ucrainei pentru o mare parte din acesta nu e razboi invazia nu exista o asa presa nu vrem si trebuie sa ne aliniem deciziilor ue din acest punct de vedere trebuie sa cream un cadru legal care sa permita identificarea si pedepsirea actiunilor subversive la adresa democratiei camuflate sub forma de presa va multumesc cristian bordei senator circumscriptia electorala nr treisprezece cluj ,"(492.0, 7254.94)"
40,Domnul Virgil Guran:,72285,Domnul Lucian Trufin:,72379, multumim domnule senator are cuvantul domnul senator trufin lucian ,"(7274.94, 7276.94)"
41,Domnul Lucian Trufin:,72379,Domnul Virgil Guran:,75398, multumesc domnule presedinte stimati colegi mi am intitulat declaratia politica de astazi romanii solidari cu ucrainenii gandurile noastre se indreapta in aceste momente catre poporul ucrainean imaginile transmise de catre toate televiziunile din romania sunt cutremuratoare si greu de inteles din perspectiva anului doua mii douazeci si doi in viata aceasta nu alegem intotdeauna ce ni se intampla dar sunt momente in care alegerile noastre schimba soarta lucrurilor zilele acestea privind drama prin care trece poporului ucrainean am inteles mai mult ca oricand ca adevarata putere sta in solidaritate si ca empatia si spiritul de intrajutorare sunt virtuti inca vii nimeni nu credea ca vom mai vedea astfel de imagini in viata noastra la granitele romaniei dar din pacate povestirile bunicilor nostri din vremea celui de al doilea razboi mondial le avem acum in fata ochilor am convingerea ca binele si adevarul vor invinge pana atunci drama vecinilor nostri care iau drumul pribegiei si calea razboiului este impresionanta iar romanii de la granita cu ucraina si nu numai dau dovada de solidaritate si omenie de la aceasta tribuna doresc sa le multumesc tuturor botosanenilor mei atat din mediul privat din societatea civila dar si conducatorilor institutiilor locale si judetene pentru solidaritatea de care dau dovada si ajutorul concret pe care il ofera refugiatilor din tara vecina nimeni nu stie cat va dura acest razboi si mai ales care va fi deznodamantul trebuie sa constientizam faptul ca viata noastra nu va mai fi la fel de acum incolo dar in aceste momente grele se vad caracterul si omenia noastra imaginile cu ajutorul oferit la granita de catre romanii nostri strabat intreaga europa si impresioneaza prin caracterul dezinteresat al romanilor am convingerea ca vom continua pe acest drum al incurajarii si solidaritatii cat timp va fi nevoie sunt mandru ca sunt roman si ma inclin in fata altruismului conationalilor mei botosanenilor societatii civile autoritatilor asociatiilor ong urilor bisericii ortodoxe romane si tuturor celor care au oferit in mod voluntar suport logistic material si uman refugiatilor ucraineni fara sa astepte vreun moment ceva la schimb stimati colegi in aceste momente actiunea si fermitatea in respectarea principiilor uniunii europene si nato trebuie sa fie regula nu mai trebuie facute concesii nu mai sunt utile compromisurile trebuie sa spunem ferm nu imperialismului totalitarismului chiar si daca acest lucru ne va costa din punct de vedere economic politica tancurilor nu mai trebuie sa existe in europa traim vremuri grele dar respectarea principiilor de drept referitoare la libertatea cetatenilor si inviolabilitatea teritoriala nu se negociaza orice compromis pe aceste principii mai devreme sau mai tarziu se plateste si astazi vedem ca in ucraina se plateste cu sange va multumesc senator psd lucian trufin botosani ,"(7232.94, 7276.94)"
42,Domnul Virgil Guran:,75398,Domnul Eugen-Remus Negoi:,75498, multumim domnule senator dau cuvantul domnului senator negoi eugen remus ,"(5708.76, 7216.94)"
