,start_text,start_index,end_text,end_index,text,timestamp,start,end
49,Domnul Adrian Streinu Cercel:,53649,Doamna Alina-Ștefania Gorghiu:,55341, multumesc frumos doamna presedinta de sedinta propunerea legislativa are ca obiect de reglementare completarea legii nr nouazeci si cinci doua mii sase privind reforma in domeniul sanatatii preconizandu se ca perioada in care cabinetul medical individual a furnizat servicii medicale si conexe actului medical respectiv servicii medico dentare sa constituie pentru titularul cabinetului experienta profesionala de medic respectiv experienta profesionala de medic stomatolog si sa fie asimilata vechimii in munca in anumite conditii consiliul legislativ a avizat favorabil cu observatii consiliul economic si social a dat aviz favorabil propunerii legislative prin punctul de vedere ministerul sanatatii sustine adoptarea propunerii legislative sub rezerva insusirii observatiilor formulate lucru care s a si intamplat la comisia pentru sanatate comisia pentru munca familie si protectie sociala si comisia pentru drepturile omului egalitate de sanse culte si minoritati au transmis aviz favorabil comisia pentru buget finante activitate bancara si piata de capital a transmis aviz negativ in urma dezbaterilor din data de douazeci si patru mai doua mii douazeci si doi comisia pentru sanatate a hotarat sa adopte cu unanimitate de voturi raportul de admitere cu amendamente admise ce se regasesc in anexa la prezentul raport fata de cele prezentate comisia pentru sanatate supune plenului spre dezbatere si adoptare raportul de admitere cu amendamente admise si propunerea legislativa prin continutul sau normativ proiectul de lege face parte din categoria legilor organice senatul este prima camera sesizata va multumesc ,"(4285.0, 4342.0)",4285.0,4342.0
50,Doamna Alina-Ștefania Gorghiu:,55341,Domnul Eugen-Remus Negoi:,55543, multumesc domnule presedinte din partea grupurilor parlamentare dezbateri generale exista doritori domnule remus negoi aveti cuvantul va rog domnule senator ,"(1023.0, 4844.0)",1023.0,4844.0
51,Domnul Eugen-Remus Negoi:,55543,Doamna Alina-Ștefania Gorghiu:,57573, va multumesc doamna presedinte de sedinta initiativa legislativa propusa de usr reglementeaza o chestiune care trebuia reglementata de foarte mult timp medicii care lucreaza in propriile lor cabinete individuale vor avea vechimea in munca recunoscuta initiativa legislativa repara o nedreptate facuta zecilor de mii de medici de familie de specialitate sau stomatologi care lucreaza in cadrul propriilor lor cabinete medicale potrivit legislatiei actuale lor nu le era recunoscuta vechimea in munca in cazul unor concursuri de angajare sau al incadrarii pe grila de salarizare in unitatile publice potrivit statisticilor in anul doua mii douazeci in tara noastra erau inregistrate aproape patruzeci zero de cabinete medicale independente ale medicilor de familie de specialitate sau stomatologi propunerea legislativa prevede ca perioada in care cabinetul medical individual a furnizat servicii medicale sa fie considerata experienta profesionala de medic pentru titularul cabinetului si sa fie considerata vechime in munca similar prevederilor legale care li se aplica de exemplu avocatilor ce au recunoscuta vechimea in propriile cabinete pentru a fi luat in considerare ca vechime in munca pentru medic cabinetul sau individual trebuie sa indeplineasca doua conditii sa fi avut venituri nete de cel putin doisprezece salarii minime brute pe tara sa fi achitat contributiile datorate bugetului asigurarilor sociale de stat cu alte cuvinte sunt niste conditii de foarte mult bun simt care pun pe acelasi palier ceea ce se intampla in alte categorii profesionale cu ce inseamna medicii de familie as vrea in incheiere sa apreciez si sa multumesc presedintelui comisiei de sanatate din senat si membrilor comisiei care au votat in unanimitate raportul si care au facut si amendamentele care au dus la votarea in unanimitate a acestui raport grupul senatorilor usr va vota pentru aceasta initiativa legislativa va multumesc ,"(4368.0, 4496.0)",4368.0,4496.0
52,Doamna Alina-Ștefania Gorghiu:,57573,Domnul Ion Rotaru:,58191, multumesc domnule senator din partea celorlalte grupuri constat ca nu mai exista inscrieri la cuvant proiectul ramane la vot final la punctul opt avem propunerea legislativa pentru completarea articolului doisprezece litera b din ordonanta de urgenta a guvernului nr o suta cincizeci si opt doua mii cinci privind concediile si indemnizatiile de asigurari sociale de sanatate declar deschise dezbaterile generale asupra propunerii legislative domnul presedinte rotaru din partea comisiei pentru munca familie si protectie sociala va prezenta raportul va rog domnule presedinte ,"(4500.0, 4530.0)",4500.0,4530.0
53,Domnul Ion Rotaru:,58191,Doamna Alina-Ștefania Gorghiu:,58614, multumesc doamna presedinta raportul vizeaza propunerea legislativa pentru completarea articolului doisprezece litera b din oug nr o suta cincizeci si opt doua mii cinci privind concediile si indemnizatiile de asigurari sociale de sanatate comisia a dezbatut aceasta propunere legislativa si a adoptat un raport de admitere cu majoritate de voturi legea este organica senatul este prima camera sesizata multumesc ,"(1023.0, 4844.0)",1023.0,4844.0
54,Doamna Alina-Ștefania Gorghiu:,58614,Domnul Alexandru-Robert Zob:,58843, multumesc domnule presedinte din partea grupurilor parlamentare exista inscrieri la dezbaterile generale domnul senator robert zob are cuvantul este invitat la microfonul central ,"(4555.0, 4580.0)",4555.0,4580.0
55,Domnul Alexandru-Robert Zob:,58843,Doamna Alina-Ștefania Gorghiu:,60257, multumesc doamna presedinta doamnelor si domnilor senatori cred ca stiti deja foarte bine consecintele pandemiei de coronavirus cei doi ani de pandemie ne au aratat cat de fragili suntem noi si ne au aratat cat de vulnerabile sunt afacerile micilor antreprenori din tara noastra eu precum alti colegi de ai mei ma trag din mediul privat stiu cat de provocatoare poate fi fiecare zi si cat de mare poate fi presiunea zilei de maine din pacate nu de putine ori s a intamplat ca statul sa fie exact cel care le a pus cele mai mari piedici antreprenorilor mici chichite legislative pot face ca afacerea lor sa stagneze si stiti foarte bine ca acest lucru nu face decat sa ii descurajeze dragi colegi datoria noastra in calitate de demnitari este sa aparam interesele fiecarui cetatean din aceasta tara acest proiect vine direct in sprijinul antreprenorilor si ii va ajuta sa aiba o predictibilitate mult mai mare in ceea ce priveste cheltuielile cu plata medicala totodata micii intreprinzatori vor fi feriti de abuzuri vorbim de schimbari mici cu impact mare haideti sa i sustinem pe micii intreprinzatori si sa le aratam romanilor ca afacerile lor sunt sustinute incurajate si protejate de catre statul roman haideti sa livram fapte si sa le aratam oamenilor ca mediul antreprenorial este o prioritate pentru noi va multumesc ,"(4582.0, 4659.0)",4582.0,4659.0
56,Doamna Alina-Ștefania Gorghiu:,60257,Domnul György Attila:,60821, va multumesc domnule senator alte inscrieri la cuvant nu mai sunt lasam initiativa legislativa la vot final punctul noua proiect de lege privind supravegherea prudentiala a societatilor de servicii de investitii financiare precum si pentru modificarea si completarea unor acte normative declar deschise dezbaterile generale asupra proiectului de lege din partea ministerului de finante il invit pe domnul secretar de stat attila gyorgy sa ia cuvantul microfonul opt staff ul tehnic va rog ,"(4671.0, 4705.0)",4671.0,4705.0
57,Domnul György Attila:,60821,Doamna Alina-Ștefania Gorghiu:,61092, multumesc frumos prin proiectul de lege se transpun o serie de acte normative europene si se asigura corelarea legislatiei in domeniul serviciilor de investitii financiare va rugam sa fiti de acord cu proiectul de lege multumesc ,"(4841.0, 4844.0)",4841.0,4844.0
58,Doamna Alina-Ștefania Gorghiu:,61092,Domnul Sorin Vlașin:,61362, multumesc avem comisia pentru buget finante activitate bancara si piata de capital si comisia economica industrii si servicii care au elaborat un raport comun va invit domnule vicepresedinte sa prezentati raportul ,"(1023.0, 4844.0)",1023.0,4844.0
59,Domnul Sorin Vlașin:,61362,Doamna Alina-Ștefania Gorghiu:,62157, multumesc doamna presedinte membrii celor doua comisii au analizat proiectul de lege punctele de vedere exprimate avizele primite si au hotarat cu majoritate de voturi sa adopte un raport comun de admitere fara amendamente apreciind ca prevederile cuprinse in prezentul proiect de lege furnizeaza mediului de afaceri un grad sporit de claritate predictibilitate certitudine juridica avand in vedere stabilirea unui cadru prudential distinct aplicabil ssif urilor fata de cele prezentate comisia economica industrii si servicii si comisia pentru buget finante activitate bancara si piata de capital supun plenului senatului pentru dezbatere si adoptare raportul comun de admitere fara amendamente si proiectul de lege multumesc ,"(4742.0, 4784.0)",4742.0,4784.0
60,Doamna Alina-Ștefania Gorghiu:,62157,Domnul György Attila:,63004, ii multumesc domnului senator vlasin pentru prezentarea raportului din partea grupurilor parlamentare daca exista inscrieri la cuvant nu exista proiectul ramane la vot final punctul zece proiectul de lege pentru modificarea si completarea ordonantei de urgenta a guvernului nr treizeci si doi doua mii doisprezece privind organismele de plasament colectiv in valori mobiliare si societatile de administrare a investitiilor precum si pentru modificarea si completarea legii nr doua sute nouazeci si sapte doua mii patru privind piata de capital a legii nr saptezeci si patru doua mii cincisprezece privind administratorii de fonduri de investitii alternative precum si a legii nr douazeci si patru doua mii saptesprezece privind emitentii de instrumente financiare si operatiuni de piata declar dezbaterile deschise il rog pe domnul secretar de stat gyorgy sa prezinte pe scurt initiativa va rog ,"(4784.0, 4829.0)",4784.0,4829.0
61,Domnul György Attila:,63004,Doamna Alina-Ștefania Gorghiu:,63321, va multumesc o sa sintetizez intr o singura propozitie proiectul de lege aduce modificari si completari asupra mai multor acte normative incidente organismelor de plasament colectiv si emitentilor de valori mobiliare va rugam sa fiti de acord cu proiectul de lege multumesc ,"(4830.0, 4844.0)",4830.0,4844.0
62,Doamna Alina-Ștefania Gorghiu:,63321,Domnul Sorin Vlașin:,63419, multumesc din partea comisiei domnule vlasin aveti cuvantul ,"(4843.0, 4848.0)",4843.0,4848.0
63,Domnul Sorin Vlașin:,63419,Doamna Alina-Ștefania Gorghiu:,64045, multumesc in sedinta din data de douazeci si trei cinci doua mii douazeci si doi membrii comisiei pentru buget finante activitate bancara si piata de capital si membrii comisiei economice industrii si servicii au analizat proiectul de lege si au hotarat cu majoritatea voturilor membrilor prezenti optsprezece voturi pentru si o abtinere sa adopte un raport comun de admitere fara amendamente comisia de buget finante activitate bancara si piata de capital si comisia economica industrii si servicii supun spre dezbatere si adoptare plenului senatului raportul de admitere fara amendamente si proiectul de lege multumesc ,"(4848.0, 4865.0)",4848.0,4865.0
64,Doamna Alina-Ștefania Gorghiu:,64045,Domnul Ion-Narcis Mircescu (de la prezidiu):,64394, multumesc tare mult din partea grupurilor parlamentare daca exista interventii daca nu lasam proiectul la vot final la punctul unsprezece propunerea legislativa privind modificarea si completarea ordonantei de urgenta a guvernului sanatate nr treizeci si noua doua mii cinci privind ei chef ,"(4879.0, 4887.0)",4879.0,4887.0
65,Domnul Ion-Narcis Mircescu (de la prezidiu):,64394,Doamna Alina-Ștefania Gorghiu:,64450, alergie ,"(4897.0, 4897.0)",4897.0,4897.0
66,Doamna Alina-Ștefania Gorghiu:,64450,Doamna Gabriela Crețu:,65114, alergie ceva e completarea ordonantei de urgenta a guvernului nr treizeci si noua doua mii cinci privind cinematografia precum si pentru modificarea legii nr trei sute douazeci si opt doua mii sase pentru aprobarea ordonantei guvernului nr treizeci si noua doua mii cinci privind cinematografia ,"(2543.0, 4898.0)",2543.0,4898.0
67,Doamna Gabriela Crețu:,65114,Doamna Alina-Ștefania Gorghiu:,66775, imi cer scuze si in numele comisiei credeam ca este viorel badea ca a prezentat anterior proiectul de lege stimati colegi despre ce este vorba in aceasta lege avem fiecare dintre noi in orasele noastre cate o cladire sau cate o gradina publica in degradare aproape totala ele ar putea servi interesului public si partial si interesului privat dar acest lucru nu este posibil pentru ca ele sunt in patrimoniul radef adica regia autonoma de distributie si exploatare a filmelor romania film care este in situatie de insolventa in patrimoniul acesteia e o dezorganizare totala al acestei regii exista bunuri care sunt proprietate publica in proprietatea publica a statului care sunt in proprietatea privata a statului care sunt in proprietatea privata a autoritatilor locale care sunt in proprietatea publica a autoritatilor locale aceasta initiativa legislativa este a unor colegi de la camera care incearca sa puna putina ordine si sa faca inventarul acestui patrimoniu sa stabileasca in ce conditii autoritatile locale pot prelua daca intentioneaza aceste cladiri sau gradini publice in care functionau cinematografe ce ramane la regia autonoma astfel incat ea insasi sa poata fi salvata pentru ca altfel conditiile in care se afla sunt total improprii din acest punct de vedere noi la comisia de cultura suntem de acord si grupul psd de asemenea sa votam aceasta lege daca sub aspect juridic inca are ceva probleme speram din suflet ca la camera colegii nostri initiatori sa solutioneze acele probleme dar ea este o lege absolut necesara si absolut bine intentionata multumim ,"(4942.0, 5067.0)",4942.0,5067.0
68,Doamna Alina-Ștefania Gorghiu:,66775,Doamna Laura-Mihaela Fulgeanu-Moagher:,67367, multumesc doamna senator din partea celorlalte grupuri parlamentare pare ca nu mai exista interventii lasam proiectul la vot final punctul doisprezece proiectul de lege privind valorificarea adaptata a unor masuri dovedite benefice pentru institutiile din domeniul justitiei instituite pe perioada starii de alerta declarate in vederea prevenirii si combaterii efectelor pandemiei de covid nouasprezece declar dezbaterile generale deschise din partea comisiei juridice doamna vicepresedinte moagher va prezenta succint raportul va rog ,"(5068.0, 5093.0)",5068.0,5093.0
69,Doamna Laura-Mihaela Fulgeanu-Moagher:,67367,Doamna Alina-Ștefania Gorghiu:,68717, va multumesc doamna presedinta raport asupra proiectului de lege privind valorificarea adaptata a unor masuri dovedite benefice pentru institutiile din domeniul justitiei instituite pe perioada starii de alerta declarate in vederea prevenirii si combaterii efectelor pandemiei de covid nouasprezece proiectul de lege are obiect de reglementare stabilirea unor masuri temporare in domeniul activitatii de judecata a instantelor civile in domeniul insolventei precum si in domeniul executarii pedepselor al masurilor educative si a altor masuri dispuse de organele judiciare in cursul procesului penal similare celor instituite pe durata starii de alerta declarate in vederea prevenirii si combaterii efectelor pandemiei de covid nouasprezece consiliul legislativ a avizat favorabil comisia pentru administratie publica comisia pentru comunicatii si tehnologia informatiei comisia pentru drepturile omului egalitate de sanse culte si minoritati comisia pentru sanatate au transmis avize negative in sedinta din doi iunie doua mii douazeci si doi membrii comisiei juridice de numiri disciplina si imunitati au avizat si au prezentat un raport de admitere fara amendamente asupra proiectului de lege comisia juridica propune votului plenului senatului raportul de admitere fara amendamente si proiectul de lege ,"(5099.0, 5165.0)",5099.0,5165.0
70,Doamna Alina-Ștefania Gorghiu:,68717,Domnul George Cătălin Șerban – secretar de stat la Ministerul Justiției:,68994, multumesc doamna vicepresedinte daca din partea grupurilor parlamentare a iertati ma este si domnul secretar de stat catalin serban din partea ministerului justitiei am fost sesizata va rog domnule secretar de stat aveti cuvantul ,"(4843.0, 4848.0)",4843.0,4848.0
71,Domnul George Cătălin Șerban – secretar de stat la Ministerul Justiției:,68994,Doamna Alina-Ștefania Gorghiu:,69824, multumesc doamna presedinta obiectul proiectului de act normativ se refera la posibilitatea aplicarii cu caracter temporar sau dupa caz adaptarea unor masuri instituite pe durata starii de alerta declarate in vederea prevenirii si combaterii efectelor pandemiei de covid nouasprezece necesare functionarii justitiei ca serviciu public in domeniul activitatii de judecata a instantelor civile in domeniul insolventei in domeniul executarii pedepselor al masurilor educative si al altor masuri dispuse de organele judiciare in cursul procesului penal masuri care sa fie aplicabile pe o perioada de un an de la data intrarii in vigoare a proiectului de lege evident in calitate de initiator guvernul sustine proiectul de lege va multumesc ,"(5187.0, 5222.0)",5187.0,5222.0
72,Doamna Alina-Ștefania Gorghiu:,69824,Doamna Diana Iovanovici-Șoșoacă:,69983, va multumesc domnule ministru secretar de stat din partea grupurilor parlamentare doamna senator sosoaca aveti cuvantul ,"(1023.0, 4844.0)",1023.0,4844.0
73,Doamna Diana Iovanovici-Șoșoacă:,69983,Doamna Alina-Ștefania Gorghiu:,74023, multumesc probabil ca nu stiti cum se desfasoara totul online in instanta nu sunt de acord cu implementarea acestui sistem de ce pentru ca si asa dreptate nu se mai face in instantele din romania in primul rand nu stiu daca stiti dar la nivelul unei sectii de la tribunalul bucuresti exista o singura tableta tableta aceea se da din mana in mana pana cand unii au acces la ea altii nu au doi la mana transmiterea actelor prin modul electronic de foarte multe ori aceste mesaje ajung in spam nu esti atent nu iti verifici o zi doua trei s a terminat cu a lua la cunostinta de respectivele date mai mult exista o judecatorie mi s a intamplat mie personal in timpul perioadei starii de urgenta si ulterior in starea de alerta judecatoria cornetu ca ea sunt nenumarate alte judecatorii ori de cate ori am transmis pe calea mail ului sau fax ului acte cu privire la respectivele dosare niciodata acele acte nu au ajuns la instanta nici macar dupa cinci luni nu s au gasit niciodata nu se stie unde au disparut nu a fost numai cazul meu a fost cazul tuturor avocatilor care trimiteau acte la aceasta instanta mai mult sunt sectii de la tribunalul bucuresti care si asa si cand le depui in format fizic da se regasesc abandonate dupa luni si luni de zile de cautare exista o mare problema la nivelul instantelor mai mult nu exista personal care sa scaneze toate aceste acte noaptea cand noi am putea sa trimitem va spun avocatii exista instante care la ora douazeci zero inchid faxul nu poti sa mai trimiti exista de exemplu curtea de apel bucuresti care nu iti permite sa trimiti atasamente mai mari de douazeci de mega exista la parchete nu poti sa trimiti decat cateva acte si acolo afli cu stupoare ca nu au fost inregistrate pentru ca nu au ajuns suntem peste douazeci si trei cinci sute de avocati in romania ia ganditi va ca acesti douazeci si trei cinci sute de avocati trimit totul online eu personal aveam peste o suta cincizeci de dosare un simplu cabinet de avocatura da care tot timpul se marea numarul acelor dosare la fiecare sa trimiti online si sa vezi ca la majoritatea judecatoriilor tribunalelor si curtilor de apel nu iti ajung actele intotdeauna am fost nevoiti sa trimitem si prin posta si sa vedeti cum functioneaza posta ajungea dupa doua saptamani plicul respectiv puteai sa pierzi si termenul trebuia sa faci cereri sa faci recurs pentru a reveni a se rejudeca acea cauza avem grave probleme nu cred ca suntem in momentul in care sa putem sa dispunem de astfel de cum sa zic progrese din punct de vedere al posibilitatii de a merge pe mail pe fax si asa mai departe nu exista de cele mai multe ori nu au cum sa scoata la imprimanta tot ceea ce trimitem pentru ca nu au bani sa isi incarce imprimantele nu au bani sa si incarce fax urile nu le merge internetul avem grave probleme nu puteti sa votati lucruri care mai mult vor duce intr o degringolada sistemul juridic si mai am o intrebare exista acolo un articol care spune ca aceasta initiativa si anumite aspecte se raporteaza se poate amana la cererea persoanei care e in carantina izolare raportat la pandemia de covid nouasprezece cat timp va mai dura pandemia de covid nouasprezece ca sa fie aplicabil acest articol in conditiile in care acum vine variola maimutei nu mai stiu ce pesta porcina nu mai stiu ce gripa a tomatei si asa mai departe deci covid ul acesta pandemia de covid nouasprezece a anulat tot ceea ce inseamna gripa de ce nu aveti aceeasi dispozitie de amanare a dosarelor si cand ai gripa si cand ai o durere de cap si cand esti internat in spital pentru ca exista instante care nu vor aplica nici macar aceste lucruri spunand ca sunt cu caracter de recomandare cred ca nu stiti ce este in instante se vede clar ca nu stiti dumneavoastra trebuie sa vorbiti cu factorii implicati direct in aceste cauze ca sa va spuna cum functioneaza sau cum este disfunctional sistemul juridic din romania acestea sunt adevaruri multumesc frumos ,"(5241.0, 5543.0)",5241.0,5543.0
74,Doamna Alina-Ștefania Gorghiu:,74023,Domnul Radu-Mihai Mihail:,74186, pe procedura va rog tocmai voiam sa spun ca aceste dezbateri generale s au finalizat si lasam proiectul la vot final va rog ,"(1150.0, 5564.0)",1150.0,5564.0
75,Domnul Radu-Mihai Mihail:,74186,Doamna Alina-Ștefania Gorghiu:,74285, multumesc doamna presedinte doar scurt suntem obositi multumesc ,"(1023.0, 4844.0)",1023.0,4844.0
76,Doamna Alina-Ștefania Gorghiu:,74285,Domnul George Cătălin Șerban:,74783, am inteles e o procedura interesanta dati mi voie sa finalizam dezbaterile generale cu urmatorul punct propunerea legislativa pentru modificarea si completarea legii nr doua sute cincizeci si patru din nouasprezece iulie doua mii treisprezece privind executarea pedepselor si a masurilor privative de libertate dispuse de organele judiciare in cursul procesului penal declar dezbaterile deschise domnule secretar de stat si la asta aveti punct de vedere da va rog prezentati ,"(5578.0, 5601.0)",5578.0,5601.0
77,Domnul George Cătălin Șerban:,74783,Doamna Alina-Ștefania Gorghiu:,77139, multumesc doamna presedinta foarte pe scurt propunerea legislativa contine doua categorii de modificari sau completari prima dintre ele reprezinta practic un transfer de atributii de la procuror la judecatorul de supraveghere a privarii de libertate iar cea de a doua la mentinerea in centrul de retinere si arestare preventiva a persoanelor arestate preventiv aflate in curs de judecata si care au fost selectionate pentru a presta activitati in interesul centrului cu acordul lor pe o perioada de maximum doisprezece luni fata de maximum sase luni cat se prevede de lege lata aratam ca nu sustinem propunerea legislativa pentru urmatoarele considerente in primul rand ca judecatorul de supraveghere a privarii de libertate are ca atributii administrativ jurisdictionala solutionarea plangerilor detinutilor privind exercitarea drepturilor prevazute de lege prin urmare judecatorul nu poate dispune cu privire la acordarea drepturilor el nefiind implicat in mod direct in procedurile referitoare la acordarea drepturilor decat in cazurile prevazute de lege in alta ordine de idei exista anumite motive intemeiate pentru care interesul anchetei penale poate impune o restrangere a contactelor persoanelor inculpate cu anumite persoane fizice sau juridice care pot fi coinculpati martori victime sau care pot influenta aceste parti din dosar aceasta fiind de altfel si ratiunea pentru care este necesar acordul procurorului intrucat aceste chestiuni intereseaza asigurarea bunei desfasurari a urmaririi penale intr o cauza pendiente in care inculpatul este arestat preventiv in fine relativ la termenul de sase luni pe care initiatorii doresc a l modifica aratam ca acesta nu se refera la mentinerea persoanei arestate preventiv in cursul judecatii cu acordul sau in activitatile de prestare a unei munci neremunerate ci la pastrarea acesteia in centrul de retinere si arestare preventiva daca a fost selectionata in vederea prestarii unei munci neremunerate in interesul centrului in conditiile in care transferarea persoanei arestate preventiv din subordinea administratiei penitenciarelor in subordinea administratiei penitenciarelor in centrele de arestare preventiva este obligatorie potrivit legii in concluzie nu sustinem aceasta propunere va multumesc ,"(5650.0, 5723.0)",5650.0,5723.0
78,Doamna Alina-Ștefania Gorghiu:,77139,Doamna Laura-Mihaela Fulgeanu-Moagher:,77247, multumesc o invit pe doamna vicepresedinte moagher sa prezinte raportul ,"(1023.0, 4844.0)",1023.0,4844.0
