,start_text,start_index,end_text,end_index,text,timestamp,start,end
29,Domnul Viorel-Riceard Badea:,30127,Doamna Alina-Ștefania Gorghiu:,32325, multumesc doamna presedinte cu adresa l533 doua mii douazeci si unu din treisprezece decembrie doua mii douazeci si unu comisia pentru cultura si media a fost sesizata in fond cu proiectul de lege pentru modificarea si completarea legii audiovizualului nr cinci sute patru doua mii doi privind modificarea si completarea ordonantei guvernului nr treizeci si noua doua mii cinci privind cinematografia precum si pentru modificarea legii nr patruzeci si unu o mie noua sute nouazeci si patru privind organizarea si functionarea societatii romane de radiodifuziune si societatii romane de televiziune adoptat de camera deputatilor in sapte decembrie doua mii douazeci si unu proiectul are ca obiect de reglementare modificarea si completarea legii nr cinci sute patru doua mii doi a audiovizualului in scopul transpunerii directivei doua mii optsprezece o mie opt sute opt a parlamentului european si a consiliului din paisprezece noiembrie doua mii optsprezece de modificare a directivei doua mii zece treisprezece a uniunii europene privind coordonarea anumitor dispozitii stabilite prin acte cu putere de lege sau acte administrative in cadrul statelor membre referitor la furnizarea de servicii de mass media audiovizuala consiliul legislativ a avizat favorabil proiectul de lege cu observatii si propuneri consiliul economic si social avizeaza favorabil proiectul de lege aviz comunicat sub nr sase mii noua sute optzeci si noua din patru octombrie doua mii douazeci si unu proiectul legislativ a primit avize favorabile fara amendamente din partea comisiei pentru buget finante activitate bancara si piata de capital comisiei pentru sanatate comisiei pentru drepturile omului egalitate de sanse culte si minoritati comisiei pentru invatamant tineret si sport si din partea comisiei juridice de numiri disciplina imunitati si validari comisia economica industrii si servicii a transmis comisiei un aviz favorabil cu un amendament admis de asemenea comisia pentru comunicatii si tehnologia informatiei a transmis un aviz negativ proiectul legislativ a fost luat in dezbatere de comisia pentru cultura si media pe parcursul sedintelor sale din douazeci aprilie saptesprezece mai si respectiv treizeci si unu mai in urma dezbaterilor membrii comisiei au hotarat cu majoritatea voturilor senatorilor prezenti sa adopte raport de admitere cu amendamente admise si amendamente respinse multumesc ,"(2532.0, 2580.0)",2532.0,2580.0
30,Doamna Alina-Ștefania Gorghiu:,32325,Doamna Gabriela Crețu:,32501, multumesc domnule presedinte vad ca doamna senator cretu este din partea grupului psd inscrisa la cuvant la microfonul central va rog ,"(1023.0, 4844.0)",1023.0,4844.0
31,Doamna Gabriela Crețu:,32501,Doamna Alina-Ștefania Gorghiu:,35121, multumesc doamna presedinta grupul psd sustine legea in forma actuala cu amendamentele admise este o lege stimati colegi cu adevarat muncita cu audieri repetate ale partilor interesate cu dezbateri si negocieri grele pe fiecare amendament si credem ca s a ajuns la o forma adecvata in acest moment si in baza prevederilor directivei nr o mie opt sute opt doua mii optsprezece pe care vrea sa o transpuna si a problemelor pe care le intampinam mai ales odata cu aparitia platformelor on line asta nu inseamna ca directiva europeana este ideala traim in epoca media audiovizualul in forma lui mai clasica dar si in forma noua permisa de aparitia internetului ne spune ce sa facem ne spune cum sa gandim ne spune ce e bine si ce e rau si asta in forma din filmele western in care exista de o parte raul absolut de cealalta parte binele absolut si asta intr o lume in care exista multe nuante de gri si spre fericirea noastra exista si multe culori si pe care a trebuit sa le luam in considerare cei care detin retelele de cablu cei care detin platformele on line cei care controleaza capitalul furnizorilor de programe au o putere enorma de a influenta opinia publica de a influenta politica economia societatea cultura iar solutia pe care o propunem si pe care trebuie s o adoptam e inca in stilul clasic adica cream autoritati de reglementare autonome care prin intelepciunea lor se presupune vor preveni abuzul si ne vor apara valorile iar metoda pe care o folosesc este cea a supravegherii si pedepsei o stim prea bine la noi e cna ul in aceasta privinta se pun inca niste intrebari si legislatia viitorului trebuie sa fie probabil diferita de cea de astazi putem si avem cadre suficiente pentru a supraveghea diversitatea surselor in mediul online de exemplu cine i supravegheaza pe supraveghetori e o alta intrebare ca ei sunt oameni si pot gresi in egala masura ca si cei care pun in circulatie tot felul de informatii noi exercitam controlul democratic asupra cna ului acum dar cred ca pe langa a trata efectele deci inca o data noi votam aceasta lege credem ca este adecvata relativ scopului noi trebuie sa investim in oameni astfel incat sa faca diferenta intre bine si rau intre fals si adevar astfel incat sa asiguram si pluralismul opiniilor ca adeseori vedem o singura opinie desi sunt o suta de surse de informare si nu numai decat este cea adevarata si sa asiguram si independenta furnizorilor de continut de cei care cu adevarat detin puterea multumesc foarte mult vom vota pentru ,"(2686.0, 2822.0)",2686.0,2822.0
32,Doamna Alina-Ștefania Gorghiu:,35121,Doamna Diana Iovanovici-Șoșoacă:,38175, multumesc din partea grupului pnl o sa va spun cateva vorbe ca sa justific votul pentru pe aceasta initiativa legislativa pornind de la un lucru absolut normal si anume ca adaptarea legislatiei la nevoile generate de catre dezvoltarea societatii n ar trebui sa sperie pe nimeni nici macar in acest domeniu al audiovizualului aceasta directiva de care si domnul secretar de stat vorbea si colega noastra de la psd din comisie doamna senator cretu a carei negociere a inceput acum mai bine de cinci ani de zile si care a fost adoptata la nivel european in doua mii optsprezece a identificat necesitatile si actantii noi in domeniu romania transpune aceste prevederi care reglementeaza in primul rand modalitatea de raportare la noile tipuri de platforme care asigura continut similar cu furnizorii clasici de materiale audiovizuale suntem datori ca atare sa protejam in primul rand tanara generatie de continut nociv iar prin legislatie putem sa facem acest lucru in mod nepartinitor sunt de acord toata lumea e de acord ca dreptul la libera exprimare este esential si trebuie sa l protejam prin toate mijloacele posibile insa n avem voie sa permitem sub un fals discurs de exemplu ca bullyingul ca discursul instigator la ura sau toate practicile comerciale nocive sa se instaleze in sanul democratiei pandemia ne a aratat insa si ce inseamna fata urata a dezinformarii care a ajuns sa puna pumnul in gura tuturor argumentelor ca utilizatori fiecare dintre noi trebuie sa aiba dreptul sa stie cine este furnizorul materialelor audiovizuale independent de mijloacele pe care acest furnizor le utilizeaza pentru a transmite informatia astazi acest proiect de lege pe care l aveti in fata si pe care l dezbatem aduce urmatoarele beneficii foarte pe scurt o data protejarea cetatenilor mai ales a minorilor impotriva continutului nociv precum si combaterea continutului care instiga la ura terorism pornografie infantila xenofobie si rasism sau alte forme de discriminare in al doilea rand vorbim despre promovarea operelor europene ceea ce va creste spiritul de apartenenta national dar si european si se va traduce prin aducerea de venituri importante pentru sectorul cultural romanesc totodata prin suplimentarea fondului national cinematografic cu cele doua tipuri de venituri producatorii romani vor primi predictibilitatea necesara pentru finantarea operelor audiovizuale nationale si sigur dar nu in ultimul rand vorbim despre transparenta in legatura cu furnizorii de servicii media audiovizuale a fost un proiect care a avut suficiente blocaje si la nivelul guvernului si in parlament ne am blocat putin au fost foarte multe dezbateri si l felicit pe viorel badea presedintele comisiei de cultura ca a reusit sa faca aceasta armonizare a discutiilor intre diversii actori astfel incat astazi sa putem sa dam votul final pe proiectul de lege multumesc doamna senator sosoaca va rog ,"(2915.0, 3112.0)",2915.0,3112.0
33,Doamna Diana Iovanovici-Șoșoacă:,38175,Doamna Alina-Ștefania Gorghiu:,41241, cu tot respectul dar aceasta initiativa nu are nicio legatura cu democratia ci cu dictatura v am auzit vorbind aici ca in pandemie nu ati fost lasati sau nu stiu cine nu a fost lasat sa si aduca argumentele noi cei care am fost singura voce noi din civic si apoi in politica o mana de oameni care am fost singurii care am contrazis tot ceea ce se impunea la nivel guvernamental presedintial european si acum dupa doi ani si jumatate s a adeverit absolut tot ceea ce am spus noi si am venit cu argumente medicale dumneavoastra ne ati pus pumnul in gura sa nu vorbim mai mult decat atat cenzura opereaza la toate nivelele mai mult decat atat toate amenzile cna care au fost date catre televiziuni care au avut curajul sa prezinte o cu totul alta opinie decat cea a medicilor platiti de catre guvern toate acele amenzi au fost duse in instanta unde instanta le a anulat in schimb n ati facut altceva decat sa dati apa la moara cna ului care cu niste membrii care nu au niciun fel de studii de specialitate a anihilat tot ceea ce insemna presa libera in romania cred ca nu intelegeti ca tot ceea ce faceti acum se intoarce impotriva dumneavoastra si dumneavoastra veti fi supusi cenzurii n o sa fiti nonstop la putere roata se intoarce fie ea si patrata toate adevarurile care au fost spuse de noi s au adeverit desi in cna toate televiziunile amendate toti producatorii au adus argumente stiintifice si cu baza legala le au fost respinse toate argumentele ba mai mult nu au fost lasati nici macar sa vorbeasca si dumneavoastra vorbiti de democratie si de libertatea de exprimare libertatea de exprimare a fost anulata traim intr o veridica dictatura era mai bine pe vremea lui ceausescu decat pe vremea voastra stiti de ce pentru ca pe vremea lui ceausescu stiam regulile acum voi sub o perdea de democratie aveti de fapt cea mai cumplita dictatura si daca va referiti la minori v ati gandit vreodata ce a facut acea mediatizare a vaccinarii obligatorii cu privire la psihicul copiilor botnita voastra impusa in scoala aveti trei copii pe constiinta morti din cauza mastii aveti nenumarati oameni morti din cauza vaccinarii pe care voi ati facut o sa fie obligatorie prin constrangere morala si psihica si veniti cu proiecte de genul asta in care cna ul are toate drepturile din lume de parca ar trebui sa mai existe cna ul dupa ce exista un presedinte care uraste romania un guvern care nu face altceva decat sa instituie reguli la nivel european impotriva suveranitatii romaniei si un parlament care intr o imensa majoritate nu face altceva decat sa incalce suveranitatea romaniei dreptul la libera exprimare dreptul la libera gandire si constiinta anulati tot ceea ce inseamna drepturi si libertati fundamentale pentru care sute de ani s a luptat si s a murit in aceasta lume aveti mainile cei mai multi dintre voi cei care ati luat decizii in pandemie aveti mainile patate de sange ,"(3127.0, 3356.0)",3127.0,3356.0
34,Doamna Alina-Ștefania Gorghiu:,41241,Doamna Diana Iovanovici-Șoșoacă:,41292, multumesc frumos ,"(1023.0, 4844.0)",1023.0,4844.0
35,Doamna Diana Iovanovici-Șoșoacă:,41292,Doamna Alina-Ștefania Gorghiu:,41364, si va stiti voi cine sunteti aceia ,"(3365.0, 3365.0)",3365.0,3365.0
36,Doamna Alina-Ștefania Gorghiu:,41364,Doamna Laura-Iuliana Scântei:,42143, doamna senator data viitoare poate vorbiti si pe proiectul de lege va multumesc dat fiind faptul ca nu mai sunt inscrieri la cuvant o sa las proiectul la vot final la punctul cinci al ordinii de zi este inscrisa propunerea legislativa pentru modificarea art douazeci si trei alin imediat comisia juridica de numiri disciplina imunitati si validari si comisia pentru drepturile omului egalitate de sanse culte si minoritati au elaborat un raport comun o invit pe doamna presedinte iulia scantei sa prezinte raportul ,"(1023.0, 4844.0)",1023.0,4844.0
37,Doamna Laura-Iuliana Scântei:,42143,Doamna Alina-Ștefania Gorghiu:,42853, va multumesc doamna presedinta propunerea legislativa l346 doua mii douazeci si doi are ca obiect completarea numarului membrilor colegiului director al consiliului national pentru combaterea discriminarii de la noua cati sunt in prezent la unsprezece cu obligatia ca unul dintre acesti membrii sa fie un reprezentant al grupului parlamentar al minoritatilor nationale din camera deputatilor consiliul legislativ a avizat favorabil aceasta propunere legislativa iar in sedinta comuna a comisiei juridice si comisiei pentru drepturile omului a fost adoptat cu majoritate de voturi un raport de admitere fara amendamente pe care il supunem votului plenului senatului va multumesc ,"(3421.0, 3467.0)",3421.0,3467.0
38,Doamna Alina-Ștefania Gorghiu:,42853,Domnul Claudiu-Richard Târziu:,43034, multumesc doamna presedinta din partea grupurilor parlamentare il invit pe liderul aur la microfon domnul senator claudiu tarziu ,"(1023.0, 4844.0)",1023.0,4844.0
39,Domnul Claudiu-Richard Târziu:,43034,Doamna Alina-Ștefania Gorghiu:,43931, multumesc doamna presedinte v as ruga sa supuneti la vot propunerea noastra de retrimitere la comisie a proiectului de lege avand in vedere ca a trecut foarte repede prin comisii si ca noi avem obiectii de fond asupra acestor modificari intai de toate consiliul pentru discriminare din punctul nostru de vedere n ar trebui sa existe este o institutie care discrimineaza in sine dar trecand peste asta nu vedem niciun rost in marirea numarului de membrii si cu atat mai putin in prevederea expresa ca trebuie sa fie neaparat un reprezentant al grupurilor minoritatilor atata vreme cat celelalte grupuri parlamentare nu sunt in mod obligatoriu reprezentante sunt alesi bineinteles reprezentantii in functie de numarul de voturi si de cele mai multe ori cu acceptul si cu osardia majoritatii va rog deci supuneti la vot ,"(3484.0, 3549.0)",3484.0,3549.0
40,Doamna Alina-Ștefania Gorghiu:,43931,Doamna Laura-Iuliana Scântei:,44657, voi supune votului plenului solicitarea de retrimitere la comisie a liderului de grup aur stimati colegi va rog sa va pregatiti cartelele rog vot multumesc optzeci si patru prezenti treizeci si cinci pentru contra patruzeci si noua propunerea domnului tarziu a fost respinsa din partea grupurilor parlamentare la dezbateri generale rog interventii nu exista atunci voi lasa proiectul la vot final punctul sase propunerea legislativa pentru completarea legii nr doua sute saptezeci si trei doua mii patru privind procedura adoptiei declar dezbaterile deschise din partea comisiei juridice numiri disciplina imunitati aceeasi eterna fascinanta doamna presedinta iulia scantei va rog aveti cuvantul ,"(3551.0, 3623.0)",3551.0,3623.0
41,Doamna Laura-Iuliana Scântei:,44657,Doamna Alina-Ștefania Gorghiu:,45853, va multumesc doamna presedinta propunerea legislativa pentru completarea legii nr doua sute saptezeci si trei doua mii patru privind procedura adoptiei are ca scop incriminarea faptei parintelui sau a reprezentantului legal al unui copil care pretinde bani ori alte foloase materiale in scopul stabilirii intre copil si terte persoane a unor legaturi asemanatoare celor dintre parinti si copii fara a se recurge la procedura standard de adoptie consiliul legislativ a avizat favorabil cu observatii si propuneri proiectul legislativ consiliul economic si social a avizat favorabil propunerea legislativa de asemenea consiliul superior al magistraturii a transmis un punct de vedere favorabil dar sub rezerva preluarii unor observatii iar in cadrul sedintei din treizeci si unu mai la care a participat si reprezentantul ministerului justitiei si caruia va rog cu amabilitate sa i acordati cuvantul dupa expunerea raportului pentru ca este prezent in sala in sedinta din treizeci si unu mai doua mii douazeci si doi membrii comisiei juridice au adoptat cu unanimitate de voturi un raport de admitere cu amendamente admise asupra propunerii legislative pe care il inaintam plenului senatului ,"(3618.0, 3685.0)",3618.0,3685.0
42,Doamna Alina-Ștefania Gorghiu:,45853,Doamna Laura-Iuliana Scântei:,46057, in regula dau cuvantul grupurilor parlamentare pe dezbateri generale daca exista inscrieri la cuvant doamna iulia scantei pe dezbateri generale da va rog frumos ,"(3710.0, 3717.0)",3710.0,3717.0
43,Doamna Laura-Iuliana Scântei:,46057,Doamna Alina-Ștefania Gorghiu:,47926, va multumesc doamna presedinta am dorit sa iau cuvantul din partea grupului parlamentar pnl pentru a explica de ce astazi impreuna cu colegii mei vom vota o propunere legislativa buna initiata de colegii nostri de la usr pentru ca impreuna cu ceilalti membrii ai comisiei juridice din cadrul grupului parlamentar pnl am corectat aceasta procedura legislativa care repet ca scop de legiferare este una corecta incriminarea intr un limbaj obisnuit a vanzarii de copii atunci cand se incearca eludarea procedurii legale de adoptie din pacate solutiile legislative ale initiatorilor nu ar fi dus la transpunerea realizarea scopului initiativei legislative si am considerat util impreuna cu colegii mei senatori din comisia juridica claudia banu si cristi tagarlas sa ajutam initiatorii sa corecteze acest proiect mai mult am dorit sa incriminam mai multe fapte care erau accesorii si erau strict legate de scopul acestui proiect respectiv am incriminat si fapta persoanei de a oferi sau de a da bani ori de a da alte foloase materiale parintelui sau reprezentantului legal al unui copil atunci cand doreste sa faciliteze procedura de adoptie si am sanctionat o cu o pedeapsa de la doi la sapte ani iar strict pe propunerea legislativa a colegilor nostri de la usr am extins ceea ce si au propus acestia si am sanctionat inclusiv intermedierea acestor fapte numite de vanzare de copii de fapt intr un limbaj juridic intermedierea pentru stabilirea intre o persoana si respectivul copil a unor legaturi asemanatoare celor dintre parinti si copii in scopul obtinerii de foloase materiale pentru care am propus o pedeapsa de la unu la cinci ani pentru aceste motive impreuna cu colegii din grupul parlamentar pnl vom sustine la vot aceasta propunere legislativa va multumesc ,"(3727.0, 3845.0)",3727.0,3845.0
44,Doamna Alina-Ștefania Gorghiu:,47926,Doamna Elena-Simona Spătaru:,48048, multumesc doamna senator o invit pe doamna senator simona spataru la cuvant va rog ,"(3844.0, 3847.0)",3844.0,3847.0
45,Doamna Elena-Simona Spătaru:,48048,Doamna Alina-Ștefania Gorghiu:,50716, multumesc doamna presedinte de sedinta stimati colegi astazi va cer votul pentru copiii care cad victime ale vanzarii ca urmare a ocolirii procedurilor de adoptie asa cum si colega mea de comisie careia ii multumesc pentru colaborare si multumesc tuturor colegilor ca au votat aceasta propunere in unanimitate va aduc la cunostinta ca oricat de cutremurator suna dupa foarte multi ani de la revolutie sunt inca copii care cad victime acestei proceduri de ocolire a adoptiilor si sunt vanduti pe nimic sunt vanduti pentru ca exista multa multa saracie si lipsa de educatie sunt lucruri care din pacate au fost lasate in nelucrare in toti acesti ani cu toate ca atat inalta curte de casatie si justitie cat si alte instante europene au constatat acest vid legislativ mai mult decat atat romania a ratificat protocolul facultativ la conventia cu privire la drepturile copilului referitor la vanzarea de copii prostitutia copiilor si pornografia infantila in septembrie doua mii unu sase septembrie doua mii unu iar conform acestui protocol romania trebuia sa faca toate diligentele pentru ca vanzarea de copii considerata orice act sau tranzactie prin care un copil este transferat de orice persoana sau grup de persoane catre o alta persoana ori catre un alt grup contracost sa fie interzisa cu toate acestea cum va spuneam romania pana astazi nu a asigurat transpunerea in legislatia nationala a acestei prevederi si vanzarea de copii este inca posibila eu va multumesc astazi si sunt convinsa ca vom vota in unanimitate acest proiect de lege este firesc ca noi statul roman sa indreptam aceasta situatie si sa depunem toate diligentele necesare pentru ca drepturile fundamentale ale copilului sa fie respectate si ne referim aici si la dreptul de a stabili si pastra identitatea sa dreptul la nume dreptul de a avea o cetatenie de a si cunoaste parintii de a fi ingrijit crescut si educat de acestia dreptul de a si pastra numele si relatiile de familie dreptul de a mentine relatii personale si contacte directe cu parintii rudele dreptul de a si cunoaste rudele si de a intretine relatii personale cu acestea iar toate acestea trebuie sa fie respectate indiferent de posibilitatile materiale ale familiei din care acesti copii provin multumesc deci colegilor pentru sustinere si va indemn pe toti sa votam aceasta propunere legislativa pe care am facut o alaturi de colegul meu mindruta george si in toate cazurile asemanatoare sa lucram impreuna pentru indreptarea acestor situatii abominabile va multumesc ,"(3936.0, 4006.0)",3936.0,4006.0
46,Doamna Alina-Ștefania Gorghiu:,50716,Doamna Diana Iovanovici-Șoșoacă:,50821, multumesc doamnei senator constat ca nu mai doamna senator sosoaca ,"(1023.0, 4844.0)",1023.0,4844.0
47,Doamna Diana Iovanovici-Șoșoacă:,50821,Doamna Alina-Ștefania Gorghiu:,52745, va multumesc da este o initiativa foarte buna numai ca va trebui sa fie completata si va spun si de ce probabil ca nu stiti ca aceste donari de bani nu pot fi descoperite pentru ca exista un dublu interes al celui care isi vinde copilul si al celui care l cumpara stiti cand se dau banii inca inainte de conceptie suma variaza intre trei zero si cinci zero de euro exista si cazuri de zece zero de euro cuplul face ce face persoana ramane gravida deci va spun ca am nenumarate cazuri cunoscute niciunul dintre niciuna dintre persoanele implicate nu a vrut sa depuna vreo plangere penala vreodata femeia ramane gravida se interneaza in anumite spitale unde se interneaza si mama cumparatoare care este inregistrata ca cea fiind gravida si care ar fi dat nastere mama care a nascut iese imediat afara din spital si la iesire dupa patruzeci si opt saptezeci si doi de ore mama de fapt care a platit copilul adoptativa este de fapt cea care iese nici nu mai trebuie sa treaca prin procesul de adoptie aici este problema si niciuna dintre aceste persoane nu vrea sa depuna plangere pentru ca ei sunt inregistrati ca fiind de fapt parintii adevarati ai copilului in cazurile de adoptie filiera si ar fi trebuit sa o vedeti la comisia din care faceti parte multi dintre dumneavoastra este urmatoarea se merge de la primar protectia copilului judecator procuror si apoi copilul este vandut pretul unui copil vandut mai ales in strainatate este intre o suta zero si sase sute zero de euro vreau sa stiu cati dintre procurori au anchetat aceste cauze pentru ca noi i am sesizat niciodata nu au gasit vinovatul niciodata nu au condamnat pe nimeni aici este drama poporului roman da este foarte buna initiativa dar nu stiu cate dosare vor exista vreodata cu solutionare de condamnare intr un asemenea caz multumesc ,"(4021.0, 4169.0)",4021.0,4169.0
48,Doamna Alina-Ștefania Gorghiu:,52745,Domnul Adrian Streinu Cercel:,53649, daca nu mai exista alte interventii las acest punct la votul final o sa rog liderii de grup domnul oprea domnul tagarlas domnul radu mihail sa mi comunicati daca putem prelungi cu jumatate de ora programul astfel incat sa mai dezbatem cateva legi organice asa cum ati stabilit la bp da atunci o sa va rog sa trecem la votul acestei prelungiri de program pana la saisprezece treizeci ca sa putem sa mai operam cateva legi organice va rog vot optzeci si sase prezenti optzeci si trei pentru trei abtineri multumesc frumos stimati colegi pentru prelungirea programului punctul sapte al ordinii de zi inscrisa propunerea legislativa pentru completarea legii nr nouazeci si cinci doua mii sase privind reforma in domeniul sanatatii declar dezbaterile deschise dau cuvantul comisiei pentru sanatate pentru prezentarea raportului domnule presedinte streinu cercel aveti cuvantul ,"(4185.0, 4249.0)",4185.0,4249.0
