,start_text,start_index,end_text,end_index,text,timestamp,start,end
1,S T E N O G R A M A,0,şedinţei Senatului din 7 iunie 2022,21, ,"(30.0, 6802.0)",30.0,6802.0
2,şedinţei Senatului din 7 iunie 2022,21,S U M A R,60, ,"(30.0, 6802.0)",30.0,6802.0
3,S U M A R,60,S T E N O G R A M A,5093, unu aprobarea ordinii de zi si a programului de lucru patru cinci douazeci si trei doi adoptarea tacita prin implinirea termenului pentru dezbatere si adoptare la doi si trei cinci iunie doua mii douazeci si doi a unor initiative legislative trei dezbaterea si adoptarea proiectului de hotarare pentru modificarea art opt din cinci hotararea senatului nr douazeci si sase doua mii douazeci si doi privind investigarea cazurilor de abuzuri sexuale sau a oricaror abuzuri fizice impotriva minorilor din serviciile de tip rezidential aflate in subordinea directiilor generale de asistenta sociala si protectie a copilului din legea nr patruzeci si sapte o mie noua sute nouazeci si doi privind organizarea si functionarea curtii constitutionale republicata ,"(851.0, 6792.0)",851.0,6792.0
4,S T E N O G R A M A,5093,ședinței Senatului din 7 iunie 2022,5114, ,"(30.0, 6802.0)",30.0,6802.0
5,ședinței Senatului din 7 iunie 2022,5114,Doamna Alina-Ștefania Gorghiu:,5379, sedinta a inceput la ora cincisprezece cinci lucrarile sedintei au fost conduse de doamna alina stefania gorghiu vicepresedinte al senatului asistata de domnii ion mocioalca si ion narcis mircescu secretari ai senatului ,"(30.0, 6802.0)",30.0,6802.0
6,Doamna Alina-Ștefania Gorghiu:,5379,Domnul György Attila – secretar de stat la Ministerul Finanțelor:,9241, stimati colegi o sa va rog sa luati loc in banci si sa introduceti cartelele ca sa putem sa verificam daca avem cvorum de incepere a sedintei multumesc declar deschise dezbaterile generale asupra acestui proiect invit din partea ministerului finantelor pe domnul secretar de stat attila gyorgy pentru sustinerea punctului de vedere microfon opt staff tehnic va rog multumesc ,"(981.0, 998.0)",981.0,998.0
7,Domnul György Attila – secretar de stat la Ministerul Finanțelor:,9241,Doamna Alina-Ștefania Gorghiu:,9725, multumesc doamna presedinta de sedinta prin ordonanta de urgenta nr saizeci si doi doua mii douazeci si doi s au implementat o serie de solutii privind disfunctionalitatile identificate in ceea ce priveste politele de asigurare emise de societati impotriva carora au fost pronuntate hotarari de deschidere a procedurii de faliment va rugam sa fiti de acord cu raportul de admitere pregatit de comisia de specialitate multumesc ,"(1001.0, 1025.0)",1001.0,1025.0
8,Doamna Alina-Ștefania Gorghiu:,9725,Doamna Laura-Iuliana Scântei:,10021, va multumesc din partea comisiilor raportoare care sunt comisia economica industrii si servicii comisia juridica de numiri disciplina imunitati si validari care au elaborat raport comun o invit pe doamna presedinta iulia scantei sa prezinte raportul ,"(1023.0, 1039.0)",1023.0,1039.0
9,Doamna Laura-Iuliana Scântei:,10021,Doamna Alina-Ștefania Gorghiu:,10741, va multumesc doamna presedinta comisia economica industrii si servicii precum si comisia juridica de numiri disciplina imunitati si validari din senat au fost sesizate de biroul permanent pentru intocmirea raportului comun asupra legii de adoptare proiectul de lege pentru aprobarea ordonantei de urgenta nr saizeci si doi am analizat textul ordonantei de urgenta de asemenea avizele favorabile primite de la consiliul legislativ precum si de la comisia coavizatoare comisia pentru buget finante si cu unanimitate de voturi cele doua comisii raportoare au adoptat un raport comun de admitere fara amendamente pe care il supunem votului plenului senatului va multumesc ,"(1039.0, 1079.0)",1039.0,1079.0
10,Doamna Alina-Ștefania Gorghiu:,10741,Doamna Hegedüs Csilla – secretar de stat la Ministerul Investițiilor și Proiectelor Europene:,11839, multumesc doamna presedinta scantei va rog din partea grupurilor parlamentare daca exista interventii acest proiect va ramane la vot final dati mi voie sa anunt prezenta la balconul salii de plen a unui grup de studenti de la facultatea de comunicare inteleg invitati de domnul senator remus negoi ii felicitam le uram o sedinta o audiere placuta a plenului de astazi succes dragii mei declar deschise dezbaterile generale asupra proiectului de lege dau cuvantul doamnei secretar de stat hegedus din partea mipe pentru prezentarea succinta a proiectului de lege va rog microfonul noua tehnicul ,"(1140.0, 1151.0)",1140.0,1151.0
11,Doamna Hegedüs Csilla – secretar de stat la Ministerul Investițiilor și Proiectelor Europene:,11839,Doamna Alina-Ștefania Gorghiu:,12817, buna ziua prezenta ordonanta de urgenta are drept scop instituirea unor masuri temporare denumite sprijin pentru romania pana la data de treizeci si unu decembrie doua mii douazeci si doi pentru sprijinul material al unor categorii de populatie vulnerabila bugetul masurii temporare sprijin pentru romania acordata prin intermediul tichetelor sociale pe suport electronic pentru perioada unu iunie treizeci si unu decembrie doua mii douazeci si doi este de trei unu miliarde de lei cu surse de finantare de la bugetul de stat prin bugetul ministerului investitiilor si proiectelor europene precum si din fondurile europene nerambursabile din cadrul poad doua mii paisprezece doua mii douazeci incepand cu unu iunie mipe a inceput procesul de emitere distribuire si incarcare a voucherelor sociale oferite prin programul guvernamental sprijin pentru romania rugam frumos aprobarea oug ului in forma adoptata de guvernul romaniei multumesc ,"(1155.0, 1209.0)",1155.0,1209.0
12,Doamna Alina-Ștefania Gorghiu:,12817,Domnul Nicolae Neagu:,13241, multumesc doamna secretar de stat pentru prezentare din partea comisiilor raportoare avem comisia pentru buget finante activitate bancara piata de capital si comisia pentru munca familie si protectie sociala care au elaborat un raport comun il invit pe domnul presedinte nicu neagu din partea comisiei de buget finante sa prezinte acest raport domnule presedinte va rog ,"(1209.0, 1228.0)",1209.0,1228.0
13,Domnul Nicolae Neagu:,13241,Doamna Alina-Ștefania Gorghiu:,13629, multumesc doamna presedinta in urma dezbaterilor care s au desfasurat in sedinte separate membrii celor doua comisii au hotarat cu majoritate de voturi sa adopte un raport comun de admitere fara amendamente in raport cu obiectul de reglementare proiectul de lege face parte din categoria legilor ordinare senatul este prima camera sesizata ,"(1230.0, 1252.0)",1230.0,1252.0
14,Doamna Alina-Ștefania Gorghiu:,13629,Domnul Claudiu-Marinel Mureșan:,13915, va multumesc din partea grupurilor parlamentare inscrieri la cuvant o sa mi dati voie mie atunci sa cobor la microfon daca nu exista din partea celorlalte grupuri exista domnule muresan va invit pe dumneavoastra atunci va dau prioritate ,"(1252.0, 1265.0)",1252.0,1265.0
15,Domnul Claudiu-Marinel Mureșan:,13915,Doamna Alina-Ștefania Gorghiu:,17087, va multumesc foarte mult doamna presedinte doamnelor si domnilor senatori guvernul ne propune sa votam astazi un proiect de lege care presupune acordarea de tichete sociale in valoare de doua sute cincizeci de lei o valoare care va fi transferata o data la doua luni catre beneficiarii nominalizati dupa anumite criterii prin aceasta masura guvernul spera sa scoata romania din saracie nu vreau sa intru in foarte multe detalii dar as vrea totusi sa punctez cateva lucruri care din punctul meu de vedere sunt importante in primul rand trebuie sa spunem ca legea aceasta este una incorecta si spun asta pentru ca prin aceste masuri nu faceti altceva decat sa dati inapoi romanilor o prea mica parte din banii pe care ii luati prin taxe de tot felul pe care le aplicati noilor preturi la utilitati la alimente si la combustibili si sa nu spuneti ca nu este asa pentru ca chiar domnul ministru caciu a mentionat ca exista o parte importanta de venituri o crestere importanta a incasarilor la bugetul de stat stim si noi evident de unde vin aceste masuri noi vom vota pentru acest proiect asta i clar pentru ca stim ca romanii au nevoie disperata de sprijin dar cu siguranta masura asta nu rezolva nici pe departe nevoile romanilor este greu de inteles de ce nu acceptati aplicarea unei masuri cu impact direct si care i ar ajuta pe toti cetatenii acestei tari noi v am propus o deja si ma refer aici la reducerea tva la cinci pentru utilitati si combustibili citind aceasta lege mi am amintit de celebrul raspuns al rabinului intrebat fiind pe patul de moarte de baiatul sau cum a reusit sa stranga o avere atat de mare acesta a raspuns cand am zis ca iau am luat cand am zis ca dau am zis o sa inchei citind un fragment dintr un mesaj pe care l am primit zilele trecute de la un tanar din sibiu stimate domnule senator de ce clasa politica din romania a facut deja o obisnuinta din a si bate joc de noi tinerii acestei tari care am ales sa ramanem aici cum aveti pretentia ca tinerii din aceasta tara sa nu plece cand dumneavoastra luati cu doua maini si ne dati inapoi cu pipeta ne jigniti aruncandu ne doua sute cincizeci de lei o data la doua luni in conditiile in care acum un an un plin de motorina ma costa doua sute cincizeci de lei astazi cand litrul de motorina este noua lei un plin ma costa aproximativ patru sute nouazeci de lei ceea ce rezulta ca tva ul este de saptezeci si opt de lei am nevoie de minim doua plinuri de motorina pe luna pentru a ma deplasa strict la munca asta inseamna ca voi plati lunar doar o suta cincizeci de lei in plus fata de acum un an in doua luni sunt trei sute de lei domnule senator adica cu cincizeci de lei mai mult decat tichetul pe care mi l dati dumneavoastra de ce nu dati inapoi oamenilor macar taxele si accizele pe care le platim in plus la utilitati asta ca sa nu mai vorbesc de banii suplimentari pe care i platim pentru subzistenta nu ajunge ca va bateti joc de noi acum ne mai si jigniti votati pentru acest proiect dar haideti sa convingem guvernul sa dea inapoi banii incorect incasati celor care acum sunt amagiti cu o suta douazeci si cinci de lei pe luna si nu numai lor va multumesc frumos ,"(1280.0, 1527.0)",1280.0,1527.0
16,Doamna Alina-Ștefania Gorghiu:,17087,Domnul Liviu-Lucian Mazilu:,17200, multumesc domnule senator il invit pe domnul senator la microfon dupa care ,"(1023.0, 4844.0)",1023.0,4844.0
17,Domnul Liviu-Lucian Mazilu:,17200,Doamna Alina-Ștefania Gorghiu:,18110, multumesc doamna presedinte este un proiect extrem de important pentru romania practic este un proiect psd care se ingrijeste de oamenii cu veniturile cele mai mici din aceasta tara practic oamenii cei mai napastuiti si vestea buna pe care vreau sa le o dau colegilor de la usr este ca proiectul se implementeaza in ritm accelerat proiectul deja produce efecte posta romana va incepe sa distribuie aceste vouchere si mai mult decat atat iata ca din cele trei unu milioane de lei necesare acestui program jumatate vin din fonduri europene din bani europeni si daca colegii de la usr sustineau ca nu vom avea niciodata acordul comisiei europene ca acesta este doar un powerpoint se vede foarte clar ca s au inselat si de aceasta data si eu cred ca tot ce face guvernul in acest moment este extrem de necesar pentru acei oameni cu venituri mici va multumesc ,"(1560.0, 1612.0)",1560.0,1612.0
18,Doamna Alina-Ștefania Gorghiu:,18110,Doamna Rodica Boancă:,20893, multumesc domnului mazilu nu vreau sa va supar domnule mazilu dar nu e un proiect psd intamplarea face ca e chiar un proiect al guvernului de coalitie pnl psd udmr si ma bucur ca este asa asa cum sustinea doamna secretar de stat acum cand resimtim din plin efectele economice ale pandemiei cand vorbim despre un razboi in plina regula la granitele noastre cand preturile alimentelor pentru traiul zilnic al populatiei au inregistrat cresteri semnificative vorbim despre masuri pe care guvernul este obligat sa le ia si e foarte sanatos ca le ia acum daca am ajuns sa criticam si masurile bune inseamna ca nu mai avem ce critica si in aceasta categorie intra asa cum stiti alimente de baza ulei zahar faina orez si altele de aceea cred eu ca atat in senatul romaniei cat si in camera deputatilor in societatea romaneasca trebuie sa aratam ca statul arata si este solidar si ajuta concret grupurile vulnerabile pentru ca din nefericire vorbim despre grupuri vulnerabile atunci cand luam aceste masuri exact asta fac tichetele sociale reglementate prin actualul proiect de lege au ca sa stie toti colegii nostri o valoare nominala de doua sute cincizeci de lei cu ele se pot achizitiona produse de baza alimente de baza si mese calde acestea vor fi oferite pe card si se va acorda suma o data la doua luni pana la finalul anului important este ca acestea vor ajunge exact la cei care au cea mai mare nevoie si vorbim de doi cinci milioane de oameni toti acestia aflati in situatii de deprivare materiala sau de risc de saracie vorbim despre familii cu cel putin doi copii sau monoparentale cu venit mai mic de sase sute de lei pe luna de pensionari cu venit mai mic de unu cinci sute de lei pe luna de persoanele cu venit minim garantat sau persoanele cu dizabilitati e pentru prima data in romania cand o masura de sprijin social ajunge la atat de multi beneficiari si sigur este asa cum spuneau colegii mei o masura care face parte din pachetul sprijin pentru romania va reamintesc ca din acest pachet saizeci merge catre mediul de afaceri si investitii iar aproximativ patruzeci pentru persoanele vulnerabile ca atare vorbim despre o strategie sustenabila de crestere economica nu de masuri populiste asa cum am auzit astazi in sala de plen grupul pnl va sustine acest proiect si va multumim celor din guvern care ati facut eforturi ca el sa devina realitate si va urez succes in continuare pentru ca e in plina desfasurare procedura de comunicare a voucherelor sper sa ajunga cat mai repede la beneficiari pentru ca fiecare dintre aceste persoane vulnerabile sa se bucure de aceasta masura multumesc frumos o invit din partea grupului aur pe doamna senator rodica boanca ,"(1626.0, 1825.0)",1626.0,1825.0
19,Doamna Rodica Boancă:,20893,Doamna Alina-Ștefania Gorghiu:,22765, multumesc doamna presedinta de sedinta onorat prezidiu stimati colegi am sa incep prin a spune ca aur va vota pentru raportul de admitere referitor la aceasta lege care ar trebui sa tempereze saracia extrema sa reduca saracia extrema insa exista un mare insa astfel de masuri si noi eu cel putin de principiu nu sunt impotriva masurilor populiste pentru ca pana la urma statul este despre popor si trebuie sa lucreze pentru popor iar masurile populiste in anumite situatii se impun singura mea dezamagire si singura frustrare a aliantei pentru unirea romanilor legata de acest proiect este aceea ca suma este derizorie in niciun caz nu va opri saracia extrema doua sute cincizeci de lei la doua luni inseamna fix doi covrigi si o sticla de apa sau doar un covrig si o sticla de apa ca am mai intalnit la magazine si o sticla de jumatate de apa plata la trei lei deci nici macar doi covrigi nu se pot lua zilnic de catre beneficiari este nevoie de bani in cazul pentru persoanele defavorizate este mare nevoie de sustinere financiara pentru aceste persoane suntem de acord cu asta suntem de acord ca pandemia a adus saracia la un nivel si mai ridicat insa astfel de masuri de stanga pe care le accepta si dreapta nu fac decat sa adanceasca gradul de umilinta si sa rezolve nu stiu poate zero unu din problema saraciei daca tot doriti sa aduceti binele catre populatie si sa faceti masuri populiste intre ghilimele bineinteles mariti alocatiile asa cum a propus aur sau puteti sa veniti dumneavoastra cu propunerea ca inteleg ca i o problema daca vine din partea aur mariti alocatiile mariti pensiile mariti salariile unor categorii de bugetari si o sa vedeti ca in felul asta si abandonul scolar scade si rata infractionalitatii scade si saracia se reduce va multumesc ,"(1856.0, 2017.0)",1856.0,2017.0
20,Doamna Alina-Ștefania Gorghiu:,22765,Doamna Diana Iovanovici-Șoșoacă:,22930, multumesc doamna senator imi cer scuze ati avut deja vorbitor din partea grupului ultimul vorbitor este doamna diana sosoaca ,"(2017.0, 2022.0)",2017.0,2022.0
21,Doamna Diana Iovanovici-Șoșoacă:,22930,Doamna Alina-Ștefania Gorghiu:,24649, multumesc frumos da este salutara aceasta initiativa insa v ati gandit cum ii discriminati pe oameni care este diferenta intre venitul de unu cinci sute de lei si unu cinci sute unu lei acordati ajutoare familiilor care au unu cinci sute de lei ce faceti cu cei care au unu cinci sute unu lei unu cinci sute zece lei acordati ajutoare in functie de venituri cu un leu mai mult poate ar fi meritat si ceilalti faceti creati efectiv discriminari si mai creati ceva o prapastie sociala intre unu cinci sute de lei si unu cinci sute unu lei asa cum ati facut dintotdeauna in loc sa plafonati preturile inainte sa creasca dumneavoastra le ati lasat sa creasca apoi le ati plafonat apoi ati subventionat ceea ce inseamna ca toti acesti investitori straini isi iau banii indiferent cum si pe ce cai la produsele la care au crescut valoarea iar statul roman evident incaseaza si mai multe taxe numai ca va trebui sa acoperiti tot din bani publici ceea ce nu poate acoperi poporul roman un an de zile dupa aceea probabil o s o mai faceti un an ca vin alegerile si trebuie sa dati bine la electorat pana una alta poporul roman este din ce in ce mai sarac si daca nu vedeti ce se intampla la pompa de benzina cred ca ar trebui sa vedeti ce este in magazine cand oamenii nu si mai pot umple un cos de cumparaturi ci s a nu s a injumatatit isi iau o treime din ce si au luat candva imi pare foarte rau ca aveti o astfel de politica de fapt aici nici nu trebuie sa faceti politica aici trebuie sa faceti interesul poporului roman iar dumneavoastra nu serviti decat interesul multinationalelor si societatilor acestora care se imbogatesc pe zi ce trece de fapt pe secunda ce trece multumesc ,"(2034.0, 2170.0)",2034.0,2170.0
22,Doamna Alina-Ștefania Gorghiu:,24649,Doamna Hegedüs Csilla:,25162, multumesc declar dezbaterile inchise proiectul va ramane la vot final la punctul trei al ordinii de zi avem proiectul de lege pentru aprobarea ordonantei de urgenta a guvernului nr saizeci si patru doua mii douazeci si doi privind ajustarea preturilor si a valorii devizelor generale in cadrul proiectelor finantate din fonduri externe nerambursabile declar dezbaterile deschise de asemenea o invit pe doamna secretar de stat hegedus sa ia cuvantul tot microfonul noua rog stafful tehnic ,"(2170.0, 2185.0)",2170.0,2185.0
23,Doamna Hegedüs Csilla:,25162,Doamna Alina-Ștefania Gorghiu:,26579, buna ziua tuturor din nou multumesc doamna presedinte ordonanta de urgenta nr saizeci si patru doua mii douazeci si doi privind ajustarea preturilor si a valorii devizelor generale in cadrul proiectelor finantate din fonduri externe nerambursabile are in vedere reglementarea ajustarii preturilor din contracte si implicit a valorii contractelor de finantare prin raportare la specificul programelor operationale prezenta ordonanta de urgenta pune la dispozitia partilor contractante o metoda de reechilibrare a contractelor de lucrari si sau a celor de produse si servicii aflate in stransa legatura cu executia lucrarilor afectate de contextul pandemic si de conflictul militar din ucraina suprapuse pe o crestere de preturi in sectorul de energie si al materiilor prime in acest sens prin prezentul act normativ reglementam unele masuri pentru ajustarea preturilor necesare actualizarii costurilor investitiei in contractele de achizitie publica contracte sectoriale acorduri cadru precum si in alte categorii de contracte respectiv ajustarea devizelor generale de investitii in cadrul contractelor de finantare care au asigurate resursele financiare partial sau integral din fonduri externe nerambursabile este o masura de mult asteptata de piata si din acest motiv va rugam sa aprobati oug nr saizeci si patru in forma adoptata de guvernul romaniei multumesc doamna presedinte ,"(2200.0, 2286.0)",2200.0,2286.0
24,Doamna Alina-Ștefania Gorghiu:,26579,Domnul Császár Károly Zsolt:,26859, multumesc frumos comisia de buget finante activitate bancara si piata de capital si comisia pentru administratie publica au elaborat un raport comun domnul presedinte al comisiei de administratie este invitat sa prezinte raportul va rog ,"(2286.0, 2303.0)",2286.0,2303.0
25,Domnul Császár Károly Zsolt:,26859,Doamna Alina-Ștefania Gorghiu:,27373, multumesc doamna presedinte in sedinte separate din douazeci si trei si douazeci si patru mai membrii celor doua comisii au analizat proiectul de ordonanta de urgenta si au hotarat sa adopte cu unanimitate de voturi ale senatorilor prezenti un raport comun de admitere fara amendamente astfel comisia pentru buget finante si comisia pentru administratie publica supun spre dezbatere si adoptare plenului senatului raportul comun de admitere precum si proiectul de lege va multumesc ,"(2303.0, 2333.0)",2303.0,2333.0
26,Doamna Alina-Ștefania Gorghiu:,27373,Domnul Demeter András István – secretar de stat la Ministerul Culturii:,28235, ii multumesc domnului presedinte declar dezbaterile deschise daca din partea grupurilor parlamentare exista interventii nu exista declar dezbaterile inchise proiectul ramane la vot final la punctul patru domnule demeter sper ca ma auziti la punctul patru al ordinii de zi e inscris proiectul de lege pentru modificarea si completarea legii audiovizualului nr cinci sute patru doua mii doi privind modificarea si completarea ordonantei guvernului nr treizeci si noua doua mii cinci privind cinematografia precum si pentru modificarea legii nr patruzeci si unu o mie noua sute nouazeci si patru privind organizarea si functionarea societatii romane de radiodifuziune si societatii romane de televiziune declar deschise dezbaterile generale asupra proiectului de lege il invit pe domnul ministru secretar de stat andras demeter sa ia cuvantul microfonul opt rog stafful tehnic ,"(2333.0, 2382.0)",2333.0,2382.0
27,Domnul Demeter András István – secretar de stat la Ministerul Culturii:,28235,Doamna Alina-Ștefania Gorghiu:,29936, va multumesc doamna presedinte de sedinta doamnelor si domnilor senatori initiativa legislativa a guvernului care este supusa dezbaterii plenului are ca scop implementarea sau transpunerea directivei nr o mie opt sute opt doua mii optsprezece cunoscuta sub denumirea directiva avms audiovisual media services aceasta modifica in esenta trei legi legea nr cinci sute patru a audiovizualului ordonanta nr treizeci si noua privind cinematografia si respectiv legea nr patruzeci si unu o mie noua sute nouazeci si patru privind functionarea societatii romane de televiziune si societatii romane de radiodifuziune procedura de transpunere a directivei a inceput cu o lunga nelucrare dupa care guvernul romaniei timp de un an si ceva s a consultat cu toti actorii interesati practic in punerea in aplicare a acestor legi ajungand ca in octombrie doua mii douazeci si unu sa fie adoptata la nivelul guvernului aceasta initiativa legislativa intrand in procedura parlamentara inclusiv la prima camera sesizata au fost consultari si au fost adoptate o serie de amendamente in vederea pe de o parte a imbunatatirii acestei transpuneri a directivei pe de alta parte a reglementarii si a altor aspecte importante in domeniile reglementate de asemenea asa cum rezulta si din raportul comisiei de cultura a senatului si la nivelul acestei comisii au fost organizate intalniri si dezbateri de mai multe ori acestea finalizandu se cu o propunere de adoptare cu amendamente in considerarea celor de mai sus va rugam doamnelor si domnilor senatori sa sustineti transpunerea acestei directive prin votul dumneavoastra va multumesc ,"(2451.0, 2506.0)",2451.0,2506.0
28,Doamna Alina-Ștefania Gorghiu:,29936,Domnul Viorel-Riceard Badea:,30127, multumesc domnule secretar de stat din partea comisiei de cultura media va prezenta raportul domnul presedinte viorel badea va rog domnule presedinte ,"(2512.0, 2527.0)",2512.0,2527.0
