,start_text,start_index,end_text,end_index,text,timestamp
68,Domnul Daniel-Cătălin Zamfir:,59042,Domnul Florin-Vasile Cîțu:,60409, pe procedura multumesc domnule presedinte aici as vrea sa va informez stimati colegi in primul rand termenul de doua saptamani retrimitere la comisie nu este unul fezabil avand in vedere ca legea are termen de adoptare tacita in aceasta saptamana sambata noi am discutat foarte aprofundat aceasta chestiune la comisia economica dupa cum vedeti legea se refera intr adevar la procedura prin care se adopta anumite proceduri pentru investitiile straine si atentie mai are un mic apendic apendice si anume o modificare la legea concurentei modificarea la legea concurentei prevede doar acordarea serviciului de paza si protectie catre presedintele consiliului concurentei atat este modificarea care suscita acest interes din partea presedintelui consiliului concurentei si anume faptul ca isi doreste paza spp eu cred ca nu e potrivit ca presedintele consiliului concurentei sa aiba paza spp asadar retrimiterea la comisie ar insemna practic aprobarea tacita in forma initiata respectiv cu paza spp pentru presedintele consiliului concurentei ca atare va propun sa nu fim de acord cu retrimiterea la comisie ci sa fim de acord asa cum am votat la comisia economica in unanimitate reprezentantii tuturor partidelor forma in care legea sa intre la vot va multumesc mult ,"(5158.88, 5243.88)"
69,Domnul Florin-Vasile Cîțu:,60409,Domnul Sorin Vlașin:,61234, va multumesc este o propunere pe care va trebui sa o supunem la vot ce inteleg eu ca guvernul a trecut intr o forma ea este modificata in parlament modificarea ar fi diferita de cea a guvernului avem o propunere de retrimitere la comisie a proiectului de lege pentru doua saptamani stimati colegi va rog atentie va trebui sa votam va rog sa votati cu douazeci si noua de voturi pentru treizeci si sapte impotriva nouasprezece abtineri propunerea nu a trecut atunci trecem la dezbaterea proiectului de lege la punctul sase declar deschise dezbaterile generale asupra proiectului de lege dau cuvantul reprezentantului guvernului pentru prezentarea proiectului de lege daca avem nu avem dau cuvantul reprezentantului comisiei economice industrii si servicii pentru prezentarea raportului ,"(4753.88, 5306.88)"
70,Domnul Sorin Vlașin:,61234,Domnul Florin-Vasile Cîțu:,62367, multumesc domnule presedinte membrii comisiei economice industrii si servicii au hotarat cu unanimitate de voturi sa adopte un raport de admitere cu amendamente admise cuprinse in anexa la raport anexa face parte integranta din prezentul raport fata de cele prezentate comisia economica industrii si servicii supune plenului senatului spre dezbatere si adoptare raportul de admitere cu amendamente admise si proiectul de lege potrivit prevederilor art saptezeci si cinci alin din regulamentul senatului multumesc ,"(4753.88, 4765.88)"
71,Domnul Florin-Vasile Cîțu:,62367,Domnul Antal István-Loránt:,63315, va multumesc daca sunt interventii la proiectul de lege nu sunt interventii declar incheiate dezbaterile initiativa legislativa ramane la vot final stimati colegi stiti foarte bine avem pana la ora patru si treizeci patru jumatate avem dezbatere pe initiative legislative si dupa patru jumatate vot final la punctul sapte al ordinii de zi este inscrisa propunerea legislativa privind modificarea si completarea legii nr o suta saizeci si cinci doua mii saisprezece privind siguranta operatiunilor petroliere offshore declar deschise dezbaterile generale asupra propunerii legislative dau cuvantul initiatorului daca este prezent nu este prezent dau cuvantul reprezentantului guvernului pentru prezentarea punctului de vedere al executivului nu este dau cuvantul reprezentatului comisiei pentru energie infrastructura energetica si resurse minerale pentru prezentarea raportului ,"(5414.88, 5441.88)"
72,Domnul Antal István-Loránt:,63315,Domnul Florin-Vasile Cîțu:,64285, va multumesc mult domnule presedinte in urma dezbaterilor care au avut loc in sedinta comisiei pentru energie infrastructura energetica din trei mai doua mii douazeci si doi membrii comisiei au analizat propunerea legislativa punctele de vedere exprimate avizele primite si au hotarat cu majoritatea voturilor senatorilor prezenti sa adopte raport de admitere consiliul legislativ a avizat favorabil cu observatii si propuneri consiliul economic si social a avizat favorabil propunerea legislativa comisia economica industrii si servicii a transmis aviz favorabil comisia pentru mediu a transmis aviz favorabil propunerea legislativa face parte din categoria legilor ordinare senatul este prima camera sesizata fata de cele prezentate comisia pentru energie infrastructura energetica si resurse minerale supune plenului senatului pentru dezbatere si adoptare raportul de admitere si propunerea legislativa va multumesc ,"(5470.88, 5522.88)"
73,Domnul Florin-Vasile Cîțu:,64285,Domnul György Attila – secretar de stat la Ministerul Finanțelor:,64734, va multumesc daca sunt interventii din partea colegilor senatori nu sunt declar incheiate dezbaterile initiativa legislativa ramane la vot final punctul opt proiect de lege pentru modificarea si completarea unor acte normative din domeniul fondurilor europene declar deschise dezbaterile dau cuvantul reprezentantului guvernului pentru prezentarea proiectului de lege microfonul noua va rog ,"(4753.88, 5528.88)"
74,Domnul György Attila – secretar de stat la Ministerul Finanțelor:,64734,Domnul Florin-Vasile Cîțu:,65301, multumesc domnule presedinte prin proiectul de lege se propun prevederi care permit efectuarea de reglaje la nivelul bugetului de stat tinand cont de responsabilitatile fiecarui ordonator principal de credite in utilizarea sumelor aferente fondului de indisponibilitati temporare pentru fondurile aferente programelor phare ex ispa sapard si respectiv aferente perioadei de programare doua mii sapte doua mii treisprezece va rugam sa fiti de acord cu raportul comisiei de buget multumim ,"(5550.88, 5578.88)"
75,Domnul Florin-Vasile Cîțu:,65301,Domnul Nicolae Neagu:,65509, va multumesc dau cuvantul reprezentantului comisiei pentru buget finante activitate bancara si piata de capital pentru prezentarea raportului domnule presedinte ,"(4753.88, 5586.88)"
76,Domnul Nicolae Neagu:,65509,Domnul Florin-Vasile Cîțu:,66055, multumesc domnule presedinte comisia de buget finante intrunita in data de trei mai doua mii douazeci si doi a analizat proiectul de lege avizele si amendamentele primite si au hotarat cu unanimitatea voturilor senatorilor prezenti sa adopte un raport de admitere cu amendamente admise supunem pentru dezbatere si adoptare plenului senatului raportul cu amendamente admise si proiectul de lege in acelasi timp facem precizarea ca proiectul de lege face parte din categoria legilor ordinare senatul fiind prima camera sesizata ,"(5586.88, 5615.88)"
77,Domnul Florin-Vasile Cîțu:,66055,Doamna Daniela Nicolescu – secretar de stat la Ministerul Economiei:,66649, va multumesc daca sunt interventii din partea colegilor senatori daca nu sunt declar incheiate dezbaterile initiativa legislativa ramane la vot final punctul noua proiectul de lege pentru aprobarea ordonantei de urgenta a guvernului nr patruzeci si cinci doua mii douazeci si doi privind unele masuri pentru diminuarea arieratelor bugetare ale unor operatori economici din industria nationala de aparare declar deschise dezbaterile generale asupra proiectului de lege dau cuvantul reprezentantului guvernului pentru prezentarea proiectului de lege va rog microfonul zece ,"(4753.88, 5528.88)"
78,Doamna Daniela Nicolescu – secretar de stat la Ministerul Economiei:,66649,Domnul Florin-Vasile Cîțu:,68752, domnule presedinte multumesc prezentul proiect de act normativ are ca obiect adoptarea unor masuri pentru diminuarea arieratelor bugetare ale unor operatori economici din industria nationala de aparare actul normativ vizeaza numai operatorii economici cu capital integral de stat din industria nationala de aparare care sunt de interes strategic pentru statul roman si desfasoara activitati necesare realizarii de produse militare sensibile si strategice sau servicii aferente acestora in actualul context geopolitic se impune intarirea capacitatii de aparare a romaniei prin luarea unor masuri urgente de redresare economico financiara a operatorilor economici de interes strategic prevazuti in anexa la prezenta ordonanta de urgenta astfel incat fsna sa poata fi pregatite pentru protejarea intereselor esentiale si sigurantei statului roman precum si pentru a si onora obligatiile asumate in calitate de stat membru ue si nato pornind de la conceptul de interes esential de siguranta se propune mentinerea de catre statul roman a unor capacitati adecvate de productie militara care sa permita pe de o parte un grad ridicat de autonomie privind inzestrarea fsna iar pe de alta parte continuarea exporturilor in vederea amortizarii costurilor cercetarii retehnologizarii si productiei militare pentru uz propriu fata de cele prezentate se constata riscuri majore care pot afecta capacitatile productiei de aparare situatie care poate fi evitata in conditiile aplicarii prevederilor art trei sute patruzeci si sase din tratatul de functionare al uniunii europene conform caruia orice stat membru poate lua masurile pe care le considera necesare pentru protectia intereselor esentiale ale sigurantei sale si care se refera la productia cu comertul de armament munitie material de razboi sub conditia ca aceste masuri sa nu modifice conditiile de concurenta pe piata interna fata de cele aratate va rog mult sa adoptati acest proiect de act normativ ,"(5657.88, 5760.88)"
79,Domnul Florin-Vasile Cîțu:,68752,Domnul Nicolae Neagu:,69045, va multumesc comisia pentru buget finante activitate bancara si piata de capital si comisia pentru aparare ordine publica si siguranta nationala au elaborat un raport comun invit reprezentantul comisiei pentru buget finante pentru prezentarea raportului ,"(4753.88, 4765.88)"
80,Domnul Nicolae Neagu:,69045,Domnul Florin-Vasile Cîțu:,69516, da domnule presedinte membrii celor doua comisii precizate de dumneavoastra au dezbatut proiectul de lege in sedinte separate si au hotarat cu unanimitate de voturi sa adopte prezentul raport comun de admitere fara amendamente supunem spre dezbatere si adoptare plenului senatului raportul comun de admitere impreuna cu proiectul de lege proiectul de lege face parte din categoria legilor ordinare senatul prima camera sesizata ,"(5782.88, 5804.88)"
