,start_text,start_index,end_text,end_index,text,timestamp,start,end
1,S T E N O G R A M A,0,ședinței Senatului din 12 octombrie 2022,21, ,"(240.0, 7400.0)",240.0,7400.0
2,ședinței Senatului din 12 octombrie 2022,21,S U M A R,65, ,"(240.0, 7400.0)",240.0,7400.0
3,S U M A R,65,S T E N O G R A M A,2143, unu intrebari si interpelari doi doisprezece patruzeci si unu patruzeci si sapte doi declaratii politice doisprezece patruzeci si unu patruzeci si sapte patruzeci si opt trei propunerea legislativa pentru modificarea si completarea ordonantei guvernului patruzeci si opt nr patruzeci si trei din douazeci si opt august o mie noua sute nouazeci si sapte privind regimul drumurilor si a legii nr trei sute cincizeci doua mii unu privind amenajarea teritoriului si urbanismul ,"(1080.0, 3248.0)",1080.0,3248.0
4,S T E N O G R A M A,2143,şedinţei Senatului din 12 octombrie 2022,2164, ,"(240.0, 7400.0)",240.0,7400.0
5,şedinţei Senatului din 12 octombrie 2022,2164,Domnul Virgil Guran:,2418, sedinta a inceput la ora noua treizeci si doi lucrarile sedintei au fost conduse de domnul virgil guran vicepresedinte al senatului asistat de domnul ion narcis mircescu si domnul sorin lavric secretari ai senatului ,"(240.0, 7400.0)",240.0,7400.0
6,Domnul Virgil Guran:,2418,Domnul Dănuț Bica:,2992, buna dimineata doamnelor si domnilor senatori declar deschisa sesiunea de intrebari interpelari de astazi doisprezece octombrie doua mii douazeci si doi conducerea fiind asigurata de subsemnatul senator virgil guran vicepresedinte al senatului asistat de domnul senator ion narcis mircescu si domnul senator sorin lavric secretari ai senatului conform programului aprobat timpul alocat pentru sesiunea de intrebari interpelari este de saizeci de minute repartizat pe grupurile parlamentare potrivit ponderii acestora invit la microfon pe domnul senator bica danut ,"(7189.0, 7189.0)",7189.0,7189.0
7,Domnul Dănuț Bica:,2992,Domnul Virgil Guran:,11516, multumesc domnule presedinte de sedinta prima intrebare este adresata domnului sorin mihai grindeanu viceprim ministru ministrul transporturilor si infrastructurii obiectul intrebarii modernizarea reabilitarea trecerii la nivel cu calea ferata din comuna leordeni judetul arges si are termenul de intrare in vigoare in luna martie a anului doua mii douazeci si trei va solicit urmatoarele informatii unu care este data pana la care proiectul de lege privind codul amenajarii teritoriului urbanismului si constructiilor va fi adoptat de guvern si transmis parlamentului pentru dezbatere si aprobare doi cand estimati ca va deveni operationala platforma digitala nationala interconectata cu registrul national al constructiilor pe care se vor incarca toate documentatiile planurilor urbanistice generale si care va constitui o importanta baza de date si un suport pentru autoritati la emiterea certificatelor de urbanism a acordurilor unice si autorizatiilor de construire solicit raspuns in scris va multumesc cu deosebita consideratie danut bica senator pnl de arges multumesc ,"(2331.0, 3218.0)",2331.0,3218.0
8,Domnul Virgil Guran:,11516,Domnul Claudiu-Marinel Mureșan:,11602, multumesc si eu are cuvantul domnul senator muresan claudiu ,"(2331.0, 4476.0)",2331.0,4476.0
9,Domnul Claudiu-Marinel Mureșan:,11602,Domnul Virgil Guran:,14589, va multumesc frumos domnule presedinte buna dimineata stimati colegi as dori sa adresez o interpelare ministrului mediului domnului tanczos barna cu privire la raportul de evaluare al comisiei europene intocmit romaniei cu referire la aplicarea politicilor de mediu saptamana trecuta vorbeam despre economia circulara si despre faptul ca romania parca se indeparteaza mai mult decat se apropie de acest obiectiv atunci i am cerut domnului ministru sa ne prezinte strategia ministerului pe care l conduce in obtinerea unor rezultate pozitive in acest domeniu astazi voi face referire la un alt sector important si anume gestionarea deseurilor municipale acolo unde romania nu a inregistrat deloc progrese in ultimul deceniu asadar domnule ministru comisia a hotarat sa trimita din nou romania in fata curtii de justitie a uniunii europene pentru nerespectarea pe deplin a hotararii curtii din data de optsprezece octombrie doua mii optsprezece in care se constata ca romania nu si a indeplinit obligatiile prevazute in directiva privind depozitele de deseuri in legatura cu saizeci si opt de depozite de deseuri in prezent domnule ministru patruzeci si doi de depozite de deseuri tot nu au fost inchise aceasta a doua sesizare a curtii poate duce la aplicarea unor sanctiuni importante pentru intervalul de timp scurs intre prima hotarare si data la care se rezolva problema sesizata in romania functioneaza un numar semnificativ de depozite de deseuri neconforme cu standardele in vigoare care comporta riscuri grave pentru sanatatea umana si pentru mediu rata de reciclare a deseurilor municipale este foarte scazuta cantitatea de deseuri municipale reciclate fiind in doua mii douazeci de o suta patruzeci si patru de kilograme pe cap de locuitor asta mentionez dupa ce romania a inregistrat o scadere in doua mii optsprezece aceasta rata este mult sub media de patruzeci si opt din uniunea europeana in doua mii douazeci domnule ministru romania risca sa nu indeplineasca obiectivele uniunii europene pentru doua mii douazeci in materie de reutilizare reciclare a deseurilor fiind necesar sa intensifice investitiile in reciclare pentru a atinge obiectivele de reciclare ale uniunii pentru doua mii douazeci si doua mii douazeci si cinci tinand cont de cele expuse va rog sa mi transmiteti un raspuns in scris cu privire la urmatoarele prin ce metode veti asigura inchiderea si reabilitarea depozitelor de deseuri care nu corespund standardelor si ce masuri propuneti impotriva depozitelor ilegale de deseuri a doua intrebare ce standarde aveti in vedere pentru imbunatatirea si extinderea colectarii separate a deseurilor inclusiv a biodeseurilor vreau de asemenea sa ne spuneti daca aveti in vedere elaborarea si punerea in aplicare a unor programe destinate municipalitatilor prin care acestea sa fie sprijinite in actiunile de organizare a colectarii separate si de imbunatatire a rezultatelor de reciclare si care sunt acestea va multumesc claudiu muresan senator de sibiu ,"(2331.0, 3218.0)",2331.0,3218.0
10,Domnul Virgil Guran:,14589,Domnul Sorin-Cristian Mateescu:,14683, multumesc si eu are cuvantul domnul senator mateescu sorin cristian ,"(2331.0, 4476.0)",2331.0,4476.0
11,Domnul Sorin-Cristian Mateescu:,14683,Domnul Virgil Guran:,17843, multumesc domnule presedinte am astazi o intrebare si o interpelare intrebarea este adresata domnului presedinte cristian nicolae stanica presedintele comisiei nationale de strategie si prognoza este de fapt o revenire la o intrebare precedenta privind situatia economico financiara a romaniei in contextul efectelor razboiului din ucraina domnule presedinte in luna aprilie doua mii douazeci si doi v am adresat o intrebare privind modul in care razboiul din ucraina si relatiile noastre cu federatia rusa ne au afectat din punct de vedere energetic ne ati transmis un raspuns in care ati prognozat o anumita crestere raportata la realitatea de pe teren privind preturile la gaze si petrol cu efecte in economia romaneasca in acest sens tinand cont de faptul ca pretul barilului de petrol oscileaza de la cresteri la scaderi avand din pacate efecte doar in cresterea preturilor la cereale si alimente va solicit din nou sa precizati ce prognoze financiare aveti in vedere privind situatia economica a tarii si cum vor fi afectati romanii de rand in urmatoarele trei luni mai ales ca va veni perioada de iarna precizez ca va solicit acest punct de vedere in contextul recomandarii venite din partea ministrului finantelor care ne a transmis ca institutia pe care o coordonati ne poate oferi raspunsurile la solicitarile de mai sus va multumesc solicit raspuns in scris senator aur sorin cristian mateescu urmatoarea interpelare este adresata domnului ministru adrian caciu ministrul finantelor obiectul interpelarii situatia economico financiara a romaniei in contextul oscilatiilor pretului la barilul de petrol pe piata romaneasca domnule ministru motorina a trecut iarasi de opt lei si este inca mult mai scumpa decat benzina au crescut preturile la pompa in ultima saptamana dupa ce ne am obisnuit cu reveniri si sunt asteptari sa mai creasca in perioada urmatoare in acest sens tinand cont de faptul ca pretul barilul de petrol oscileaza in functie de jocurile de culise ale pietei ca urmare a conflictului din ucraina si se asteapta o criza alimentara va rog sa precizati urmatoarele unu de ce guvernul romaniei prin ministrul finantelor publice nu reduce accizele aplicate prelucrarii titeiului si furnizarii de combustibil sub forma de motorina sau benzina timp de sase noua luni pentru a nu exista presiune pe inflatie si pe preturile care explodeaza indirect din cauza acestor accize la combustibili doi care sunt explicatiile si la ce sa ne asteptam in lunile urmatoare de la nivelul ministerului pe care il coordonati in contextul scaderii puterii de cumparare a romanilor cu venituri sub sase zero lei luna si ce masuri aveti in vedere si pentru angajatii din mediul public dar mai ales privat care au un venit pe familie intre sase zero zece zero lei luna au cel putin un copil la scoala si nu beneficiaza de ajutoare sociale ca cei care au minimul pe economie va multumesc solicit raspuns in scris si verbal senator aur sorin mateescu va multumesc ,"(2331.0, 3218.0)",2331.0,3218.0
12,Domnul Virgil Guran:,17843,Doamna Evdochia Aelenei:,17930, multumesc si eu are cuvantul doamna senator aelenei evdochia ,"(2331.0, 4476.0)",2331.0,4476.0
13,Doamna Evdochia Aelenei:,17930,Domnul Virgil Guran:,19557, multumesc am o intrebare adresata doamnei ligia deca ministrul educatiei obiectul acestei intrebari de ce pleaca profesorii din sistemul de invatamant dotarea unitatilor scolare cu personal calificat domnule presedinte de sedinta doamnelor domnilor senatori doamna ministru de cativa ani se tot vorbeste de scolile cu veceul in curte dar mai rar am auzit dezbatandu se ceea ce eu cred ca este veriga slaba a sistemului anume neasigurarea lui cu invatatori si profesori cu adevarat calificati indemnul pentru a pune aceasta intrebare recunosc ca l am primit dupa ce am citit recent un articol de ziar in care se scrie fug profesorii se angajeaza pilele potrivit acelei surse numai in august curent au parasit sistemul peste cincisprezece zero de persoane in plus aflam e drept sporadic despre cadre didactice molestate de elevii lor elevi care nu pot fi exmatriculati pare ca lumea scolii s a intors cu susul in jos profesorul nu mai conteaza in acest context va intreb doamna ministru unu care sunt dimensiunile si cauzele plecarii personalului din invatamant doi cum stam in acest an scolar cu acoperirea necesarului de invatatori si profesori calificati trei ce poate face si ce masuri va propune si va adopta ministerul pe care il conduceti pentru imbunatatirea statutului salarizarii si a pregatirii personalului didactic astept cu interes un raspuns in scris din partea dumneavoastra la senatul romaniei cu deosebita recunostinta senator neafiliat evdochia aelenei circumscriptia nr paisprezece constanta multumesc ,"(3100.0, 3115.0)",3100.0,3115.0
14,Domnul Virgil Guran:,19557,Domnul Eugen-Remus Negoi:,19639, multumesc si eu are cuvantul domnul senator negoi remus ,"(2331.0, 4476.0)",2331.0,4476.0
15,Domnul Eugen-Remus Negoi:,19639,Domnul Virgil Guran:,22684, multumesc domnule presedinte de sedinta stimati colegi va supun atentiei o interpelare adresata domnului ministru al sportului eduard novak ilie floroiu un campion de exceptie uitat citez din jurnalistul vladimir moraru ilie floroiu este cel mai frumos accident intamplat vreodata atletismului romanesc cariera lui venita de nicaieri intr un moment nepotrivit intr un loc nepregatit intr un sport care si pierduse inocenta si curmata practic la numai douazeci si sapte de ani ramane un miracol pe care putini dintre cei care n au vazut atletismul dinlauntrul lui il pot intelege atletismul este un sport al cifrelor dar in cazul lui floroiu cifrele recordurile lui nu spun totul desi pentru a fi azi ce a fost floroiu in o mie noua sute saptezeci si opt un fondist roman ar trebui sa alerge cinci zero de metri in doisprezece minute si treizeci si noua de secunde si zece zero de metri in doua mii sase sute patruzeci au trecut alti douazeci si sapte de ani de cand ilie a alergat o mie trei sute cincisprezece zero si doua mii sapte sute patruzeci sase iar aceste cifre par mai indepartate azi de urmasii lui floroiu decat erau in o mie noua sute saptezeci si opt la jo cm sau ce unde toata lumea buna e prezenta front runnerul de tipul floroiu e condamnat desprinderea e imposibila pentru ca e mai usor sa urmezi o trena decat sa o stabilesti iar urmaritorii intr o fireasca alianta ad hoc contreaza pe rand ca in ciclism singuratatea alergatorului de cursa lunga e o metafora frumoasa care nu e si adevarata in cursele pentru titluri medaliile se decid in ultima tura de cei mai buni sprinteri care sunt oricum si mai proaspeti pentru ca au stat in pluton ilie floroiu a fost al cinci lea la jo in o mie noua sute saptezeci si sase si la ce in o mie noua sute saptezeci si opt dar i a intrecut in curse directe pe toti cei care l au devansat la montreal si la praga in o mie noua sute saptezeci si patru inainte de a implini douazeci si doi de ani si dupa numai trei ani de atletism organizat floroiu termina al cinci lea in finala de cinci zero a ce de la roma in o mie trei sute treizeci si sapte doi intrand viguros in elita mondiala pentru urmatorii cinci ani el a fost unul dintre marii alergatori de fond ai lumii cat de mare o putem vedea cu totii in vara lui doua mii douazeci si doi celebrele recorduri nationale la cinci zero si zece zero de metri ale fostului mare atlet constantean ilie floroiu au implinit patruzeci si patru de ani din o mie noua sute saptezeci si opt de cand au fost stabilite nimeni din romania nu se poate apropia nici pe departe de ele din pacate atat performantele lui ilie floroiu descrise excelent in randurile de mai sus citate din vladimir moraru nu au fost suficiente pentru a recompensa eforturile pe care acesta le a facut in scurta cariera sportiva statul roman a calculat rece ca ilie floroiu unul din pionierii atletismului romanesc nu se incadreaza in panoplia marilor sportivi ai romaniei domnule ministru in urma celor prezentate mai sus va rog sa mi raspundeti la urmatoarele intrebari unu ce recompense poate acorda statul roman unui atlet de asemenea valoare doi ce poate fi facut pentru a repara nedreptatea neacordarii de facilitati de catre statul roman lui ilie floroiu solicit raspuns scris pe adresa de e mail senator remus negoi constanta ,"(1080.0, 3218.0)",1080.0,3218.0
16,Domnul Virgil Guran:,22684,Domnul Sorin Lavric:,22778, multumesc domnule senator are cuvantul domnul senator lavric sorin ,"(4475.0, 4476.0)",4475.0,4476.0
17,Domnul Sorin Lavric:,22778,Domnul Virgil Guran:,24085, multumesc domnule presedinte virgil guran interpelarea mea se adreseaza ministrului culturii domnul lucian romascanu si are drept obiect demolarea penitenciarului pitesti domnule ministru aflu cu stupoare din presa ca o parte din penitenciarul pitesti mai precis celularul fostei inchisori este pe cale de a fi demolata in vederea ridicarii unui bloc de locuinte este de prisos sa va reamintesc despre aura macabra pe care acest penitenciar o are in memoria romanilor alaturi de fortul treisprezece jilava sighet aiud ramnicu sarat si gherla penitenciarul pitesti face parte din patrimoniul pe cat de lugubru pe atat de important din cultura romaneasca a darama un asemenea simbol echivaleaza cu stergerea unui vestigiu care pledeaza pentru atrocitatile regimului comunist va solicit prin aceasta interpelare sa depuneti toate diligentele pentru a clasa de urgenta celularul de la pitesti ca monument istoric aflat in patrimoniul national altminteri exista riscul ca mandatul dumneavoastra sa primeasca pata indelebila a demolarii acestui simbol va rog sa aveti amabilitatea de a mi preciza ce masuri ati luat pentru ca inchisoarea de la pitesti sa intre in randul monumentelor de patrimoniu national va multumesc sorin lavric ,"(2331.0, 3218.0)",2331.0,3218.0
18,Domnul Virgil Guran:,24085,Domnul Dorinel Cosma:,24169, multumesc si eu are cuvantul domnul senator cosma dorinel ,"(2331.0, 4476.0)",2331.0,4476.0
19,Domnul Dorinel Cosma:,24169,Domnul Virgil Guran:,27629, multumesc domnule presedinte virgil guran astazi voi adresa o intrebare doamnei gabriela firea ministrul familiei tineretului si egalitatii de sanse obiectul intrebarii situatia copiilor ai caror parinti sunt plecati la munca in strainatate stimata doamna ministru in contextul in care familia este celula de baza a societatii si o societate construita din familii sanatoase are radacini puternice copiii crescuti in familii armonioase unite sunt predestinati succesului si implinirilor in perioada in care avem de toate inclusiv multe libertati a da nastere a creste un copil in tara noastra a devenit un lux deficitul locurilor de munca si veniturile castigate in propria tara fac ca tot mai multi romani sa aleaga calea pribegiei este mult mai usor sa obtii un job in strainatate decat in tara unde este mult mai bine platit sa ai un copil sa l cresti sa i cumperi rechizite uniforma scolara sa i asiguri alimentatia corecta sanatatea sa l intretii in facultate si in scoli toate acestea presupun sacrificii din partea parintilor in familiile cu doi trei copii costurile depasesc posibilitatile financiare ale parintilor ins a venit cu informatii potrivit carora rata inflatiei in mai doua mii douazeci si doi comparativ cu aceeasi luna a anului doua mii douazeci si unu a fost de paisprezece cinci preturile marfurilor alimentare au crescut cu paisprezece trei cele ale marfurilor nealimentare au fost mai mari cu saptesprezece doi iar tarifele serviciilor s au marit cu sapte cinci tarifele serviciilor au crescut in medie cu sapte cinci in principal pentru apa canal serviciile de salubritate optsprezece sapte alte servicii unsprezece trei transport interurban noua doi in luna mai doua mii douazeci si doi comparativ cu luna mai doua mii douazeci si unu preturile produselor agricole au crescut cu treizeci si opt nouazeci si trei de asemenea comparativ cu luna mai doua mii douazeci si unu cresteri de pret s au inregistrat la productia si furnizarea de energie electrica si termica gaze apa calda si aer conditionat cu o suta treizeci si cinci sapte ce face parintele in aceasta situatie credite iar atunci cand datoriile devin prea mari pleaca sa munceasca in strainatate cand pleaca unul din parinti copilul este partial afectat cand pleaca si mama si tata copilul traieste de facto abandonul lipsa afectivitatii parentale poate avea consecinte pe termen lung poate influenta dezvoltarea normala a copilului atat in privinta dezvoltarii fizice cat si a celei psihice conform datelor centralizate de autoritatea nationala pentru protectia drepturilor copilului si adoptie peste doisprezece zero de copii care provin din familii in care parintii sunt plecati la munca in strainatate raman singuri acasa sau cu bunicii lor nemaicontinuand studiile la scoli in acest context va adresez rugamintea de a mi raspunde punctual la urmatoarele intrebari unu ministerul pe care il conduceti are in derulare dezvoltarea unei strategii de mobilizare si interventie la nivel local doi are ministerul campanii de informare si constientizare adresate parintilor trei aveti in vedere campanii media de promovare a solutiilor si oportunitatilor pentru acesti copii lasati singuri plus campanii de informare si constientizare adresate parintilor in legatura cu consecintele asupra copiilor patru aveti in vedere servicii de consiliere pentru persoanele care au in ingrijire copii cu ambii parinti plecati in strainatate va solicit raspuns scris si oral cu deosebita consideratie dorinel cosma senator aur botosani va multumesc ,"(3100.0, 3115.0)",3100.0,3115.0
20,Domnul Virgil Guran:,27629,Domnul Gheorghe Adrian Cătană:,28050, multumesc si eu mai sunt colegi la intrebari interpelari nu mai avem o sa lasam deschisa sesiunea de intrebari interpelari si trecem la sesiunea de declaratii politice conform programului aprobat timpul alocat pentru prezentarea acestora fiind de saizeci de minute repartizat pe grupurile parlamentare potrivit acestora dau cuvantul domnului senator catana gheorghe adrian ,"(2331.0, 2733.0)",2331.0,2733.0
21,Domnul Gheorghe Adrian Cătană:,28050,Domnul Virgil Guran:,33225, multumesc domnule presedinte de sedinta titlul declaratiei politice de astazi este declaratia de independenta stimati colegi un rol important in realizarea marii uniri l a avut declaratia de independenta a transilvaniei banatului crisanei si maramuresului din doisprezece octombrie o mie noua sute optsprezece marele patriot roman vasile goldis a avut un rol important in problema autodeterminarii afirmand ca romanii nu vor sa domneasca peste alte popoare dar nici nu vor a mai tolera ca un alt popor sa domneasca asupra lor ziua de sase octombrie o mie noua sute optsprezece a marcat astfel inceputul unei perioade hotaratoare pentru marea implinire si anume desavarsirea unitatii nationale statale a poporului roman ziarul american new york times scria la sase octombrie o mie noua sute optsprezece ca cele patru milioane de romani din transilvania banat si bucovina ce traiau sub asuprirea maghiara si treptat si austriaca au considerat razboiul ca pe propria lor mult asteptata lupta de eliberare care ii va scapa de stapanire straina si i va uni cu cei opt milioane de romani din regatul roman ceea ce inseamna potrivit redactiei new york times salvarea neamului romanesc asadar in lupta nationala la ordinea zilei se aflau autodeterminarea si unirea iar nu federalizarea imperiului austro ungar formula inacceptabila impotriva careia protestau reprezentantii natiunilor oprimate din monarhia habsburgica hotarate sa traiasca in state proprii independente pe linia acestor preocupari reprezentantii partidului national roman s au intalnit la oradea in doisprezece octombrie o mie noua sute optsprezece aceasta intrunire se poate considera ca fiind actiunea majora definitorie care avea sa pregateasca drumul romanilor spre marea unire ea a avut loc in casa avocatului doctor aurel lazar om politic si personalitate marcanta a municipiului oradea documentul aprobat la oradea e numit declaratia de autodeterminare nationala a romanilor din transilvania banat crisana si maramures declaratia a fost redactata de vasile goldis si aprobata de comitetul executiv al partidului national roman din care faceau parte theodor mihali stefan cicio pop alexandru vaida voevod aurel vlad doctor aurel lazar ioan suciu si ioan ciordas textul declaratiei de autodeterminare nationala avea urmatorul cuprins comitetul executiv al partidului national roman din ardeal si ungaria ca organ politic al natiunii romane din ardeal si ungaria constata ca urmarile razboiului indreptatesc pretentiunile de veacuri ale natiunii romane la deplina libertate nationala pe temeiul dreptului firesc ca fiecare natiune poate dispune hotari singura si liber de soarta ei un drept oarecare este acum recunoscut si de catre guvernul ungar prin propunerea de armistitiu a monarhiei natiunea romana din ungaria si ardeal doreste sa faca acuma uz de acest drept si reclama in consecinta si pentru ea dreptul ca libera de orice inraurire straina sa hotarasca singura asezarea ei printre natiunile libere precum si stabilirea legaturii de coordonare a ei cu celelalte natiuni libere organul national al natiunii romane din ungaria si ardeal nu recunoaste indreptatirea acestui parlament si acestui guvern sa se considere ca reprezentante ale natiunii romane ca sa poata reprezenta la congresul general de pace interesele natiunii romane din ungaria si ardeal caci apararea intereselor ei natiunea romana o poate incredinta numai unor factori designati de propria lor adunare nationala afara de organele delegate de adunarea nationala sau alese din mijlocul sau asadar afara de comitetul executiv al partidului national roman nimeni nu poate fi indreptatit sa trateze si sa hotarasca in treburi care se refera la situatia politica a natiunii romane toate deciziunile si acordurile care s ar lua si s ar face fara aprobarea acestor organe le declaram ca nule si fara valoare care nu leaga intru nimic natiunea romana natiunea romana care traieste in monarhia austro ungara asteapta si cere dupa multe suferinte de veacuri afirmarea si valorizarea drepturilor ei nestramutate si inalienabile la viata nationala declaratia de independenta fata de ungaria a poporului roman din transilvania banat si partile ungare cinci optsprezece octombrie o mie noua sute optsprezece oradea doisprezece octombrie o mie noua sute optsprezece declaratia de autodeterminare de la oradea a reprezentat un moment istoric fundamental pentru natiunea romana pentru desavarsirea unitatii sale politice si de stat un document de mare importanta programatica si practica aceasta declaratie de autodeterminare nationala pe baza principiului nationalitatilor a fost adusa la cunostinta parlamentului ungar de la budapesta de catre marele om politic si patriot alexandru vaida voevod in discursul sau tinut in parlamentul ungariei pe optsprezece octombrie o mie noua sute optsprezece sunt onorat ca sub cupola senatului romaniei sa pomenesc numele acestor ilustri si merituosi inaintasi ai nostri care au pus inca o piatra la temelia identitatii si statalitatii romanesti bucuresti doisprezece octombrie doua mii douazeci si doi cu respect senator aur gheorghe adrian catana va multumesc ,"(2331.0, 3218.0)",2331.0,3218.0
