,start_text,start_index,end_text,end_index,text,timestamp,start,end
35,Domnul Vasile-Cristian Achiței:,58137,Domnul Virgil Guran:,61018, multumesc domnule presedinte expertize peste expertize le comandam si le platim din bani publici si ce facem cu ele le ignoram si asteptam sa expire doamnelor si domnilor senatori doresc sa atrag atentia asupra unei probleme cu care ne confruntam atunci cand vine vorba de realizarea investitiilor publice expertizele tehnice comandate si realizate pe bani publici pe care insa ulterior nu le mai baga nimeni in seama fiind lasate pur si simplu sa expire in judetul botosani pe care il reprezint in senatul romaniei sunt realizate sau in curs de realizare saisprezece expertize tehnice privitoare la starea infrastructurii rutiere fie ca vorbim de drumurile propriu zise sau de poduri aceste documente recomanda o serie de masuri de remediere a situatiilor constatate adica realizarea de investitii sunt date termene limita pana la care aceste investitii trebuie facute pentru a va da un singur exemplu expertizele privind podurile si podetele de pe drumurile nationale botosanene au concluzionat ca opt dintre acestea se afla intr o stare tehnica nesatisfacatoare dintre care patru sunt in stare critica in toate aceste cazuri expertii recomanda reabilitarea sau chiar constructia unor poduri sau podete noi in termen de cel mult cinci ani timpul trece si nu se intampla nimic concret pentru implementarea solutiilor tehnice impuse de expert si vorbim de poduri intr o tara in care am trait recent episodul prabusirii unui pod in judetul neamt tocmai ca urmare a ignorarii unor expertize tehnice stimati colegi expertizele tehnice comandate de autoritati costa bani banii acestia sunt pur si simplu aruncati in vant daca nu alocam ulterior fonduri pentru realizarea investitiilor recomandate si mai grav este faptul ca problemele raman nerezolvate punand in pericol sanatatea si chiar viata cetatenilor de aceea consider obligatorie luarea la timp a deciziilor pentru realizarea investitiilor care rezulta din expertizele tehnice iar primul pas este cuprinderea in bugetul de stat pentru anul doua mii douazeci si trei a acestor investitii in cazul judetului botosani este vorba despre patru poduri si podete in stare critica la ungureni si glodu alb saveni pe dn29 la lunca varfu campului pe dn29c si la liveni manoleasa pe dn24c patru poduri si podete in stare nesatisfacatoare la unteni rachiti si popauti pe dn29 respectiv la leorda pe dn29b sase sectoare de drum national pe dn29d botosani stefanesti dn29b catamaresti deal dn29b botosani dorohoi dn29a varfu campului dorohoi dn29 botosani saveni si dn24c badarai stefanesti manoleasa prut toate acestea necesita investitii urgente personal sunt un om al faptelor care uraste vorbele goale si demagogia haideti sa trecem la treaba acum va multumesc senator de botosani cristian achitei ,"(2331.0, 3218.0)",2331.0,3218.0
36,Domnul Virgil Guran:,61018,Domnul Eugen-Remus Negoi:,61106, multumesc si eu are cuvantul domnul senator negoi eugen remus ,"(2331.0, 4476.0)",2331.0,4476.0
37,Domnul Eugen-Remus Negoi:,61106,Domnul Virgil Guran:,64436, va multumesc domnule presedinte de sedinta a trecut un an de la instalarea ministrului alexandru rafila in functia de ministru al sanatatii ma asteptam sa apara domnul ministru in toate mediile posibile anuntand un bilant extraordinar dar nu e nicio surpriza ministrul rafila nu a iesit nicaieri cu nimic pentru ca nu are nimic de spus atata timp cat nu a facut nimic totusi s a remarcat cu ceva lacrimile de crocodil a plans pe unde a putut ca nu se poate ca nu poate ca e greu ca nu stie cum ca sunt putine posibilitati spuneam acum opt luni ca alexandru rafila recunoaste ca are bani de spitale prin pnrr sunt unu sapte miliarde de euro pentru douazeci si cinci de spitale el trebuie doar sa aleaga din cele patruzeci si noua de proiecte existente atat dar nici macar lucrul acesta nu l poate face si spune senin ca nu poate chiar si marcel ciolacu psd istul sef a iesit sa spuna ca nu vor putea sa absoarba toti banii din pnrr pentru spitale va dati seama cata indolenta si incompetenta numai ca ciolacu si rafila stiu ceva sa faca numiri politice pe pile de partid andis agentia noua care trebuie sa aduca specialisti romani din tara sau din strainatate arhitecti ingineri project manageri care trebuie sa se ocupe de investitiile in cele douazeci si cinci de spitale a fost sufocata cu oameni de partid fara absolut nicio legatura cu constructia de spitale din presa am aflat chiar ca unul dintre directorii numiti la andis a facut si puscarie curat murdar coane marcele coane alexandru mai mult declaratiile elucubrante ale ministrului rafila vin sa intareasca ceata in care se afla si din care nu poate iesi plangea domnul rafila ca de ce am pus noi usr in pnrr infiintarea unui departament profesionist la ministerul sanatatii care sa se ocupe de constructia de spitale tocmai de aceea pentru ca ministerul sanatatii nu a fost in stare sa construiasca niciun spital desi aveau o gramada de specialisti care chipurile se ocupau de asta nu a fost sa fie avem cel mai slab trimestru pe pnrr cincisprezece jaloane din douazeci si patru erau intarziate la expirarea termenului niciodata nu am avut pana acum atat de multe jaloane neindeplinite la expirarea unui termen din pnrr doar noua din cele douazeci si patru de jaloane pe care romania le avea de inchis in trimestrul iii doua mii douazeci si doi au fost finalizate la termen pentru prima data prin pnrr avem prinsi o suta optzeci de milioane de euro ca finantare pentru medicina de preventie adica trei zero de cabinete medicale renovate si tehnologizate ce a facut ministrul rafila a deschis apelul dupa care a stins lumina si a inchis usa federatia nationala a patronatelor medicilor de familie il acuza pe rafila ca a delegat unui singur consilier sa se ocupe de proiectele trimise dupa care consilierul a plecat in concediu in tot acest timp rafila se plange in conferinta de presa ca medicii de familie nu trimit suficiente proiecte incredibil adica mai bine da vina pe altii pentru propria i incompetenta domnul rafila are totul mura in gura lasat de usr ar trebui ca ministrul sa se ridice de pe fotoliul comod de unde mai arunca cate un mesaj somnoros de fapt cel mai bine pentru toata lumea e sa apara demisia de onoare a ministrului nimic nupot egreu alexandru rafila demisia remus negoi senator usr constanta ,"(1080.0, 3218.0)",1080.0,3218.0
38,Domnul Virgil Guran:,64436,Doamna Diana Iovanovici-Șoșoacă:,64552, multumesc are cuvantul pentru declaratie politica doamna senator diana iovanovici sosoaca ,"(4475.0, 4476.0)",4475.0,4476.0
39,Doamna Diana Iovanovici-Șoșoacă:,64552,Domnul Virgil Guran:,76993, multumesc frumos domnule presedinte declaratia mea politica se intituleaza datoriile istorice ale germaniei fata de romania stimati colegi senatori se vede ca aveti un presedinte tradator agent al serviciilor altei tari cel putin un sclav al tarii a carei limba o cunoaste mai bine decat limba romana care a ajuns presedinte al romaniei cu ajutorul unor tari cu interese in tara noastra si care fara mandat din partea poporului roman renunta la datoriile germaniei fata de romania mai mult nu face niciun demers pentru apararea intereselor cetatenilor romani care cer ajutor pentru ca li se iau copiii abuziv in timp ce ambasadori ai altor tari au tupeul sa se implice in anchetele penale din romania si sa dispuna in locul procurorilor nu mai cereti herr prasident sa se cerceteze la sange si datoriile germaniei catre romania ca atunci cand aveti ordine de la oculta mondiala impotriva celor care sunt antisistem si lupta pentru libertate si sunteti primul care le indeplineste radu golban este economistul de origine romana care a descoperit ca germania ne datoreaza nouasprezece miliarde de euro din acordurile comerciale bilaterale incheiate inainte si in timpul celui de al doilea razboi mondial a trait si studiat in germania elvetia si romania iar acum locuieste in elvetia in prezent este lector la colegiul national de comert si diplomatia relatiilor economice din bucuresti acesta a declarat intr un interviu ca in cadrul cercetarilor la lucrarea sa de doctorat care nu a fost un plagiat nene ciuca si nene cimpeanu hotilor de idei si infractorilor de plagiat devalizatorilor de bogatii si distrugatori de invatamant cu privire la politica monetara si europeana a fost interesat sa gaseasca si o alta metoda de colaborare monetara in europa asa a descoperit ca incepand cu anii treizeci a existat pana in o mie noua sute patruzeci si patru o uniune de clearing se spune clar ca romania renunta la toate pretentiile de despagubire de la germania si de la cetatenii germani cu exceptia drepturilor dobandite din tratate si contracte anterioare datei de unu septembrie o mie noua sute treizeci si noua motivul pentru care aceasta datorie nu este stinsa astazi este ca romania nu a renuntat explicit la acesti bani dreptul dobandit al romaniei in urma datoriei de clearing fiind din o mie noua sute treizeci si sase adica nu se incadreaza in ceea ce s a decis la conferinta de la londra noi am renuntat la tot ce ne am angajat in timpul razboiului dar acest contract de tip barter incheiat cu germania este din o mie noua sute treizeci si sase tratatul semnat la paris trebuie studiat cu atentie iar daca romania nu a renuntat intr adevar la acesti bani atunci nu as vedea de ce sa nu i cerem acum in final au organizat un eveniment fantoma in doua mii doisprezece in care au spus ca datoria este mult mai mica adica douazeci si cinci din cele nouasprezece miliarde de euro nu puteau spune ca datoria nu exista pentru ca au fost confruntati cu materialul academiei romane nicolae ceausescu a initiat in o mie noua sute saptezeci si patru in estul europei un grup de lucru care sa se ocupe de problema despagubirilor de razboi si sa deschida negocieri cu germania negocierile de la berlin au fost purtate de george macovescu ministru de externe la acea vreme romania a enuntat explicit diferenta dintre despagubiri si un credit fortat cum a fost cel de clearing acesti bani nu sunt in contul unei despagubiri de razboi noi am renuntat la despagubiri in mod explicit nu putem sa cerem bani pentru atrocitatile si jafurile comise de armata nazista dupa douazeci si trei august patruzeci si patru nu avem dreptul la asa ceva dar aceasta suma nu reprezinta o paguba de razboi este rezultatul unei relatii comerciale economistul roman stabilit in elvetia spune ca s au facut presiuni internationale asupra romaniei pentru a renunta la aceste creante de vreme ce o eventuala recuperare a lor ar putea crea un precedent iar astfel mai multe tari ar putea cere germaniei sa si onoreze datoriile istorice art douazeci si opt din tratatul de pace de la paris prevede ca romania renunta la toate pretentiile fata de germania cu exceptia celor care rezulta din contracte si alte obligatii anterioare datei de unu septembrie o mie noua sute treizeci si noua precum si din drepturi dobandite inainte de aceeasi data in timp ce bnr a declarat ca nu detine dovezi privind aceasta datorie bundestagul german confirma in raspunsul oficial trimis ca exista intr adevar un sold in favoarea romaniei de unu o suta douazeci si sase miliarde de marci imperiale care ar avea acum o valoare de nouazeci si noua de miliarde de euro putin mai mult decat jumatatea datoriilor romaniei doctorul in economie radu golban a confirmat faptul ca nemtii stiu despre datoria germaniei catre romania si acest subiect a fost discutat in parlamentul german insa nu au niciun interes sa recunoasca faptul ca la un moment dat in istorie au fost ajutati de catre o alta tara mai slaba precum romania cand veti cere lasilor drepturile tarii noastre cand veti invata ca se poate negocia orice in beneficiul romaniei cand veti invata sa va slujiti tara si poporul iudelor va multumesc senator diana iovanovici sosoaca partidul s o s romania va multumesc frumos domnule presedinte ,"(5428.0, 5485.0)",5428.0,5485.0
40,Domnul Virgil Guran:,76993,Domnul Cristinel-Gabriel Berea:,77152, multumim si noi are cuvantul domnul senator cristian berea doamna aelenei evdochia sa veniti mai aproape ca urmati dumneavoastra ,"(240.0, 7400.0)",240.0,7400.0
41,Domnul Cristinel-Gabriel Berea:,77152,Domnul Virgil Guran:,80241, va multumesc domnule presedinte eu am sa vreau sa vorbesc astazi despre implicatiile unei negocieri cu rusia in timp ce kievul era atacat complet brutal si haotic de catre rusia dovedindu se inca o data cruzimea si lipsa de ratiune sau de legitimitate daca mai era nevoie din deciziile moscovei ministrul apararii face apel la pace prin negocieri internationale daca pentru personalitati ca elon musk sau oameni politici ca emmanuel macron este mai usor de discutat din confortul occidentului despre o pace ce presupune de facto predarea ucrainei ramane sa ne miram cum ministrul unei tari cu o trauma istorica adanca in relatiile cu rusia poate indemna la asa ceva mai mult domnul dincu pare dispus sa ia o parte la o retrasare a teritoriului ucrainean din afara prin negocieri ale europei cu rusia se pare ca dansul nu cunoaste prea bine sau a uitat ce inseamna a negocia cu rusia ziaristul pamfil seicaru spunea intr un eseu al sau ca rusia de astazi este din punct de vedere al politicii externe egala cu uniunea sovietica si cu rusia tarista urmarind in definitiv indiferent de schimbarile de regim aceeasi politica expansionista dintotdeauna daca ucraina ar ceda problemele nu se vor opri aici ucraina a cedat in doua mii paisprezece cand a avut loc anexarea crimeei vedem ce a urmat apoi o eventuala concesie il apropie pe putin mai mult de transnistria si mai apoi de moldova ministrul apararii nu ar trebui sa aiba in vedere aceste aspecte si ce implicatii aduc ele desigur pacea este dezideratul suprem dar ea nu inseamna umilinta si nici stergerea de pe harta a unei natiuni si dreptul ei de autodeterminare si apoi sa ne intrebam daca maine putin ar invada romania cum ne am simti ca statele vecine si europene sa ne spuna ca ar trebui sa negociem si sa acceptam o conventie la care noi romanii sa fim doar terti presedintele tarii cu atributii clare in politica externa a intarziat sa si traga de mana guvernul pentru aceste devieri domnul iohannis care nu a ezitat sa iasa in fata ca sustinator al ucrainei si ca om de baza al aliatilor vestici ar trebui sa ia mult mai in serios aceasta lipsa de coordonare intr o chestiune atat de importanta un presedinte responsabil ar trebui sa recunoasca importanta unor astfel de declaratii ce presupun ele si sa si coordoneze agenda de lucru pe politica externa cu cea a ministerului apararii nationale si a ministerului afacerilor externe orice informatie cu privire la aparare si securitate nationala ce ajunge eronat in spatiul public poate fi periculoasa razboiul nu convine nimanui dar el este mai usor de dus atunci cand dusmanul este unanim recunoscut si are opozanti uniti singura solutie pentru negocieri reale este in momentul de fata o victorie a ucrainei sau pierderi semnificative provocate rusiei atat militar cat mai ales economic iar liderii nostri trebuie sa stie lucrul asta pentru aceasta hotararea si neclintirea vestului sunt esentiale va multumesc cristi berea senator usr ,"(2331.0, 6947.0)",2331.0,6947.0
42,Domnul Virgil Guran:,80241,Doamna Evdochia Aelenei:,80322, multumesc are cuvantul doamna senator aelenei evdochia ,"(4475.0, 4476.0)",4475.0,4476.0
43,Doamna Evdochia Aelenei:,80322,Domnul Virgil Guran:,84858, buna ziua tema declaratiei mele politice opriti inflatia artificiala doamnelor domnilor senatori cand am intitulat prezenta declaratie politica opriti inflatia artificiala nu m am gandit ca ar putea exista un guvern sau o banca centrala care sa opreasca o lege economica sa actioneze obiectiv dar in avalansa actuala de scumpiri ale preturilor exista o parte artificiala datorata slabiciunilor administrative si politicilor guvernamentale nu este adevarat ca scumpirile din perioada actuala au doar cauze externe guvernul pnl psd udmr presedintele statului si banca nationala dau vina inflatiei pe factori externi efectele pandemiei seceta razboiul din vecinatate sanctiunile aplicate rusiei politicile ecologiste ale ue globalismul si economia de piata covid nouasprezece si alte tulpini toti acestia sunt factori necontrolabili si aceasta ar absolvi chipurile actuala putere de orice vina nu putem accepta o astfel de manipulare situatia in care se gasesc romanii este o consecinta a slabiciunilor si politicilor demagogice ale guvernantilor din ultimele trei decenii care sunt cam aceiasi pnl psd udmr si banca nationala cu eternul sau guvernator au girat politicile falimentare care tin romania pe ultimul loc in ue la dezvoltare si prosperitate in ciuda faptului ca aceste forte politice au venit in fata electoratului cu programe ca fiind de dezvoltare si modernizare realitatea cu care ne confruntam este una trista istoria va retine ca in timpul guvernelor pnl psd udmr al mandatelor presedintilor basescu si iohannis al multelor mandate ale domnului isarescu in romania s a produs cea mai mare distrugere industriala necreativa si de asemenea cea mai mare si mai grava despadurire tot necreativa cu urmari catastrofale pentru mediul romanesc acum ne ingrijoreaza preturile la energie combustibili si servicii publice dar era firesc sa ajungem aici atata timp cat unitatile de productie in loc sa fie mentinute in functie si modernizate au fost demolate inchise sau vandute la fier vechi puteam sa ne acoperim necesarul de energie si chiar sa exportam dar guvernantii nostri au redus capacitatile si oferta au privatizat la straini distributia iar romanii sunt sfatuiti sa faca economii la curent electric la acelasi rezultat s a ajuns si in privinta alimentelor in loc sa se faca imbunatatiri funciare sa se redea terenul productiei agricole acesta a fost redus deteriorat si o parte nelucrat distrugerea sistemului de irigatii in loc de dezvoltarea modernizarea si eficientizarea lui conduce spre acelasi tragic deznodamant in felul acesta oferta de produse agroalimentare s a redus cererea a crescut preturile au luat o razna iar consumatorul roman urmeaza sa faca foamea doamnelor domnilor senatori ce se mai poate face o parte din cresterea preturilor se duce la bugetul de stat aceste venituri suplimentare pot fi indreptate spre sprijinirea afacerilor ca sa continue si sa dezvolte capacitatile de productie in loc sa fie inchise mai multe fonduri trebuie repartizate familiilor nevoiase care nu mai pot face fata cu resurse proprii frigului si foamei legile si ordonantele adoptate de actualul parlament pe care si eu le am votat tinteau aceste obiective dar in aplicarea si administrarea lor practica efectele benefice au fost modeste de aceea trebuie sa presam in continuare puterea sa vina cu noi masuri banca nationala care a scapat de sub control limitele tintei de inflatie poate determina bancile comerciale sa nu mai externalizeze peste hotare capitalul si profitul ci sa crediteze economia autohtona cu dobanzi rezonabile nu speculative se vorbea cu ceva timp in urma ca in statele ue profitul sa fie reinvestit in tarile in care acesta se realizeaza ce s a ales din aceasta lozinca de amagit romanii nu sunt informatii oare de ce in final observ ca actualele partide de la guvernare si au epuizat potentialul politic de a mai guverna eficient si in interes national imi exprim neincrederea ca actualii guvernanti partide presedinte guvernator mai au capacitatea si vointa necesare scoaterii romanilor din crizele in care i au impins este timpul ca alegatorii romani din tara si din lume sa constientizeze mai bine faptul ca este necesar si in interesul lor sa ridice alte partide noi si capacitati politice la conducerea statului va multumesc senator aelenei evdochia ,"(2331.0, 3218.0)",2331.0,3218.0
44,Domnul Virgil Guran:,84858,Domnul Raoul-Adrian Trifan:,85115, multumesc si eu are cuvantul domnul senator trifan raoul adrian o sa am rugamintea sa incercati sa sintetizati e adevarat ca si inainte s a vorbit destul de mult sa ne incadram in timp ca o sa inceapa si sesiunea cealalta ,"(2331.0, 4476.0)",2331.0,4476.0
45,Domnul Raoul-Adrian Trifan:,85115,Domnul Virgil Guran:,87210, da sigur voi fi succint va multumesc domnule presedinte de sedinta accelerati afara din ministerul de interne domnule bode ministrul lucian bode ne a aratat in ultima perioada calitatile sale pe langa talentul de a ascunde la vedere deja de doi ani de zile o lucrare de doctorat ministrul se mai remarca si prin celebra sa lucrare de data aceasta o suta publica fraudarea unei licitatii publice cu bani din fonduri europene acum cateva luni premierul ciuca cerea sefilor de ministere sa reduca cheltuielile cu zece ce a inteles din asta ministrul bode a inteles sa cumpere sase sute de bmw uri cu treizeci si opt zero de euro bucata cum prin realizarea unui caiet de sarcini care se pliaza perfect culmea pe un model foarte specific de masina domnule bode cu totii intelegem nevoia de a cumpara pentru politia romana masini noi si performante dar sa poata veni si alte firme la licitatie nu doar prietenii domnului iohannis ati crezut ca o sa treaca neobservata o astfel de fapta dar din fericire pentru romani nu a fost asa nu puteti sa faceti caiete de sarcini pentru prietenii sefului de partid nu puteti sa treceti neobservate sase sute de limuzine licitate fraudulos si sa credeti ca toata lumea o sa creada gogosile pe care le povestiti in platourile televiziunilor prietenilor asa cum albul nu este negru nici acest act de coruptie la nivel inalt nu va putea trece ca un act administrativ corect asa cum incercati sa l prezentati ati fraudat cu buna stiinta o licitatie din bani europeni va ascundeti cu meticulozitate teza de doctorat in fiecare zi aratati romanilor ca sunteti incompatibil cu functia pe care o detineti si ca va asumati un rol de simpla marioneta domnule bode parca erati mai putin nociv atunci cand dormeati pe bancheta din spate a masinilor lucian bode trebuie sa elibereze de urgenta functia de ministru al afacerilor interne domnule bode v a prins radarul sugerez sa parasiti mandatul la prima iesire va multumesc senator de timis usr raoul trifan va multumesc ,"(2331.0, 7305.0)",2331.0,7305.0
46,Domnul Virgil Guran:,87210,Domnul Cristian Bordei:,87290, multumesc are cuvantul domnul senator bordei cristian ,"(4475.0, 4476.0)",4475.0,4476.0
