,start_text,start_index,end_text,end_index,text,timestamp,start,end
1,S T E N O G R A M A,0,ședinței Senatului din 20 iulie 2022,21, ,"(30.0, 1896.0)",30.0,1896.0
2,ședinței Senatului din 20 iulie 2022,21,sesiune extraordinară,63, ,"(30.0, 1896.0)",30.0,1896.0
3,sesiune extraordinară,63,S U M A R,90, ,"(30.0, 1896.0)",30.0,1896.0
4,S U M A R,90,S T E N O G R A M A,2013, unu aprobarea ordinii de zi si a programului de lucru doi doi informare cu privire la proiectele de lege privind aprobarea unor ordonante de patru urgenta ale guvernului proiectul de lege pentru aprobarea ordonantei de urgenta a guvernului nr o suta doisprezece doua mii douazeci si doi privind instituirea unor masuri pentru stimularea investitiilor cu finantare din fonduri externe nerambursabile in domeniul eficientei energetice resurselor regenerabile de energie pentru intreprinderi mari si intreprinderi mici si mijlocii energiei verzi din surse regenerabile destinate autoritatilor publice locale precum si unele masuri in domeniul specializarii inteligente precum si pentru modificarea si completarea unor acte normative din legea nr patruzeci si sapte o mie noua sute nouazeci si doi privind organizarea si functionarea curtii constitutionale republicata ,"(102.0, 153.0)",102.0,153.0
5,S T E N O G R A M A,2013,şedinţei Senatului din 20 iulie 2022,2034, ,"(30.0, 1896.0)",30.0,1896.0
6,şedinţei Senatului din 20 iulie 2022,2034,sesiune extraordinară,2076, ,"(30.0, 1896.0)",30.0,1896.0
7,sesiune extraordinară,2076,Domnul Virgil Guran:,2312, sedinta a inceput la ora paisprezece unu lucrarile sedintei au fost conduse de domnul virgil guran vicepresedinte al senatului asistat de domnul eugen pirvulescu si domnul sorin lavric secretari ai senatului ,"(30.0, 1896.0)",30.0,1896.0
8,Domnul Virgil Guran:,2312,Doamna Janina-Mirela Sitaru – secretar de stat la Ministerul Afacerilor Externe:,8841, doamnelor si domnilor senatori declar deschisa sedinta plenului senatului intrunit in sesiune extraordinara astazi douazeci iulie doua mii douazeci si doi sedinta este condusa de guran virgil vicepresedinte al senatului asistat de domnul senator eugen pirvulescu si domnul senator sorin lavric secretari ai senatului stimati colegi in temeiul dispozitiilor art saizeci si sase si art o suta cincisprezece alin raportul comun doriti sa luati cuvantul la raport sau la la dezbateri da raportul comun al comisiei pentru politica externa si comisiei pentru aparare ordine publica si siguranta nationala este de admitere a proiectului de lege proiectul de lege face parte din categoria legilor ordinare si se adopta cu votul majoritatii senatorilor prezenti minim treizeci si cinci de voturi senatul este camera decizionala incep dezbaterile avem si din partea guvernului daca doriti sa interveniti dar foarte scurt ,"(492.0, 520.0)",492.0,520.0
9,Doamna Janina-Mirela Sitaru – secretar de stat la Ministerul Afacerilor Externe:,8841,Domnul Virgil Guran:,11147, buna ziua janina sitaru secretar de stat multumesc domnule presedinte doamnelor si domnilor senatori asa cum bine stiti la cinci iulie doua mii douazeci si doi reprezentantii permanenti ai statelor membre nato au semnat protocoalele de aderare ale republicii finlanda si ale regatului suediei la tratatul atlanticului de nord avand la baza decizia celor doua state de a depune cererile de aderare pentru obtinerea statutului de membru confirma succesul nato ca organizatie de securitate dar si al politicii de extindere ale aliantei care a extins zona transatlantica de valori si securitate de a lungul timpului finlanda si suedia impartasesc cu statele membre nato principiile democratice si valorile fundamentale si participa la angajamentul deplin al aliantei fata de securitatea internationala prin pregatirea comuna cu aliatii si participarea la exercitiile armate armatele celor doua state au atins un inalt nivel de interoperabilitate aducand contributii importante la operatiunile nato pe aceste coordonate contributia celor doua state in calitate de state membre va determina consolidarea sistemului de aparare aliat inclusiv din perspectiva posturii nato pe flancul estic in contextul actual de securitate atat regional cat si international marcat de razboiul din ucraina continuarea procesului de extindere cu doua state pozitionate strategic si care dispun de armate dotate cu echipamente moderne interoperabile cu cele ale structurii de forte ale aliantei constituie o garantie suplimentara a mentinerii si consolidarii credibilitatii nato in raport cu provocarile externe in acest moment trebuie sa ne asiguram ca finlanda si suedia vor fi integrate in nato cat mai curand posibil abordare care este impartasita unanim la nivelul statelor aliate pana in prezent procesul de ratificare a fost finalizat in paisprezece din statele membre ratificarea rapida a aderarii de catre romania va transmite un semnal puternic prin sustinerea noastra practica pentru consolidarea aliantei a politicii sale de extindere si de sprijin pentru cele doua state aspirante va multumesc si va rog sa aprobati proiectul de lege privind ratificarea celor doua protocoale ,"(541.0, 659.0)",541.0,659.0
10,Domnul Virgil Guran:,11147,Domnul Titus Corlățean:,11303, multumesc si eu trecem la reprezentantii grupurilor parlamentare psd va rog domnul titus corlatean domnul senator ,"(669.0, 1896.0)",669.0,1896.0
11,Domnul Titus Corlățean:,11303,Domnul Virgil Guran:,15600, multumesc domnule presedinte de sedinta stimati colegi daca mi permiteti in dubla calitate de presedinte al comisiei pentru politica externa si din partea grupului senatorial psd cateva scurte comentarii asa cum ati mentionat astazi in cadrul sesiunii extraordinare a senatului cele doua comisii competente pe fond comisia pentru politica externa respectiv comisia pentru aparare au fost sesizate cu intocmirea raportului comun referitor la proiectul de lege pentru ratificarea celor doua protocoale de aderate la tratatul atlanticului de nord pentru republica finlanda respectiv regatul suediei ati mentionat faptul ca raportul comun a fost adoptat transmis in timp util adoptat cu unanimitate de membrii comisiilor ceea ce reflecta o atitudine politica extrem de importanta la nivelul clasei politice romanesti este un moment istoric asa cum impreuna cu doamna presedinte pauliuc am mentionat amandoi la sedinta comuna a celor doua comisii pentru ca iata politici indelungate de neutralitate a doua state ma refer la finlanda si suedia s au modificat in mod dramatic in doar cateva saptamani ca rezultat al unei agresiuni militare a federatiei ruse impotriva ucrainei deci ca raspuns la folosirea agresiva cu incalcarea elementelor de baza ale dreptului international public prin actiunea armata pe care rusia a declansat o impotriva altui stat suveran in europa secolului xxi si este dreptul legitim suveran al oricarui stat atunci cand se simte la randul sau amenintat sa si aleaga aranjamentele de securitate faptul ca suedia care inca de la inceputul secolului xix a avut o politica de neutralitate post razboaie napoleoniene si post razboiul finlandez faptul ca finlanda care la randul ei a avut o indelungata perioada de neutralitate consolidata dupa cel de al doilea razboi mondial de linia de neutralitate stricta paasikivi au decis in doar cateva saptamani sa si modifice aceasta pozitie extraordinar de importanta de neutralitate spune foarte mult despre modul in care au resimtit riscul de securitate nationala rezultata din actiunea agresiva a federatie ruse asa incat votul de astazi a fost absolut previzibil predictibil noi la nivelul comisiei pentru politica externa de altfel in paisprezece iunie in prezenta celor doua doamne ambasador marjut akola ambasadorul republicii finlanda la bucuresti si respectiv therese hyden reprezentatul ambasadorului regatului suediei la bucuresti pe care de altfel le salut in clipa de fata pentru ca urmaresc virtual aceasta dezbatere am adoptat o declaratie a comisiei pentru politica externa in unanimitate pentru a spune trei lucruri in esenta unu e un drept suveran al statelor de a si alege liber aranjamentele de securitate nationala doi politica usilor deschise pe care romania a sustinut o consecvent trei sustinem o ratificare rapida in parlamentul romanie a celor doua protocoale iata ca lucrurile au avansat rapid si astazi suntem in fata unui vot de asemenea istoric as vrea pentru final sa fac urmatorul comentariu este nevoie mai mult decat oricand de solidaritate este nevoie de solidaritate internationala intre statele democratice iar suedia si finlanda in mod natural fac parte din aceasta familie a democratiilor de tip occidental deci sunt bine venite in nato sunt convins ca votul parlamentului romaniei si pozitia guvernului romaniei vor avea consecinte pozitive in relatiile bilaterale ale romaniei cu finlanda si cu suedia dar si in cooperarea multilaterala in proiecte in care da este nevoie de solidaritate in sens invers respectiv un calendar mai rapid de negociere pentru aderarea la ocde pentru romania si respectiv finalizarea unui obiectiv absolut legitim respectiv aderarea romanie la spatiul schengen asa incat nu mi ramane decat sa spun pe de o parte ca grupul senatorial psd in mod predictibil va vota proiectul de lege pentru aderarea celor doua state la tratatul atlanticului de nord si sa spun incerc sa nu gresesc foarte mult mai intai in finlandeza tervetuloa nato si in suedeza valkommen till nato adica bun venit in nato atat finlandei cat si suediei va multumesc ,"(685.0, 957.0)",685.0,957.0
12,Domnul Virgil Guran:,15600,Doamna Nicoleta Pauliuc:,15711, multumim si noi din partea grupului parlamentar pnl doamna senator nicoleta pauliuc ,"(968.0, 1390.0)",968.0,1390.0
13,Doamna Nicoleta Pauliuc:,15711,Domnul Virgil Guran:,19677, domnule presedinte asa cum a spus si domnul presedinte corlatean felicit si eu colegii care astazi in comisia pentru aparare si comisia reunita comisia pentu aparare si comisia pentru politica externa au votat in unanimitate proiectul de lege de ratificare a tratatului de aderare a suediei si finlandei la nato in acelasi timp vreau sa felicit toti factorii de decizie de la bucuresti administratie prezidentiala guvern si parlament pentru faptul ca romania este printre primele tari care ratifica protocolul de aderare a finlandei si suediei la nato asa cum am spus si in cadrul comisiei pentru aparare astazi este un vot istoric este un semnal extraordinar pe care l transmitem partenerilor nostri internationali intr un context inca foarte delicat aratam ca romania intelege foarte bine cat de importanta este unitatea lumii democratice liberale occidentale in fata agresiunii barbare si nejustificate a federatiei ruse le dovedim tuturor ca se poate pune baza in noi de altfel cred ca asa cum subliniau multe voci libere ale lumii occidentale romania a reusit sa si sporeasca semnificativ prestigiul international pentru felul in care a gestionat aceasta criza fara precedent dupa al doilea razboi mondial cererea de aderare la nato a celor doua state nordice reprezinta un pas istoric simplul fapt ca suedia si finlanda tari care indeplineau toate criteriile pentru aderare la nato chiar inaintea romaniei decid sa iasa din zona de neutralitate ne dovedesc trei lucruri pe de o parte ca aceste doua state cu democratii consolidate vad in federatia rusa o amenintare la adresa pacii de pe intreg continentul european iata spun eu si de ce este important sa nu banalizam raul si sa nu devenim nepasatori la tragedia colosala care se petrece dincolo de granita de nord a romaniei ucrainenii stimati colegi nu lupta doar pentru tara lor ci pentru intregul continent implicit si pentru linistea pacea si prosperitatea tarilor din uniunea europeana pe de alta parte aderarea celor doua state nordice delimiteaza net sferele de valori in perspectiva unei noi rupturi majore si din fericire de aceasta data romania este de partea cea buna a noii cortine care se va asterne probabil odata cu incheierea conflictului militar in ucraina stimati colegi suedia si finlanda se alatura nato pentru ca impartasesc principiile si valorile care sunt fundamentale ale celei mai puternice aliante militare defensive pe care a cunoscut o lumea moderna democratia liberala statul de drept respectul fata de viata recunoasterea normelor de drept international in plus nato intelege valoarea strategica uriasa pe care aderarea suediei si finlanda o reprezinta in opinia mea acest demers este unul dintre deciziile majore in vederea descurajarii unei eventuale noi agresiuni a federatiei ruse finlanda si suedia fac ceea ce trebuie faptul ca cele doua state intra in nato arata ca amenintarile kremlinului raman forme fara fond de altfel asa cum am spus si in alte randuri agresiunea lui putin asupra ucrainei ne a facut sa ne dam mai bine seama ca trebuie sa fim uniti si sa actionam impreuna a adus din nou statele unite ale americii si europa impreuna as vrea sa salut de la nivelul parlamentului romaniei disponibilitatea aratata de turcia in a accepta aderarea celor doua tari la nato puterea politica de la ankara ne arata ca vrea sa fie de partea corecta a istoriei si acesta este un lucru extraordinar avand in vedere parteneriatul strategic dintre romania si turcia dar si faptul ca turcia este cea mai importanta forta a nato de la marea neagra inchei prin a mi exprima speranta ca toate celelalte state membre ale nato vor face la fel ca romania si vor ratifica in scurt timp aceste cereri de aderare pentru ca impreuna suntem mai puternici ,"(983.0, 1251.0)",983.0,1251.0
14,Domnul Virgil Guran:,19677,Doamna Anca Dana Dragu:,19819, multumesc daca din partea grupurilor parlamentare mai exista doamna anca dragu va rog doamna senator anca dragu ,"(1267.0, 1896.0)",1267.0,1896.0
15,Doamna Anca Dana Dragu:,19819,Domnul Virgil Guran:,20867, multumesc domnule presedinte stimati colegi intr adevar ne aflam in fata unui vot istoric o zi importanta in care doua state cu o pozitie geopolitica importanta devin membre ale aliantei nord atlantice incepand cu douazeci si patru februarie doua mii douazeci si doi lumea a aratat altfel am luat cu totii masuri sa facem fata unor provocari uriase la care nu ne asteptam ne am trezit vecini cu un razboi la granitele romaniei am constatat ca pacea si securitatea pot fi puse la risc pot deveni un risc si pot ajunge in pericol peste noapte practic acest lucru s a intamplat iar lumea a reactionat europa a reactionat si astfel am ajuns sa facem fata unei situatii cum spuneam absolut de neconceput inainte de februarie douazeci si patru doua mii douazeci si doi grupul usr va vota pentru acest proiect de lege desigur grupul usr sustine extinderea nato si noi intelegem foarte bine cat de important a fost pentru romania ca romania este membra a uniunii europene si membra nato in aceste momente extraordinar de dificile pentru intreaga lume multumesc ,"(1282.0, 1389.0)",1282.0,1389.0
16,Domnul Virgil Guran:,20867,Domnul Sorin Lavric:,20943, multumim are cuvantul domnul senator sorin lavric ,"(1390.0, 1391.0)",1390.0,1391.0
17,Domnul Sorin Lavric:,20943,Domnul Virgil Guran:,22098, multumesc domnule presedinte guran partidul aur va vota ratificarea protocolului de aderare a finlandei si suediei dar vreau sa va amintesc un detaliu o imprejurare stanjenitoare si anume finlanda s a opus tot timpul intrarii romaniei in spatiul schengen si atunci la gestul nostru de prietenie asteptam din partea autoritatilor finlandeze o reactie pe masura atunci cand se va pune din nou problema intrarii noastre in spatiul schengen am vorbit de solidaritate si domnul corlatean si doamna pauliuc si doamna anca dragu unde este solidaritate din partea finlandei cand se pune problema intrarii noastre o tara un stat care este tinut pe tusa de atata timp in privinta acestei granite simbolice comercial economice care este spatiul schengen asadar nu avem nimic impotriva aderarii finlandei si suediei ceea ce vrem este respectarea reciprocitatii la gestul nostru de sprijin gestul romaniei fata de finlanda vrem ca de acum incolo si finlanda sa raspunda cu o reactie de prietenie asemanatoare asadar aur va vota ratificarea acestui protocol de aderare va multumesc ,"(1402.0, 1477.0)",1402.0,1477.0
18,Domnul Virgil Guran:,22098,Doamna Diana Iovanovici-Șoșoacă:,22229, multumesc si eu din partea senatorilor neafiliati prin telefon doamna senator diana iovanovici sosoaca ,"(1477.0, 1479.0)",1477.0,1479.0
19,Doamna Diana Iovanovici-Șoșoacă:,22229,Domnul Virgil Guran:,25492, va multumesc foarte mult buna ziua in primul rand as vrea sa mentionez cateva chestiuni de procedura unu mi se pare inadmisibil sa fim anuntati de aceasta sedinta cu o ora inainte eu personal nu am fost anuntata oficial de nimeni din cadrul senatului romaniei intamplator am vorbit la comisia pentru cercetarea abuzurilor si mi s a spus ca am plen cu o jumatate de ora inainte de inceperea plenului acest lucru este inadmisibil doi tableta mea nu are internet desi eu sunt in bucuresti orice as face nu pot sa votez de aceea o sa va rog frumos sa gasiti o solutie astfel incat sa pot sa mi exprim si eu votul si eu sunt senator la fel ca si dumneavoastra deci pe tableta este imposibil sa votez nu imi permite sa am date mobile desi sunt in bucuresti atentie trei la mana aceasta ordine va rog sa luati act ca ma opun si as fi votat impotriva ordinii de zi si va rog sa luati act de ceea ce va spun acum si sa mentionati ca subsemnata a votat impotriva ordinii de zi nu mi ati dat posibilitatea sa votez pe tableta nu stiu care sunt problemele tehnice in ceea ce priveste acest punct de pe ordinea de zi eu cred ca ar trebui sa ne gandim mai bine care este interesul romaniei asa cum spunea si domnul senator sorin lavric nu exista niciun sprijin fata de romania din partea celor doua state mai mult romania a fost denigrata de cele doua state in plus avem probleme cu copiii preluati de la familiile romane da si li se iau toate drepturile parintilor romani si nu numai acolo dar vorbim de aceste doua cazuri de aceea extinderea nato vorbim despre democratie in europa nu mai este democratie de mult este o dictatura asa ca atunci cand discutam de nato si de intentiile sale pe bune sa va aduceti aminte ce a facut nato in o mie noua sute nouazeci si noua cand intr o noapte de paste a bombardat iugoslavia si a omorat oameni si copii in biserici iar pe bombele nato scria happy easter paste fericit multumesc frumos dar eu nu am nevoie de un astfel de nato nato trebuie sa si revizuiasca atitudinea nato nu trebuie sa mai instige la razboi ceea ce se intampla in ucraina se intampla din doua mii paisprezece nu v am vazut afectati pentru crimele impotriva umanitatii din interiorul ucrainei impotriva etnicilor romani ucraina detine teritorii ilegal teritorii romanesti ucraina a distrus tot ceea ce inseamna identitatea romaneasca va rog sa luati act este treaba celor doua state sa adere la nato nu ma pot opune eu sau sa aprob eu nici nu ma intereseaza cert este ca ii veti provoca pe rusi si va spun ca pana la urma interesele rusilor si ale americanilor sunt cu totul altele decat interesele romaniei sunt intelegeri intre aceste doua mari puteri si nu cred ca mai trebuie sa ii mai periem atata pe toti in conditiile in care interesul nostru este ultimul uitati va ce a facut in acest moment ministerul afacerilor externe domnul aurescu permite navelor cu cereale ale ucrainei sa tranziteze canalul bastroe si chilia cum isi permite acest lucru este o inalta tradare fata de romania va rog sa luati act avand in vedere ca nu mi permiteti sa votez ca la acest punct ma abtin de la vot va multumesc foarte mult ,"(1546.0, 1722.0)",1546.0,1722.0
