,start_text,start_index,end_text,end_index,text,timestamp,start,end
1,S T E N O G R A M A,0,şedinţei Senatului din 22 iunie 2022,21, ,"(30.0, 2336.52)",30.0,2336.52
2,şedinţei Senatului din 22 iunie 2022,21,S U M A R,61, ,"(30.0, 2336.52)",30.0,2336.52
3,S U M A R,61,S T E N O G R A M A,3855, unu intrebari interpelari trei sapte saisprezece doi declaratii politice opt saisprezece saisprezece trei domnul senator ion dragos popescu informeaza plenul senatului asupra demisiei saisprezece sale din grupul parlamentar al usr urmand sa activeze ca senator neafiliat grupurilor parlamentare patru dezbaterea si adoptarea proiectului de lege pentru modificarea si completarea saptesprezece optsprezece ordonantei de urgenta a guvernului nr treizeci si doi doua mii doisprezece privind organismele de treizeci si sase treizeci si opt plasament colectiv in valori mobiliare si societatile de administrare a investitiilor precum si pentru modificarea si completarea legii nr doua sute nouazeci si sapte doua mii patru privind piata de capital din legea nr patruzeci si sapte o mie noua sute nouazeci si doi privind organizarea si functionarea curtii constitutionale republicata ,"(30.0, 2336.52)",30.0,2336.52
4,S T E N O G R A M A,3855,şedinţei Senatului din 22 iunie 2022,3876, ,"(30.0, 2336.52)",30.0,2336.52
5,şedinţei Senatului din 22 iunie 2022,3876,Domnul Virgil Guran:,4176, sedinta a inceput la ora noua douazeci si sase lucrarile sedintei au fost conduse de domnul virgil guran inlocuit de doamna alina stefania gorghiu vicepresedinti ai senatului asistati de domnul ion mocioalca si domnul sorin lavric secretari ai senatului ,"(30.0, 2336.52)",30.0,2336.52
6,Domnul Virgil Guran:,4176,Domnul Claudiu-Marinel Mureșan:,4787, buna dimineata stimati colegi declar deschisa sesiunea de intrebari interpelari de astazi douazeci si doi iunie doua mii douazeci si doi conducerea fiind asigurata de subsemnatul senator virgil guran vicepresedinte al senatului asistat de domnul senator ion mocioalca si domnul senator sorin lavric secretari ai senatului programul era cel clasic dar pentru ca ieri a intervenit schimbarea programului vom desfasura activitatea pana la zece zero fara cinci minute moment in care trebuie sa ne deplasam la plenul comun invit la microfon pe domnul senator muresan claudiu marinel pentru a prezenta intrebarea ,"(30.0, 93.52)",30.0,93.52
7,Domnul Claudiu-Marinel Mureșan:,4787,Domnul Virgil Guran:,7306, va multumesc frumos domnule presedinte am o interpelare de adresat domnului ministru alexandru rafila ministrul sanatatii si interpelarea se refera la programul centrelor de transfuzie de sange stimate domnule ministru in fiecare zi medicii fac apel catre populatie sa vina sa doneze sange pentru ca stim cu totii sunt foarte multi bolnavi care au nevoie de sange in perioada in care in perioada bolii donarea de sange si de componente sanguine faciliteaza o gama larga de tratamente esentiale si reprezinta o prioritate strategica de siguranta nationala iar sistemul ar trebui sa primeasca atentia cuvenita din pacate insa zilele de weekend sunt pentru multi romani internati in spitalele din romania si pentru apartinatorii acestora adevarate zile de calvar fac aici referire la cei internati in spitale cu diverse probleme de sanatate si care au nevoie urgenta de transfuzii de sange acesti pacienti trec prin momente de groaza sau pur si simplu se sting pe paturile spitalelor din romania din cauza faptului ca in mod absolut ridicol si sfidator centrele de transfuzie pur si simplu pun lacatul pe usa vineri si se redeschid abia luni in prezent programul de lucru al centrelor de transfuzie sanguina din romania se desfasoara intre orele sapte treizeci si saptesprezece treizeci de luni pana vineri asta in timp ce multi donatori ar putea sa doneze sange sambata sau duminica e groaznic e realmente inuman sa vezi cum bolnavilor care au nevoie de sange li se spune ca in weekend nu pot sa il primeasca de parca boala are rabdare sau bolnavul poate amana cum doreste tratamentul este evident faptul ca sistemul trebuie restructurat si modernizat pentru imbunatatirea accesului donatorilor la centrele de donare dar mai ales al pacientilor la sange produse si derivate din sange in consecinta va adresez respectuos urmatoarele intrebari pentru care va solicit un raspuns in scris care este strategia ministerului sanatatii cu privire la problemele legate de programul centrelor de transfuzie va rog de asemenea sa mi spuneti daca aveti in vedere modificarea acestui program prin impunerea unui program continuu adica si in zilele de sambata si duminica de asemenea va rog sa mi spuneti in ce stadiu se afla reorganizarea si modernizarea sistemului national de transfuzie sanguina in romania va multumesc frumos claudiu muresan senator de sibiu multumesc domnule presedinte ,"(111.52, 269.52)",111.52,269.52
8,Domnul Virgil Guran:,7306,Domnul Dorinel Cosma:,7390, multumesc si eu are cuvantul domnul senator cosma dorinel ,"(269.52, 1226.52)",269.52,1226.52
9,Domnul Dorinel Cosma:,7390,Domnul Virgil Guran:,9230, buna ziua dragi colegi buna ziua domnule presedinte astazi voi prezenta o intrebare adresata domnului barna tanczos ministrul mediului apelor si padurilor obiectul intrebarii controalele la societatile comerciale ce practica arderi ilegale de deseuri stimate domnule ministru pe paisprezece aprilie au avut loc descinderi de amploare in satul balteni judetul dambovita actiuni la care au participat peste doua sute de politisti jandarmi si comisari ai garzii de mediu care au perchezitionat societati care practica arderi ilegale de deseuri in acest sens garda de mediu a identificat douazeci si patru de societati comerciale care au ca domeniu de activitate prelucrarea deseurilor si materialelor feroase si neferoase din cauza neregulilor gasite de catre autoritati cei vizati au primit amenzi iar activitatea firmelor a fost intrerupta autoritatile din judetul dambovita au efectuat de asemenea actiuni de reciclare a deseurilor gasite pe campuri urmand ca ulterior acestea sa fie in totalitate curatate dupa mai multe zile de eforturi in acest context va adresez rugamintea de a mi raspunde la urmatoarele intrebari unu care este perspectiva ministrului mediului apelor si padurilor cu privire la societatile comerciale care practica actiuni ilegale de ardere a deseurilor doi ce masuri are in vedere ministerul pe care il conduceti in aceasta directie pentru a diminua cazurile de acest gen de poluare trei luand in considerare descinderile efectuate in dambovita care este rezolutia viitoare pentru restul judetelor din tara care vizeaza societatile comerciale ce practica astfel de activitati ilegale de ardere de deseuri va solicit raspuns scris si oral va multumesc cu deosebita consideratie dorinel cosma senator aur botosani va multumesc ,"(365.52, 436.52)",365.52,436.52
10,Domnul Virgil Guran:,9230,Doamna Ionela-Cristina Breahnă-Pravăț:,9722, multumesc si eu daca mai avem declaratii politice da domnul intrebarile va rog doamna senator ,"(269.52, 2262.52)",269.52,2262.52
11,Doamna Ionela-Cristina Breahnă-Pravăț:,9722,Domnul Virgil Guran:,11193, multumesc domnule presedinte prima interpelare este adresata domnului ministru virgil popescu ministrul energiei si vizeaza o solicitare privind transmiterea motivarii accelerarii reformei de decarbonizare a romaniei domnule ministru am observat cu totii pasii rapizi pe care doriti sa i parcurgeti in privinta decarbonizarii economiei romanesti toate acestea desi vicepresedintele comisiei europene valdis dombrovskis a anuntat ca in contextul crizei energetice si a conflictului din ucraina statele membre pot sa modifice pnrr cu privire la energia verde in situatia in care state precum germania si austria accelereaza procesul de redeschidere si operationalizare a minelor de carbune strategia dumneavoastra este contrarie desi minerii din tara noastra ingroasa randurile somerilor avand in vedere toate aspectele mentionate mai sus va rog sa mi transmiteti prin raspunsul dumneavoastra care este fundamentarea actiunilor de a inchide mine de carbune intr un ritm accelerat desi comisia europeana ne a pasuit in ceea ce priveste implementarea strategiei energiei verzi pe durata crizei generate de conflictul din ucraina va multumesc si in incheiere doresc sa mi raspundeti in scris atat pe adresa personala cat si pe cea a grupului senatorial al partidului social democrat si inca treizeci de secunde maximum un minut domnule presedinte daca mi permiteti ,"(481.52, 578.52)",481.52,578.52
12,Domnul Virgil Guran:,11193,Doamna Ionela-Cristina Breahnă-Pravăț:,11245, va rog daca e foarte scurt ,"(580.52, 580.52)",580.52,580.52
13,Doamna Ionela-Cristina Breahnă-Pravăț:,11245,Domnul Virgil Guran:,12587, da multumesc interpelarea este adresata tot domnului ministru virgil popescu si vizeaza o solicitare privind defalcarea pretului benzinei si motorinei si in acelasi timp solicitarea efectuarii unei analize comparabile a profiturilor inregistrate de companii in perioada doua mii douazeci si unu doua mii douazeci si doi domnule ministru avand in vedere explozia preturilor combustibililor va rog sa mi transmiteti cum este construit pretul carburantilor structura acestuia evident din ce este format si cat la suta din pretul de la pompa a fost reprezentat de profit pentru companiile producatoare in cadrul cercetarii va rog sa aveti in vedere analiza comparabila a constructiei pretului carburantilor de la nivelul mediei anului doua mii douazeci si unu si a mediei aferente primelor cinci luni din anul doua mii douazeci si doi va rog sa mi transmiteti de asemenea daca profitul companiilor a crescut in doua mii douazeci si doi fata de anul doua mii douazeci si unu si cat a reprezentat procentual aceasta crestere in sensul celor exprimate mai sus va rog sa mi transmiteti si care ar fi trebuit sa fie pretul combustibililor de la pompa daca procentul de profit pentru companiile producatoare ar fi ramas constant la nivelul anului doua mii douazeci si unu va multumesc solicit raspuns scris cu consideratie cristina breahna pravat senator psd de bacau va multumesc ,"(582.52, 655.52)",582.52,655.52
14,Domnul Virgil Guran:,12587,Doamna Evdochia Aelenei:,12735, va multumesc si ultimul coleg pentru intrebari interpelari doamna aelenei evdochia una singura va rog da doamna ,"(662.52, 675.52)",662.52,675.52
15,Doamna Evdochia Aelenei:,12735,Domnul Virgil Guran:,13426, da da da da o sa citesc o interpelare adresata domnului ministru al sanatatii alexandru rafila stimate domnule ministru in patru sute douazeci si patru de localitati din romania nu exista niciun medic de familie deficitul este de peste doi zero de astfel de cadre iar multi dintre medicii de familie au acum peste saizeci de ani drept urmare in circa zece ani nu vom mai avea medicina primara va rog domnule ministru sa mi raspundeti daca aveti in vedere acest aspect si ce masuri preconizati sa intreprindeti astept raspuns scris la adresa de e mail evdochia aeleneisenat ro cu respectul cuvenit senator aelenei evdochia circumscriptia nr paisprezece constanta va multumesc ,"(677.52, 705.52)",677.52,705.52
16,Domnul Virgil Guran:,13426,Domnul Cosmin-Marian Poteraș:,14700, multumesc si eu dau citire listei senatorilor care au depus intrebari si interpelari in scris interpelari doamnele si domnii senatori maties gheorghe calin cazanciuc robert marius popa maricel cionoiu nicusor purcarin bianca mihaela mocioalca ion rujan ion cristinel mirea siminica toanchina gheorghe marius bica danut bumb ioan sorin mihail radu mihai darau ambrozie irineu vlad sergiu cosmin ivan dan muresan claudiu marinel lavric sorin mateescu cristian sorin busuioc andrei intrebari doamnele si domnii senatori toanchina marius gheorghe popa maricel genoiu mihail prioteasa ion maties gheorghe calin bogdan florian bodog florian pardon guran virgil bumb ioan sorin bordei cristian palarie stefan dragu dana anca popescu dragos ion costea adrian aelenei evdochia cosma dorinel busuioc andrei mateescu sorin cristian hangan andrei declar inchisa sesiunea de intrebari interpelari de astazi conform programului aprobat continuam cu sesiunea consacrata declaratiilor politice va specific din nou avem saisprezece minute pentru declaratii politice asa ca va rog sa va limitati la doua minute maximum trei minute fiecare dau cuvantul domnului senator poteras cosmin marian ,"(725.52, 839.52)",725.52,839.52
17,Domnul Cosmin-Marian Poteraș:,14700,Domnul Virgil Guran:,16107, va multumesc domnule presedinte de sedinta astazi voi vorbi despre vechimea asimilata a magistratilor inechitate in sistemul de justitie nu toata lumea stie din pacate ca dupa ce un avocat notar jurist si asa mai departe categoria e mult mai larga devine magistrat toata vechimea anterioara in profesie se considera vechime in magistratura cu toate privilegiile care decurg de aici si ma refer in special la cele legate de pensia de serviciu nu exista niciun considerent etic sau moral pentru care acest aspect ar trebui sa se intample doar o dispozitie legala profund incorecta prin aplicarea careia un magistrat cu treizeci de ani vechime in cariera are tratament egal cu unul cu doi ani de magistratura dupa care ne indignam justificat de cate ori apare in presa vreun articol despre un consilier juridic care a fost judecator un an sau doi si se pensioneaza la patruzeci si cinci de ani cu pensie de serviciu urmeaza la vot in senat un proiect de lege care si propune sa extinda categoria celor care ajunsi magistrati beneficiaza de ceea ce se numeste vechime asimilata din fericire proiectul are raport negativ din pacate am ratat si de data aceasta ocazia de a purta o discutie onesta despre statutul magistratilor si despre privilegiile cateodata nemeritate care vin la pachet cu acest statut va multumesc cosmin poteras senator de dolj ,"(852.52, 950.52)",852.52,950.52
18,Domnul Virgil Guran:,16107,Domnul Vasile-Cristian Achiței:,16198, va multumesc are cuvantul domnul senator achitei vasile cristian ,"(272.52, 1697.52)",272.52,1697.52
19,Domnul Vasile-Cristian Achiței:,16198,Domnul Virgil Guran:,19410, multumesc domnule presedinte modernizarea infrastructurii rutiere din judetul botosani trebuie sa continue oamenii cei pe care ii reprezentam in parlament au pe buna dreptate asteptari de la noi sa facem legi bune pentru romani si sa ne asiguram ca facem totul pentru dezvoltarea substantiala a judetelor noastre iar aceasta dezvoltare trebuie sa fie una echilibrata cu o grija deosebita pentru zonele defavorizate care inregistreaza un deficit istoric la acest capitol judetul pe care il reprezint botosani este unul dintre cele care au nevoie de dezvoltare accelerata de aceea mi am concentrat activitatea parlamentara pe promovarea si sustinerea prin toate mijloacele legale avute la dispozitie a prioritatii absolute pe care am identificat o pentru dezvoltarea judetului botosani si anume investitiile in modernizarea infrastructurii rutiere sunt multumit de faptul ca in prezent se modernizeaza pe fonduri europene doua drumuri nationale din judetul botosani dn28b cel care leaga municipiul resedinta de judet de restul tarii prin targu frumos si dn29d care pune in valoare vama cu republica moldova de la stanca costesti prin stefanesti sunt preocupat de evolutia lucrarilor si voi uza de intreaga forta pe care mi o confera pozitia de parlamentar pentru a le finaliza sunt in acelasi timp extrem de determinat de motivat pentru a continua eforturile de modernizare a infrastructurii rutiere botosanene prin promovarea de noi investitii importante in reteaua de drumuri nationale din judetul pe care l reprezint drumul expres botosani suceava varianta ocolitoare a municipiului botosani si varianta ocolitoare a orasului flamanzi finantate prin poim trebuie sa aiba finalizate documentatiile pana in decembrie doua mii douazeci si trei eliminarea celor doua puncte negre de pe drumurile nationale botosanene de la rosiori si baisa trebuie realizata urgent fiind prevazuta si in pnrr siguranta rutiera este o prioritate si atunci cand vine vorba de constructia si reabilitarea podurilor de pe drumurile nationale si atrag atentia ca sase dintre acestea au fost catalogate de experti ca fiind in stare critica sau nesatisfacatoare o alta urgenta pe care ministerul transporturilor si cnair prin directia regionala de drumuri si poduri iasi trebuie sa o rezolve este intocmirea documentatiei si proiectarea reabilitarii unui tronson de trei trei km din dn29d care nu a fost prins in investitia mare de modernizare a acestui drum expertizarea tehnica a drumurilor nationale dn29a varfu campului dorohoi dn29b botosani dorohoi dn29 botosani saveni si dn24c badarai manoleasa prut ca si alocarea de fonduri suficiente pentru lucrarile de intretinere sunt alte prioritati ale perioadei urmatoare pentru infrastructura rutiera botosaneana ca atare in perioada urmatoare imi voi concentra eforturile cu perseverenta pe promovarea proiectelor de investitii si la fel cum am facut si in cazul dn28b si dn29d voi convinge factorii de decizie de necesitatea implementarii tuturor acestor noi proiecte va multumesc senator de botosani cristian achitei ,"(977.52, 1079.52)",977.52,1079.52
20,Domnul Virgil Guran:,19410,Domnul Liviu Brătescu:,19506, multumesc si eu are cuvantul domnul senator bratescu liviu ,"(269.52, 1226.52)",269.52,1226.52
21,Domnul Liviu Brătescu:,19506,Domnul Virgil Guran:,22861, va multumesc domnule presedinte de sedinta doamnelor si domnilor senatori parlamentarii nu fac nici drumuri si nici nu construiesc scoli aceasta nu i impiedica uneori in campaniile electorale sa le promita sunt insa destule lucrurile pe care le pot misca pentru cetatenii pe care ii reprezinta din aceasta importanta demnitate publica ca senator pnl iasi am o datorie importanta fata de moldova si iesenii care ne au dat votul lor pentru a ajunge aici sa le reprezentam interesele romania are la randul ei o datorie enorma fata de moldova si fata de ieseni aceasta vine partial din istoria noastra nationala si partial din trecutul recent cand regiunea noastra a fost privata de mari proiecte de investitii asa ne a prins centenarul marii uniri impreuna regiunile istorice dar atat de departe unele de altele prin lipsa infrastructurii rutiere sau feroviare adecvate autostrada unirii si a7 spitalul regional de urgenta sau institutul regional de boli cardiovasculare sunt proiecte de echipa carora ma voi alatura cu toata forta ele reprezinta baza contractului nostru cu alegatorii si in orice formula guvernamentala sunt nenegociabile oamenii nu mai au rabdare si trebuie sa livram acum in acelasi timp iasiului trebuie sa i se recunoasca statutul de capitala culturala a romaniei si altfel decat prin imnuri si buchete de flori iasiul are nevoie de o infrastructura culturala solida iar aici deja am inceput sa facem pasi mari si concreti personal am contribuit la includerea pe lista de finantari a constructiei unei noi sali de spectacole pentru opera nationala romana iasi in perioada mandatului meu de secretar de stat in ministerul culturii banca de dezvoltare a consiliului europei va finanta printr un imprumut consistent numeroase obiective culturale din romania iar circa cincisprezece milioane de euro sunt destinate operei iesene asadar astazi banii exista pentru acest proiect si este o reusita a echipei liberale iesene nu in ultimul rand trebuie sa ne concentram atentia asupra programului national de investitii anghel saligny unde iasiul se numara printre judetele care vor primi importante fonduri pentru comunitatile locale este meritul primarilor din judetul iasi care au realizat ca este o sansa unica pentru a reusi investitii in canalizare in retele de gaz si in alte obiective vitale care sa aduca aceste localitati in secolul pe care il traim blamat inutil programul anghel saligny este vital in acele zone care nu mai sunt acoperite de fondurile europene sunt restantele noastre istorice este instrumentul prin care acum abia reparam o mare nedreptate facuta prea multor romani care nu au sansa sa locuiasca intr o mare aglomerare urbana care a atins deja standarde europene de trai nu mai putem permite sa avem mai multe romanii in interiorul acelorasi granite nu mai putem permite ca moldova sa fie o regiune subdezvoltata in vreme ce bucurestiul si ilfovul totalizeaza din punct de vedere economic douazeci si cinci din pib ul tarii pe un spatiu geografic restrans boala centralizarii este endemica in romania iar noi reprezentantii iesenilor la bucuresti trebuie sa i gasim leacul astazi nu cand vin data viitoare alegerile va multumesc liviu bratescu senator pnl iasi ,"(1207.52, 1422.52)",1207.52,1422.52
22,Domnul Virgil Guran:,22861,Doamna Ionela-Cristina Breahnă-Pravăț:,22962, multumesc si eu are cuvantul doamna senator breahna pravat ionela cristina ,"(269.52, 2262.52)",269.52,2262.52
23,Doamna Ionela-Cristina Breahnă-Pravăț:,22962,Domnul Virgil Guran:,27028, multumesc foarte mult domnule presedinte declaratia politica de astazi are ca titlu municipiul bacau salvat pana la degradare domnule presedinte stimati colegi dragi bacauani am dat de multe ori glas solicitarilor dumneavoastra care nu vizeaza decat aspecte ce tin de crearea unui context decent de trai in municipiul din care provin solicitari trecute pur si simplu cu vederea de primarul usr si le inteleg pe deplin bacauanilor atat problemele cat si situatiile neplacute intampinate de la momentul instaurarii acestei asa zise salvari fortate salvare care se indreapta cu pasi rapizi spre degradarea totala a municipiului bacau care abia se mai zareste din jungla care pune stapanire pe strazi parcuri si alei domnule primar al municipiului bacau in scurt timp degradarea continua va da nastere altor probleme de ordin sanitar dupa cum ati vazut deja zilele trecute care vor pune vietile cetatenilor in pericol daunatorii isi vor face simtita prezenta in mod frecvent si din ce in ce mai aproape de locuintele si locurile noastre de joaca daca primaria nu va interveni in oras pentru salubrizare iar bacauanii va asigur ca si doresc un oras cu adevarat european asa cum le ati promis de fapt in anul doua mii douazeci dar nu ca la bucuresti sa fie muscati de sobolani pe strazi de asemenea de parca nu ar exista suficiente probleme in municipiul bacau la nivelul primariei sunt blocate in acest moment trei obiective vitale si vorbesc aici despre asa zisul pavilion al spitalului municipal ce necesita un amplu proces de finalizare si chiar modernizare despre rezerva de apa a municipiului bacau si despre reabilitarea aductiunii de apa de la valea uzului in privinta spitalului municipal stiti foarte bine consiliul judetean si a exprimat deja in nenumarate randuri intentia de a prelua administrarea acestuia astfel incat investitiile pentru finalizarea acestui obiectiv sa se deruleze in cel mai scurt timp partidul social democrat intelege necesitatea modernizarii infrastructurii sanitare la nivelul municipiului bacau si personal doresc sa trag un semnal de alarma si sa le reamintesc colegilor liberali din cadrul consiliului local bacau faptul ca rezolvarea acestei probleme sta si in voturile dumnealor care pot vota pentru solutia propusa de catre psd de fapt in scopul binelui bacauanilor o alta problema foarte grava este reprezentata cum spuneam si de rezerva de apa a orasului in urma avariei din luna februarie comitetul judetean pentru situatii de urgenta a decis operationalizarea rezervei de apa un proiect finantat prin pndl un proiect care deja a fost finalizat dar doar pe hartie achitat in integralitate insa complet nefunctional la momentul acesta va spun sincer ca nu stiu cum ar fi mai rau sa credem ca este rea vointa fata de noi cetatenii bacaului sau doar incapacitatea domnului primar viziteu oricare dintre variantele precizate mai inainte aduce grave prejudicii insa nivelului nostru de trai de asemenea declaratia mea politica continua si cu aspecte ce vizeaza reabilitarea aductiunii de apa si faptul ca la momentul acesta domnul primar usr asa zisul salvator al bacaului inca cauta solutii dar nu pentru a finanta reabilitarea aductiunii de apa ci pentru a gasi vinovatii vinovati care provin dintr un mandat incheiat fortat de catre fostul primar pnl in doua mii paisprezece ceea ce nu ne ajuta cu absolut nimic domnule primar trebuie sa cautati solutii de finantare nu vinovati la momentul acesta prin urmare problemele care treneaza asupra primariei bacau s au acutizat recent iar majoritatea sunt cauzate de managementul defectuos al actualei administratii din fruntea institutiei nepasarea si incompetenta au iesit la iveala din spatele sloganurilor populiste lasand loc unei noi imagini unei imagini reale si mult mai ample a celor care au promis cu orice pret salvarea multumesc cristina breahna pravat senator psd de bacau ,"(1438.52, 1693.52)",1438.52,1693.52
24,Domnul Virgil Guran:,27028,Domnul Cristinel-Gabriel Berea:,27163, multumesc are cuvantul domnul senator berea cristinel gabriel daca se poate sa fie scurta sa ne incadram ,"(1697.52, 1703.52)",1697.52,1703.52
