,start_text,start_index,end_text,end_index,text,timestamp,start,end
77,Doamna Alina-Ștefania Gorghiu:,76413,Domnul Adrian Streinu Cercel:,77521, multumesc constat inchise mai vreti sa luati cuvantul multumesc declar dezbaterile inchise propunerea legislativa ramane la vot final punctul noua al ordinii de zi propunerea legislativa pentru completarea legii nr nouazeci si cinci doua mii sase privind reforma in domeniul sanatatii republicata in monitorul oficial al romaniei nr sase sute cincizeci si doi din data de douazeci si opt august doua mii cincisprezece cu modificarile si completarile ulterioare si pentru modificarea ordonantei de urgenta a guvernului nr o suta paisprezece din douazeci si opt decembrie doua mii optsprezece privind instituirea unor masuri in domeniul investitiilor publice si a unor masuri fiscal bugetare modificarea si completarea unor acte normative si prorogarea unor termene publicata in monitorul oficial al romaniei partea i nr o mie o suta saisprezece din data de douazeci si noua decembrie doua mii optsprezece cu modificarile si completarile ulterioare raportul comisiei de sanatate este de respingere a propunerii legislative propunerea face parte din categoria legilor ordinare se adopta cu votul majoritatii senatorilor prezenti il rog pe domnul presedinte streinu cercel sa prezinte raportul comisiei ,"(267.52, 269.52)",267.52,269.52
78,Domnul Adrian Streinu Cercel:,77521,Doamna Alina-Ștefania Gorghiu:,78778, va multumesc doamna presedinta propunerea legislativa vizeaza completarea legii nr nouazeci si cinci cu un nou titlu prin care se doreste stabilirea unor finantari pentru unele cheltuieli din sanatate ca atare se propune reinstaurarea taxei pe viciu si indicarea obiectivelor de finantare din aceasta taxa consiliul legislativ si consiliul economic si social au avizat favorabil propunerea legislativa comisia pentru buget finante activitate bancara si piata de capital si comisia economica industrii si servicii au dat un aviz negativ propunerii legislative la sedinta au participat secretarul de stat aurel george mohanu din partea ministerului sanatatii si expertul superior cristian dinca de la ministerul finantelor publice ministerul sanatatii nu sustine propunerea legislativa in sedinta din sapte sase doua mii douazeci si doi membrii comisiei au hotarat cu majoritate de voturi sa adopte un raport de respingere comisia pentru sanatate supune spre dezbatere si adoptare plenului senatului raportul de respingere si propunerea legislativa in raport cu obiectul de reglementare aceasta lege face parte din categoria legilor ordinare senatul este prima camera sesizata va multumesc ,"(269.52, 2262.52)",269.52,2262.52
79,Doamna Alina-Ștefania Gorghiu:,78778,Domnul Eugen-Remus Negoi:,78956, multumesc frumos domnule presedinte declar deschise dezbaterile generale si pe acest proiect de lege domnule senator negoi aveti cuvantul ,"(267.52, 269.52)",267.52,269.52
80,Domnul Eugen-Remus Negoi:,78956,Doamna Alina-Ștefania Gorghiu:,81375, multumesc as vrea inainte de alocutiune sa fac o precizare este foarte curios de ce ministerul sanatatii nu sustine primirea de bani direct in conturile sale dar ne am obisnuit cu ciudateniile din ministerul sanatatii ce as vrea sa spun despre colectarea taxei de viciu direct la ministerul sanatatii cu o alocare de sub sase din pib la jumatatea mediei uniunii europene sistemul public de sanatate din romania este subfinantat iar rezultatele le stim cu totii infrastructura de sanatate este inadecvata cu cladiri vechi pe alocuri insalubre cu circuite improprii cu autorizatii de functionare temporare sau inexistente si cu planuri de conformare perpetue dotare precara sau personal insuficient materiale sanitare putine si de slaba calitate va spun asta si ca senator de constanta localitate unde nici dupa opt luni mai bine de opt luni de la tragedia provocata de incendiul din spitalul de boli infectioase din municipiul constanta acest spital inca nu a fost deschis toate programele nationale subprogramele actiunile prioritare sunt finantate fara predictibilitate de la an la an desi adreseaza probleme majore de sanatate publica prin ordonanta nr o suta paisprezece doua mii optsprezece taxa pe viciu nu mai ajunge in bugetul ministerului sanatatii ci in acel sac fara fund de fapt cu fund dublu al ministerului finantelor publice iar alocarile spre programele de sanatate sunt in permanenta concurenta cu alte prioritati bugetare multe dintre ele de un populism feroce prin aceasta propunere legislativa propunem revenirea la starea de fapt anterioara lui doua mii optsprezece adica anterioara oug nr o suta paisprezece privind constituirea taxei pentru sanatate ca venituri proprii ale ministerului sanatatii si indicarea obiectivelor de finantare din aceasta taxa colectarea taxei pe viciu direct in bugetul ministerului sanatatii permite o mai buna trasabilitatea a destinatiei fondurilor evitand pe viitor actiuni in instanta prin care contribuabilii solicita returnarea contributiilor virate la bugetul de stat instantele de judecata s au pronuntat deja prin sentinte civile pe spete similare in sensul restituirii sumelor motivand lipsa de trasabilitate a destinatiei fondurilor din toate aceste motive grupul senatorilor usr va vota impotriva raportului de respingere si pentru lege va multumesc ,"(269.52, 2262.52)",269.52,2262.52
81,Doamna Alina-Ștefania Gorghiu:,81375,Domnul Florian-Dorel Bodog:,81477, multumesc din partea grupului psd domnule bodog aveti cuvantul ,"(1226.52, 1226.52)",1226.52,1226.52
82,Domnul Florian-Dorel Bodog:,81477,Doamna Alina-Ștefania Gorghiu:,82104, voi face cateva precizari scurte in ceea ce priveste actul normativ actul normativ nu are absolut nicio noima nu poate fi aplicat in forma in care a fost prezentat comisiei pentru sanatate pe de o parte si daca vorbim despre ciudatenii legate de ministerul sanatatii eu i as invita pe colegii din grupul usr sa se uite la ciudatii care au fost la conducerea ministerului sanatatii si la initiativele si deciziile ciudate pe care le au luat in ceea ce priveste sanatatea romanilor si pe urma sa vorbeasca despre ciudatenii multumesc grupul psd va vota pentru raportul de respingere ,"(269.52, 2262.52)",269.52,2262.52
83,Doamna Alina-Ștefania Gorghiu:,82104,Domnul Ionuț Neagu:,83819, alte interventii la dezbateri generale nu mai exista proiectul va ramane la vot final dat fiind faptul ca decizia comitetului liderilor a fost ca programul de dezbateri generale sa fie pana la ora treisprezece zero va propun sa continuam lucrarile cu exprimarea votului final asupra initiativelor legislative dezbatute in sistem hibrid card de vot si tablete in conformitate cu hotararea comitetului liderilor grupurilor parlamentare potrivit prevederilor art o suta unsprezece din regulamentul senatului se vor supune unui singur vot raportul in intregime si initiativa legislativa de asemenea va reamintesc ca votul se exercita prin intermediul sistemului de vot electronic hibrid in timpul sedintei de vot electronic hibrid in cazul in care senatorul este inregistrat in aplicatie sau are cardul de vot introdus in consola dar nu apasa nicio tasta va figura absent la votul respectiv in situatia in care din eroare senatorul prezent in sala de plen exercita acelasi vot prin modalitati diferite de exprimare in mod automat se va inregistra si se va lua in considerare doar optiunea exprimata prin intermediul sistemului din sala de plen cardul de vot avand in vedere cele prezentate anterior cu privire la votul prin intermediul sistemului de vot electronic hibrid urmeaza sa derulam un vot test in acest sens va rog sa introduceti cardurile de vot in consola sau sa accesati aplicatia vot va reamintesc ca aveti la dispozitie treizeci de secunde pentru exercitarea votului va rog vot patruzeci si patru de voturi pentru unul impotriva douazeci si cinci de abtineri noua nu votez sunt obiectiuni interventii cu privire la sesiunea de vot test va rog domnule senator ,"(30.0, 2336.52)",30.0,2336.52
84,Domnul Ionuț Neagu:,83819,Doamna Alina-Ștefania Gorghiu:,84106, doamna presedinta avem un coleg care si a uitat cartela de vot acasa datile trecute colegii de la alte grupuri parlamentare au putut vota puteti va rog frumos sa ne explicati in baza carui articol nu i permiteti colegului sa si exprime votul multumesc ,"(269.52, 2262.52)",269.52,2262.52
