,start_text,start_index,end_text,end_index,text,timestamp,start,end
25,Domnul Cristinel-Gabriel Berea:,27163,Domnul Virgil Guran:,30244, foarte scurt va multumesc domnule presedinte de sedinta am sa vreau sa va vorbesc astazi despre paralela dintre spirit civic si siguranta rutiera stimati colegi doamnelor si domnilor stiati ca in legea romana gasim sute de articole care nu mai au sens sau utilitate adesea ne intalnim cu erori care nu sunt facute cu rea credinta ci au ramas scrise negru pe alb de a lungul anilor pana cand o situatie le aduce inapoi la lumina acest lucru s a intamplat si in cazul de fata legea aparent normala prezenta si in alte tari europene titreaza faptul ca este obligatoriu ca un autovehicul sa fie echipat cu extinctor doua triunghiuri reflectorizante si trusa medicala de prim ajutor unele tari instituie obligativitatea legii doar in cazul autovehiculelor care transporta pasageri alte state membre includ si autovehiculele private cu toate acestea este ingrijorator faptul ca legea romana lasa loc de interpretare obligand astfel si soferii de mopede si motociclete sa se echipeze cu acest echipament multi dintre ei nici nu stiu despre aceasta obligatie asadar cetatenii romani cad victime ale unei legi pe care nu o cunosc intr un caz recent din judetul cluj a fost mediatizat faptul ca un echipaj de politie folosea acest tip de amenda ca pedeapsa pentru motociclistii asupra carora nu se putea retine o alta ilegalitate acest abuz a fost facilitat de catre o astfel de lege fara utilitate dar inca in vigoare motivatia pentru a pastra o astfel de lege este minima iar motivele pentru a modifica textul sunt numeroase riscurile si complicatiile unui accident al motociclistilor de multe ori nu se pot inlatura prin utilizarea extinctorului a trusei si a triunghiurilor adesea motociclistul se afla intr o situatie in care este grav ranit catapultat la o distanta considerabila de vehicul si avand nevoie de ajutor extern multe dintre vehicule sunt de mici dimensiuni si au spatii limitate pentru depozitare in practica lipsa de spatiu se traduce in necesitatea soferului de a si atasa compartimente suplimentare care pot dezechilibra motocicleta si pot conduce la accidente o alta posibilitate este un ghiozdan pe care soferul sa il poarte in spate in timpul calatoriei in cazul unui accident indiferent de gravitate soferul catapultat de pe motocicleta carand in spate un extinctor se supune unui risc suplimentar de impact cu un obiect contondent este oare spiritul civic de a putea sari in ajutorul altuia mai important decat siguranta proprie consider aceasta lege lipsita de utilitate si cu un impact negativ am depus un proiect de lege care a primit aviz nefavorabil din partea ces sper totusi ca colegii din parlament vor sesiza utilitatea proiectului depus si vor vota in consecinta astept in acelasi timp punctul de vedere al ministerului afacerilor interne deoarece am incredere ca acolo exista specialisti care inteleg particularitatile circulatiei pe doua roti cristi berea senator usr multumesc ,"(1757.52, 1879.52)",1757.52,1879.52
26,Domnul Virgil Guran:,30244,Doamna Evdochia Aelenei:,30445, multumesc si eu doamna aelenei daca e foarte foarte scurta haideti ca daca nu trebuie sa ajungem la plen in trei minute dau cuvantul doamnei senator aelenei evdochia ,"(1891.52, 1893.52)",1891.52,1893.52
27,Doamna Evdochia Aelenei:,30445,Domnul Virgil Guran:,32483, stimate domnule presedinte obiectul declaratiei politice explozia preturilor la carburanti scoate lumea in strada explozia preturilor la carburanti scoate lumea in strada pretul carburantilor se apropie de zece lei pe litru si atinge un nou record pentru piata din romania pretul carburantilor in romania a explodat in ultimele patru luni litrul de motorina a sarit pragul psihologic de noua lei indreptandu se cu pasi repezi spre zece lei jumatate din pretul carburantului de la pompa reprezinta taxe si accize care merg la bugetul statului actuala guvernare pnl psd s a intrecut in primele doua luni ale acestui an in anuntarea unor masuri economice care vor sprijini populatia vulnerabila au fost doar discursuri demagogice populiste fara nicio finalitate in timp ce la noi au fost doar vorbe in ungaria pretul de benzina a fost plafonat de guvern la patru sute optzeci de forinti adica aproximativ sase lei consecinta acestei explozii a preturilor la carburanti este dramatica cresterea acestora se reflecta direct in preturile alimentelor de baza si bunurilor de stricta necesitate iar furia romanilor este de la o zi la alta tot mai mare liderul pietei carburantilor din romania omv petrom a profitat de scumpirea benzinei si mai ales a motorinei si a realizat in primul trimestru o marja de rafinare record de optsprezece treizeci si unu dolari baril mai mult decat dubla fata de cea mai ridicata marja din ultimii ani de opt saptezeci si cinci dolari baril realizata in trimestrul al treilea din doua mii saptesprezece federatia operatorilor romani de transport solicita guvernului romaniei plafonarea preturilor carburantilor la tarife maximale dupa modelul statelor vecine partidul aur avand o propunere legislativa in acest sens pentru a veni in sprijinul romanilor in cazul in care romania nu va reusi sa ia masuri active pentru protejarea populatiei criza economica profunda va avea consecinte nefaste asupra tarii noastre va multumesc senator circumscriptia nr paisprezece constanta aelenei evdochia ,"(1910.52, 2036.52)",1910.52,2036.52
28,Domnul Virgil Guran:,32483,Doamna Diana Iovanovici-Șoșoacă:,32621, multumesc si eu si o foarte foarte foarte scurta declaratie politica doamna senator diana iovanovici sosoaca ,"(269.52, 2262.52)",269.52,2262.52
29,Doamna Diana Iovanovici-Șoșoacă:,32621,Domnul Virgil Guran:,35995, multumesc frumos avand in vedere ca sarbatorim pe data de douazeci si patru ziua iei si pe data de douazeci si sase iunie ziua tricolorului as dori sa punctez cateva aspecte nu intamplator ziua universala a iei a fost stabilita in aceasta zi douazeci si patru iunie cu multiple semnificatii pentru cultura si spiritualitatea romaneasca si universala este nasterea sfantului ioan botezatorul numita in cartile religioase luceafarul pentru felul in care pregateste nasterea soarelui a lui iisus hristos peste sarbatoarea crestina se suprapune in calendarul popular dragaica sau sanzienele o sarbatoare prin excelenta solara dedicata anotimpului cald avand in vedere ca pe douazeci si unu iunie este marcat solstitiul de vara sanziana sau dragaica insotita de alaiul sau format din zane fecioare de o frumusete aparte umbla prin vazduh si pe pamant cantand si dansand sanziana face parte din categoria zanelor bune care binecuvanteaza recoltele motiv pentru care mai este numita si regina holdelor nu se cunoaste cu precizie momentul aparitiei acestui articol de imbracaminte insa cercetarile atesta faptul ca ia ar putea data inca din perioada culturii cucuteni cea mai veche civilizatie a europei care a existat in perioada cinci mii doua sute trei mii doua sute inaintea erei noastre localizata in moldova in nord estul munteniei sud estul transilvaniei si basarabia membrii acestei civilizatii erau renumiti in activitati mestesugaresti casnice precum tesutul si olaritul potrivit cercetarilor realizate de istorici insemnele culturii cucuteni amintesc de ia traditionala romaneasca concluziile acestora au atribuit purtarea acesteia haine pentru prima data de catre cucuteni la doua zile de la sarbatoarea internationala a iei romanii sarbatoresc ziua drapelului la data de douazeci si sase iunie simbol al natiunii romane ca si faimoasa ie tricolorul nu a fost un adevarat simbol national pana prin secolul xix cand miscarea pasoptista l a folosit in toate regiunile tarii intr o zona sau alta considerandu l un simbol al celor trei regiuni se pare insa ca mihai viteazul ar fi folosit imbinarea celor trei culori in campaniile sale militare desi nu in mod generalizat primul care a folosit drapelul tricolor ca simbol al romanilor in adevaratul sens al cuvantului ramane insa tudor vladimirescu in timpul revolutiei din o mie opt sute douazeci si unu este meritul domnitorului alexandru d ghica de a l institutionaliza si formaliza mai tarziu cerand in o mie opt sute treizeci si patru acordul imperiului otoman pentru a folosi un steag rosu albastru galben si o sa inchei cu prilejul aniversarii a cincisprezece ani de la luptele din dealul spirii la unu septembrie o mie opt sute saizeci si trei s au acordat in prezenta domnitorului alexandru ioan cuza unui numar de zece unitati militare noi drapele tricolore cu aceasta ocazie pe platoul de la cotroceni domnitorul a rostit un impresionant discurs in care spunea steagul este romania acest pamant binecuvantat al patriei stropit cu sangele strabunilor nostri si imbelsugat cu sudoarea muncitorului el este familia ogorul fiecaruia casa in care s au nascut parintii unde se vor naste copiii nostri steagul este totodata trecutul prezentul si viitorul tarii intreaga istorie a romaniei va multumesc senator partidul s o s romania diana iovanovici sosoaca va multumesc frumos domnule presedinte ,"(2051.52, 2262.52)",2051.52,2262.52
30,Domnul Virgil Guran:,35995,Doamna Alina-Ștefania Gorghiu:,36739, multumesc si eu revin la interpelari si va informez ca a depus in scris o interpelare si doamna senator doua interpelari de fapt doamna senator iovanovici sosoaca diana de asemenea dau citire listei senatorilor care au depus declaratii politice in scris doamnele si domnii senatori stan ioan bodog florian dorel sbirnea liliana genoiu mihail prioteasa ion popa maricel azamfirei leonard mutu gabriel stanescu paul purcarin bianca mihaela mirea siminica toanchina marius gheorghe bumb sorin ioan bordei cristian bodea marius ivan dan lavric sorin cosma dorinel hangan andrei si neagu ionut declar inchisa sesiunea consacrata declaratiilor politice de astazi va multumesc ,"(2262.52, 2336.52)",2262.52,2336.52
31,Doamna Alina-Ștefania Gorghiu:,36739,Domnul Ionuț Neagu:,36914, doamnelor si domnilor senatori dati mi voie sa declar deschisa sedinta plenului senatului de astazi douazeci si doi iunie doua mii douazeci si doi pe procedura va rog ,"(1227.52, 1227.52)",1227.52,1227.52
32,Domnul Ionuț Neagu:,36914,Doamna Alina-Ștefania Gorghiu:,37408, doamna presedinta multumesc pentru acordarea cuvantului pe procedura vreau sa staff ul si secretarii sa constate daca s a incheiat sedinta de la camera deputatilor dumneavoastra din cate stiu ati prezidat sedinta de dincolo de la camera deputatilor daca nu s a incheiat va rog sa ne explicati cum puteti sa indepliniti ambele functii si la camera deputatilor sa fiti presedinta si aici in momentul in care nu s a incheiat sedinta multumesc ,"(269.52, 2262.52)",269.52,2262.52
33,Doamna Alina-Ștefania Gorghiu:,37408,Domnul Ion-Dragoș Popescu:,38864, multumesc frumos sedinta este condusa de mine in calitate de vicepresedinte al senatului asistata de domnul senator sorin lavric si de domnul senator ion mocioalca ca secretari ai senatului ordinea de zi pentru sedinta plenului de astazi si programul de lucru stabilite de biroul permanent al senatului si comitetul liderilor grupurilor parlamentare au fost distribuite si afisate pe pagina de internet a senatului doamnelor si domnilor senatori potrivit dispozitiilor art o mie trei sute saizeci si unu coroborat cu prevederile art o suta treizeci si sase din regulamentul senatului conform hotararii biroului permanent al senatului adoptata cu acordul prealabil al comitetului liderilor grupurilor parlamentare sedinta plenului senatului se desfasoara prin mijloace electronice in conformitate cu procedura prevazuta la art o suta unsprezece din regulamentul senatului in cadrul dezbaterilor generale poate lua cuvantul cate un singur reprezentant al fiecarui grup parlamentar pentru maximum doua minute iar reprezentantul senatorilor neafiliati pentru un minut maximum pentru operativitate in prima parte a sedintei de plen se vor desfasura dezbaterile asupra punctelor inscrise pe ordinea de zi iar dupa incheierea acestora in a doua parte a sedintei se va desfasura sesiunea de vot final conform hotararii comitetului liderilor grupurilor parlamentare pe procedura il rog pe domnul senator dragos popescu sa ia cuvantul ,"(1226.52, 1227.52)",1226.52,1227.52
34,Domnul Ion-Dragoș Popescu:,38864,Doamna Alina-Ștefania Gorghiu:,39113, multumesc doamna presedinta stimati colegi incepand de astazi mi am dat demisia din usr si nu voi mai face parte din grupul usr si voi activa ca parlamentar neafiliat ca senator neafiliat multumesc ,"(269.52, 2262.52)",269.52,2262.52
35,Doamna Alina-Ștefania Gorghiu:,39113,Domnul Mihai Pașca – secretar de stat la Ministerul Justiției:,41133, multumesc domnule senator la punctul unu al ordini de zi este inscris proiectul de lege pentru modificarea si completarea ordonantei de urgenta a guvernului nr treizeci si doi doua mii doisprezece privind organismele de plasament colectiv in valori mobiliare si societatile de administrare a investitiilor precum si pentru modificarea si completarea legii nr doua sute nouazeci si sapte doua mii patru privind piata de capital raportul comisiei juridice de numiri disciplina imunitati si validari este de admitere a proiectului de lege proiectul de lege face parte din categoria legilor organice si se adopta cu votul majoritatii senatorilor senatul este prima camera sesizata incepem dezbaterile daca din partea grupurilor parlamentare exista inscrieri la cuvant nu exista am incheiat dezbaterile generale dat fiind faptul ca domnul ministru secretar de stat a fost anuntat inainte ca onor comitetul liderilor sa propuna procedura simplificata dar fiind prezent il invit sa ia cuvantul pe acest proiect de lege va rog domnule secretar de stat ,"(269.52, 2262.52)",269.52,2262.52
36,Domnul Mihai Pașca – secretar de stat la Ministerul Justiției:,41133,Doamna Alina-Ștefania Gorghiu:,43032, va multumesc doamna presedinte de sedinta voi fi scurt venit in contextul strategiei nationale pentru recuperarea creantelor provenite din infractiuni pentru perioada doua mii douazeci si unu doua mii douazeci si cinci si al planului de actiune pentru implementarea acesteia ambele initiate de ministerul justitiei si adoptate de guvernul romaniei proiectul de lege pentru care va solicitam azi votul de adoptare vine sa ofere agentiei nationale pentru administrarea bunurilor indisponibilizate un cadru si instrumente cu ajutorul carora sa si atinga mai bine obiectivele de recuperare a creantelor nascute in urma unor solutii de condamnare vorbim aici de prejudicii produse prin infractiuni dar si despre beneficiile supuse confiscarii pentru ca actul de justitie poate fi complet doar odata cu recuperarea acestora si cu executarea sub toate aspectele a hotararilor de condamnare in prezent ministerul justitiei prin anabi gestioneaza un portofoliu de peste un miliard de lei iar in urma votului dumneavoastra de adoptare si intrarii in vigoare a acestui act normativ anticipam o crestere cu peste cincizeci a performantei agentiei dar si a activele administrate de anabi vorbim aici de o tinta asumata prin pnrr in cadrul caruia adoptarea acestui proiect reprezinta un jalon vor fi extinse posibilitatile legale ale anabi de a identifica active in strainatate vor fi extinse cazurile de administrare a bunurilor de catre anabi dar si mandatul acesteia cu privire la cauzele speciale de valorificare a unor astfel de bunuri reglementam un cadru legal si este important acest lucru care sa permita prioritizarea de resurse pentru prevenirea criminalitatii si pentru protectia victimelor infractiunilor alocand resurse adecvate personalului agentiei va multumim si va solicitam un vot de adoptare ,"(267.52, 269.52)",267.52,269.52
37,Doamna Alina-Ștefania Gorghiu:,43032,Domnul Radu-Mihai Mihail:,43248, multumesc domnului secretar de stat daca din partea grupurilor parlamentare exista inscrieri la dezbaterile generale nu sunt da domnul lider usr va rog domnul radu mihail ,"(1226.52, 1226.52)",1226.52,1226.52
38,Domnul Radu-Mihai Mihail:,43248,Doamna Alina-Ștefania Gorghiu:,43801, multumesc doamna presedinta propunerea este una bine venita pentru ca romanii asteapta de mult ca banii furati sa se intoarca de unde au fost furati problema este momentul aceste imbunatatiri trebuiau sa fie facute acum multi ani si nu au fost facute pentru ca s a mai dat ragaz hotilor sa si gestioneze linistiti banii e bine ca apare grupul usr o va vota dar repetam in ritmul asta cu legi care apar dupa ani de zile dupa momentul cand ar fi trebuit sa intre in vigoare romania nu va progresa multumesc ,"(269.52, 2262.52)",269.52,2262.52
39,Doamna Alina-Ștefania Gorghiu:,43801,Domnul Claudiu-Marinel Mureșan:,44657, multumesc daca mai exista alte interventii la dezbateri generale nemaiexistand inchidem dezbaterile generale asupra acestui punct initiativa legislativa ramane la vot final la punctul trei este inscris proiectul de lege privind gestionarea si utilizarea fondurilor interreg si a contributiei publice nationale pentru obiectivul cooperare teritoriala europeana in perioada doua mii douazeci si unu doua mii douazeci si sapte raportul comun al comisiei de buget finante activitate bancara si piata de capital si comisiei pentru afaceri europene e de admitere a acestui proiect proiectul de lege face parte din categoria legilor ordinare si se adopta cu votul majoritatii senatorilor prezenti senatul e prima camera sesizata o sa l rog pe domnul senator muresan sa prezinte raportul comisiilor ,"(269.52, 2262.52)",269.52,2262.52
40,Domnul Claudiu-Marinel Mureșan:,44657,Doamna Alina-Ștefania Gorghiu:,45490, va multumesc doamna presedinte proiectul de lege are ca obiect de reglementare crearea cadrului legal de alocare a fondurilor interreg si a contributiei publice nationale in bugetul institutiilor implicate in gestionarea si utilizarea acestora pentru obiectivul cooperare teritoriala europeana precum si stabilirea circuitelor financiare ale programelor interreg pe care romania le gestioneaza in calitate de autoritate de management autoritate nationala comisia pentru buget finante activitate bancara si piata de capital si comisia pentru afaceri europene au supus supun plenului senatului spre dezbatere si adoptare un raport comun de admitere si proiectul de lege proiectul de lege face parte din categoria legilor ordinare senatul este prima camera sesizata multumesc ,"(267.52, 269.52)",267.52,269.52
41,Doamna Alina-Ștefania Gorghiu:,45490,Domnul Claudiu-Marinel Mureșan:,46453, multumesc tare mult daca din partea grupurilor parlamentare exista inscrieri la cuvant la dezbateri generale nu exista proiectul va ramane la vot final punctul patru proiectul de lege privind stabilirea unor masuri de punere in aplicare a regulamentului raportul comisiei buget finante activitate bancara si piata de capital este de admitere a proiectului de lege proiectul de lege face parte din categoria legilor organice si se adopta cu votul majoritati senatorilor senatul este prima camera sesizata de asemenea il invit la microfon pe domnul senator muresan pentru prezentarea raportului la aceasta initiativa legislativa ,"(269.52, 2262.52)",269.52,2262.52
42,Domnul Claudiu-Marinel Mureșan:,46453,Doamna Alina-Ștefania Gorghiu:,47197, multumesc din nou doamna presedinte proiectul de lege are ca obiect de reglementare stabilirea unor masuri la nivel national pentru punerea in aplicare a prevederilor regulamentului uniunii europene doua mii douazeci o mie cinci sute trei al parlamentului european si al consiliului din sapte octombrie doua mii douazeci privind furnizorii europeni de servicii de finantare participativa pentru afaceri si de modificare a regulamentului ue nr doua mii saptesprezece o mie o suta douazeci si noua si a directivei ue doua mii nouasprezece o mie noua sute treizeci si sapte comisia pentru buget finante activitate bancara si piata de capital supune spre dezbatere si adoptare plenului senatului raportul de admitere si proiectul de lege proiectul de lege face parte din categoria legilor organice senatul este prima camera sesizata ,"(267.52, 269.52)",267.52,269.52
43,Doamna Alina-Ștefania Gorghiu:,47197,Domnul Claudiu-Marinel Mureșan:,47337, multumesc incepem dezbaterile generale la dezbateri generale domnule senator muresan aveti cuvantul ,"(1226.52, 1226.52)",1226.52,1226.52
44,Domnul Claudiu-Marinel Mureșan:,47337,Doamna Alina-Ștefania Gorghiu:,49067, multumesc frumos doamna presedinte doamnelor si domnilor senatori finantarea participativa reprezinta un tip de activitate in cadrul careia un furnizor de servicii de finantare administreaza o platforma digitala aceasta platforma digitala este deschisa publicului scopul ei fiind de a pune in legatura potentialii investitori cu mediul de afaceri care cauta finantare finantarea participativa a devenit un canal foarte popular de finantare alternativa pentru start up uri in special in statele unite ale americii si in marea britanie din acest motiv parlamentul european a promovat si adoptat acum un an si jumatate un regulament unic la nivel de uniune care sa sustina ecosistemul de start up uri europene si care a intrat in vigoare in noiembrie anul trecut tehnic vorbind romania este in infringement acum fata de acest regulament desi in romania a aparut deja un numar important de platforme in baza carora unii deja lucreaza suntem printre cei mai activi din europa de est si asta este foarte bine doar ca neavand inca aprobare in legislatia nationala specifica ne aflam intr un vid legislativ platformele din romania nu au cum si unde sa se autorizeze singura modalitate este ca ownerii de platforme sa isi depuna dosarul in alta tara membra a uniunii europene care a transpus deja acest regulament in legislatia nationala prezentul proiect asta face practic stabileste supraveghetorul domeniului si pe cel care acorda licente respectiv asf odata obtinuta autorizatia din oricare tara membra ue primesti implicit si un pasaport european in domeniu salutam aceasta initiativa vom vota desigur pentru va multumesc ,"(267.52, 1227.52)",267.52,1227.52
45,Doamna Alina-Ștefania Gorghiu:,49067,Domnul George Scarlat:,49925, multumesc frumos daca din partea celorlalte grupuri parlamentare mai exista inscrieri la cuvant nu exista proiectul va ramane la vot final punctul cinci propunerea legislativa pentru modificarea si completarea legii nr patruzeci si cinci doua mii noua privind organizarea si functionarea academiei de stiinte agricole si silvice gheorghe ionescu sisesti si a sistemului de cercetare dezvoltare din domeniile agriculturii silviculturii si industriei alimentare raportul comisiei pentru agricultura industrie alimentara si dezvoltare rurala este de admitere cu amendamente admise a propuneri legislative propunerea face parte din categoria legilor organice se adopta cu votul majoritatii senatorilor senatul este prima camera sesizata il invit la cuvant pe domnul presedinte al comisiei george scarlat ,"(267.52, 269.52)",267.52,269.52
46,Domnul George Scarlat:,49925,Doamna Alina-Ștefania Gorghiu:,51160, multumesc frumos doamna presedinta propunerea legislativa are ca obiect de reglementare transmiterea unei suprafete de teren de doi doua mii saptezeci si trei hectare aflate in domeniul public al statului din administrarea statiunii de cercetare dezvoltare agricola turda in administrarea consiliului local al municipiului turda in cadrul dezbaterilor a fost formulat un amendament care supus votului a fost adoptat si se regaseste in anexa ce face parte integranta din prezentul raport in sedinta din data de paisprezece sase membrii comisiei au hotarat cu majoritate de voturi sa adopte un raport de admitere cu un amendament admis comisia supune dezbaterii si adoptarii plenului senatului raportul de admitere cu un amendament admis si propunerea legislativa pentru modificarea legii nr patruzeci si cinci privind organizarea si functionarea academiei de stiinte agricole si silvice gheorghe ionescu sisesti si a sistemului de cercetare dezvoltare in domeniul agriculturii silviculturii si industriei alimentare asa cum ati prezentat si dumneavoastra doamna presedinte pe scurt raportul legea face parte din categoria legilor organice senatul este prima camera sesizata va multumesc ,"(267.52, 269.52)",267.52,269.52
47,Doamna Alina-Ștefania Gorghiu:,51160,Domnul Andrei Postică:,51286, multumesc frumos din partea grupurilor parlamentare va invit domnule senator la cuvant ,"(1226.52, 1226.52)",1226.52,1226.52
