,start_text,start_index,end_text,end_index,text,timestamp,start,end
48,Domnul Andrei Postică:,51286,Doamna Alina-Ștefania Gorghiu:,53400, multumesc doamna presedinta in anul o mie noua sute nouazeci cercetarea agricola dispunea de doua sute cincizeci zero de hectare teren agricol iar in prezent nu mai dispune decat de douazeci si cinci zero de hectare ce ne spun aceste cifre simplu cercetarea agricola a disparut sub presiunea avarilor investitori politici patrimoniul cercetarii agriculturii romanesti a ajuns la zece din ce era acum treizeci de ani restul a disparut ce avem noi astazi aici patru parlamentari pnl vor transmiterea unei suprafete de teren de doi doi hectare de pe raza municipiului turda judetul cluj aflata in domeniul public al statului si in administrarea statiunii de cercetare dezvoltare agricola turda in domeniul public al municipiului turda si in administrarea consiliului local condus bineinteles de un primar pnl conform art opt sute saizeci si sase din legea nr doua sute optzeci si sase doua mii noua privind codul civil drepturile reale corespunzatoare proprietatii publice sunt dreptul de administrare dreptul de concesiune dreptul de folosinta cu titlu gratuit iar conform art opt sute saizeci si sapte alin avem prevazuta modalitatea de constituire a dreptului de administrare asupra bunurilor proprietate publica respectiv prin hotarare de guvern sau hotarare de consiliu judetean dupa caz consiliu local potrivit art doua sute nouazeci si noua din codul administrativ darea in administrare a bunurilor proprietate publica se realizeaza numai prin hotarare de guvern conform ccr prin decizia nr unu doua mii paisprezece administrarea bunurilor proprietate publica privata a statului apartine in mod exclusiv guvernului deci propunerea legislativa excedeaza competenta de legiferare a parlamentului propunerea legislativa prin obiectul sau dispune intr un domeniu care tine exclusiv de competenta guvernului nu a parlamentului stimati colegi cred ca am ajuns in momentul in care trebuie sa facem legi corecte si nu populiste mentionez de asemenea ca consiliul economic si social a oferit un aviz negativ la fel si consiliul legislativ comisia juridica a senatului a oferit de asemenea un aviz negativ grupul usr va vota impotriva acestui proiect de lege multumesc ,"(269.52, 2262.52)",269.52,2262.52
49,Doamna Alina-Ștefania Gorghiu:,53400,Domnul George Scarlat:,53513, multumesc pentru interventie il rog pe domnul senator scarlat sa ia cuvantul ,"(1226.52, 1226.52)",1226.52,1226.52
50,Domnul George Scarlat:,53513,Doamna Alina-Ștefania Gorghiu:,56231, multumesc doamna presedinta sincer nu as fi intervenit aici dar colegul ma provoaca si nu sunt genul sa dau replici la lucruri neadevarate dar aici chiar e necesar stimate coleg si stimati colegi atat din cadrul usr ului cat si toti cei prezenti in sala initiativa are ca obiect de reglementare asa cum bine ati spus dumneavoastra partial din administrarea academiei de stiinte agricole si silvice sa treaca in administrarea municipalitatii turda pentru a fi folosit de catre liceul agricol turda astazi liceul agricol turda este administrator si proprietar doar pe cladiri iertati ma nu este proprietar proprietar este municipalitatea doar pe cladiri iar terenul de sub cladiri si curtea liceului nu sunt in administrare nu poate sa obtina fonduri europene nu poate sa se dezvolte nu poate depune niciun proiect intrucat nu poate sa faca dovada utilizarii terenului asta are obiect de reglementare cu privire la cercetare v as da dreptate in totalitate cu un singur amendament astazi academia de stiinte agricole si silvice gheorghe ionescu sisesti pe langa cele aproximativ sapte zero de hectare pe care le are in proprietate mai are aproximativ saizeci si patru cinci sute de hectare aproximativ va pot da cifrele exacte daca vreti de la comisie ca intr adevar terenul in cea mai mare parte nu este supus cercetarii este cu totul alta discutie dar sa veniti aici asa cum din nefericire luni ati votat impotriva unui asemanator act legislativ cu privire la pentru ca discutam aici de o lege organica specifica asa cum spuneati dumneavoastra doar prin hotarare de guvern se transmite dreptul de administrare in schimb doar pentru academia de stiinte agricole si silvice este o lege speciala si trebuie actul nu sunt jurist dar trebuie sa fie de cel putin acelasi nivel si de aceea tot ceea ce are referiri de modificari ale anexelor la legea nr patruzeci si cinci se face doar prin lege stimate coleg de aceea v as spune si v as supune atentiei si sa intelegeti inclusiv grupul partidului usr sa analizati oportunitatea si ceea ce legea in fapt doreste transmiterea celor doi doi hectare in administrarea liceului pentru a se dezvolta atata tot nu mai mult nu este vorba de nu stiu ce terenuri ascunse si ceea ce ati spus dumneavoastra aici imi pare rau nu sustin in totalitate ceea ce ati spus dumneavoastra subiectul cercetare este cu totul un alt subiect va multumesc doamna presedinta grupul partidului national liberal va vota si va sustine aceasta initiativa pentru ca vine in sprijinul invatamantului de profil indiferent de ce liceu agricol vorbim multumesc ,"(269.52, 2262.52)",269.52,2262.52
51,Doamna Alina-Ștefania Gorghiu:,56231,Domnul Ion Marcel Vela:,56636, multumesc vad ca mai exista numai o secunda mai exista o interventie si din partea domnului senator marcel vela la microfonul lateral si pe urma domnul senator din partea grupului usr doreste sa intervina dar va reamintesc ca suntem in procedura simplificata si o sa va rog sa concentram interventiile va rog domnule senator ,"(269.52, 2262.52)",269.52,2262.52
52,Domnul Ion Marcel Vela:,56636,Doamna Alina-Ștefania Gorghiu:,57993, doamnelor si domnilor senatori am dorit sa iau cuvantul nu neaparat punctual pentru a contrazice sau pentru a puncta exact pe acest subiect vreau sa explic celor din sala care se opun la un asemenea proiect ca principiu ca intotdeauna un ales local si in acest context cred ca si grupul usr ar trebui sa sustina proiectul pentru ca pana la urma ajutam o comunitate locala accesarea fondurilor europene si reglementam juridic o stare de fapt ce este pe raza unei localitati haideti sa fie al localitatii multumesc ,"(269.52, 2262.52)",269.52,2262.52
53,Doamna Alina-Ștefania Gorghiu:,57993,Domnul Andrei Postică:,58129, il invit pe domnul senator postica sa ia cuvantul acelasi microfon rog staff ul tehnic ,"(30.0, 2336.52)",30.0,2336.52
54,Domnul Andrei Postică:,58129,Doamna Alina-Ștefania Gorghiu:,58408, multumesc doamna presedinte intelegem oportunitatea unui proiect insa nu intelegem incalcarea legilor in vigoare consiliul legislativ a reiterat acest aspect consiliul economic si social la fel atat si comisia juridica a senatului multumesc ,"(267.52, 269.52)",267.52,269.52
55,Doamna Alina-Ștefania Gorghiu:,58408,Domnul Virgil-Marius Bob:,59099, multumesc pentru interventie declar dezbaterile inchise la acest punct proiectul va ramane la vot final punctul sase propunerea legislativa privind integrarea pe piata fortei de munca din romania a cetatenilor straini pentru modificarea si completarea unor acte normative raportul comisiei juridice de numiri disciplina imunitati si validari e de respingere a propunerii legislative propunerea legislativa face parte din categoria legilor organice si se adopta cu votul majoritatii senatorilor senatul este prima camera sesizata il rog pe domnul senator bob sa prezinte raportul din partea comisiei ,"(269.52, 2262.52)",269.52,2262.52
56,Domnul Virgil-Marius Bob:,59099,Doamna Alina-Ștefania Gorghiu:,60121, multumesc raport asupra propunerii legislative privind integrarea pe piata fortei de munca din romania a cetatenilor straini pentru modificarea si completarea unor acte normative propunerea legislativa are ca obiect reglementarea acordarii unor facilitati in ceea ce priveste acordarea cetateniei romane cetatenilor straini ai statelor terte vecine care au contribuit in mod direct semnificativ la stimularea dezvoltarii economice regionale si la diminuarea deficitului inregistrat pe piata fortei de munca facilitarea accesului pe piata muncii din romania al cetatenilor din statele terte vecine consiliul legislativ a avizat favorabil consiliul economic a avizat favorabil comisia de politica externa a transmis aviz negativ iar comisia de munca a trimis avizul negativ in consecinta membrii comisiei juridice care s au intrunit in cincisprezece iunie doua mii douazeci si doi au hotarat cu unanimitate de voturi sa adopte un raport de respingere a propunerii legislative ,"(269.52, 2262.52)",269.52,2262.52
57,Doamna Alina-Ștefania Gorghiu:,60121,Domnul Sorin-Ioan Bumb:,61054, in regula multumesc frumos pentru prezentarea raportului daca exista la dezbateri generale inscrieri la cuvant nu exista domnule bumb la urmatorul da bun inchidem dezbaterile generale asupra acestui punct al ordinii de zi initiativa legislativa ramane la vot final la punctul sapte avem propunerea legislativa solidaritate cu ucraina pentru interzicerea importului si achizitiilor intracomunitare de petrol gaz natural carbune si combustibil nuclear provenind din federatia rusa pe durata agresiunii neprovocate impotriva ucrainei raportul comisiei pentru energie infrastructura energetica si resurse minerale e de respingere a propunerii legislative propunerea face parte din categoria legilor organice si se adopta cu votul majoritatii senatorilor senatul este prima camera sesizata incepem dezbaterile prin prezentarea raportului de domnul senator bumb ,"(269.52, 2262.52)",269.52,2262.52
58,Domnul Sorin-Ioan Bumb:,61054,Doamna Alina-Ștefania Gorghiu:,62126, multumesc doamna presedinte stimati colegi propunerea legislativa solidaritate cu ucraina pentru interzicerea importului si achizitiilor intracomunitare de petrol gaz natural carbune si combustibil nuclear provenind din federatia rusa pe durata agresiunii neprovocate impotriva ucrainei in urma dezbaterilor care au avut loc in sedinta comisiei pentru energie infrastructura energetica si resurse minerale din sapte iunie doua mii douazeci si doi membrii comisiei au analizat propunerea legislativa punctele de vedere exprimate avizele primite si au hotarat cu majoritate de voturi sa adopte raport de respingere consiliul legislativ a avizat favorabil cu observatii si propuneri consiliul economic si social a avizat nefavorabil propunerea legislativa face parte din categoria legilor organice senatul este prima camera sesizata fata de cele prezentate comisia pentru energie infrastructura energetica si resurse minerale supune plenului senatului pentru dezbatere si adoptare raportul de respingere si propunerea legislativa ,"(267.52, 269.52)",267.52,269.52
59,Doamna Alina-Ștefania Gorghiu:,62126,Domnul Cosmin-Marian Poteraş:,62242, il rog pe domnul senator poteras sa ia cuvantul ca initiator va rog ,"(30.0, 2336.52)",30.0,2336.52
60,Domnul Cosmin-Marian Poteraş:,62242,Doamna Alina-Ștefania Gorghiu:,64212, va multumesc doamna presedinta am depus aceasta initiativa legislativa in primul rand pentru a declansa o dezbatere serioasa privind resursele energetice ale romaniei si felul in care statul roman isi poate asigura in timp independenta energetica am vazut cu totii ce se intampla atunci cand un stat hotaraste sa incalce cu buna stiinta tratatele si regulile de drept international si sa invadeze un stat suveran in timp ce restul tarilor alimenteaza cu bani agresorul din nevoia de resurse romania poate si trebuie sa fie altfel trebuie sa investeasca in exploatarea propriilor resurse sa le foloseasca eficient si sustenabil si sa ia masuri ferme pentru a asigura alternative daca totusi importul nu poate fi evitat acest proiect reprezinta un prim pas in directia corecta e practic o declaratie de independenta energetica fata de federatia rusa reprezentand in acelasi timp o masura de solidaritate cu vecinii nostri napastuiti de razboi legea a fost depusa imediat dupa rezolutia parlamentului european in care se recomanda exact ceea ce propunem si noi embargou pe petrol gaze si combustibil nuclear din federatia rusa practic aceasta oportunitate ar fi trebuit sa acest proiect de lege ar fi trebuit sa declanseze o discutie serioasa inclusiv cu ministerele pentru a identifica modalitatea optima de a ne atinge acest obiectiv de independenta energetica ce s a intamplat este faptul ca ministerele au preferat sa respinga cu totul acest proiect in loc sa vina cu un plan cu niste amendamente prin care sa facem niste pasi in directia corecta la nivelul institutiilor europene discutiile au evoluat si s a propus un set de masuri puteam sa ne folosim de acest proiect ca vehicul pentru a incepe si noi implementarea cred ca am ratat aceasta ocazie si problema in continuare ne tine captivi ai unei tari care vrea sa mute granitele europei dupa bunul plac va multumesc ,"(269.52, 2262.52)",269.52,2262.52
61,Doamna Alina-Ștefania Gorghiu:,64212,Domnul Sorin-Ioan Bumb:,64362, multumesc initiatorului pentru sustinerea proiectului il invit la dezbateri generale pe domnul senator sorin bumb ,"(1226.52, 1226.52)",1226.52,1226.52
62,Domnul Sorin-Ioan Bumb:,64362,Doamna Alina-Ștefania Gorghiu:,65703, multumesc doamna presedinte stimati colegi cred ca trebuie sa dam dovada de maturitate si stiti foarte bine ca romania a fost printre primele tari care s au aliat si au acordat sprijin ucrainei insa acest proiect este populist si va spun de ce este un proiect populist noi trebuie sa ne gandim ca sunt foarte multe contracte in derulare saptezeci din titeiul pe care il importam este din kazahstan avem foarte multe probleme pe care nu le putem rezolva peste noapte in mod cert ca incercam sa ne asiguram independenta energetica dar sunt foarte multe probleme care trebuiesc privite cu obiectivitate si la care trebuie sa gasim rezolvari urgente dar nu rezolvari populiste nu prin embargou total asupra resurselor aduse din federatia rusa reusim sa rezolvam peste noapte aceste probleme si nu astfel o sa transmitem lumii intregi ca suntem alaturi de ucraina cred ca demersurile pe care le a facut guvernul romaniei pentru sprijinirea ucrainei au fost evidente si intreg spectrul international a observat acest lucru dar cu partea energetica cred ca trebuie sa fim mult mai chibzuiti sa gasim solutiile cele mai bune si intr adevar trebuie sa ne preocupe independenta energetica dar pentru aceasta trebuie sa gasim rezolvari reale si in timp real multumesc ,"(267.52, 269.52)",267.52,269.52
63,Doamna Alina-Ștefania Gorghiu:,65703,Doamna Diana Iovanovici-Șoșoacă:,65981, multumesc domnului senator in cadrul dezbaterilor generale mai exista solicitari inscrieri doamna senator sosoaca si ma iertati ca i am dat cuvantul prima in mod normal grupurile trebuiau epuizate dar nu v am vazut cu mana ridicata ,"(269.52, 2262.52)",269.52,2262.52
64,Doamna Diana Iovanovici-Șoșoacă:,65981,Doamna Alina-Ștefania Gorghiu:,66635, multumesc o sa dureze putin usr ul aveti atatea initiative numai pentru ucraineni ma intreb pentru romanii care vin din afara granitelor tarii ce proiecte aveti ne pasa numai de straini de ai nostri nu si ma uitam vreti sa faceti infractiune da daca cumva vine vreun pic de petrol gaz sau nu stiu de unde de la rusi pai intrebati i si pe nemti poate vreti sa i bagati si pe ei in puscarie poate vreti sa i bagati in puscarie si pe etnicii rusi din romania dumneavoastra realizati ca omv ul are treizeci aport rusesc eu zic sa desfiintam si omv ul si sa ne reluam petromul cu asta sunt de acord ,"(269.52, 2262.52)",269.52,2262.52
65,Doamna Alina-Ștefania Gorghiu:,66635,Domnul Ștefan Pălărie:,66735, domnule palarie aveti cuvantul domnule senator palarie va rog ,"(30.0, 2336.52)",30.0,2336.52
66,Domnul Ștefan Pălărie:,66735,Doamna Alina-Ștefania Gorghiu:,69431, multumesc doamna presedinte de sedinta o sa profit de ocazie sa raspund si la intrebarea adresata anterior nu mai devreme de saptamana aceasta in cadrul comisiei de munca am purtat o dezbatere aprinsa pe o initiativa referitoare la crearea unor grupe speciale pentru copiii diasporenilor romani care se reintorc in romania si care au dreptul sa se acomodeze cu limba si cultura romana mai ales daca s au nascut in strainatate sau au petrecut foarte mult timp in afara granitelor deci propuneri pentru romani in general dar si pentru romanii din strainatate usr are si va avea in continuare acum referitor la aceasta initiativa asa cum a spus si colegul initiator ar fi trebuit sa declanseze o conversatie o discutie si o dezbatere daca maine federatia rusa decide unilateral sa tripleze preturile la gaze o va face cu impact ravasitor asupra intregii europe inclusiv asupra noastra si in felul acesta alimentandu si in continuare masinaria de razboi care astazi macina vietile ucrainenilor noi in situatia aceasta suntem apoi domnul coleg de la pnl spunea ca e nevoie de mai mult calm de mai multa rabdare uitati va ce se intampla cu piata facturilor la energie la gaz in general cu acest calm si rabdare aveti dumneavoastra un ministru acolo de foarte multa vreme pentru care usr se pregateste sa depuna inca o data o motiune simpla pentru ca nu stau lucrurile bine chiar daca sunt cu calm si cu rabdare si asta este realitatea romanii o stiu in al treilea rand este absolut inadmisibil ca discutam despre un raport de respingere a acestei initiative care este corelata cu o directiva europeana de a stopa importurile de produse petroliere din federatia rusa catre toate statele membre noi discutam asta cand avem in paralel inca nici nu este clar cat de legitim este plenul senatului sedinta plenului de astazi in paralel cu teoretic plenul reunit avem in continuare pe parlamentarii pnl si psd care vor vota cu omul gazprom iulian iancu in agentia nationala de reglementare a energiei din romania cand ma uit la colegi sau vorbesc cu ei pe coridor lasa privirea in jos si spun ca le e rusine noi respingem o lege care ar fi trebuit sa creeze o solidaritate pentru cei care sunt afectati de razboiul din ucraina in schimb punem omul gazprom in fruntea uneia dintre cele mai importante agentii nationale vom vota in mod evident impotriva raportului de respingere si gasim absolut ca fiind penibile argumentele de a nu avea aceasta dezbatere reala pentru politica energetica a romaniei pe viitor multumesc ,"(267.52, 269.52)",267.52,269.52
67,Doamna Alina-Ștefania Gorghiu:,69431,Domnul Ionuț Neagu:,69540, multumesc il invit pe domnul senator din partea grupului aur la cuvant ,"(1226.52, 1226.52)",1226.52,1226.52
68,Domnul Ionuț Neagu:,69540,Doamna Alina-Ștefania Gorghiu:,70474, multumesc doamna presedinta o sa vreau sa iau cuvantul pe marginea legii si pe procedura dupa aceasta da am fost prezent la dezbaterea legii in comisia de energie din pacate colegii de la usr nu au venit nici cu un plan care sa detalieze ce se intampla in momentul in care noi ca tara oprim importurile din rusia suntem de acord cu acest lucru sa facem acest lucru dar sa facem acest lucru asigurandu ne ca romanii nu vor suferi ca nu ne vom afla intr o situatie similara liberalizarii pietei de energie si pe procedura doamna presedinta va rog frumos sa mentionati in procesul verbal sedinta comuna de la camera deputatilor si senat s a inchis la doisprezece treizeci si noua va rog ca secretarul senatului sa constate viciul de procedura asupra dezbaterilor pana la punctul acesta toate punctele care s au discutat sunt susceptibile de a fi contestate la curtea constitutionala multumesc ,"(269.52, 2262.52)",269.52,2262.52
69,Doamna Alina-Ștefania Gorghiu:,70474,Domnul Adrian Streinu Cercel:,71071, multumesc domnule senator daca din partea celorlalte grupuri parlamentare mai exista inscrieri la cuvant daca nu multumesc proiectul ramane la vot final punctul opt propunerea legislativa privind etichetarea nutritionala voluntara nutri score raportul comisiei pentru sanatate este de respingere a propunerii propunerea face parte din categoria legilor ordinare se adopta cu votul majoritatii senatorilor prezenti senatul e prima camera sesizata domnule presedinte streinu cercel aveti cuvantul microfonul cinci va rog staff ul ,"(267.52, 1438.52)",267.52,1438.52
70,Domnul Adrian Streinu Cercel:,71071,Doamna Alina-Ștefania Gorghiu:,72421, multumesc doamna presedinta propunerea legislativa privind etichetarea nutritionala voluntara nutri score a primit de la consiliul economic si social aviz negativ pentru propunerea legislativa consiliul legislativ a avizat negativ propunerea legislativa comisia pentru comunitati si telecomunicatii informeaza aviz favorabil comisia economica industrii si servicii aviz negativ la dezbateri a participat in conformitate cu prevederile art saizeci si trei din regulamentul senatului republicat cu modificarile si completarile ulterioare din partea ministerului sanatatii secretarul de stat domnul mohanu aurel din partea confederatiei patronale concordia andreea zalomir si nadina pana in urma dezbaterilor din sedinta din sapte sase doua mii douazeci si doi membrii comisiei pentru sanatate au hotarat sa adopte cu majoritate de voturi un raport de respingere din mai multe considerente comisia pentru sanatate supune spre dezbatere si adoptare plenului senatului raportul de respingere si propunerea legislativa aceasta face parte din categoria legilor ordinare potrivit art saptezeci si cinci alin din regulamentul senatului republicat cu modificarile si completarile ulterioare senatul este prima camera sesizata va multumesc ,"(269.52, 2262.52)",269.52,2262.52
71,Doamna Alina-Ștefania Gorghiu:,72421,Domnul Eugen-Remus Negoi:,72623, multumesc domnule presedinte dezbateri generale deschise va invit la microfon domnule senator din partea grupului usr aveti cuvantul domnul negoi eugen remus ,"(267.52, 1438.52)",267.52,1438.52
72,Domnul Eugen-Remus Negoi:,72623,Doamna Alina-Ștefania Gorghiu:,74959, multumesc doamna presedinta propunerea legislativa privind etichetarea nutritionala voluntara nutri score trei miliarde de oameni au o alimentatie inadecvata conform statisticilor riscul nutritional este cel mai mare risc la adresa sanatatii publice dupa riscul infectios prin care tocmai am trecut alimentatia defectuoasa este responsabila de boli cardiovasculare cancere sau obezitate adeseori categoriile vulnerabile din punct de vedere social sau financiar sunt cele mai afectate de riscul nutritional atat la adulti cat si la copii romania in particular europa in general au nevoie de un nou sistem de etichetare nutritionala un sistem vizual bazat pe structura cromatica usor de interpretat un sistem care sa informeze direct si in mod accesibil consumatorul indiferent de nivelul de educatie asupra calitatii nutritionale a alimentelor pe care le cumpara un astfel de sistem nutri score a fost implementat subliniez pe baza voluntara asa cum si initiativa noastra spune in spania in belgia in franta in germania in olanda sau in luxemburg se bazeaza pe semaforizarea cromatica a alimentelor in functie de continutul de fibre alimentare de fructe legume sau proteine ca scor pozitiv cu culoare verde si pe continutul de grasimi saturate sare sau zahar ca scor negativ ca semafor rosu scorul final obtinut asociaza produsului o anumita culoare de la verde inchis asa cum spuneam produsele care aduc beneficii sanatatii la rosu produsele care impacteaza negativ sanatatea consumatorului actualul sistem pe care l stim cu totii de etichetare nutritionala mai degraba dezinformeaza sau informeaza spre zero prin diluarea informatiilor intr o succesiune densa de cifre si denumiri la care nu se uita aproape nimeni si asta o stim cu totii unul dintre obiectivele proiectului este ca romania sa implementeze pe baza voluntara initial acest sistem nutri score la fel ca tarile pe care le am mentionat din europa ulterior insa vom sustine si demersul de schimbare si adoptare a directivei europene de etichetare si introducere obligatorie a acestei semaforizari alimentare asa cum ne dorim cu totii grupul senatorilor usr va vota impotriva raportului de respingere si pentru lege va multumesc ,"(269.52, 2262.52)",269.52,2262.52
73,Doamna Alina-Ștefania Gorghiu:,74959,Domnul Florian-Dorel Bodog:,75089, multumesc domnule senator din partea grupului psd invit la microfon pe domnul senator bodog ,"(1226.52, 1226.52)",1226.52,1226.52
74,Domnul Florian-Dorel Bodog:,75089,Doamna Alina-Ștefania Gorghiu:,75700, multumesc doamna presedinte de sedinta initiativa legislativa asa cum a fost formulata si cum a fost prezentata in fata comisiei pentru sanatate nu rezolva niciuna dintre problemele invocate in preambul acesta este si motivul din contra aduce foarte multe modificari in ceea ce priveste etichetarea modificari care sunt absolut imposibil de pus in practica de altfel nu opreste nimeni producatorii sa faca aceasta etichetare suplimentara daca si o doresc acesta este motivul pentru care in comisia de sanatate noi am propus si am adoptat aviz negativ multumesc ,"(267.52, 269.52)",267.52,269.52
75,Doamna Alina-Ștefania Gorghiu:,75700,Domnul Ionuț Neagu:,75907, va multumesc constat ca nu mai sunt domnul senator negoi va rog sa veniti la microfonul central dar sa va ganditi ca luati cuvantul ca sa nu va ratez doamne fereste ,"(1226.52, 1226.52)",1226.52,1226.52
76,Domnul Ionuț Neagu:,75907,Doamna Alina-Ștefania Gorghiu:,76413, multumesc doamna presedinta de sedinta in primul rand nu stiu pentru mine legea aceasta mi se pare un nonsens daca nu este obligatorie etichetarea la ce o mai impunem da vreti initial sa ne obisnuim cu ideea dupa care sa obligam populatia de fapt producatorii o sa fie niste costuri in spatele acestei etichetari pentru ca vor fi necesare niste analize iarasi ma intreb cine o sa suporte costurile stim foarte bine cine populatia romaniei multumesc ,"(1226.52, 1226.52)",1226.52,1226.52
