,start_text,start_index,end_text,end_index,text,timestamp
39,Doamna Liliana Sbîrnea:,29455,Doamna Alina-Ștefania Gorghiu:,30024, apreciem buna intentie a initiatorilor doar ca initiativa legislativa creeaza diferente in ceea ce priveste modul de angajare la acest moment cetatenii ucraineni beneficiaza de aceleasi drepturi ca si cetatenii romani ganditi va ca daca aceasta initiativa ar intra in vigoare s ar putea intampla urmatorul fenomen angajatorul sa prefere sa angajeze un cetatean ucrainean pentru ca ulterior va primi cincizeci din salariul acestuia in limita a doi cinci sute maximum si mai putin sa angajeze un cetatean roman multumesc frumos ,"(1952.0, 1955.0)"
40,Doamna Alina-Ștefania Gorghiu:,30024,Doamna Diana Iovanovici-Șoșoacă:,30155, ii multumesc doamnei senator sbirnea pentru interventie doamna senator sosoaca aveti cuvantul ,"(1952.0, 1955.0)"
41,Doamna Diana Iovanovici-Șoșoacă:,30155,Doamna Alina-Ștefania Gorghiu:,31579, va multumesc inteleg preocuparea pentru problema din ucraina cred ca pana acum am ajutat cetatenii ucraineni care au venit in romania mai mult decat orice alta tara aflata intr o situatie precara economica cum este romania ca sa va dau un exemplu italia nu primeste niciun refugiat din ucraina decat daca il vaccineaza obligatoriu anti covid daca nu il da afara efectiv deci asta e situatia in italia bun in ceea ce ne priveste pe noi mi ar fi placut sa vad din partea usr ului mai multa preocupare pentru cetatenii romani mai ales integrarea cetatenilor romani care vin din strainatate inapoi in romania avand in vedere ca inclusiv un ministru secretar de stat a spus ceea ce v am spus eu de anul trecut ca sunt peste opt milioane de romani in afara granitelor tarii foarte multi din cauza problemelor economice se intorc astfel de initiative ar trebui sa le avem pentru cetatenii romani pentru ca in uniunea europeana acolo unde se duc catre tarile mult mai bogate decat romania acolo unde se duc acesti cetateni ucraineni au mai multe posibilitati acolo cred ca ne am facut datoria cu varf si indesat si le am acordat mai multe drepturi decat am acordat cetatenilor romani haideti sa ne gandim si la romani si la romania si la cat mai poate duce economia romaniei sa tot ajute fara sa producem nimic multumesc ,"(3326.0, 3412.0)"
42,Doamna Alina-Ștefania Gorghiu:,31579,Domnul Ion Rotaru:,32086, multumesc declar dezbaterile incheiate proiectul ramane la vot final punctul sase propunerea legislativa pentru completarea unor acte normative cu privire la regimul strainilor in romania si incadrarea in munca a strainilor pe teritoriul romaniei declar deschise dezbaterile generale initiator n avem reprezentantul guvernului nu de asemenea domnule rotaru aveti cuvantul pentru prezentarea raportului domnule presedinte va rog ,"(1952.0, 10385.0)"
43,Domnul Ion Rotaru:,32086,Doamna Alina-Ștefania Gorghiu:,32677, multumesc doamna presedinta propunerea legislativa vizeaza regimul strainilor in ansamblu nu numai al celor din ucraina privind incadrarea in munca si celelalte aspecte care tin de drepturile pe care le au strainii in romania fac precizarea ca avem avize negative de la consiliul legislativ de la comisia pentru politica externa de la comisia pentru drepturile omului pe cale de consecinta comisia pentru munca a adoptat un raport de respingere a propunerii legislative legea este ordinara senatul este prima camera sesizata multumesc ,"(1952.0, 3490.0)"
44,Doamna Alina-Ștefania Gorghiu:,32677,Domnul Ambrozie-Irineu Darău:,32781, multumesc domnule presedinte domnule senator darau aveti cuvantul ,"(1952.0, 1955.0)"
45,Domnul Ambrozie-Irineu Darău:,32781,Doamna Alina-Ștefania Gorghiu:,35156, multumesc doamna presedinta si aceasta initiativa legislativa vine in sprijinul refugiatilor din ucraina si inainte sa spun exact despre ce este vorba vreau totusi n am vrut sa intervin inainte sa renuntam la aceste discursuri care arunca undeva si mixeaza roman romania frici abuz cam asta auzim in senatul romaniei de cateva ori la fiecare plen o tragedie umanitara de dimensiunea celei din ucraina nu poate fi rezolvata nici usor si nu cred ca exista limite pana la care trebuie sa ajutam un popor vecin si pana la urma niste milioane de oameni care au probleme pe care nimeni nu si le ar dori sa le aiba in viata si de pe o zi pe alta asa cum le au avut ei pana una alta apropo de ocuparea fortei de munca noi romanii ne bucuram de drepturile si libertatile fundamentale din uniunea europeana inclusiv dreptul la circulatie si dreptul de a avea si a gasi servicii oriunde in uniunea europeana deci haideti sa vorbim despre initiativele concrete nu sa facem aceasta gargara pro rusa plen de plen ne am saturat cu totii si cred ca s au saturat si romanii privind aceasta initiativa usr plus a sesizat de la inceput nevoia de a sprijini refugiatii si a venit cu o propunere de reducere a timpilor si a costurilor pentru obtinerea de catre cetatenii din ucraina a vizei de lunga sedere pentru angajare in munca si a permisului unic de sedere in scop de angajare initiativa vizeaza si posibilitatea acordarii vizei de lunga sedere pentru angajare in munca fara prezentarea copiei avizului de angajare si strainilor care fac dovada cunoasterii limbii romane cel putin la un nivel satisfacator intrucat formalitatile obtinerii avizului de angajare ingreuneaza accesul la timp pe piata muncii al lucratorilor factorul timp este unul dintre aspectele esentiale ce trebuie avute in vedere in cazul lucratorilor sezonieri nu intelegem reactia guvernului de a nu sustine initiativa de a nu rezolva sau macar contribui la ameliorarea crizei de forta de munca de pe piata muncii din tara noastra si de a nu debirocratiza procesele cu institutiile publice aceasta initiativa este una benigna este una care nu costa si care doar simplifica accesul pe piata muncii pentru refugiatii ucraineni asadar vom vota impotriva raportului de respingere multumesc ,"(3509.0, 3648.0)"
46,Doamna Alina-Ștefania Gorghiu:,35156,Domnul Florian-Dorel Bodog:,35279, multumesc domnului senator darau il invit la microfon pe domnul senator bodog va rog ,"(1952.0, 1955.0)"
47,Domnul Florian-Dorel Bodog:,35279,Doamna Alina-Ștefania Gorghiu:,35964, multumesc doamna presedinta doamnelor si domnilor colegi eu am fost stupefiat cand am auzit ca de la acest microfon ni se cere sa nu mai vorbim despre romani si despre romania si nu inteleg de ce daca vorbim despre romani si despre romania facem politica pro rusa nu nu inteleg aceasta acuzatie ceea ce vreau eu sa va spun domnule senator este faptul ca suntem trimisi aici de romani si de romania despre asta vorbim in senatul romaniei nu despre altceva in ceea ce priveste initiativa legislativa asa cum ati vazut are defectele pe care le a sesizat comisia de fond motiv pentru care vom vota impotriva multumesc ,"(3675.0, 3704.0)"
48,Doamna Alina-Ștefania Gorghiu:,35964,Domnul Ion-Narcis Mircescu (de la prezidiu):,36064, multumesc domnului senator bodog daca mai exista alti ,"(1952.0, 1955.0)"
49,Domnul Ion-Narcis Mircescu (de la prezidiu):,36064,Doamna Alina-Ștefania Gorghiu:,36120, daneasa ,"(2001.0, 3716.0)"
50,Doamna Alina-Ștefania Gorghiu:,36120,Domnul Mircea Dăneasă:,36216, domnul senator daneasa din partea grupului aur are cuvantul ,"(3716.0, 3716.0)"
51,Domnul Mircea Dăneasă:,36216,Doamna Alina-Ștefania Gorghiu:,37313, va multumesc stimati colegi nimeni nu are nimic impotriva ajutorarii poporului dezavantajat din ucraina numai ca acest ajutor nu trebuie facut prin legi peste legi adoptate repede trebuie facut printr un acord sau un tratat bilateral intre romania si ucraina in care sa se analizeze foarte clar relatiile romania ucraina atat la activ cat si la pasiv noi la pasiv avem de recuperat de la ucraina o legislatie care se refera la dreptul limbii romane in ucraina in momente de dezastru de crize majore ca aceasta trecem peste aceasta problema dar nu o putem lasa la voia intamplarii pentru viitorul apropiat si indepartat relatiile noastre cu ucraina consider ca trebuie rezolvate printr un tratat bilateral prin care noi sa ajutam dar prin care si ucraina sa isi recunoasca si sa si asume obligatiile ce deriva din dreptul international vizavi de etnicii romani din ucraina lucrurile sunt deosebit de complicate si nu pot fi dezbatute intr un plen al senatului trebuie pregatita inainte o initiativa de tratat va multumesc ,"(3726.0, 3820.0)"
52,Doamna Alina-Ștefania Gorghiu:,37313,Doamna Diana Iovanovici-Șoșoacă:,37398, multumesc doamna senator sosoaca aveti cuvantul ,"(1952.0, 1955.0)"
53,Doamna Diana Iovanovici-Șoșoacă:,37398,Doamna Alina-Ștefania Gorghiu:,39915, da sunt in asentimentul domnului senator de la psd cred ca romanii s au cam saturat sa va auda ca toti cei care reprezinta interesele romaniei si tin cu poporul roman si solicita ajutor pentru romani sunt pro rusi cred ca nu aveti capacitatea de a intelege ce inseamna a fi pro rus si cred ca ar trebui sa reveniti un pic la dictionarul explicativ al limbii romane pentru ca nu vreau sa cred ca asistam la acei saizeci de analfabeti functionali pe care i are romania dar in acest context vreau sa va intreb cand o sa va pese de drama poporului roman sunt zece milioane daca nu mai mult de romani in afara granitelor tarii nu i ajuta nimeni nu se intereseaza nimeni daca acolo au un loc de munca sunt enorm de multi care nu sunt inregistrati oficial sunt enorm de multi care nu au ajutor din partea nimanui ministerul afacerilor externe ridica din umeri si spune nu ma bag dar dumneavoastra sunteti foarte interesati cum sa ajutati niste oameni care fug vin pe la noi si pleaca de fapt in tarile bogate i am ajutat ii ajutam nu putem sa inlocuim romanii plecati cu cetateni ai altor state va interzice constitutia romaniei aceea pe care vreti sa o schimbati si sa o anulati este inacceptabil ceea ce se intampla initiative peste initiative pentru ajutorarea strainilor unde sunt initiativele pentru ajutorarea romanilor vin in tara vin si mi spun la cabinetul parlamentar eu unde ma angajez nu ma angajeaza nimeni in schimb altii sunt angajati pe banda rulanta nu este normal nu poti sa pui propriul popor mai prejos decat orice alt cetatean indiferent ce se intampla acolo exista ajutoare de peste tot din statele unite din europa din afara europei si asa mai departe iar razboiul acesta nu va dura la nesfarsit la un moment dat se va termina si probabil mai mult ca sigur se vor intoarce acolo oricum ar trebui sa verificati cati cetateni ucraineni cu reale probleme financiare au ajuns sa plece pentru ca adevaratii oameni saraci de acolo nu au cu ce sa plece nu au de unde sa dea spaga vamesului ucrainean care i cere sa plece femeile cu copii au plecat conform legii de acolo pe timp de razboi barbatii nu au cum sa paraseasca tara si totusi e plina romania de barbati la volanul unor limuzine de sute de mii de euro si sunt ucraineni poate ar trebui sa lasam demagogia la o parte si sa vedem realitatea ca nu trebuie sa pareti foarte bine in fata lui soros tot timpul multumesc ,"(3837.0, 4006.0)"
54,Doamna Alina-Ștefania Gorghiu:,39915,Domnul Radu-Mihai Mihail:,39975, va rog domnule lider usr ,"(1761.0, 9808.0)"
55,Domnul Radu-Mihai Mihail:,39975,Doamna Alina-Ștefania Gorghiu:,40208, va multumesc doamna presedinta si stim cu totii ca noi parlamentarii avem libertatea de a ne exprima dar v as ruga sa nu mai acceptati sa fie emise insulte de la microfoanele senatului multumesc ,"(1952.0, 1955.0)"
56,Doamna Alina-Ștefania Gorghiu:,40208,Domnul Sorin Vlașin:,41119, multumesc liderului usr dat fiind faptul ca este ora saisprezece fara doi minute rog liderii sa mi comunice pana la ce punct doresc continuarea dezbaterilor domnule oprea declar dezbaterile deschise initiator nu avem comisia economica industrii si servicii pentru prezentarea raportului are cuvantul va rog ,"(1952.0, 1955.0)"
57,Domnul Sorin Vlașin:,41119,Doamna Alina-Ștefania Gorghiu:,42115, multumesc doamna presedinta de sedinta prezenta propunere legislativa are ca obiect de reglementare modificarea si completarea legii nr trei sute douazeci si unu doua mii noua privind comercializarea produselor alimentare republicata cu modificarile si completarile ulterioare mentionez ca avem un aviz negativ de la consiliul legislativ si un aviz nefavorabil de la consiliul economic si social membrii comisiei economice industrii si servicii au analizat propunerea legislativa punctele de vedere exprimate si avizele primite si au hotarat cu majoritate de voturi sa adopte un raport de respingere apreciind ca in actuala formulare prezenta propunere legislativa nu poate fi promovata intrucat este incompatibila atat cu reglementarile uniunii europene cat si cu legislatia nationala fata de cele prezentate comisia economica industrii si servicii supune plenului senatului pentru dezbatere si adoptare raportul de respingere si propunerea legislativa multumesc ,"(4142.0, 4195.0)"
58,Doamna Alina-Ștefania Gorghiu:,42115,Domnul Adrian Streinu Cercel:,42699, ii multumesc domnului senator vlasin pentru prezentarea raportului declar dezbaterile deschise daca din partea grupurilor parlamentare exista inscrieri la cuvant nu exista proiectul va ramane la vot final la punctul opt propunerea legislativa pentru modificarea si completarea art opt sute trei din legea nr nouazeci si sase doua mii cinci privind reforma in domeniul sanatatii declar dezbaterile generale deschise dau cuvantul comisiei pentru sanatate pentru prezentarea raportului domnule presedinte streinu cercel aveti cuvantul va rog ,"(4195.0, 4219.0)"
59,Domnul Adrian Streinu Cercel:,42699,Doamna Alina-Ștefania Gorghiu:,44356, va multumesc doamna presedinta este vorba de o modificare la art opt sute trei din legea nr nouazeci si cinci doua mii sase privind reforma in domeniul sanatatii respectiv l224 doua mii douazeci si doi in care se dorea introducerea unei noi litere c1 care sa prevada ca exceptie furnizarea de medicamente autoritatilor si organizatiilor care actioneaza in domeniul asistentei umanitare chiar daca nu detin autorizatii de distributie angro sau nu reprezinta unitati farmaceutice precizand in expunerea de motive ca art opt sute trei ar fi limitativ la dezbateri au participat in conformitate cu prevederile art saizeci si trei din regulamentul senatului din partea ministerului sanatatii domnul secretar de stat mohan aurel si din partea anmdmr razvan mihai prisada presedinte iar in urma dezbaterilor din sedinta din trei mai membrii comisiei pentru sanatate au hotarat sa adopte cu majoritate de voturi un raport de respingere avand in vedere ca organizatiile care actioneaza in domeniul asistentei umanitare nu se pot substitui calitatii de distribuitor angro neavand capacitatea de a asigura conditiile de calitate instalatii si echipamente temperatura controlata trasabilitate igiena spatiului si nu in ultimul rand respectarea obligatiilor instituite de regulamentul nr o suta saizeci si unu doua mii saisprezece de a verifica si scoate din uz dupa caz indicatorul unic al unui medicament ca atare comisia pentru sanatate supune pentru dezbatere si adoptare plenului senatului raportul de respingere si respectiv respingerea propunerii legislative legea face parte din categoria legilor organice iar senatul este prima camera sesizata va multumesc ,"(4228.0, 4314.0)"
60,Doamna Alina-Ștefania Gorghiu:,44356,Domnul Sorin Lavric:,44591, va multumesc domnule presedinte la dezbateri generale daca exista inscrieri la cuvant din partea grupului aur il invit pe domnul sorin lavric domnul senator sorin lavric la microfonul central ,"(1952.0, 2671.0)"
61,Domnul Sorin Lavric:,44591,Doamna Alina-Ștefania Gorghiu:,45928, multumesc doamna presedinta alina gorghiu dragi colegi stiti foarte bine ca legea nr nouazeci si cinci doua mii sase cea privind reforma din domeniul sanatatii spune foarte limpede ca medicamentele in aceasta tara nu pot fi distribuite decat de cei care au parte de acea autorizatie din partea ministerului sanatatii aceasta autorizatie este un filtru calitativ fara acest filtru calitativ pot fi distribuite medicamente falsificate deteriorate sau chiar expirate or ceea ce vrea aceasta noua propunere legislativa este sa ciunteasca acest spirit al legii si sa spuna ca apar niste organizatii de asistenta umanitara insufletite de intentiile cele mai filantropice si care in anumite situatii de exceptie pot trimite catre pacientii din spitale pot distribui medicamente fara sa primeasca aceasta autorizatie calitativa din partea ministerului sanatatii va dati seama unde se poate ajunge va dati seama la ce riscuri si pericole pot fi expusi pacientii in spitale si in acelasi timp va dati seama ce se va intampla in mintea medicilor cand vor fi sa aleaga intre medicamentele autorizate de ministerul sanatatii si aceste medicamente care intretin de fapt un comert ilicit sub masca asistentei umanitare iata de ce grupul aur va vota pentru raportul de respingere a propunerii legislative ,"(4342.0, 4434.0)"
62,Doamna Alina-Ștefania Gorghiu:,45928,Domnul Eugen-Remus Negoi:,46056, multumesc domnule senator va rog domnule senator din partea grupului usr aveti cuvantul ,"(1952.0, 2671.0)"
63,Domnul Eugen-Remus Negoi:,46056,Doamna Alina-Ștefania Gorghiu:,48016, va multumesc doamna presedinta haideti sa lamurim niste lucruri stimati colegi s au spus multe neadevaruri aici si as vrea sa punctez cateva chestiuni care sa lamureasca pe cei care asista la aceste dezbateri si pe privitorii nostri dincolo de aceasta sala initiativa legislativa pe care usr a propus o face referire strict la situatii exceptionale si singurul exemplu pe care vi l pot da in acest moment este cel al conflictului din ucraina pe fondul acesta a fost creata aceasta initiativa legislativa distributia angro a medicamentelor avizate nu a celor expirate nu a celor care nu au aviz ci a medicamentelor avizate distributie angro inseamna ca in caz de conflict si fac o mica paranteza aici stim foarte bine si v o spun ca unul care alaturi de colegii mei din usr am fost in zonele prin care treceau refugiatii si am vazut cu ce drame se confrunta aceste medicamente pot fi distribuite de ong uri fara sa mai astepte treizeci de zile ca sa obtina un aviz pentru a distribui medicamente in respectivele zone medicamentele odata distribuite angro nu vor fi date la voia intamplarii bineinteles ca acolo exista medici de razboi repet vorbim de situatii exceptionale situatii de razboi cu care se confrunta unele locuri stim foarte bine cat de anchilozate sunt institutiile statului atunci cand e vorba de astfel de situatii si repet nu o spun ca unul care a vazut doar la televizor aceste lucruri am fost in primele zile in acele zone de trecere a frontierei si am vazut cat de anchilozate de ruginite sunt unele institutii ale statului care ar fi trebuit sa rezolve pe loc aceste probleme din acest motiv noi vom vota impotriva raportului de respingere pentru ca ceea ce v am expus mai devreme este o situatie reala o situatie care atunci cand e vorba de un razboi nu asteapta avize si nu asteapta a merge acolo imbracati la papion va multumesc ,"(4459.0, 4593.0)"
64,Doamna Alina-Ștefania Gorghiu:,48016,Domnul Florian-Dorel Bodog:,48137, ii multumesc domnului negoi pentru interventie domnule senator bodog aveti cuvantul ,"(1952.0, 1955.0)"
65,Domnul Florian-Dorel Bodog:,48137,Doamna Alina-Ștefania Gorghiu:,48709, si in aceasta situatie primeaza siguranta pacientului nu ne permitem sa punem pe piata medicamente care nu au trecut prin filtrul calitatii statului roman si al ministerului sanatatii eu nu vreau sa fac nicio acuzatie doar imi aduc aminte ca cineva din acelasi partid se lauda ca a carat medicamente cu geanta in romania si cred ca asta este motivul de fapt pentru care s a facut aceasta initiativa legislativa acest lucru este absolut ilegal in toate tarile din uniunea europeana nu doar in romania multumesc ,"(4604.0, 4636.0)"
66,Doamna Alina-Ștefania Gorghiu:,48709,Domnul Adrian Streinu Cercel:,48860, multumesc domnule senator o precizare din partea domnului senator streinu cercel va rog microfonul din lateral ,"(1952.0, 1955.0)"
67,Domnul Adrian Streinu Cercel:,48860,Doamna Alina-Ștefania Gorghiu:,49711, va multumesc doamna presedinta asa cum spunea si domnul senator bodog e problema de siguranta a pacientului dupa cum bine stim sunt o serie de stiu si eu cum sa le numesc de companiute care se ocupa cu manufactura de medicamente si eliberarea lor inclusiv pe net in momentul de fata exista o legislatie foarte bine pusa la punct la nivel european care permite urmarirea respectiv trasabilitatea medicamentului nu putem sa renuntam la aceasta trasabilitate a medicamentului doar asa pentru ca la un moment dat ni se pare noua ca va fi ceva grav atunci cand va fi ceva grav avem o serie de unitati ale statului care se pot implica direct respectiv avem anmdmr ul avem unifarm ul avem ministerul sanatatii care sunt implicate direct in astfel de proceduri va multumesc ,"(4647.0, 4688.0)"
68,Doamna Alina-Ștefania Gorghiu:,49711,Domnul Radu-Mihai Mihail:,49847, multumesc o singura interventie va rog domnule lider radu mihail si cu asta inchidem dezbaterile ,"(1952.0, 1955.0)"
69,Domnul Radu-Mihai Mihail:,49847,Doamna Alina-Ștefania Gorghiu:,50086, va multumesc doamna presedinta voiam doar sa rezum interventiile psd pe care le putem descrie astfel mai bine sa moara oameni decat sa ne atingem de birocratia din romania ,"(1952.0, 1955.0)"
70,Doamna Alina-Ștefania Gorghiu:,50086,Domnul Adrian Streinu Cercel:,50369, domnule senator nu am la ce sa va dau drept la replica nu va suparati doar daca vreti sa faceti o precizare suplimentar si cu asta chiar vreau sa inchidem dezbaterile generale pentru ca drept la replica la replica nu isi are sensul va rog ,"(4723.0, 4729.0)"
71,Domnul Adrian Streinu Cercel:,50369,Doamna Alina-Ștefania Gorghiu:,50696, multumesc doamna presedinta problema se pune in felul urmator in momentul de fata in medicina se scrie un nou capitol care se cheama interactiuni medicamentoase nu putem sa lasam deoparte acest lucru doar asa pentru ca cineva vrea sa se joace cu cuvintele va multumesc ,"(1952.0, 1955.0)"
72,Doamna Alina-Ștefania Gorghiu:,50696,Domnul Császár Károly Zsolt:,51119, multumesc domnule senator declar dezbaterile inchise initiativa ramane la vot final la punctul noua propunerea legislativa pentru modificarea si completarea legii nr o suta paisprezece o mie noua sute nouazeci si sase privind locuintele declar deschise dezbaterile generale dau cuvantul domnului presedinte al comisiei pentru administratie publica pentru prezentarea raportului va rog ,"(1952.0, 10385.0)"
73,Domnul Császár Károly Zsolt:,51119,Doamna Alina-Ștefania Gorghiu:,51491, va multumesc doamna presedinte in sedinta din zece mai doua mii douazeci si doi membrii comisiei au analizat propunerea legislativa si au hotarat cu majoritatea voturilor membrilor prezenti sa adopte un raport de respingere comisia pentru administratie publica supune spre dezbatere si adoptare plenului senatului raportul de respingere va multumesc ,"(1952.0, 8714.0)"
74,Doamna Alina-Ștefania Gorghiu:,51491,Doamna Laura-Mihaela Fulgeanu-Moagher:,52176, va multumesc frumos dezbateri generale inscrieri la cuvant nu exista proiectul ramane la vot final punctul zece propunerea legislativa privind transmiterea terenurilor si altor active patrimoniale aflate in patrimoniul societatilor comerciale si regiilor la care statul sau una sau mai multe autoritati ale administratiei publice locale este actionar majoritar declar deschise dezbaterile generale guvern n avem comisia pentru administratie publica comisia juridica au elaborat un raport comun o invit pe doamna senator vicepresedinte al comisiei doamna moagher sa prezinte raportul comisiei ,"(4796.0, 4827.0)"
75,Doamna Laura-Mihaela Fulgeanu-Moagher:,52176,Doamna Alina-Ștefania Gorghiu:,52262, va multumesc doamna presedinta ,"(1952.0, 1955.0)"
76,Doamna Alina-Ștefania Gorghiu:,52262,Domnul Sorin-Ioan Bumb:,52465, atunci imi cer scuze doamna senator dati mi voie sa i permit domnului bumb care este initiator sa prezinte proiectul si imediat va dau cuvantul pentru raport ,"(4839.0, 4847.0)"
77,Domnul Sorin-Ioan Bumb:,52465,Doamna Alina-Ștefania Gorghiu:,53613, multumesc doamna presedinte stimati colegi aceasta initiativa legislativa este foarte importanta pentru administratiile publice locale deoarece sunt dupa cum bine stiti o gramada de terenuri si de active patrimoniale ale societatilor comerciale cu capital majoritar sau integral de stat si ale regiilor care sunt in paragina care nu sunt folosite si nu le mai deservesc obiectului de activitate pe care l au prin acest proiect de lege propunem transferul acestora catre unitatile administrativ teritoriale la pretul de inventar actualizat ceea ce inseamna ca nu este o nationalizare pentru ca a mai fost o initiativa in mandatul trecut si nu a reusit sa treaca si pe aceasta cale vreau sa multumesc reprezentantilor ministerului de finante si tuturor colegilor din comisia de administratie si din comisia juridica pentru ca prin amendamentele pe care le au adus acestui proiect de lege au reusit sa faca o lege care sper sa fie operabila si sa ajute mult administratiile locale prin valorificarea tuturor terenurilor si a activelor care in acest moment nu sunt utilizate multumesc ,"(4857.0, 4933.0)"
78,Doamna Alina-Ștefania Gorghiu:,53613,Domnul Ion Iordache:,53764, multumesc domnule senator tot initiator coinitiator va rog aveti cuvantul domnule senator iordache ,"(1952.0, 1955.0)"
