,start_text,start_index,end_text,end_index,text,timestamp
79,Domnul Ion Iordache:,53764,Doamna Alina-Ștefania Gorghiu:,56165, multumesc doamna presedinte stimati colegi l165 privind transmiterea terenurilor si altor active patrimoniale din patrimoniul regiilor autonome si societatilor comerciale cu capital majoritar de stat sau cu capital integral de stat este legea care reglementeaza transferul terenurilor neutilizate si repet neutilizate si al cladirilor catre autoritatile publice locale inca de la inceputul mandatului meu am constatat in intalnirile pe care le am avut cu diversi reprezentanti ai autoritatilor locale din judetul gorj pe care l reprezint dar si judetele dolj hunedoara mehedinti si alte judete ca una dintre principalele nevoi pe care le aveau era tocmai aceasta reglementare care sa poata permite ca autoritatile publice locale sa aiba acces la terenuri si cladiri care nu mai sunt folosite care sunt in proprietatea unor regii autonome si societati comerciale iar acestea nu au posibilitatea de a le intretine si de a le utiliza dar nicio reglementare legala care sa le permita predarea lor catre autoritatile publice locale care ar avea posibilitatea sa le foloseasca sa acceseze fonduri europene si sa le puna in valoare dupa aceste intalniri am discutat cu multi dintre dumneavoastra colegi senatori si am identificat ca si in celelalte judete era aceeasi problema chiar si in bucuresti exista aceasta problema cand avem cladiri terenuri ale regiilor autonome si ale societatilor cu capital de stat care nu sunt folosite in momentul acesta si nici nu pot fi predate multumesc comisiilor de administratie si juridica care au dat dovada de responsabilitate si au lucrat extrem de mult pe aceasta lege au produs si am produs impreuna amendamente desi legea a avut mai multe avize negative in final au fost rezolvate toate aceste probleme si astazi ne aflam in fata dumneavoastra cu aceasta lege care consider eu ca este de o importanta majora pentru intreaga societate pentru intreaga tara pentru toate autoritatile publice locale dar si pentru regiile si societatile carora le genereaza cheltuiala si nici nu au posibilitatea de a le valorifica intr un alt fel va multumesc tuturor pentru sustinere si constat o foarte mare responsabilitate de data aceasta chiar daca initiatori am fost de la un senator neafiliat ca a sustinut aceasta initiativa legislativa va multumesc ,"(4945.0, 5150.0)"
80,Doamna Alina-Ștefania Gorghiu:,56165,Doamna Laura-Mihaela Fulgeanu-Moagher:,56278, multumesc initiatorilor o rog pe doamna senator moagher sa prezinte raportul ,"(1952.0, 1955.0)"
81,Doamna Laura-Mihaela Fulgeanu-Moagher:,56278,Doamna Alina-Ștefania Gorghiu:,57732, va multumesc doamna presedinte raport comun asupra propunerii legislative privind transmiterea terenurilor si altor active patrimoniale aflate in patrimoniul societatilor comerciale si regiilor la care statul sau una sau mai multe autoritati ale administratiei publice locale este actionar propunerea legislativa are obiect de reglementare transmiterea cu titlu gratuit proprietatea sau alte drepturi reale prevazute la art cinci sute cincizeci si unu cod civil asupra terenurilor si a altor active patrimoniale aflate in patrimoniul societatilor comerciale si regiilor la care statul sau una sau mai multe autoritati ale administratiei publice locale este actionar majoritar consiliul legislativ a analizat propunerea legislativa si a transmis un aviz negativ aviz nefavorabil de la consiliul economic si social comisia de buget finante activitate bancara si piata de capital aviz negativ comisia economica pe parcursul mai multor sedinte membrii comisiei juridice de numiri imunitati si validari si a comisiei de administratie publica au dezbatut propunerea legislativa si au hotarat cu majoritate de voturi a senatorilor prezenti sa adopte un raport comun de admitere cu amendamente admise cuprinse in anexa astfel supune spre dezbatere si adoptare plenului senatului raportul comun de admitere cu amendamente admise si propunerea legislativa va multumesc ,"(5164.0, 5247.0)"
82,Doamna Alina-Ștefania Gorghiu:,57732,Domnul Mircea Dăneasă:,57915, multumesc doamna vicepresedinta dezbateri generale domnul mircea daneasca are cuvantul din partea grupului aur microfonul de langa domnia sa ,"(1952.0, 1955.0)"
83,Domnul Mircea Dăneasă:,57915,Doamna Alina-Ștefania Gorghiu:,59914, va multumesc doamna presedinta stimati colegi daca ati fost putin atenti cred ca ati observat o inadvertenta intre felul cum a fost prezentat proiectul de lege de colegul de la alba iulia colegul senator de la alba iulia si felul cum suna legea si cum doamna presedinta a si enuntat o dansul a spus ca este vorba de o transmitere la pretul de inventar recalculat si actualizat asta presupune o vanzare deci legea initiatorii au prezentat o ca pe o vanzare insa legea la art unu alin spune ca societatile comerciale si regiile la care statul sau una sau mai multe autoritati ale administratiei publice de stat sunt actionari majoritari atentiune au obligatia de a transmite cu titlu gratuit deci cu titlu gratuit proprietatea sau alte drepturi reale care sunt aceste drepturi reale in afara de proprietate adica in afara de activele imobile si mobile se mai vorbeste de creante deci a transmite creantele adica drepturile pe care aceste companii le au de incasat presupune o chestiune logica aceste companii care au dreptul de a incasa nu pot fi numite in paragina ele au niste drepturi patrimoniale niste creante care in aceasta lege la pct trei de la art unu spune ca sunt trecute cu titlu gratuit in proprietatea nu se stie a cui a unor societati comerciale scrie mai departe pentru a putea desfasura niste proiecte derula niste proiecte pentru fonduri pentru a incasa fonduri europene sunt lucruri bune ca intentie felul insa cum este transferata proprietatea si drepturile patrimoniale inseamna un lucru care nu poate fi acceptat in nicio economie de piata in nicio forma de economie ar fi normal ca daca ei vor sa puna in valoare aceste active asa zise in paragina unele intr adevar sunt in paragina si vor sa si insuseasca proprietatea sa plateasca nu cand le transfera proprietarul ci mai tarziu asa cum este acum legea aur nu o poate vota va multumesc ,"(5262.0, 5442.0)"
84,Doamna Alina-Ștefania Gorghiu:,59914,Domnul Császár Károly Zsolt:,60056, va multumesc frumos il invit pe domnul presedinte csaszar la cuvant microfonul doi va rog sa l deschideti ,"(1952.0, 1955.0)"
85,Domnul Császár Károly Zsolt:,60056,Doamna Alina-Ștefania Gorghiu:,60840, va multumesc doamna presedinte din pacate stimatul nostru coleg a analizat proiectul legislativ in forma initiatorului iar in comisia pentru administratie publica au fost introduse foarte multe amendamente tocmai in ideea de a corecta aceste observatii si va invit domnul senator sa consultati raportul comisiilor raportoare prin care au fost aprobate o serie de amendamente care regleaza aceste lucruri nu se transmite gratuit nicio proprietate se transmite la valoarea de inventar se transmite dreptul de proprietate si nu si alte drepturi reale deci toate aceste lucruri au fost amendate in comisiile raportoare astfel ca toate cele afirmate de distinsul nostru coleg nu sunt adevarate in prisma raportului adoptat va multumesc ,"(5466.0, 5526.0)"
86,Doamna Alina-Ștefania Gorghiu:,60840,Domnul Maricel Popa:,60950, va multumesc domnule presedinte domnul senator maricel popa are cuvantul ,"(1952.0, 1955.0)"
87,Domnul Maricel Popa:,60950,Doamna Alina-Ștefania Gorghiu:,62105, va multumesc acest l165 a fost unul dintre cele mai dezbatute proiecte de lege cred ca in jur de doua luni s au facut amendamente s a mers pe ideea ca nu numai in mehedinti sau la giurgiu sau in oltenia sunt astfel de terenuri ci in fiecare judet sunt terenuri care sunt lasate badadailor sau cainilor vagabonzi si nimeni nu ia nicio masura dar sunt foarte multe uat uri care doresc sa construiasca o cresa o gradinita pe astfel de terenuri sunt foarte multe uat uri care nu mai au terenuri in proprietate si atunci trebuie sa cumpere de la privati oare nu este mai simplu sa cumpere de la societatile de stat ca oricum sunt lasate terenuri in paragina noi grupul partidului social democrat vom vota pentru aceasta lege este foarte buna este bine venita fata de cum a fost initial propusa au fost foarte multe amendamente imi pare rau colegii de al aur nu citesc si amendamentele noi comisia de administratie cred ca am muncit in jur de cincizeci saizeci de zile doua luni la aceste amendamente pentru a aduce cat mai transparenta aceasta vanzare si vom vota pentru va multumesc ,"(5531.0, 5612.0)"
88,Doamna Alina-Ștefania Gorghiu:,62105,Domnul Gabriel Mutu:,62412, multumesc domnule senator inainte sa i dau cuvantul doamnei sosoaca o sa va rog sa mi permiteti o scurta interventie si pentru domnul senator gabriel mutu s a inscris la cuvant mai doriti domnule senator va rog aveti microfonul de langa dumneavoastra ,"(1952.0, 5624.0)"
89,Domnul Gabriel Mutu:,62412,Doamna Alina-Ștefania Gorghiu:,64336, multumesc doamna presedinte colegii mei antevorbitori si care fac parte din comisia pentru administratie au explicat foarte corect ceea ce s a intamplat in cadrul sedintelor noastre aceasta lege a fost modificata cred si pot sa spun fara niciun fel de rezerva la punctele esentiale in sensul ca transferul respectivelor imobile nu se face cu titlu gratuit se face la valoarea de inventar actualizata si vreau sa fac o completare ca sa se inteleaga corect foarte multi dintre colegii nostri au lucrat in administratia publica locala si nu de putine ori s au lovit de aceasta problema in sensul in care foarte multe terenuri abandonate in localitatile pe care le reprezentau nu puteau fi valorificate in sensul nu de a fi vandute ci de a fi modernizate autoritatile locale au posibilitatea sa atraga fonduri europene pentru modernizarea acestor terenuri si din pacate nu pot face acest lucru decat daca le au in administrare pe de alta parte discutam despre societati comerciale unde statul este actionar majoritar sau cu capital integral de stat inclusiv la regiile autonome unde aceste terenuri nu sunt valorificate sub nicio forma nu au bani pentru a le intretine sau pentru a dezvolta proiecte pe aceste terenuri si locuitorii care locuiesc in zonele respective sunt privati de dreptul de a trai intr o zona civilizata de aceea i as raspunde colegului meu domnul senator daneasa ca legea a fost corectata fata de ce a citit dumnealui si ca in acest moment nu mai reprezinta niciun fel de problema din punct de vedere al transferului proprietatii mai mult decat atat noi am avut discutii si cu reprezentantii ministerului de finante si cu reprezentantii de la ocpi unde ni s a explicat foarte clar care este procedura prin care se face transferul acestor proprietati de aceea am si prevazut in lege aceasta procedura multumesc ,"(5632.0, 5751.0)"
90,Doamna Alina-Ștefania Gorghiu:,64336,Doamna Diana Iovanovici-Șoșoacă:,64444, multumesc ultimul vorbitor este doamna sosoaca va rog doamna senator ,"(1952.0, 1955.0)"
91,Doamna Diana Iovanovici-Șoșoacă:,64444,Doamna Alina-Ștefania Gorghiu:,66496, multumesc va asigur ca eu am citit varianta cu amendamente de cate ori vad o astfel de initiativa credeti ma aceste initiative imi dau fiori si unii dintre cei negativi de ce pentru ca ma gandesc in primul rand ma gandesc juridic cele mai multe dintre aceste regii in acest moment sunt fie in insolventa fie in faliment ca de aceea nu pot sa le foloseasca da in aceste conditii cum puteti dumneavoastra in procedura insolventei sau a falimentului sa transmiteti aceste terenuri deci este una dintre ipoteze da una dintre ipoteze sa transmiteti catre autoritatile locale asa ceva doi la mana vorbiti de creante pai daca acea regie are de recuperat creante de ce nu o ajutati sa recupereze creantele astfel incat sa poata sa functioneze exista o lege adoptata mi se pare anul trecut prin care aceste administratii locale cedeaza catre tot felul de parteneri privati aceste terenuri ca le dau in concesiune ca au posibilitatea sa le vanda interesant la pretul de inventar pretul de inventar dupa ce au trecut cativa zeci de ani stiti care este nu mai e ala adevarat este la o atat de mica valoare incat de fapt o dai pe degeaba da daca gresesc imi asum dar dar se face o data la trei ani si oare daca ea nu este folosita care este valoarea reevaluarea eu stiu cum se face reevaluarea ca am vazut aceste lucruri puteti sa mentionati dar sunt lucruri pe care noi vi le ridicam le supunem atentiei pentru ca ma gandeam ca daca tot aveti astfel de regii autonome si ati avut un pnrr ma gandeam ca in loc de douazeci si cinci de milioane de euro consultanta in fiecare domeniu mai bine ati fi alocat sa refaceti aceste regii sau societati in care exista un capital majoritar de stat deci exista o mare problema si ascunde de fapt adevaratele intentii pentru ca nu va suparati in treizeci si doi de ani eu nu am vazut o intentie buna cu privire la aceste regii autonome societati comerciale cu capital de stat multumesc ,"(5769.0, 5922.0)"
92,Doamna Alina-Ștefania Gorghiu:,66496,Domnul Radu-Mihai Mihail:,66590, multumesc il invit pe liderul usr radu mihail la cuvant ,"(1952.0, 1955.0)"
93,Domnul Radu-Mihai Mihail:,66590,Doamna Alina-Ștefania Gorghiu:,68142, va multumesc doamna presedinta este evident si usr sustine acest lucru este nevoie ca primarii sa aiba mai multa flexibilitate sa aiba la indemana mijloacele necesare sa poata valorifica toate activele pe care le au in uat si de aceea munca facuta in comisia de administratie pentru a gasi modalitatea de a sprijini administratia locala este de laudat acestea fiind spuse doamnelor si domnilor noi am decis ca aceasta lege sa mearga in doua comisii de raport la administratie si la juridic de ce la juridic pentru ca atunci cand ne jucam cu proprietatea statului trebuie sa fim foarte foarte atenti sa nu ne intoarcem la bombe gen romexpo si atunci comisia juridica avea indatorirea sa verifice sa se aplece cel putin cu aceeasi atentie ca si comisia de administratie asupra acestui subiect ce s a intamplat de fapt a durat treizeci de secunde in comisia juridica ca sa nu mai spun ca au fost conditii neclare daca intr adevar a fost regulamentar sau nu ce s a intamplat acolo la vot deci haideti sa fim seriosi si sa ne preocupam alaturi de preocuparea pentru administratia locala care este legitima sa ne preocupam de ce se intampla cu banul cu proprietatea statului astfel incat sa nu avem asa cum am avut timp de zeci de ani praduirea acesteia de aceea din acest motiv faptul ca nu suntem siguri ca vom avea cu adevarat protectie pentru proprietatea statului dand aceasta libertate carpita cu amendamente din cate am inteles grupul usr va vota impotriva multumesc ,"(5936.0, 6035.0)"
94,Doamna Alina-Ștefania Gorghiu:,68142,Domnul Mircea Dăneasă:,68255, multumesc ultimul drept la replica este al domnului senator daneasa va rog ,"(1952.0, 1955.0)"
95,Domnul Mircea Dăneasă:,68255,Doamna Alina-Ștefania Gorghiu:,69181, da va multumesc ma scuzati stimati colegi dar legea a fost prezentata de doamna presedinta asa cum am spus eu deci transfer cu titlu gratuit daca exista amendamente care s au pus dupa ce a trecut prin comisia buget finante unde a fost avizul v as ruga ca aceste amendamente sa fie depuse in timp util sa le putem studia dar in cazul in care exista un amendament legat de creante pot sa va spun ca este imposibil ca acea companie care are de incasat creante sa le mai poata incasa dupa ce a transferat patrimoniul si efectiv ea a fost dizolvata o firma dizolvata nu mai poate recupera nimic sigur ca da puteti sa veniti cu tot felul de replici insa problema este ca aceste legi trebuie studiate putin mai aprofundat pentru asta trebuie depuse la timp amendamentele si nu asa cum a spus colegul de la usr in treizeci de secunde sa ii dam raport pozitiv va multumesc ,"(6049.0, 6113.0)"
96,Doamna Alina-Ștefania Gorghiu:,69181,Doamna Laura-Mihaela Fulgeanu-Moagher:,73280, multumesc domnule senator declar dezbaterile inchise proiectul ramane la vot final la punctul unsprezece al ordinii de zi am inscris cu votul plenului propunerea legislativa pentru modificarea si completarea legii nr doua sute opt doua mii cincisprezece privind alegerea senatului si a camerei deputatilor precum si pentru organizarea si functionarea autoritatii electorale permanente daca din partea initiatorilor mai doreste sa vorbeasca cineva daca nu o rog pe doamna presedinta anca dragu sa prezinte raportul doamna senator laura moagher atunci prezinta raportul din partea comisiei juridice si a comisiei pentru drepturile omului ,"(8609.0, 8619.0)"
97,Doamna Laura-Mihaela Fulgeanu-Moagher:,73280,Doamna Alina-Ștefania Gorghiu:,75573, va multumesc doamna presedinte de sedinta raport comun cu privire asupra propunerii legislative pentru modificarea si completarea legii nr doua sute opt doua mii cincisprezece privind alegerea senatului si a camerei deputatilor precum si pentru organizarea si functionarea autoritatii electorale permanente propunerea legislativa are ca obiect de reglementare modificarea si completarea legii nr doua sute opt doua mii cincisprezece privind alegerea senatului si a camerei deputatilor precum si pentru organizarea si functionarea autoritatii electorale permanente cu modificarile si completarile ulterioare in sensul stabilirii unor reguli de alcatuire a listelor de candidati propuse de partidele politice astfel incat sa se asigure o reprezentare echilibrata a femeilor si a barbatilor in cele doua camere ale parlamentului prezenta initiativa legislativa are in vedere asigurarea unei reprezentari echitabile echilibrate si juste a genurilor in domeniile puterii politice pentru realizarea echilibrului cotelor de gen in parlament se propune introducerea obligativitatii pentru toate formatiunile politice de a respecta un raport de unu la doi intre genuri la intocmirea listelor electorale de candidati pentru senat si camera deputatilor astfel initiativa prevede modificarea legii nr doua sute opt doua mii cincisprezece privind alegerea senatului si a camerei deputatilor precum si pentru organizarea si functionarea autoritatii electorale permanente cu modificari si completari ulterioare consiliul legislativ a analizat propunerea legislativa si a transmis un aviz favorabil cu observatii si propuneri membrii comisiei pentru drepturile omului egalitate de sanse culte si minoritati si cei ai comisiei juridice de numiri disciplina imunitati si validari au analizat si dezbatut propunerea legislativa amendamentele depuse si avizele primite si au hotarat cu majoritate de voturi a membrilor prezenti sa adopte un raport comun de admitere cu amendamente admise si supun spre dezbatere si adoptare plenului senatului raportul comun de admitere cu amendamente admise si propunerea legislativa in raport cu obiectul de reglementare propunerea legislativa face parte din categoria legilor organice va multumesc ,"(6451.0, 6577.0)"
98,Doamna Alina-Ștefania Gorghiu:,75573,Domnul Sorin Lavric:,75790, multumesc doamna senator moagher declar dezbaterile deschise daca din partea grupurilor parlamentare exista interventii il invit pe domnul sorin lavric la cuvant si ulterior ,"(1952.0, 1955.0)"
99,Domnul Sorin Lavric:,75790,Doamna Alina-Ștefania Gorghiu:,78709, multumesc doamna presedinte alina gorghiu dragi colegi stiti foarte bine ca o societate ca sa fie sanatoasa are nevoie de ierarhii iar ierarhiile se cladesc numai pe seama unei selectii valorice selectia valorica dintre noi se face fie pe seama unor insusiri native congenitale fie pe seama unor calitati dobandite mentale artistice morale organizatorice sociale asa se face selectia valorica pe seama acestor insusiri dar in niciun caz pe seama unor determinatii biologice ca culoarea pielii etnie si sex sexul nu poate fi un criteriu pentru selectia valorica sa va dau cateva exemple hortensia papadat bengescu este o foarte mare scriitoare dar este o mare scriitoare nu pentru ca este femeie ci pentru ca avea har scriitoricesc ganditi va cum ar fi aratat istoria literaturii romane daca lui calinescu i s ar fi impus o cota obligatorie de reprezentare a femeilor romanciere sau poete acolo cum ar fi aratat elisabeta polihroniade a fost un mare sahist roman dar a fost un mare sahist roman nu pentru ca era femeie ci pentru ca mintea ei avea acea inclinatie abstracta de a anticipa mutarile si de aici incolo pot sa fac cate variatiuni vreti doamna anca dragu este o experta in finante dar nu este o experta in finante pentru ca este femeie ci pentru ca are pregatirea si mintea pe care o are doamna diana sosoaca este un bun avocat dar nu pentru ca este femeie ci pentru ca stie sa interpreteze legile si pentru ca are arta retorica rodica boanca la fel este un profesor extraordinar de limba romana dar nu pentru ca e femeie ci pentru ca are har pedagogic ce vreau sa va zic aceasta cota obligatorie inlocuieste calitatea umana cu o cantitate numerica cand aud raportul acesta numeric obligatoriu pe listele electorale imi dau seama ca avem de a face cu opusul meritocratiei avem de a face cu o contraselectie nu mai alegem un om aici in senat pe seama aptitudinii si pe seama recunoasterii din partea semenilor ci alegem pe acel om pentru ca este femeie sau barbat ce legatura are perechea cromozomiala xx si xy cu reprezentarea politica niciuna fara sa va dati seama vrand sa impiedicati o discriminare introduceti un alt tip de discriminare va spuneam selectia valorica aici in acest parlament nu se poate face pe seama etniei a culorii pielii sau a sexului or aceasta lege tocmai asta va introduce inlocuirea meritocratiei cu o contraselectie al carei deznodamant va fi un nou fel de discriminare de aceea aur se opune acestei legi nu va mai spun ca legea existenta deja prevede ca femeile sa fie pe listele electorale niciun partid nu va putea sa participe la alegeri daca pe fiecare lista n ar fi macar o femeie si atunci de ce introduceti acest raport numeric obligatoriu tot ceea ce este obligatoriu inseamna contraselectie va multumesc ,"(6660.0, 6801.0)"
100,Doamna Alina-Ștefania Gorghiu:,78709,Doamna Laura-Iuliana Scântei:,78827, multumesc domnule senator o invit la microfon pe doamna presedinte iulia scantei ,"(1952.0, 1955.0)"
