,start_text,start_index,end_text,end_index,text,timestamp
101,Doamna Laura-Iuliana Scântei:,78827,Doamna Alina-Ștefania Gorghiu:,84706, va multumesc doamna presedinta va multumesc si dumneavoastra pentru oportunitatea de a vorbi si in acest mandat al acestui legislativ cu privire la un proiect care iata urmareste sa stabileasca o cota minima obligatorie de reprezentare la alegerile in determinarea candidatilor listelor de candidati pentru alegerea parlamentului in ambele camere a unui procent deopotriva egal pentru femei minim dar si pentru barbati ca am avea situatii in care ar trebui sa fie valorificat acest procent inclusiv pentru reprezentarea barbatilor in anumite comunitati dupa caz as dori sa incep prin a le multumi tuturor colegilor mei parlamentari barbati si din legislativul doua mii saisprezece doua mii douazeci dar si din acest legislativ pentru ca atat eu cat si alte femei politician senatoare in acest legislativ beneficiem de increderea lor de respectul lor de sustinerea lor atunci cand ne incredinteaza misiuni complicate in comisiile in care lucram rapoarte grele dezbateri grele si chestia aceasta ne motiveaza sa continuam vreau sa fac in acelasi timp un apel la fiecare coleg senator din aceasta sala sa si aduca aminte ce au acasa in filiale cate dintre colegele dumneavoastra din filiale participa in mod activ si au participat in mod activ in campaniile electorale alaturi de dumneavoastra ca senatori la dezbateri locale la competitii politice locale cate v au sustinut pe plan local apoi vreau sa va ganditi la circumscriptiile dumneavoastra electorale municipii orase mari municipii capitale de resedinta dar si din judet in care aveti medici profesoare reprezentante ale artelor in care aveti profesiile liberale reprezentate in care aveti mame care sunt astazi nu si mai desfasoara o activitate in mod concret pentru ca sunt la pensie ganditi va la toate acele femei care au in continuare vointa putinta capacitate intelectuala de a va fi colege in parlament ganditi va la ele si acum revin la ceea ce am auzit mai devreme si speram sa nu aud intr un plen al senatului romaniei spune asa domnul distins coleg senator aur sexul nu trebuie sa fie un criteriu de selectie calitativa ceea ce faceti dumneavoastra este opusul meritocratiei am o intrebare dar sexul poate sa fie un criteriu pentru neselectia femeilor in politica pentru ca asta se intampla distins coleg cred ca nu am fi ajuns sa dezbatem acest proiect de lege daca in legislativul doua mii douazeci doua mii douazeci si patru am fi avut macar o situatie egala cu aceea din legislativul doua mii saisprezece doua mii douazeci in care cota de reprezentare a femeilor in camera deputatilor si in senatul romaniei era de douazeci si doi iar colegii din psd aveau douazeci si sapte reprezentare si acum sunt primii si felicitari pentru acest lucru dar suntem intr un regres iar distinsa mea colega coinitiator v a explicat saptesprezece bine cred ca ati luat procentul pe total parlament la senat stam si mai prost sa stiti si acum vin sa intreb ce au sau ce nu au femeile de nu sunt cooptate in echipe pentru ca eu cred ca puteti sa gasiti pe plan local dupa aceleasi criterii pe care le a mentionat distinsul coleg senator de la aur toate calitatile necesare pe care multe dintre noi le avem si le ati vazut dovedite in parlament in administratiile locale in functii guvernamentale sau in functii ale autoritatilor si institutiilor publice da am propus o cota de treizeci si trei si parca cineva ar fi lezat ca i se ia ceva pe nemerit nu este o obligatie sa promovati in limita celor treizeci si trei femei care nu au si acele criterii de competenta este o invitatie pentru fiecare partid politic sa se gandeasca atunci cand realizeaza cand completeaza acele liste de candidati ca are in circumscriptia aceea in care doreste reprezentare politica mai multe femei cu aceleasi competente profesionale si sa ingaduie prezenta mai multora pe listele de candidati nu este o invitatie la lipsa de meritocratie sau la lipsa de profesionalism ce inseamna treizeci si trei ,"(6828.0, 7122.0)"
102,Doamna Alina-Ștefania Gorghiu:,84706,Domnul Robert-Marius Cazanciuc:,84849, multumesc doamna senator scantei il invit la cuvant pe domnul vicepresedinte robert cazanciuc ,"(1952.0, 7267.0)"
103,Domnul Robert-Marius Cazanciuc:,84849,Doamna Alina-Ștefania Gorghiu:,86984, incercam sa scriu cateva cuvinte dar doamna presedinta nu m a lasat sigur nu se face primavara cu o floare are dreptate si domnul lavric are si doamna scantei dreptate meritocratia este in mod cert calea prin care putem sa facem progres dar si indrazneala curajul sunt cai prin care putem sa facem sa aducem progres in aceasta tara cand romanii au intrat in primul razboi mondial si au ales sa treaca carpatii nu s au gandit ca o sa castige razboiul dar au avut curaj au fost indrazneti cand la inceputul secolului americanii au decis sa dea dreptul de vot sau elvetienii in saptezeci sa dea drept de vot femeilor nu s au gandit neaparat la niste merite electorale pe termen scurt nu ideea ca sunt foarte multe femei care voteaza trebuie sa mane in lupta barbatii ci curajul si indrazneala legile se fac ca sa consfintim o realitate sociala sau se fac de catre cei curajosi ca sa traga societatea dupa ei dupa lideri o tara se poate conduce printr un leadership foarte hotarat la un moment dat eu cred ca aceasta lege e pana la urma o dovada a unui leadership hotarat psd ul a avut un leadership hotarat si a reusit sa puna pe listele parlamentare foarte multe doamne nu cu gandul neaparat la un castig electoral pe termen scurt ci gandindu se la contributia pe care doamnele o pot aduce in parlamentul romaniei eu am acasa doi copii un baiat si o fata diferentele dintre ei sunt extrem de mari in abordarile preocuparilor unor copii de paisprezece saisprezece ani si ma consider foarte norocos ca am un baiat si o fata pentru ca pot sa vad perspective ale unor lucruri de la varsta aceasta la care nu m as fi gandit daca as fi avut doar baieti sau doar fete asa ca dragi colegi in primul rand nu trebuie sa ne fie teama pentru ca am fost asigurat de catre doamnele initiator ca vor avea grija ca pe aceste liste barbatii sa se regaseasca intr o proportie suficient de mare incat vocea lor sa nu se piarda in parlamentul romaniei asa ca eu as alege sa fim mai degraba de partea celor care sunt indrazneti curajosi multumesc foarte mult ,"(7320.0, 7437.0)"
104,Doamna Alina-Ștefania Gorghiu:,86984,Doamna Anca Dana Dragu:,87138, multumesc domnule vicepresedinte o invit la microfonul central pe doamna senator anca dragu din partea grupului usr ,"(1952.0, 2671.0)"
105,Doamna Anca Dana Dragu:,87138,Doamna Alina-Ștefania Gorghiu:,91378, multumesc doamna presedinta am avut emotii la precedentele discursuri si am fost surprinsa de abordarea pe care domnul senator lavric a dat o acestei legi da eu trebuie sa spunem un lucru eu nu am fost presedinta senatului pentru ca sunt un bun finantist am fost ministra finantelor pentru ca sunt un bun finantist dar presedinta a senatului am fost pentru activitatea mea politica si leadershipul politic s a tot vorbit aici despre competente si despre meritocratie si cumva ne ducem in ideea in care femeile nu prea ar fi competente sa aiba functii de decizie sunt multe studii care au analizat de ce prezenta femeilor in partide este mai restransa si ca atare ele sunt mai putin prezente in parlament desigur romania sta pe un loc destul de rau codas in uniunea europeana si in lume in general dar vreau sa va spun cateva dintre motivele pentru care femeile sunt mai putin prezente in partidele politice si tocmai de aceea trebuie la nivelul partidelor si la nivelul parlamentului sa avem in vedere masuri concrete pentru cresterea participarii femeilor deci motivele pentru care prezenta femeilor este scazuta ar fi responsabilitatile ce tin de familie si de constrangeri de timp stim cu totii ca femeile sunt mult mai mult ocupate cu administrarea familiei si a casei standarde mai inalte privind femeile care intentioneaza sa candideze lipsa increderii de sine si o retea fragila de sprijin si aici iar vine randul partidelor politice care sa faca un pas pentru a si sustine membrele absenta femeilor cu rol inspirational si a mentoratului politic stereotipurile de gen predominante privind rolul femeii in societate dar si hartuirea on line este un motiv important pentru care femeile uneori sunt mai timide in politica exista aceasta practica in lumea larga de a sustine participarea femeilor prin cote de gen si am sa va spun cateva dintre tarile care au aceasta legislatie in ultimii douazeci de ani unsprezece state membre au decis introducerea cotelor de gen franta cincizeci inca din doua mii belgia cincizeci in doua mii doi portugalia treizeci si trei in doua mii sase si patruzeci in doua mii nouasprezece slovenia treizeci si cinci in doua mii sase spania patruzeci in doua mii sapte grecia treizeci si trei in doua mii opt patruzeci mai tarziu in doua mii nouasprezece croatia patruzeci inca din doua mii opt polonia treizeci si cinci in doua mii unsprezece irlanda patruzeci in doua mii doisprezece luxembourg patruzeci in doua mii saisprezece si italia patruzeci in doua mii saptesprezece sunt si tari in care participarea femeilor in parlament este de peste patruzeci fara a fi cote de gen intr o legislatie specifica dar in aceste tari observam existenta unor practici si bune practici si intelegeri ale conceptului de egalitate de gen si aici m as referi la danemarca patruzeci dintre parlamentari sunt femei finlanda patruzeci si sase suedia patruzeci si sapte si in general in tarile nordice avem aceasta participare mult mai activa pentru ca avem un mediu mult mai favorabil este vorba de o initiativa legislativa a normalitatii nu este vorba de privilegii pe care le cerem vrem numai sa trecem peste niste stereotipuri si sa avem reprezentarea femeilor in parlament asa cum ele sunt prezente si in societate si dupa cum s a mentionat aici dupa cum a spus si doamna vicepresedinte alina gorghiu prezenta femeilor in forurile decizionale ar imbunatati foarte mult politicile publice mai ales atunci cand vine vorba de scoala de sanatate de educatia copiilor pentru ca acestea sunt lucrurile cu care noi rezonam cel mai tare as vrea sa va mai spun ca obiectivele dezvoltarii durabile pentru doua mii treizeci pe care si romania le a insusit prevad egalitatea de gen pana in doua mii treizeci este obiectivul cinci din cele saptesprezece obiective deci suntem inca departe de acest cincizeci si as vrea sa spun nu in ultimul rand ca la usr plus noi am sustinut participarea femeilor prin masuri specifice in cadrul partidului si ca iata colegele mele senatoare sunt toate detinatoare de portofolii de presedinte de comisie am avut si functia de presedinte al senatului si oricare dintre colegele mele va spun sincer ar fi fost foarte nimerite pentru aceasta functie stimati colegi nu va fie teama sa impartiti puterea cu noi va rog votati aceasta lege si la senat dar si la camera multumesc ,"(7461.0, 7806.0)"
106,Doamna Alina-Ștefania Gorghiu:,91378,Doamna Diana Iovanovici-Șoșoacă:,91583, multumesc doamna presedinta doamna senator dragu este inscrisa la cuvant microfonul doamna senator sosoaca iertati ma aveti microfonul pe care fie doi fie central ,"(1952.0, 7817.0)"
107,Doamna Diana Iovanovici-Șoșoacă:,91583,Doamna Alina-Ștefania Gorghiu:,92800, multumesc am vazut ca acum se vorbeste de aici fara limita dar o sa ma limitez eu ca sa nu ma limitati dumneavoastra nu de alta dar nu vreau sa aratati ca de fapt femeile sunt discriminate in senatul romaniei sunt complet de acord cu multe cu expresia de gen nu sunt de acord pentru ca asa cum ne a explicat domnul profesor doctor streinu cercel anul trecut in medicina exista sex feminin si sex masculin de gen discutam la limba romana si presupun ca vreti sa discutam despre femeile care vreti sa invadeze senatul romaniei si camera deputatilor cu gen neutru presupun ca la asta va referiti de ati folosit aceasta expresie si asa o sa va ajute dumnezeu pentru ca in acel moment va garantez c o sa trebuiasca ,"(7833.0, 7867.0)"
108,Doamna Alina-Ștefania Gorghiu:,92800,Doamna Diana Iovanovici-Șoșoacă:,92963, va rog liniste in sala ascultati vorbitorul va rog putina liniste ca finalizeaza si doamna senator aveti rabdare va rog ,"(1761.0, 8743.0)"
109,Doamna Diana Iovanovici-Șoșoacă:,92963,Doamna Rodica Boancă (din sală):,94040, va multumesc doamna presedinte e pentru prima data cand imi luati apararea e vorba de initiativa legislativa am s o tin minte o sa va intorc favoarea problema este ca in momentul in care veti avea cel putin cincizeci de femei parlamentar ca mine o sa trebuiasca sa aveti initiative legislative prin care sa le cereti partidelor ca cel putin treizeci si trei din listele lor sa fie pline cu barbati de gen neutru probabil ca nu ne mai referim la sex acum nu mai e sex acum e gen din cauza acestei expresii imi pare foarte rau eu voi vota impotriva pentru ca eu sunt crestin ortodoxa si pentru mine exista adam si eva nu exista un adam eva sau adam si adam sau eva si eva cu tot respectul pentru absolut toata lumea dar acesta este parlamentul romaniei iar romania este crestin ortodoxa indiferent ce va spun soros si alti progresisti problema care se pune este ce faceti cu femeile care va tin piept efectiv si sunt o forta ce faceti cand vin ele in parlament va spun eu ce faceti le insultati le imbranciti ,"(7935.0, 8001.0)"
110,Doamna Rodica Boancă (din sală):,94040,Doamna Diana Iovanovici-Șoșoacă:,94090, le amenintati ,"(8013.0, 8013.0)"
111,Doamna Diana Iovanovici-Șoșoacă:,94090,Doamna Alina-Ștefania Gorghiu:,94301, le amenintati corect ,"(8013.0, 8013.0)"
112,Doamna Alina-Ștefania Gorghiu:,94301,Doamna Diana Iovanovici-Șoșoacă:,94372, va rog sa finalizati doamna senator ,"(1761.0, 8743.0)"
113,Doamna Diana Iovanovici-Șoșoacă:,94372,Doamna Alina-Ștefania Gorghiu:,94491, deci stimata doamna presedinta eu v am inteles discursul si va felicit pentru el ,"(4459.0, 8027.0)"
114,Doamna Alina-Ștefania Gorghiu:,94491,Doamna Diana Iovanovici-Șoșoacă:,94537, e in regula ,"(2549.0, 9681.0)"
115,Doamna Diana Iovanovici-Șoșoacă:,94537,Doamna Alina-Ștefania Gorghiu:,95889, insa dupa cum vedeti aveti aici doua exemple de doamne senator care nu si doresc decat un anume tipar de femeie in parlamentul romaniei una care sa taca una care sa taca sa se umileasca si sa asculte ordinele probabil ale femeilor care au mai multe legislaturi in spate probabil ca ar trebui sa vedeti ca am inteles ca sunt foarte multe locuri din acest parlament platite si probabil ca veti dori gen feminin neutru sau cum o fi care sa si plateasca foarte bine scaunele de aici de ce sa nu spunem adevarul pentru ca presa e plina de astfel de articole si vad ca nimeni nu a formulat plangeri penale impotriva jurnalistilor care au acuzat partidele dumneavoastra de vanzarea locurilor in parlament sper ca nu este adevarat ar fi inacceptabil vorbiti de meritocratie nu exista meritocratia este un concept si ar trebui sa i cumparati cartea domnului laurentiu primo cel pe care de peste zece ani l ati interzis la toate televiziunile pentru ca ridica la rang de lege principiul meritocratiei cand o sa vreti meritocratie cu adevarat in parlament nu o sa mai puneti accent pe treizeci si trei gen neutru feminin sau gen neutru masculin ci doar pe meritocratie pe accesul in parlament pe merite profesionale si nu pentru alte calitati care te descalifica va multumesc foarte mult ,"(8047.0, 8140.0)"
116,Doamna Alina-Ștefania Gorghiu:,95889,Doamna Irina Elisabeta Kovács:,96112, o invit la microfon pe doamna senator numai o secunda era inscrisa la cuvant doamna senator kovacs din partea grupului udmr microfonul doi va rog sa l activati pentru doamna senator ,"(8142.0, 8152.0)"
117,Doamna Irina Elisabeta Kovács:,96112,Doamna Alina-Ștefania Gorghiu:,99722, stimata doamna presedinta stimati colegi permiteti mi sa am si eu o interventie referitoare la aceasta initiativa legislativa participarea femeilor la viata publica si la viata politica este si va fi din pacate un subiect de discutie de ce spun din pacate pentru ca feminismul ca miscare militanta va exista atata vreme cat va exista si misoginismul nu neaparat in sens ,"(8158.0, 8177.0)"
118,Doamna Alina-Ștefania Gorghiu:,99722,Doamna Laura-Iuliana Scântei:,100020, multumesc pe procedura o sa i dau cuvantul doamnei scantei imi cer scuze domnule daneasa au vorbit deja din partea grupului n o sa las cate trei vorbitori de grup pentru ca am discutat cu liderii am introdus acest punct tocmai lasand un singur vorbitor ,"(1952.0, 8460.0)"
119,Doamna Laura-Iuliana Scântei:,100020,Doamna Alina-Ștefania Gorghiu:,102187, multumesc foarte mult doamna presedinta adevarul este ca pana in acest mandat doua mii douazeci doua mii douazeci si doi nu credeam ca o sa am un coleg si o colega distinsa senator care sa scoata dintr un rac ca mine emotiv tot naduful si toata starea de neputinta de a va convinge cat de mult gresiti doamna senator ati mentionat la acest pupitru acum cateva momente si ati deturnat pur si simplu dintr un live cum faceti dumneavoastra asa de la inceputul mandatului un proiect care ajuta toate femeile din romania si inclusiv pe barbati de ce ducandu va in aceasta obsesie a dumneavoastra pe care am mai vazut o si la dumneavoastra si la alti colegi din aur de a nu vorbi de gen de a vorbi de sex de a nu vorbi de sex de a vorbi de gen e despre femei si despre barbati si am venit la acest pupitru sa va citez din lege ca sa nu ramaneti cu aceasta optica nu se vorbeste de introducerea unei cote de gen mascate la ce gen v ati fi gandit dumneavoastra ca eu ma gandesc doar la ala din codul explicativ al limbii romane in proiectul nostru se vorbeste despre cota minima de reprezentare de treizeci si trei atat pentru femei cat si pentru barbati din totalul candidaturilor propuse va descalifica limbajul si ducerea intr o eroare asa aproape de minciuna ca sa nu zic altfel juridic sa folositi sa deturnati proiectul care poate ajuta repet la o echitabila reprezentare a femeilor in politica am vrut sa iau cuvantul pentru ca colegii nostri senatori deputati senatori femei si barbati care vor exercita acest drept de vot trebuie sa fie in cunostinta de cauza iar dumneavoastra ati utilizat un concept care este extrem de sensibil dar in acelasi timp neexplicat cum trebuie in dezbaterea publica nu vorbim despre introducerea mascata a unor cote de gen ci vorbim despre o cota de reprezentare atat pentru femei cat si pentru barbati ca sa stiti exact ce anume veti vota sau impotriva a ceea ce veti vota inchei spunandu va atat ca a murit recent si dumnezeu sa o ierte madeleine albright a zis asa exista un loc special in iad pentru femeile care nu ajuta alte femei multumesc ,"(8464.0, 8609.0)"
120,Doamna Alina-Ștefania Gorghiu:,102187,Doamna Laura-Mihaela Fulgeanu-Moagher:,103010, o sa inchid aici dezbaterile generale ,"(8611.0, 9681.0)"
121,Doamna Laura-Mihaela Fulgeanu-Moagher:,103010,Doamna Alina-Ștefania Gorghiu:,104085, va multumesc doamna presedinte raport comun suplimentar asupra propunerii legislative pentru modificarea si completarea legii nr cincizeci si cinci doua mii douazeci privind unele masuri pentru prevenirea si combaterea efectelor pandemiei de covid nouasprezece prezenta propunere legislativa are ca obiect de reglementare modificarea art patru alin din legea nr cincizeci si cinci doua mii douazeci privind unele masuri pentru prevenirea si combaterea efectelor pandemiei de covid nouasprezece guvernul nu sustine adoptarea acestei initiative legislative comisia pentru mediu comisia juridica de numiri disciplina si imunitati si comisia pentru aparare in sedinte separate au analizat propunerea legislativa si avizele primite precum si punctul de vedere al guvernului prin insumarea voturilor exprimate in cadrul sedintelor celor trei comisii a fost adoptat cu majoritate de voturi a membrilor prezenti un raport suplimentar comun de respingere supunand plenului senatului spre dezbatere si adoptare raportul comun suplimentar de respingere si propunerea legislativa va multumesc ,"(8651.0, 8714.0)"
122,Doamna Alina-Ștefania Gorghiu:,104085,Doamna Rodica Boancă:,104775, multumesc la dezbateri generale exista interventii daca nu exista lasam proiectul la vot final punctul treisprezece al ordinii de zi propunerea legislativa pentru modificarea si completarea art patru sute saptezeci si unu din legea nr doua sute douazeci si sapte doua mii cincisprezece privind codul fiscal cu modificarile si completarile ulterioare s a schimbat de vreo doua ore doamna senator tot aveati timp s o vedeti aveti cuvantul in calitate de initiator va rog sa i deschideti microfonul sapte doamnei senator boanca ,"(8714.0, 8755.0)"
123,Doamna Rodica Boancă:,104775,Doamna Alina-Ștefania Gorghiu:,104853, a exact aia era incep eu sau comisia cred ca eu ,"(8758.0, 8760.0)"
124,Doamna Alina-Ștefania Gorghiu:,104853,Doamna Rodica Boancă:,104923, initiatorul primul da ,"(8763.0, 8765.0)"
125,Doamna Rodica Boancă:,104923,Doamna Alina-Ștefania Gorghiu:,109291, initiatorul primul stimati colegi v am nu este la buget finante am initiat un proiect de lege si m am inspirat in a l crea impreuna cu toti colegii mei din aur ne am inspirat dintr un proiect asemanator care exista unde credeti in ungaria ce m a frapat cel mai tare a fost faptul ca a trecut prin doua comisii conduse de reprezentanti ai udmr si a primit vot negativ din partea lor si implicit raport de respingere deci o lege care este foarte buna in ungaria si care ajuta tinerii sa isi achizitioneze o locuinta pe baza unui ajutor de stat pentru ca in situatia in care acesti tineri intemeind o familie aduc pe lume sau adopta copii deci in aceasta situatie legea permitea ca aceasta datorie situata undeva in jurul a o suta cincizeci zero de lei sa fie stearsa in functie de numarul de copii procreati sau adoptati repet m a frapat faptul ca nu am avut nici macar sustinerea udmr o lege repet care intr o alta tara functioneaza foarte bine si care a adus foarte multi tineri acasa vad ca pleaca ai nostri colegi din udmr as fi vrut sa sper sa le aud punctul de vedere vreau sa stiti ca cincizeci si sase patru dintre romani dintre tinerii din romania intre optsprezece si treizeci si patru de ani locuiau cu parintii in doua mii nouasprezece si majoritatea isi dorea o locuinta cred ca si dumneavoastra atunci cand v ati casatorit tineri fiind v ati dorit in primul si in primul rand un acoperis stabil deasupra capului de aceea am initiat aceasta lege pentru ca in romania anului doua mii douazeci si doi s au nascut mai multi copii in strainatate decat in tara pentru ca cei mai multi tineri pleaca din romania avand ca principal motiv lipsa sigurantei unui loc de munca si a posibilitatii de a si cumpara o locuinta de a avea un acoperis stabil deasupra capului chiriile sunt foarte foarte scumpe dupa cum probabil ca stiti sau sunteti informati la nivel mondial cat si european sunt o serie de state care acorda de ani buni astfel de avantaje pentru tinerele familii canada sua republica ceha polonia turcia muntenegru sau ungaria sunt doar cateva dintre tarile care se bucura de o crestere demografica pe baza unei astfel de reglementari legislative proiectul legislativ este unul complex si vine de asemenea si in sprijinul satului romanesc si doreste revigorarea acestuia prin construirea de locuinte noi sau de ocuparea celor deja construite pentru beneficiarii programului care si achizitioneaza o casa in mediul rural locuintele care urmeaza sa fie cumparate prin programul casa noastra merg pana la clasa d din punct de vedere al eficientei energetice ceea ce face ca o serie de case de o frumusete aparte dar care cu trecerea timpului au imbatranit sa poata fi din nou puse in valoare si astfel sa se bucure de un suflu nou vreau doar sa mai amintesc doua lucruri faptul ca acest credit pe care l propune programul casa noastra prin acest proiect legislativ vizeaza atat tinerii din romania pana la treizeci si cinci de ani cat si pe cei din diaspora pana in patruzeci de ani din dorinta de a readuce acasa cat mai multi tineri cat mai multi romani plecati peste hotare si constientizand faptul ca investind in familie si investind in cresterea demografica investim de fapt in noi insine investim in viitorul romaniei investim in bugetul romaniei investim in bugetul de pensii al romaniei ganditi va doar ca peste sase milioane de romani cotizeaza platesc taxe si impozite in strainatate si doar cinci milioane de romani platesc taxe si impozite in romania rugamintea mea ar fi sa faceti abstractie macar o data de culoarea politica si de aversiunea pe care o aveti fata de aur si transcendeti cumva peste aceste sentimente pentru a da tinerilor o sansa avand in vedere ca in ungaria in urma implementarii unei astfel de legi a crescut numarul casatoriilor cu optzeci si cinci si acea prapastie demografica a fost acoperita in proportie de cincizeci si ceva la suta cred ca sunt motive suficient de clare si documentate dovedite sa aducem si in romania un astfel de proiect legislativ care intr adevar implica din punct de vedere financiar un efort dar ca sa recuperam cumva din deficitul de populatie si din deficitul economic trebuie sa si investim si tot timpul vorbim despre investitii nicio investitie nu poate fi mai importanta decat familia decat copiii acestei tari va multumesc ,"(8763.0, 9117.0)"
126,Doamna Alina-Ștefania Gorghiu:,109291,Domnul Nicolae Neagu:,109784, doamna senator astazi toata lumea e draguta cu toata lumea o sa va spun ca nu ati vorbit la punctul treisprezece ca initiativa despre care vorbiti dumneavoastra e la punctul cincisprezece dar o sa luam act de sustinerea dumneavoastra pentru punctul cincisprezece o sa i rog pe colegi sa fie suficient de amabili sa inteleaga acest lucru o sa l rog pe domnul presedinte al comisiei pentru buget finante activitate bancara domnul nicu neagu sa prezinte raportul pentru l219 ,"(9125.0, 9147.0)"
