,start_text,start_index,end_text,end_index,text,timestamp,start,end
50,Domnul Virgil Guran:,99167,Domnul Robert-Marius Cazanciuc:,100662, multumesc domnule senator nu mai sunt alti colegi care doresc sa prezinte declaratii politice drept urmare dau citire senatorilor care au depus intrebari si interpelari in scris doamnele si domnii senatori raluca ioan gabriela vestea mihail muntean lucica dina bumb sorin ioan guran virgil mihail radu mihai hangan andrei aelenei evdochia boanca rodica mateescu sorin cristian costea adrian popa maricel mirea siminica toanchina marius gheorghe vestea mihail bumb sorin ioan mihail radu mihai berea cristian lavric sorin boanca rodica cioromelea valentin rica si un grup de mai multi senatori din care fac parte scantei laura iuliana corlatean titus cazanciuc robert marius bob virgil marius fulgeanu moagher laura mihaela anastase roberta alma bordei cristian banu claudia mihaela costea adrian mateescu sorin cristian mihai alfred laurentiu antonio spataru elena simona declar inchisa sesiunea de intrebari interpelari de astazi de asemenea dau citire listei senatorilor care au depus declaratii politice in scris matei constantin bogdan azamfirei leonard popa maricel mutu gabriel toanchina marius gheorghe dunca marius alexandru tilvar angel bumb sorin ioan anisie monica cristina berea cristinel gabriel bodea marius ivan dan hangan andrei si cosma dorinel declar inchisa sesiunea consacrata declaratiilor politice de astazi va multumesc ,"(6668.0, 6852.0)",6668.0,6852.0
51,Domnul Robert-Marius Cazanciuc:,100662,Domnul Robert-Marius Cazanciuc:,100662,,"(90.0, 6852.0)",90.0,6852.0
52,Domnul Robert-Marius Cazanciuc:,100662,Domnul Robert-Marius Cazanciuc:,100662,,"(90.0, 6852.0)",90.0,6852.0
53,Domnul Robert-Marius Cazanciuc:,100662,Din sală:,101834, ziua buna stimati colegi rugamintea sa semnati in tabelul de prezenta pentru a verifica cvorumul multumesc domnul robert marius cazanciuc rog liderii de grup sa mobilizeze colegii pentru semnaturi domnul robert marius cazanciuc stimati colegi sedinta este condusa de vicepresedinte cazanciuc ajutat de domnii senatori sorin lavric si cristian eugen pirvulescu ordinea de zi a fost distribuita daca sunt comentarii la ordinea de zi daca nu va supun mai multe da e in regula multumesc stimati colegi programul pentru astazi este incepand cu ora doisprezece zero pana la ora treisprezece zero daca nu sunt alte propuneri de prelungire ramanem pentru ora treisprezece zero si in functie de cum vor evolua dezbaterile decidem daca prelungim sau nu programul multumesc punctul unu al ordinii de zi propunerea legislativa pentru completarea legii nr nouazeci si opt doua mii saisprezece privind achizitiile publice si a legii nr nouazeci si noua doua mii saisprezece privind achizitiile sectoriale l243 doua mii douazeci si doi ,"(6215.0, 6218.0)",6215.0,6218.0
54,Din sală:,101834,Domnul Robert-Marius Cazanciuc:,101850, doua sute patruzeci si doi ,"(90.0, 6852.0)",90.0,6852.0
55,Domnul Robert-Marius Cazanciuc:,101850,Doamna Victoria-Violeta Alexandru – deputat:,101998, da doua sute patruzeci si doi declar deschise dezbaterile generale daca avem initiatori da va rog doamna deputat microfonul cinci ,"(1487.0, 2929.0)",1487.0,2929.0
56,Doamna Victoria-Violeta Alexandru – deputat:,101998,Domnul Robert-Marius Cazanciuc:,105167, buna ziua tuturor multumesc domnule presedinte de sedinta sunt o sustinatoare a proiectelor legislative si a oricarei initiative publice sau private care sprijina in mod activ buna ziua persoanele cu dizabilitati respectiv persoanele apartinand grupurilor vulnerabile sa lucreze fac aceasta afirmatie nu doar din considerente financiare desi in mod evident intotdeauna pentru un om munca reprezinta cea mai buna forma de protectie sociala ci fac aceasta afirmatie mai degraba pentru ca am convingerea ca fiecare persoana inclusiv cu atat mai mult o persoana cu dizabilitati isi recapata respectul de sine si increderea in sine lucrand participand intr un mediu activ propunerea legislativa pe care am initiat o in consultare cu mediul neguvernamental inca de acum un an si mai bine vine cu modificari la legea achizitiilor publice respectiv la legea achizitiilor sectoriale in sensul in care pe scurt un procent din planul anual de achizitie asa se numeste adica bugetul anual de achizitie al unei intreprinderi institutii publice sa fie rezervat acest procent zero cinci intreprinderilor sociale de insertie care sunt astazi cand vorbim locul in care cu adevarat lucreaza persoane cu dizabilitati sunt persoane cu dizabilitati ca angajati ai acestor intreprinderi si este un mediu care i incurajeaza si pe cei care apartin acelorasi categorii si care si cauta un loc de munca sa aiba incredere ca vor gasi un climat propice pentru a si desfasura activitatea pentru a se integra in munca consiliul legislativ mi a dat aviz pozitiv cu niste observatii de care am tinut cont consiliul economic si social de asemenea recomandandu mi chiar sa mi cresc procentul asa cum multe dintre tarile europene o si fac va informez ca media este de cinci sase chiar zece in franta eu consider ca la acest moment zero cinci este un procent realist pentru romania pentru a vedea si cum se misca lucrurile urmand ca peste ceva ani dumneavoastra sau eu sa reflectam asupra cresterii procentului propus dumneavoastra astazi prin modificarile pe care le sustin prin urmare imi sustin acest proiect prin acordarea acestui procent ca urmare a recomandarii a directivei parlamentului european si a comisiei parlamentul si parlamentul si consiliul recomanda tarilor sa adapteze legislatia achizitiilor publice astfel incat sa aiba si o componenta sociala si nu doar pasiva adica de acordat sprijin ceea ce nu contest ca e necesar in situatii limita cat mai ales un sprijin activ adica sa incurajeze sa dea incredere oamenilor care au diferite tipuri de dizabilitati ca pot si ei sa munceasca si ca este bine pentru ei pentru starea lor de spirit pentru ei ca oameni sa fie integrati in mod activ pe piata muncii si repet intreprinderile sociale de insertie sunt mediul daca documentati cu atentie sunt mediul in care chiar se lucreaza astazi integrand persoane cu dizabilitati astept cu interes votul dumneavoastra fac precizarea ca in toate comisiile la care am fost am avut ,"(6215.0, 6218.0)",6215.0,6218.0
57,Domnul Robert-Marius Cazanciuc:,105167,Doamna Victoria-Violeta Alexandru:,105228, multumesc doamna deputat ,"(654.0, 6852.0)",654.0,6852.0
58,Doamna Victoria-Violeta Alexandru:,105228,Domnul Robert-Marius Cazanciuc:,105824, ma opresc in curand am avut discutii interesante inclusiv cu reprezentantii anap pentru situatia in care nu s ar prezenta cu o oferta in cuantumul acestui zero cinci intreprinderi sociale de insertie am gasit o solutie acceptabila de autoritatea nationala de achizitii publice in sensul in care autoritatea contractanta trebuie sa faca o documentare inainte dupa care va decide cu privire la acest aspect adica de alocare a fondurilor respective astept cu interes votul urmand sa ma bat si la camera pentru proiect va multumesc frumos ,"(6215.0, 6218.0)",6215.0,6218.0
59,Domnul Robert-Marius Cazanciuc:,105824,Doamna Laura-Mihaela Fulgeanu-Moagher:,105985, multumesc doamnei deputat violeta alexandru din partea guvernului daca avem pe cineva la acest punct nu comisia juridica ,"(654.0, 6852.0)",654.0,6852.0
60,Doamna Laura-Mihaela Fulgeanu-Moagher:,105985,Domnul Robert-Marius Cazanciuc:,107006, va multumesc domnule presedinte de sedinta dau citire raportului comun al comisiei juridice de numiri disciplina imunitati si validari si comisiei economice industrii si servicii propunerea legislativa are ca obiect de reglementare obligatia de a rezerva zero cinci din bugetul anual pentru autoritati entitati contractante cu un buget anual de achizitii mai mare de treizeci de milioane de lei fara tva in vederea participarii la procedura de atribuire doar intreprinderilor sociale de insertie prevazute de legea nr doua sute nouasprezece doua mii cincisprezece privind economia sociala consiliul legislativ si consiliul economic si social au avizat favorabil acest proiect in sedinta comuna din data saisprezece mai doua mii douazeci si doi membrii celor doua comisii au analizat proiectul legislativ punctele de vedere exprimate avizele primite si au formulat si admis amendamente si au hotarat cu unanimitate de voturi ale celor prezenti sa adopte raport comun de admitere cu amendamente admise va multumesc ,"(6215.0, 6218.0)",6215.0,6218.0
61,Domnul Robert-Marius Cazanciuc:,107006,Domnul Cristian Bordei:,107114, multumesc daca sunt interventii cu privire la acest punct da va rog ,"(654.0, 6852.0)",654.0,6852.0
62,Domnul Cristian Bordei:,107114,Domnul Robert-Marius Cazanciuc:,109783, multumesc domnule presedinte de sedinta as vrea sa reamintesc in ideea sprijinirii acestei initiative legislative pentru cei care inca nu sunt familiari cu termenul intreprindere sociala de insertie ca acestea sunt acele entitati care trebuie sa indeplineasca anumite conditii foarte stricte pentru a putea functiona printre cele mai importante aceea de a avea minimum treizeci din totalul angajatilor persoane din categoriile vulnerabile aceasta putand insemna persoane cu dizabilitati fizice sau mentale persoane cu adictii persoane eliberate din penitenciar si altele dar in mare parte persoane neangajabile sau foarte greu angajabile o alta conditie de a utiliza minimum saptezeci din profitul realizat in scopul social precum si o serie de alte conditii in statele europei occidentale asa cum arata si initiatoarea acest sector este foarte dezvoltat pentru ca autoritatile au inteles marile avantaje ale functionarii acestor entitati pe de o parte rolul lor in asigurarea unei vieti demne pentru persoanele vulnerabile prin scoaterea acestora din categoria asistatilor sociali si integrarea lor pe piata muncii avand astfel posibilitatea de a se autointretine si de a face parte din structuri sociale ale persoanelor active iar pe de alta parte statul practic nu numai ca si reduce cheltuielile sociale ci chiar genereaza noi venituri prin taxele si impozitele platite de aceste companii si angajatii lor dar in aceste state autoritatile au inteles si dificultatea majora a acestor intreprinderi sociale de insertie de a rezista pe o piata libera in competitie cu companii care nu au aceleasi obligatii si de aceea au pus in practica un set de masuri de suport printre care si achizitiile sociale despre care vorbim astazi adica rezervarea unei parti din bugetul total al achizitiilor publice pentru achizitii tintite catre intreprinderile sociale de insertie si avem exemple in franta italia spania cu procente care variaza intre cinci zece campioana absoluta fiind primaria barcelonei care aloca anual optzeci din bugetul de achizitii publice pentru acest tip de achizitii comparativ cu aceste prevederi din tarile occidentale ceea ce propune prezentul proiect legislativ si anume alocarea a doar zero cinci din contractele de achizitii publice pentru entitatile care au bugete de peste treizeci de milioane de lei reprezinta doar un mic ajutor pentru intreprinderile sociale de insertie si de aceea cred ca ar trebui sa sustinem cu totii la vot aceasta masura de suport grupul usr va vota pentru si va invit si pe dumneavoastra la acest vot de constiinta multumesc ,"(6215.0, 6218.0)",6215.0,6218.0
63,Domnul Robert-Marius Cazanciuc:,109783,Domnul Császár Károly Zsolt:,110442, multumesc domnule senator bordei daca mai sunt alte interventii daca nu ramane la vot final pentru ziua de luni mergem mai departe stimati colegi punctul doi propunerea legislativa pentru completarea ordonantei de urgenta a guvernului nr patruzeci si unu doua mii saisprezece privind stabilirea unor masuri de simplificare la nivelul administratiei publice centrale si pentru modificarea si completarea unor acte normative l243 doua mii douazeci si doi de aceasta data declar deschise dezbaterile generale daca avem initiator din partea guvernului la acest punct doua sute patruzeci si trei nu comisia pentru administratie va rog domnule karoly csaszar ,"(6215.0, 6218.0)",6215.0,6218.0
64,Domnul Császár Károly Zsolt:,110442,Domnul Robert-Marius Cazanciuc:,111005, va multumesc domnule presedinte in sedinta din zece mai doua mii douazeci si doi membrii comisiei pentru administratie publica au analizat propunerea legislativa si au hotarat sa adopte cu unanimitate de voturi un raport de admitere cu amendamente admise amendamentele admise se regasesc in anexa care face parte integranta din prezentul raport comisia pentru administratie publica supune spre dezbatere si adoptare plenului senatului raportul de admitere cu amendamente admise precum si propunerea legislativa va multumesc ,"(6215.0, 6218.0)",6215.0,6218.0
65,Domnul Robert-Marius Cazanciuc:,111005,Doamna Victoria-Violeta Alexandru:,111471, multumesc daca sunt interventii la acest punct daca nu ramane pentru vot final luni si mergem mai departe la punctul trei propunerea legislativa pentru modificarea si completarea legii nr saptezeci si sase doua mii doi privind sistemul asigurarilor pentru somaj si stimularea ocuparii fortei de munca declar deschise dezbaterile asupra propunerii avem initiator doamna deputat violeta alexandru microfonul cinci va rog ,"(6215.0, 6218.0)",6215.0,6218.0
66,Doamna Victoria-Violeta Alexandru:,111471,Domnul Robert-Marius Cazanciuc:,113944, multumesc si cu acest prilej domnule presedinte de sedinta aici nu stau chiar bine in sensul in care desi consider propunerea legislativa extrem de utila si am s o descriu pe scurt in continuare adevarul este ca exista un aviz negativ de la consiliul legislativ pe care l am parcurs cu atentie avem viziuni diferite asupra acestei chestiuni si nici in comisii nu am primit nereusind sa particip la toate la care acest proiect a fost nu am reusit sa primesc raport pozitiv despre ce este vorba in locul tinerilor cu dizabilitati care fac astazi obiectul care constituie astazi grupul unul dintre ele desigur dar grup sustinut prin masuri active de catre anofm adica sprijin pentru angajator ca sa poata sa i integreze pe piata muncii propun extinderea grupului cu persoane aflate in situatii vulnerabile respectiv persoane cu dizabilitati ceea ce include si tinerii dar nu se limiteaza la tineri experienta si realitatea aratand ca mai degraba persoanele de o anumita varsta se confrunta cu situatii neplacute in incercarea de a se reprofila profesional si de a se reintegra de altminteri definitia pe care am propus o e preluata din legea economiei sociale pe care dumneavoastra parlamentul ati adica nici n am inovat am propus inlocuirea tinerilor cu dizabilitati cu persoane cu dizabilitati care sa faca obiectul masurilor de sprijin active din partea anofm pentru incadrarea pe piata fortei de munca si in fine vin cu o modificare cu privire la definitia angajatorului de insertie asa se numeste persoana juridica care preia persoane apartinand grupurilor vulnerabile integrand si intreprinderile sociale de insertie pentru considerentele pe care le am expus cu ocazia proiectului anterior prezentat eu din respect pentru dumneavoastra si pentru ca am convingerea ca acest proiect poate sa fie util pentru persoanele cu dizabilitati mai ales ca se bazeaza pe o accesare de bani europeni si nu as fi vazut nicio dificultate eu mi am facut datoria sa vin in fata dumneavoastra dar la fel de corecta voi fi si va voi spune ca nu din toate comisiile am primit raport n am ajuns la toate ca sa mi l sustin respectiv punctul de vedere al consiliului legislativ este negativ cu anumite observatii pe care eu le am inclus in amendamente dar aceasta este situatia va rog luati decizia pe care o considerati inteleapta va multumesc ,"(6215.0, 6218.0)",6215.0,6218.0
67,Domnul Robert-Marius Cazanciuc:,113944,Doamna Laura Georgescu:,114116, multumesc doamnei deputat din partea guvernului la acest punct nu comisia de munca doamna senator georgescu va rog microfonul sapte ,"(654.0, 6852.0)",654.0,6852.0
68,Doamna Laura Georgescu:,114116,Domnul Robert-Marius Cazanciuc:,115038, comisia pentru munca familie si protectie sociala a fost sesizata de catre biroul permanent in vederea dezbaterii si elaborarii raportului asupra propunerii legislative pentru modificarea si completarea legii nr saptezeci si sase doua mii doi privind sistemul asigurarilor pentru somaj si stimularea ocuparii fortei de munca consiliul legislativ da un aviz negativ consiliul economic si social avizeaza favorabil comisia pentru buget finante activitate bancara si piata de capital si comisia economica industrii si servicii avizeaza negativ in data de saptesprezece mai comisia pentru munca familie si protectie sociala a hotarat cu majoritatea voturilor senatorilor prezenti intocmirea unui raport de respingere cu amendamente respinse in raport cu obiectul de reglementare propunerea legislativa face parte din categoria legilor organice senatul fiind prima camera sesizata va multumesc ,"(6215.0, 6218.0)",6215.0,6218.0
69,Domnul Robert-Marius Cazanciuc:,115038,Domnul Radu-Mihai Mihail:,115243, e in regula multumesc stimati colegi daca sunt interventii la acest punct daca nu mergem mai departe da va rog domnule radu mihail procedura la acest punct ,"(654.0, 6852.0)",654.0,6852.0
70,Domnul Radu-Mihai Mihail:,115243,Domnul Robert-Marius Cazanciuc:,115596, va multumesc domnule presedinte dat fiind ca am constatat ca se pare ca opozitia are majoritate in plen in acest moment conform art nouazeci si unu va solicit din partea grupului usr sa votam modificarea ordinii de zi si sa includem pe ordinea de zi si votul pe initiativele legislative aflate acum pe ordinea de zi multumesc ,"(6215.0, 6218.0)",6215.0,6218.0
71,Domnul Robert-Marius Cazanciuc:,115596,Domnul Radu-Mihai Mihail:,115805, deci recunosc ca n am inteles domnule radu mihail ce doriti rog liderii sa vina la tribuna va rog de la microfonul central va rog ,"(1487.0, 2929.0)",1487.0,2929.0
72,Domnul Radu-Mihai Mihail:,115805,Domnul Robert-Marius Cazanciuc:,116230, multumesc explicatia este urmatoarea simpla asa cum ati vazut si din primul vot si uitandu ma in sala in acest moment opozitia in senatul romaniei are mai multi senatori decat puterea drept pentru care conform art nouazeci si unu solicitam sa votam modificarea ordinii de zi si sa adaugam pe ordinea de zi votarea tuturor initiativelor legislative pentru ca avem sansa sa ni le trecem multumesc ,"(6215.0, 6218.0)",6215.0,6218.0
73,Domnul Robert-Marius Cazanciuc:,116230,Domnul Cristian-Augustin Niculescu-Ţâgârlaş:,116340, liderii va rog din partea grupului pnl va rog ,"(1487.0, 2929.0)",1487.0,2929.0
74,Domnul Cristian-Augustin Niculescu-Ţâgârlaş:,116340,Domnul Robert-Marius Cazanciuc:,116851, domnule presedinte stimati colegi avand in vedere dispozitiile art nouazeci si unu invocate de catre distinsul meu coleg lider al grupului usr ea este formulata intr un mod inadmisibil in conditiile in care nu se justifica urgenta unor de introducere a unor proiecte pe ordinea de zi aceasta urgenta era obligatoriu a fi motivata pentru a putea discuta o modificare reala a ordinii de zi motiv pentru care grupul pnl va vota impotriva va multumesc ,"(6215.0, 6218.0)",6215.0,6218.0
75,Domnul Robert-Marius Cazanciuc:,116851,Domnul Constantin-Bogdan Matei:,117539, stimati colegi avand in vedere ca am votat la inceputul sedintei ordinea de zi si ca dispozitiile art nouazeci si unu sunt destul de clare in sensul ca ordinea de zi poate fi modificata doar pentru motive bine intemeiate si urgente cred ca solicitarea liderului usr este inadmisibila pur si simplu va multumesc mergem mai departe punctul patru al ordinii de zi propunerea privind instituirea zilei sportului romanesc in prima duminica a lunii iunie declar deschise dezbaterile generale din partea initiatorului daca este prezent domnul senator matei e initiator si initiator si presedinte de comisie doua microfoane atunci sase si sapte ,"(6215.0, 6218.0)",6215.0,6218.0
76,Domnul Constantin-Bogdan Matei:,117539,Domnul Robert-Marius Cazanciuc:,118047, multumesc multumesc frumos domnule presedinte in ziua de trei mai doua mii douazeci si doi membrii comisiei pentru tineret si sport au hotarat cu majoritate de voturi sa adopte un raport de admitere cu un amendament admis care se regaseste in anexa prezentului raport comisia pentru tineret si sport supune spre dezbatere si adoptare plenului senatului raportul de admitere cu un amendament admis si propunerea legislativa va multumesc frumos domnule presedinte ,"(6215.0, 6218.0)",6215.0,6218.0
77,Domnul Robert-Marius Cazanciuc:,118047,Domnul Constantin-Bogdan Matei:,118196, multumesc ati vorbit ca initiator sau ca presedinte si ca presedinte va rog microfonul central ,"(6215.0, 6218.0)",6215.0,6218.0
78,Domnul Constantin-Bogdan Matei:,118196,Domnul Robert-Marius Cazanciuc:,118986, multumesc multumesc frumos din nou domnule presedinte stimati colegi asa cum sarbatorim ziua internationala a sportului pentru dezvoltare si pace sau ziua olimpismului consider ca este important sa avem si in romania o zi nationala a sportului romanesc o zi speciala pentru cei care au scris sau scriu istorie pentru romania o zi pentru ambasadorii adevarati ai tarii noastre sportivi antrenori dar si pentru toti cei care activeaza in domeniul sportiv mai mult aducem un plus de constientizare in randul copiilor nostri despre importanta practicarii exercitiului fizic in mod independent stimati colegi va rog sa sustineti aceasta initiativa legislativa grupul partidului social democrat va vota pentru va multumesc ,"(2929.0, 6218.0)",2929.0,6218.0
79,Domnul Robert-Marius Cazanciuc:,118986,Doamna Diana Iovanovici-Șoșoacă:,119147, multumesc din partea guvernului daca avem pe cineva la acest punct nu interventii doamna sosoaca va rog microfonul trei ,"(654.0, 6852.0)",654.0,6852.0
80,Doamna Diana Iovanovici-Șoșoacă:,119147,Domnul Robert-Marius Cazanciuc:,119434, cu tot respectul am vorbit cu mai multi colegi se solicita verificarea prezentei pentru ca sunt foarte multe cartele bagate in aparat dar nu sunt persoanele respective de aceea va rog frumos sa verificati prin vot daca avem cvorum multumesc ,"(2929.0, 2930.0)",2929.0,2930.0
81,Domnul Robert-Marius Cazanciuc:,119434,Domnul Constantin-Bogdan Matei:,120058, stimata colega asa cum s a stabilit in sedinta precedenta astazi nu este vot pe niciun proiect ci doar dezbateri in consecinta nu avem nevoie de cvorumul obisnuit pentru a tine dezbaterile declar deschise dezbaterile generale initiator avem domnul matei va rog ,"(1487.0, 2929.0)",1487.0,2929.0
82,Domnul Constantin-Bogdan Matei:,120058,Domnul Robert-Marius Cazanciuc:,120803, imi dati de aici multumesc multumesc frumos domnule presedinte aceasta initiativa a fost depusa in urma unei solicitari venite din partea federatiei romane de rugby si le multumesc pe aceasta cale data de patru mai are o insemnatate deosebita pentru rugby ul romanesc este prima participare a echipei nationale de rugby la jocurile olimpice patru mai o mie noua sute douazeci si patru dupa o calatorie lunga de trei zile pe resurse financiare proprii au jucat primul meci la olimpiada din rugby ul romanesc dar au si adus pentru romania singura medalie de bronz a unei echipe romanesti categoria jocuri sportive asadar stimati colegi va rog sa sustineti aceasta initiativa legislativa va multumesc domnule presedinte ,"(2929.0, 6218.0)",2929.0,6218.0
83,Domnul Robert-Marius Cazanciuc:,120803,Doamna Laura-Mihaela Fulgeanu-Moagher:,121628, multumesc daca ne va ajuta sa devenim si campioni cred ca o sa aveti un vot unanim daca sunt interventii stimati colegi din partea guvernului pe acest proiect nu dintre colegi nu sunt interventii ramane la vot final pentru luni mergem mai departe punctul sase propunerea legislativa pentru transparenta utilizarii si eficientei sumelor in cadrul programului pentru promovarea exporturilor prin completarea ordonantei de urgenta a guvernului nr o suta douazeci doua mii doi privind aprobarea sistemului de sustinere si promovare a exportului cu finantare de la bugetul de stat declar deschise dezbaterile generale initiator nu din partea guvernului la acest punct nu comisia economica si servicii antreprenoriat microfonul sapte doamna moagher ,"(6215.0, 6218.0)",6215.0,6218.0
84,Doamna Laura-Mihaela Fulgeanu-Moagher:,121628,Domnul Robert-Marius Cazanciuc:,122813, va multumesc domnule presedinte raport comun asupra propunerii legislative pentru transparenta utilizarii si eficientei sumelor din cadrul programului pentru promovarea exporturilor prin completarea ordonantei de urgenta nr o suta douazeci doua mii doi privind aprobarea sistemului de sustinere si promovare a exportului cu finantare de la bugetul de stat expunerea legislativa are in fapt ca obiect completarea ordonantei de urgenta nr o suta douazeci doua mii doi privind aprobarea sistemului de sustinere si promovare a exportului cu finantare de la bugetul de stat republicata cu modificarile si completarile ulterioare cu un nou articol respectiv art treizeci si unu consiliul legislativ a avizat favorabil acest proiect consiliul economic si social a avizat nefavorabil proiectul de act normativ in raport cu obiectul de reglementare propunerea legislativa face parte din categoria legilor ordinare fata de cele prezentate comisia economica industrii si servicii si comisia pentru antreprenoriat si turism supun plenului senatului pentru dezbatere si adoptare raportul comun de respingere a propunerii legislative va multumesc ,"(6215.0, 6218.0)",6215.0,6218.0
