,start_text,start_index,end_text,end_index,text,timestamp,start,end
1,S T E N O G R A M A,0,şedinţei Senatului din 25 mai 2022,21, ,"(90.0, 6852.0)",90.0,6852.0
2,şedinţei Senatului din 25 mai 2022,21,S U M A R,59, ,"(90.0, 6852.0)",90.0,6852.0
3,S U M A R,59,S T E N O G R A M A,3084, unu intrebari si interpelari trei patru douazeci treizeci si noua doi declaratii politice trei patru douazeci treizeci si opt treizeci si noua trei aprobarea ordinii de zi si a programului de lucru treizeci si noua patru dezbaterea propunerii legislative pentru completarea legii nr nouazeci si opt doua mii saisprezece privind patruzeci achizitiile publice si a legii nr nouazeci si noua doua mii saisprezece privind achizitiile sectoriale din legea nr patruzeci si sapte o mie noua sute nouazeci si doi privind organizarea si functionarea curtii constitutionale republicata ,"(90.0, 6852.0)",90.0,6852.0
4,S T E N O G R A M A,3084,şedinţei Senatului din 25 mai 2022,3105, ,"(90.0, 6852.0)",90.0,6852.0
5,şedinţei Senatului din 25 mai 2022,3105,Domnul Virgil Guran:,3367, sedinta a inceput la ora noua treizeci si unu lucrarile sedintei au fost conduse de domnul virgil guran inlocuit de domnul robert marius cazanciuc vicepresedinti ai senatului asistati de domnul sorin lavric secretar al senatului ,"(90.0, 6852.0)",90.0,6852.0
6,Domnul Virgil Guran:,3367,Domnul Maricel Popa:,3934, buna dimineata doamnelor si domnilor senatori declar deschisa sesiunea de intrebari interpelari de astazi douazeci si cinci mai doua mii douazeci si doi conducerea fiind asigurata de subsemnatul senator virgil guran vicepresedinte al senatului asistat de domnul senator ion mocioalca si domnul senator sorin lavric secretari ai senatului conform programului aprobat timpul alocat pentru sesiunea de intrebari interpelari este de saizeci de minute repartizat pe grupurile parlamentare potrivit ponderii acestora invit la microfon pe domnul senator popa maricel ,"(330.0, 377.0)",330.0,377.0
7,Domnul Maricel Popa:,3934,Domnul Virgil Guran:,7778, domnule presedinte de sedinta stimati colegi am o interpelare pentru domnul ministru al transporturilor domnul grindeanu domnule ministru modernizarea infrastructurii argumentul psd pentru dezvoltarea moldovei parlamentarii partidului social democrat din iasi dar si din celelalte judete ale moldovei alaturi de ministrul transporturilor si au asumat marirea ritmului de lucru la principalele proiecte de infrastructura constructia de drumuri noi rapide dar si modernizarea celor deja existente inseamna o mai buna mobilitate oportunitati noi pentru mediul de afaceri deci in final o crestere a calitatii vietii pentru autostrada moldovei a7 ministrul transporturilor a anuntat recent ca au fost depuse douazeci si opt de oferte pentru constructia celor patru tronsoane ale segmentului buzau focsani adica optzeci si doi km totodata au fost facuti pasi importanti pentru ca in curand sa se scoata la licitatie portiunile de autostrada cuprinse intre focsani si bacau dar si bacau pascani realizarea autostrazii moldovei include douazeci de trenuri care vor deservi municipiile bucuresti ploiesti buzau focsani bacau iasi si suceava au fost deblocate lucrarile la varianta ocolitoare a orasului barlad aceasta investitie este finantata prin programul operational infrastructura mare si are o valoare de peste o suta optzeci si sase de milioane de lei se executa foraje geotehnice in cadrul studiului de fezabilitate pentru drumul expres bacau piatra neamt acum cateva zile a fost semnat un contract in valoare de nouazeci si patru de milioane de lei pentru dezvoltarea platformei multimodale de la galati un proiect care va asigura un flux mai eficient de marfuri in acest port din moldova catre constanta va fi refacuta infrastructura rutiera din zona platformei si va fi relocat un segment de cale ferata sa nu uitam podul suspendat braila tulcea cea mai mare lucrare din ultimii treizeci de ani din romania care va inlesni transportul de marfuri si de persoane pe ruta moldova dobrogea a ajuns la un stadiu fizic de executie de aproape saizeci si cinci podul are o lungime de aproximativ doi km la care se adauga zeci de kilometri de drum de acces si legaturi la finalizare va fi al treilea pod din europa din punct de vedere al deschiderii centrale si al lungimii totale din acest motiv domnule ministru al transporturilor domnul sorin grindeanu va rog sa ne precizati cand vom avea prima cupa pe autostrazile a7 si a8 noi speram ca in acest an va multumesc cu deosebita consideratie senator de iasi maricel popa multumesc ,"(566.0, 654.0)",566.0,654.0
8,Domnul Virgil Guran:,7778,Domnul Călin-Gheorghe Matieș:,7883, multumesc si eu dau cuvantul domnului senator maties calin gheorghe ,"(654.0, 6218.0)",654.0,6218.0
9,Domnul Călin-Gheorghe Matieș:,7883,Domnul Virgil Guran:,8103, multumesc mult domnule presedinte stimati colegi pot sa citesc o interpelare si dup aia intrebarile domnule presedinte interpelare si dup aia intrebarile sau mergem intrebari si ,"(6215.0, 6218.0)",6215.0,6218.0
10,Domnul Virgil Guran:,8103,Domnul Călin-Gheorghe Matieș:,8163, nu puteti pe amandoua pe rand sa ,"(90.0, 6852.0)",90.0,6852.0
11,Domnul Călin-Gheorghe Matieș:,8163,Domnul Virgil Guran:,8234, ok va multumesc domnule presedinte ,"(654.0, 6852.0)",654.0,6852.0
12,Domnul Virgil Guran:,8234,Domnul Călin-Gheorghe Matieș:,8269, cu placere ,"(90.0, 6852.0)",90.0,6852.0
13,Domnul Călin-Gheorghe Matieș:,8269,Domnul Virgil Guran:,11946, am o interpelare care aceasta interpelare a fost cumva la sugestia si redactata de studentii din alba studentii care au fost in internship care si doreau intrebari aveau intrebari pentru ministrul invatamantului si atunci interpelarea suna cam asa si este adresata domnului sorin cimpeanu ministrul educatiei obiectul interpelarii premiile si bursele pentru elevii care participa la alte concursuri decat cele organizate de ministerul educatiei o problema pentru elevii sportivi de performanta stimate domnule ministru sport si spectacol sunt doua cuvinte pe care in ultimele doua decenii le intalnim tot mai des ingemanate faptul ca sportul a devenit in zilele noastre un spectacol in adevaratul sens al cuvantului este un fapt neindoielnic sportul este considerat a fi unul dintre pilonii de baza ai unei natiuni acest lucru este generat de faptul ca sanatatea si dezvoltarea unei societati depind de starea fizica a fiecarui individ in zilele noastre putem spune ca orice sfera a activitatii umane este dependenta de sport tot mai multe studii ne arata faptul ca activitatile zilnice de orice fel sunt duc la stimularea producerii de substante care protejeaza neuronii acest lucru conduce la imbunatatirea memoriei dar si a puterii de concentrare de asemenea mai multe studii arata ca practicarea unei activitati fizice duce la imbunatatirea stimei si imaginii de sine multe dintre problemele de sanatate cauzate de lipsa practicarii sportului sunt obezitatea dependenta de nicotina si hipertensiunea arteriala toate ducand la o rata mare a atacului de cord la tineri in acest moment activitatea fizica isi aduce contributia ca agent de reglare care scade riscul de boli cardiovasculare imbunatatind in acelasi timp starea de sanatate a corpului si contribuind la imbunatatirea sanatatii celor care o practica plecand de la premisa ca este nevoie de o recunoastere strategica in domeniul stiintei sportului si educatiei fizice apreciez ca acest domeniu trebuie sa faca obiectul de interes al sanatatii si prosperitatii oamenilor incepand cu varstele cele mai fragede argumentul principal este ca in momentul in care elevii sunt stimulati si recompensati cu premii pentru rezultate deosebite la diferite concursuri indiferent de natura lor ei se ambitioneaza si lupta mai mult pentru a fi mereu pe podium in temeiul art o suta doisprezece din constitutia romaniei republicata si al art o suta saptezeci si sapte din regulamentul senatului va solicit sa mi raspundeti in scris la urmatoarele intrebari unu daca apreciati oportun faptul ca in prezent doar elevii care participa la concursuri si competitii organizate de ministerul educatiei sunt premiati si recompensati de catre scolile apartinatoare doi cum apreciati faptul ca legea nr doua sute treizeci si cinci doua mii zece nu specifica nimic despre acordarea de premii si recompense de orice fel pentru elevii care au rezultate foarte bune la concursuri competitii organizate de orice fel de orice alte federatii sau organizatii altele decat ministerul educatiei trei daca apreciati ca nepremierea elevilor care au obtinut rezultate la competitii sportive altele decat cele organizate in ministerul educatiei reprezinta o forma de discriminare patru daca ministerul educatiei are o politica de stimulare a autoritatilor administrative publice locale in vederea cresterii finantarii complementare privind cheltuielile cu premiile acordate elevilor pentru castigarea unor competitii sportive cu respect calin maties senator psd de alba am doua intrebari daca mi permiteti le fac scurte ,"(814.0, 938.0)",814.0,938.0
14,Domnul Virgil Guran:,11946,Domnul Călin-Gheorghe Matieș:,11977, va rog ,"(638.0, 3019.0)",638.0,3019.0
15,Domnul Călin-Gheorghe Matieș:,11977,Domnul Virgil Guran:,18775, multumesc din suflet prima intrebare o adresez domnului lucian romascanu ministrul culturii si cumva trag niste semnale de alarma raportat la evenimentul care s a intamplat in alba iulia sambata stimate domnule ministru contextul la cei o suta la o suta cincizeci de ani de la moartea lui avram iancu primarul municipiului alba iulia gabriel codru plesa a montat statuia lui bethlen gabor chiar in inima cetatii bethlen gabor a fost principe al transilvaniei si rege al ungariei care a avut un rol primordial in maghiarizarea sistematica a ardealului si stergerea identitatii nationale a romanilor din transilvania acelasi bethlen gabor care l a slujit pe sigismund bathory si a fost membru al escortei princiare la inceputul anului o mie cinci sute nouazeci si sapte cand sigismund bathory a calatorit la praga la imparatul rudolf pentru a intari alianta transilvaniei cu imperiul habsburgic si a l intoarce pe imparat impotriva voievodului mihai viteazul acelasi bethlen gabor care a luptat impotriva lui mihai viteazul la selimbar din regulamentul senatului va solicit sa mi raspundeti in scris la urmatoarele intrebari unu daca ministerul culturii a acordat un aviz prealabil pentru descarcare arheologica montare statuie bethlen gabor in strada unirii din cadrul cetatii alba carolina a municipiului alba iulia doi daca ministerul culturii va efectua prin structura teritoriala un control privind modalitatea in care a fost aprobata si executata construirea si amplasarea statuii bethlen gabor in sensul giratoriu de pe strada unirii trei daca ministerul culturii va amenda primaria alba iulia si eparhia reformata din ardeal pentru construirea fara aviz a unei statui pe domeniul public al uat ului si in zona de monument istoric pentru care este necesara descarcare arheologica patru daca ministerul culturii va dispune desfiintarea constructiei si sesizarea organelor de urmarire penala cinci care este prejudiciul estimat in urma edificarii nelegale a constructiei pe domeniul public al uat ului si as vrea doar o intrebare adresata domnului paul racovita inspector general al inspectoratului de stat in constructii contextul nu l mai citesc este acelasi adresat ministerului culturii doar intrebarile difera si o sa va citesc intrebarile pe care le am adresat inspectoratului unu daca inspectoratul de stat in constructii va efectua prin structura teritoriala un control privind modalitatea in care a fost aprobata si executata construirea si amplasarea statuii lui bethlen gabor in sensul giratoriu de pe strada unirii doi daca institutul de constructii va amenda primaria alba iulia si eparhia reformata din ardeal pentru construirea neautorizata a unui bun aflat in proprietate privata pe teren bun aflat in din domeniul public al uat ului trei daca institutul de stat in constructii va dispune desfiintarea constructiei si sesizarea organelor de urmarire penala patru care este prejudiciul estimat in urma edificarii nelegale a constructiei pe domeniul public al uat ului domnule presedinte va multumesc din suflet multumesc stimati colegi ,"(1319.0, 1452.0)",1319.0,1452.0
16,Domnul Virgil Guran:,18775,Doamna Ionela-Cristina Breahnă-Pravăț:,19294, multumesc si eu domnule senator dau cuvantul domnului senator dorinel cosma pentru intrebari interpelari domnule senator da vreti sa prezentati declaratia politica atunci deci nu intrebarea interpelarea nu atunci pentru declaratii politice inca putin ca deschidem sesiunea dupa aceea daca mai are cineva intrebari interpelari va rog doamna senator breahna pravat ionela cristina si urmeaza doamna senator sosoaca ,"(1456.0, 1487.0)",1456.0,1487.0
17,Doamna Ionela-Cristina Breahnă-Pravăț:,19294,Domnul Virgil Guran:,23885, buna ziua multumesc domnule presedinte as avea de prezentat trei interpelari si doua intrebari cu un continut destul de succint spun eu si ulterior dupa epuizarea listei de intrebari interpelari o declaratie politica prima interpelare este adresata domnului ministru sorin cimpeanu ministrul educatiei si vizeaza o solicitare privind elaborarea cadrului legal referitor la amplasarea panourilor fotovoltaice pe acoperisurile institutiilor de invatamant domnule ministru avand in vedere faptul ca in scurt timp comisia europeana va impune un nou set de reglementari prin care fiecare institutie va fi obligata sa monteze pe acoperis panouri fotovoltaice in vederea atingerii independentei energetice si considerand aceasta directiva o oportunitate pentru scolile din romania de a se dezvolta va rog sa mi transmiteti daca ati luat legatura cu ministrii de resort respectiv cel al energiei si cel al proiectelor europene in vederea identificarii unor solutii rapide care sa fie puse in aplicare in acest sens printre beneficiile cele mai importante putem enumera electrificarea tuturor scolilor din romania care inca nu sunt electrificate iar acolo unde nu exista aceasta problema beneficiul ar putea consta evident in scaderea substantiala a costurilor energiei si a costurilor pentru incalzire va multumesc in incheiere va solicit sa mi raspundeti in scris la aceasta solicitare a doua interpelare este adresata de asemenea domnului ministru sorin cimpeanu si vizeaza o solicitare privind asigurarea echipamentelor necesare pentru desfasurarea testarii standardizate domnule ministru ati impus de curand un proiect pilot pentru testarea standardizata proiect in care au fost incluse trei sute douazeci si noua de scoli din toata tara recent o doamna profesor din cadrul uneia dintre aceste scoli a atras atentia ca nu au fost livrate suficiente echipamente pentru aceasta testare standardizata iar reprezentantii companiei brio care a asigurat buna desfasurare a acestui proces respectiv a acestei testari au sugerat ca fiecare copil ar trebui sa foloseasca un telefon inteligent propriu va rog sa imi transmiteti pe cale de consecinta care au fost deficientele inregistrate in procesul de organizare si masurile pe care le ati solicitat acestei companii care organizeaza cum spuneam acest proces de asemenea va rog sa mi comunicati in scris si care sunt costurile acestui proiect va multumesc si de asemenea in incheiere va solicit sa mi raspundeti in scris atat pe adresa de e mail personala cat si pe adresa de e mail a grupului senatorial al partidului social democrat si inca o interpelare adresata domnului ministru eduard novak ministrul sportului o interpelare care vine in contextul in care in municipiul bacau s au desfasurat doua festivitati care au avut la baza doar schimbarea unor denumiri de institutii pentru entitati care functioneaza in cladiri care au pierdut lupta cu timpul aflate intr o evident precara stare de functionare si mai suparator decat atat inconjurate de buruieni la propriu prin urmare obiectul interpelarii vizeaza o solicitare adresata ministerului in sensul comunicarii demersurilor facute de directia de sport din municipiul bacau pentru implementarea si accesarea unor fonduri in vederea implementarii unor proiecte care sa conduca la reabilitarea acestor cladiri pentru care s au schimbat etichetele domnule ministru avand in vedere faptul ca in municipiul bacau au fost modificate denumirile salilor sporturilor si de atletism desi acestea cum spuneam se afla intr o stare avansata de degradare va rog sa imi transmiteti ce demersuri concrete au fost efectuate in ultimii trei ani de catre conducerea directiei judetene pentru sport si tineret bacau actuala directie judeteana de sport bacau in urma hotararii de guvern nr treizeci si cinci doua mii douazeci si doi denumirea fiind schimbata ca urmare a acestei hotarari de guvern deci ce demersuri au fost efectuate pentru a solicita finantare in vederea reabilitarii si modernizarii celor doua imobile de mai sus precum si a altor obiective sportive din municipiul si judetul bacau va multumesc si in incheiere va solicit domnule ministru sa mi raspundeti in scris atat pe adresa personala de e mail cat si pe adresa senatoriala a grupului partidului social democrat va multumesc senator psd de bacau cristina breahna pravat ma opresc aici multumesc ,"(1503.0, 1809.0)",1503.0,1809.0
18,Domnul Virgil Guran:,23885,Doamna Diana Iovanovici-Șoșoacă:,23980, multumesc si eu are cuvantul doamna senator diana iovanovici sosoaca ,"(6215.0, 6218.0)",6215.0,6218.0
