,start_text,start_index,end_text,end_index,text,timestamp
85,Doamna Diana Iovanovici-Șoșoacă:,89497,Domnul Florin-Vasile Cîțu:,91352, cred ca acest parteneriat ar trebui sa existe si nu ar trebui respins pentru ca biserica este cea mai raspandita la nivel national nu numai prin biserici dar si prin manastiri au asezaminte de ajutor si cred ca statul ar trebui sa aiba programe prin care prin colaborare cu biserica sa ajute cat mai multi oameni pentru ca statul roman din pacate a esuat in schimb sunt nenumarate actiuni ale bisericii care ajuta oamenii nevoiasi in loc sa i ajute statul si va intreb pentru ce nu faceti nu legalizati acest lucru se duc nenumarati calugari se duc preoti care chiar fac ceva pentru binele comunitatii aveti inclusiv in bucuresti in sectorul doi pe eminescu este un loc unde un preot a reusit sa construiasca l a ajutat primaria sa construiasca un camin pentru batrani dupa care nimeni nu i a mai dat un leu noi participam si ajutam acest camin sa si plateasca tot ce are nevoie la utilitati plus donam mancare saptamanal ca sa poata sa hraneasca acesti oameni pentru ca pensiile lor sunt foarte mici si nu ajung mai ales cu pretul utilitatilor atat de mare cu ce va deranjeaza acest parteneriat ca atunci cand vin alegerile va duceti imediat la biserica si i cereti ajutorul sa propovaduiasca prin biserica in numele partidelor oare nu ar trebui sa existe parteneriat pentru sprijin social mai ales ca statul nu face fata ajutorarii acestor oameni avem saptezeci oameni saraci biserica este singura care poate ajuta cel mai bine cunoaste realitatile preotii sunt in relatie cu comunitatile lor nu cum sunt primarii cei mai multi si tot ei incearca sa ajute pe toata lumea incercati sa faceti aceste parteneriate si s ar putea sa vedeti o romanie mult mai infloritoare nu saptezeci saraci si peste treizeci sub pragul saraciei multumesc ,"(6987.0, 7122.0)"
86,Domnul Florin-Vasile Cîțu:,91352,Doamna Kovács Irina Elisabeta:,93761, va multumesc domnule senator daca mai sunt si alte interventii nu mai sunt incheiem dezbaterile initiativa legislativa ramane la vot final punctul douazeci si patru proiectul de lege pentru aprobarea ordonantei de urgenta a guvernului nr sapte doua mii douazeci si doi privind stabilirea unor masuri pentru aplicarea regulamentului de punere in aplicare a da avem ma scuzati din partea udmr microfonul doi ,"(7344.76, 7352.76)"
87,Doamna Kovács Irina Elisabeta:,93761,Domnul Florin-Vasile Cîțu:,94359, multumesc domnule presedinte pe scurt as dori sa intervin acest proiect de lege introduce in legea educatiei nationale notiunea de director de extensie universitara ca functie de conducere la nivel universitar directorul de extensie are conform acestei initiative legislative rolul de a asigura managementul extensiei universitare de a asigura calitatea si eficienta activitatii in cadrul extensiei precum si dezvoltarea acesteia conform nevoilor locale si a strategiei universitare udmr sustine acest proiect de lege va multumesc ,"(7301.76, 7344.76)"
88,Domnul Florin-Vasile Cîțu:,94359,Domnul Ştefan Pălărie:,95058, va multumesc doamna senator daca mai sunt alte interventii nu mai sunt incheiem dezbaterile initiativa legislativa ramane la vot final punctul douazeci si sapte propunerea legislativa pentru completarea art nouazeci si patru la legea educatiei nationale nr unu din cinci ianuarie doua mii unsprezece raportul comisiei pentru invatamant este de respingere a propunerii legislative propunerea legislativa face parte din categoria legilor organice si se adopta cu votul majoritatii senatorilor senatul este camera decizionala incepem dezbaterile daca sunt interventii din partea colegilor senatori da domnule senator palarie va rog microfonul central da ,"(7344.76, 7376.76)"
89,Domnul Ştefan Pălărie:,95058,Domnul Florin-Vasile Cîțu:,97003, multumesc domnule presedinte initiativa legislativa depusa de catre colegii din usr propunea sa vina cu o inovatie in zona organizarii invatamantului si a structurii de an scolar si anume sa existe vacanta care pe vremuri era intersemestriala intre semestrul i si semestrul ii diferentiata pe regiuni de dezvoltare in asa fel incat tocmai ele sa nu se mai suprapuna o idee care nu e inventata aici in tara este o idee aplicata cu succes in olanda in germania in foarte multe tari europene tocmai pentru ca vacantele diferentiate in timp sa poata sa lase mai multa mobilitate oamenilor sa nu se creeze congestie in transport si de asemenea statiunile de sezon inclusiv cele de activitati de iarna sa poata sa se bucure de prezenta copiilor si a parintilor pe o perioada mult mai mare din pacate aceasta initiativa propusa de usr a primit momentan un vot de respingere si are un raport de respingere de asemenea insa ne bucuram sa vedem ca legea ca intentie a ajuns sa devina de fapt parte din realitate prin structura anului scolar viitor mai mult decat atat asta a fost unul dintre argumentele invocate de domnul ministru sorin cimpeanu atunci cand s a dezbatut motiunea simpla in camera deputatilor saptamana trecuta si anume ca uitati ca idei bune chiar venite de la opozitie pot sa treaca noi vom vota astazi in favoarea acestei initiative mai ales ca ea a ajuns sa produca efecte si sa se bucure de o transpunere in asa fel incat asa cum stim cu totii fiecare inspectorat scolar judetean trebuie sa ia o decizie intre trei optiuni posibile de vacanta asa numita intersemestriala pe structura actuala cu module nu se mai numeste intersemestriala dar vacanta de primavara asa cum o stim cu totii va putea fi luata diferentiat uitati va ca si idei bune pot sa ajunga in executie asadar vom vota pentru aceasta initiativa multumesc ,"(7392.76, 7503.76)"
90,Domnul Florin-Vasile Cîțu:,97003,Domnul Florian-Dorel Bodog:,97150, va multumesc domnule senator daca mai sunt alte interventii la acest punct domnul senator bodog din partea psd ,"(7344.76, 7350.76)"
91,Domnul Florian-Dorel Bodog:,97150,Domnul Florin-Vasile Cîțu:,97372, raportul este de respingere pentru ca structura anului scolar nu se aproba prin prevedere prin initiativa legislativa deci prin lege asta este motivul pentru care s a respins multumesc ,"(4201.0, 7528.76)"
92,Domnul Florin-Vasile Cîțu:,97372,Domnul Ştefan Pălărie:,98305, aveti dreptate doamna senator sosoaca raportul comisiei pentru invatamant este de respingere cu amendamente respinse a propunerii legislative propunerea legislativa face parte din categoria legilor organice si se adopta cu votul majoritatii senatorilor senatul este camera decizionala incepem dezbaterile daca sunt interventii din partea colegilor senatori punctul douazeci si opt pe ordinea de zi domnul senator palarie microfonul central ,"(3349.0, 3362.0)"
93,Domnul Ştefan Pălărie:,98305,Domnul Florin-Vasile Cîțu:,100549, multumesc domnule presedinte la acelasi capitol alta initiativa legislativa care in privinta acestei propuneri cosemnate si de catre senatori pnl doamna presedinta a comisiei de invatamant a fost unul dintre semnatari isi propunea un lucru cat se poate de simplu apropo de argumentul pe care domnul senator bodog l a avut mai devreme si anume exista o decizie politica pana la urma inclusiv legislativa unde se opreste legislatia principala si unde se incepe legislatia secundara in aceasta initiativa noi propuneam un lucru cat se poate de simplu uitandu ne la evolutia numarului de zile de scoala pe an din ultimii trei ani dar mai ales ultimii zece am observat ca numarul de zile de scoala era in scadere continua ajungandu se pana la urma la un o suta saizeci si sapte daca nu gresesc intr unul din anii de pandemie in felul acesta de fapt scazand semnificativ sub numarul mediu de zile al statelor europene au existat calcule facute de specialisti nu de noi si anume ca intr un ciclu de invatamant primar plus gimnazial un elev din germania ajunge sa aiba un an in plus de scolarizare in termen de numar de ore petrecute la scoala fata de un elev in romania si atunci initiativa era cat se poate de simpla spunea anul scolar incepe la unu septembrie se termina la treizeci si unu august deci nu intram in zona de legiferare a structurii anului scolar acest atribut ramanand in continuare in slujba executivului dar am spus foarte clar nu putem cobori cu toata libertatea ministrului de a stabili anul scolar sub un numar minim o linie rosie daca doriti de o suta optzeci si cinci de zile de scoala pentru gimnaziu echivalent cu media europeana nu a fost nimic inventat nimic scos din burta a fost propusa a fost explicata punctul de vedere al guvernului evident a fost nu intrati peste libertatea noastra de decizie un lucru cu care noi nu suntem de acord in continuare o sa sustinem aceasta initiativa stiti ce este amuzant si ironic structura anului scolar doua mii douazeci si doi doua mii douazeci si trei are exact o suta optzeci si cinci de zile de scoala deci ajungem exact acolo dar e nevoie ca niste oameni sa spuna facem ca mine nu ca altii dar ideile in fond raman in spate si ele intra in executie va multumesc ,"(7594.76, 7724.76)"
94,Domnul Florin-Vasile Cîțu:,100549,Doamna Diana Iovanovici-Șoșoacă (din sală):,100862, multumesc daca mai sunt alte interventii la punctul douazeci si opt nu mai sunt incheiem dezbaterile initiativa legislativa ramane la vot final stimati colegi am avut programul dezbaterilor pana la ora saptesprezece zero am incheiat dezbaterile pe initiativele legislative trecem la votul final ,"(3317.0, 7750.76)"
95,Doamna Diana Iovanovici-Șoșoacă (din sală):,100862,Domnul Florin-Vasile Cîțu:,100958, ati fost mai rapid ca doamna gorghiu felicitari ,"(540.0, 10008.2)"
