,start_text,start_index,end_text,end_index,text,timestamp
33,Domnul Raoul-Adrian Trifan:,35563,Domnul Florin-Vasile Cîțu:,37345, multumesc domnule presedinte stimati colegi acest proiect este unul definitoriu pentru nivelul serviciilor publice pe care ni l dorim cu totii in tara noastra el sta la baza unei reforme adevarate si palpabile a statului roman un stat care nu te pune sa stai la cozi pentru a interactiona cu diferite institutii care nu necesita copii dupa acte pe care tot el le a eliberat care nu iti cere aceleasi informatii din nou si din nou si din nou pe scurt un stat eficient digitalizat si modern platforma nationala de interoperabilitate va sta la baza acestei reforme si va actiona ca un liant intre diferitele baze de date gestionate de institutiile statului roman si de diversi actori privati care au in gestiune date ale cetatenilor gandita pe principii pe care au fost cladite alte sisteme similare din tari ca estonia platforma va facilita interactiunile digitale ale cetatenilor din romania cu diferitele institutii publice si chiar private mai putine frustrari si mai putin timp consumat atunci cand te confrunti cu birocratia din institutii datele personale ale cetatenilor securizate si auditate la fiecare accesare formulare precompletate si implicit interactiuni facile si rapide intre cetatean si institutii un istoric clar usor de pastrat si urmarit al tuturor evenimentelor importante din viata noastra fie ca te casatoresti ca vinzi o masina sau ca ai trecut printr o boala totul va fi la un clic distanta si la dispozitia cetateanului pentru a valorifica acele informatii personale acestea sunt beneficiile pe care aceasta lege deosebit de importanta le aduce tarii noastre este evident ca grupul usr va sustine si va vota pentru aceasta lege va multumesc ,"(3161.0, 3270.0)"
34,Domnul Florin-Vasile Cîțu:,37345,Domnul Ion Marcel Vela:,37469, va multumesc domnule senator daca mai sunt alte interventii domnule senator vela va rog ,"(3270.0, 7350.76)"
35,Domnul Ion Marcel Vela:,37469,Domnul Florin-Vasile Cîțu:,37822, onorat parlament aceasta lege dincolo de a fi un proiect legislativ o norma care regleaza tot ceea ce este imperativ acum la ora actuala intr un domeniu extrem de important intr o era a globalizarii aceasta lege este o nevoie si o necesitate grupul partidului national liberal va sustine acest proiect ,"(3280.0, 3311.0)"
36,Domnul Florin-Vasile Cîțu:,37822,Domnul Ion-Dragoș Popescu:,39936, multumesc domnule senator alte interventii nu mai sunt incheiem dezbaterile si initiativa legislativa ramane la vot final punctul sase proiectul de lege pentru realizarea capabilitatii operationale aeriene de tranzitie prevazuta in conceptia de realizare graduala a capabilitatii de aparare aeriana in cadrul programului avion multirol al fortelor aeriene ,"(3315.0, 3327.0)"
37,Domnul Ion-Dragoș Popescu:,39936,Domnul Florin-Vasile Cîțu:,40353, multumesc domnule presedinte intr adevar este un proiect complex si ambitios as spune dar cred ca trebuie sa ne referim mai mult la amendamentele respinse prin care se elimina arbdd ul si atunci dimensiunea de protectie si conservare a resursei piscicole este exclusa si ramanem doar pe dimensiunea comerciala ceea ce nu ne asigura un viitor foarte interesant va multumesc ,"(3460.0, 3481.0)"
38,Domnul Florin-Vasile Cîțu:,40353,Domnul George Scarlat:,40523, multumesc raportul este de admitere cu amendamente admise si amendamente respinse interventie domnul scarlat din partea pnl senator ,"(3270.0, 4202.0)"
39,Domnul George Scarlat:,40523,Domnul Florin-Vasile Cîțu:,42007, multumesc domnule presedinte n as fi intervenit daca nu intervenea colegul nostru de la usr sincer tocmai prin aceasta initiativa legislativa venim sa clarificam anumite aspecte cu privire la atributiile pe care le are si le va avea agentia nationala de pescuit si acvacultura prin ministerul agriculturii care sa fie partenerul romaniei cu comisia europeana pe problema resursei piscicole si acvatice de ce pentru ca astazi discutam de doi administratori asa cum bine spunea colegul nostru pentru biosfera delta dunarii este arbdd ul pentru celelalte ape interioare si de frontiera anpa or aici discutiile sunt cine raspunde de resursa in conditiile in care decizia este la doi administratori comisia a sugerat statului membru romania sa clarifice prin legea nationala cine va fi unicul administrator asta nu inseamna ca arbdd ul nu poate sa isi faca politicile de pescuit si prin ordin comun al ministerului mediului asa cum propune si initiativa si a fost amendata al ministerului mediului si al ministerului agriculturii sa fie stabilite aceste atributii va multumesc grupul partidului national liberal si cred ca si le multumesc cu aceasta ocazie tuturor colegilor din cele trei comisii pentru votul dat si pentru amendamentele si orele zecile de ore in urma dezbaterilor cred ca a iesit o lege care astazi poate fi adoptata ca raport comun al celor trei comisii va multumesc ,"(3521.0, 3585.0)"
40,Domnul Florin-Vasile Cîțu:,42007,Domnul Liviu-Lucian Mazilu:,42122, va multumesc daca mai sunt alte interventii la punctul opt va rog domnule senator ,"(7344.76, 7350.76)"
41,Domnul Liviu-Lucian Mazilu:,42122,Domnul Florin-Vasile Cîțu:,44504, multumesc domnule presedinte vreau doar sa fac cateva completari la cele spuse de domnul senator scarlat in primul rand ca sa inteleaga toata lumea propunerea legislativa creeaza cadrul general de reglementare in domeniul pescuitului un domeniu extrem de complex si cele trei comisii sesizate au avut de dezbatut pe parcursul a saizeci de zile toate aceste articole multe din aceasta lege dar si cele peste nouazeci de amendamente care au fost depuse dintre care saizeci si doi au fost admise unul respins celelalte retrase vreau sa va spun ca a fost o reala provocare pentru ca a trebuit sa cautam si sa incercam sa gasim un echilibru intre ceea ce inseamna dorinta de a pescui mai mult din apele noastre si de a pune pe piata peste de buna calitate din apele romanesti pe de o parte pe de alta parte de a proteja resursa acvatica pentru generatiile viitoare astfel incat sa nu fie pusa in niciun fel in pericol de asemenea a fost si cred eu sau sper ca am reusit sa gasim un echilibru intre diversele categorii de pescari intre interesele pescarilor recreativi interesele comerciale ale pescuitului comercial si sigur ca a trebuit sa reglementam si pescuitul stiintific nu pretind ca aceasta lege este sau ce a iesit in urma celor peste saizeci si doi de amendamente admise ca este perfecta evident este perfectibila in mod cert ramane de dezbatut probabil colegii nostri de la camera deputatilor o vor face si se vor apleca fara presiunea timpului asupra acestei propuneri si vor stabili daca resursa acvatica vie din delta dunarii va fi administrata in mod direct de rezervatia biosferei delta dunarii sau daca ramane sub umbrela agentiei nationale pentru pescuit si acvacultura asta e o chestiune care se va vedea dar eu indemn pe toti colegii tinand cont de faptul ca totusi prin inasprirea sanctiunilor prin toate celelalte masuri care s au luat prin aceste amendamente admise prin care descurajam braconajul si orice altfel de metode ilegale de pescuit eu cred ca totusi resursa acvatica vie a fost bine protejata prin amendamentele aduse acestei legi si multumim tuturor pentru efortul depus in aceasta perioada ii indemn pe toti colegii din toate grupurile parlamentare sa voteze aceasta propunere legislativa va multumesc grupul psd va vota in favoarea acestei propuneri ,"(3591.0, 3693.0)"
42,Domnul Florin-Vasile Cîțu:,44504,Doamna Diana Iovanovici-Șoșoacă:,45498, va multumesc domnule senator daca mai sunt alte interventii nu mai sunt alte interventii la punctul opt incheiem dezbaterile initiativa legislativa ramane la vot final punctul noua proiectul de lege pentru aprobarea ordonantei de urgenta a guvernului nr saptezeci si patru doua mii douazeci si doi privind acordarea unui ajutor financiar pensionarilor sistemului public de pensii ai sistemului pensiilor militare de stat precum si beneficiarilor de drepturi prevazute de legi cu caracter special in luna iulie doua mii douazeci si doi raportul comun al comisiei pentru aparare ordine publica si siguranta nationala si comisiei pentru munca familie si protectie sociala este de admitere a proiectului de lege pentru aprobarea ordonantei proiectul de lege face parte din categoria legilor organice si se adopta cu votul majoritatii senatorilor senatul este prima camera sesizata incepem dezbaterile daca avem interventii la punctul noua doamna senator sosoaca microfonul trei va rog ,"(3776.0, 3814.0)"
43,Doamna Diana Iovanovici-Șoșoacă:,45498,Domnul Florin-Vasile Cîțu:,46171, multumesc frumos aveti o initiativa pentru luna iulie pai mai avem cateva zile si intram in luna iulie pana ajunge la camera deputatilor stiu ca sunteti in stare intr o zi sa si trimiteti sa si votati dar totusi daca e sa mergem pe procedura normala as dori sa va intreb daca aceasta initiativa se aproba cand le veti da acestor oameni banii in septembrie octombrie noiembrie nu de alta dar poate pana atunci saracii isi fac si ei niste calcule eu cred ca este o bataie de joc pe care o are guvernul romaniei indiferent din ce parte provine si cu privire la cadrele militare multumesc frumos ,"(540.0, 716.0)"
44,Domnul Florin-Vasile Cîțu:,46171,Domnul Ştefan Pălărie:,46417, multumesc doamna senator doar va atrag atentia ca este ordonanta de urgenta care isi produce efectul din momentul in care a fost aprobata publicata in monitorul oficial domnul senator palarie din partea usr ,"(3881.0, 3889.0)"
45,Domnul Ştefan Pălărie:,46417,Domnul Florin-Vasile Cîțu:,48901, multumesc domnule presedinte guvernul psd pnl udmr a gandit un mare si stralucitor pachet de ajutor numit sprijin pentru romania eu cred ca in graba de a legifera de fapt a uitat doua cuvinte cred ca pachetul se cheama firimituri de sprijin pentru romania de data aceasta beneficiarii sunt pensionarii cu venituri mai mici sau egale cu doi zero de lei fie ca vorbim de pensionarii din sistemul public fie ca vorbim de pensionarii care primesc faimoasele pensii speciale aceste persoane cu venituri reduse vor primi de data aceasta sapte sute de lei in luna iulie bun ajutor inca o taraita pe langa acea o pensie acordata tuturor la inceputul anului asa cum am spus si mai devreme in privinta pachetului sau ma rog a unei alte masuri din pachetul acesta de masuri sociale cea cu tichetele din pacate ele nu sunt decat un refren o gargara o replica de punctaj pe care comunicatorii partidelor aflate la guvern le spun in studiouri in realitate vietile oamenilor nu se schimba cu nimic ma contrazic acum se schimba in rau pentru ca in fiecare luna aceiasi oameni pot sa cumpere mai putin avand aceiasi bani nu intru din nou in toata lunga lista de scumpiri de la robor pana la pretul la combustibili energie electrica gaz produse alimentare produse de baza toate lucrurile sunt mai scumpe am pus aceeasi intrebare si in cadrul comisiei de munca si i am intrebat pe reprezentantii guvernului daca s au facut studii de politici publice daca este foarte clar cum aceasta masura va ajuta in ce masura va stopa saracirea populatiei si care va fi urmatoarea masura gandita ca un fel de strategie coerenta pe termen mediu si lung in mod evident nu am primit niciun raspuns si ne este cat se poate de clar ca nu sunt politici publice sunt doar o chestiune populista de aratat la televizor si ca sa inchei pe subiectul acesta in care de obicei lucrurile sunt facute de guvern harcea parcea in zona de investitii dar si de sprijin social readuc aminte ca in continuare profesorii din romania au salarii de mizerie am mai adus o eugenie ca simbol al faptului ca inca mai avem de lucru pentru acesti profesori si domnule presedinte o sa va inmanez dumneavoastra ultima oara doamnei alina gorghiu i a placut foarte mult eugenia adusa speram sa gasim cat mai repede miscari din partea guvernului referitor inclusiv la salariile dezastruoase pe care le au cei din invatamant va multumesc ,"(3905.0, 4053.0)"
46,Domnul Florin-Vasile Cîțu:,48901,Domnul Virgil Guran:,49041, multumesc e ok multumesc mie chiar imi plac eugeniile il rugam pe domnul guran si dupa aceea ,"(4201.0, 4202.0)"
47,Domnul Virgil Guran:,49041,Domnul Florin-Vasile Cîțu:,50969, multumesc vad ca in ultimul timp avem si distribuitori de eugenii in senat este un lucru bun e o initiativa particulara intrebarea este daca platiti impozit pentru veniturile realizate nu am inteles stiti ce imi place incep sa am si eu un pic de vechime in politica mie imi place ca intotdeauna cand suntem in opozitie stim sa facem de toate asta le o spun si colegilor mei credeti ma cand suntem la putere merge mai greu haideti sa fim un pic mai echilibrati si sa vedem ce se poate face si ce nu se poate face si atunci intr adevar functioneaza senatul daca atunci inclusiv noi poate liberalii cand am fost trebuie facut trebuie nu stiu ce cand venim la guvernare ei invatati ceva macar noi venim si spunem dom le este greu la guvernare acum dar ne am asumat o haideti cu propuneri foarte concrete ca asa daca venim numai cu lucruri populiste si spunem sa se dea fara sa vedem daca exista sau nu exista solutie nu merge va spun ca aceasta initiativa am spus o si n comisia de munca sunt sapte sute de lei va spun pentru cei care au sub doi zero de lei sapte sute de lei sa stiti conteaza foarte mult poate daca mergem mai mult unii dintre noi multi dintre noi mergem ca suntem printre oameni vedem ce inseamna pentru un om necajit sapte sute de lei si cate lucruri poate sa rezolve cu acei bani este o initiativa care face inca un pas nu putem sa facem mult mai multe minuni n a facut niciun guvern pana acum de aici din parlament doar aur ul n a fost deocamdata la guvernare ceilalti au fost toti asa ca ar trebui sa avem un pic mai multa decenta cand spunem ca este ceva asa prea usor prea nerezolvat prea nefacut aceasta initiativa este buna pana la urma s a realizat ceva nu numai pentru asta ci si pentru faptul ca este si initiativa noastra a liberalilor vom vota pentru aceasta initiativa va multumesc ,"(4073.0, 4202.0)"
48,Domnul Florin-Vasile Cîțu:,50969,Doamna Rodica Boancă:,51142, multumesc cu un singur amendament liberalii cand au fost la guvernare au avut si solutii eu asa stiu va rog doamna boanca ,"(4201.0, 4208.0)"
49,Doamna Rodica Boancă:,51142,Domnul Florin-Vasile Cîțu:,53334, multumesc domnule presedinte de sedinta stimati colegi ca sa ii raspund colegului meu domnului guran si aur este pregatit sa intre la guvernare are si solutii si daca tot e atat de greu si va plangeti orice s ar spune si orice s ar cere pentru oameni facem un schimb o rocada cateva luni vedem cum merge treaba si apoi vedem daca oamenii mai vor sa va intoarceti sau nu dar revenind la situatia de astazi este bine ca se dau acesti bani nimic de zis sapte sute de lei vorba domnului presedinte deja un clasic in viata sunt totusi sapte sute de lei doar ca nu vor rezolva problema asa cum nu vor rezolva problema saraciei nici cei patru lei pe zi pentru familiile si persoanele defavorizate aflate in risc de saracie solutia este una totusi foarte simpla si a fost votata in parlament cresterea pensiilor nu cum era colegii de la psd cu patruzeci nu s a amanat cresterea salariilor unor categorii bugetare care au salarii sub cel mediu la ora actuala respectiv a profesorilor de exemplu s a amanat investitii in agricultura se amana investitii in infrastructura productiei se amana se amana tot ceea ce inseamna crearea de locuri de munca si lucrul asta aduce saracia sapte sute de lei o data pe an sau de cate ori veti considera necesar sunt o solutie de moment in niciun caz nu vor acoperi nevoile pensionarilor in niciun caz nu vor acoperi nevoile celor care isi duc traiul de pe o zi pe cealalta si mai este o discriminare pentru ca acest ajutor se duce cumva doar catre o categorie de pensionari acum diferenta dintre unu cinci sute de exemplu si doi zero de lei nu este deloc mare cei care au pensii de doi zero de lei au primit foarte foarte putin o crestere infima la acestea si sunt foarte nemultumiti va asigur ca pensionarii romani sunt foarte nemultumiti de aceste masuri si se simt discriminati pentru ca foarte multi au lucrat ani de zile in industrie ca sa creeze aceasta tara si aceasta cladire in care ne aflam noi astazi si as incheia cu doua versuri cred ca sunt revelatorii pentru ceea ce se intampla in momentul de fata in guvernarea romaneasca buna tara rea croiala mama ei de randuiala ,"(4210.0, 4411.0)"
50,Domnul Florin-Vasile Cîțu:,53334,Doamna Evdochia Aelenei:,54197, va multumesc doamna senator daca mai sunt si alte interventii la cest punct nu nu mai sunt atunci la punctul noua incheiem dezbaterile si initiativa legislativa ramane la vot final punctul zece proiectul de lege pentru aprobarea ordonantei de urgenta a guvernului nr saptezeci si sase doua mii douazeci si doi privind infiintarea organizarea si functionarea agentiei nationale pentru dezvoltarea infrastructurii in sanatate raportul comun al comisiei pentru sanatate si comisiei pentru munca familie si protectie sociala este de admitere a proiectului de lege pentru aprobarea ordonantei proiectul de lege face parte din categoria legilor ordinare si se adopta cu votul majoritatii senatorilor prezenti senatul este prima camera sesizata incepem dezbaterile daca sunt interventii doamna aelenei microfonul central ,"(3802.0, 7350.76)"
51,Doamna Evdochia Aelenei:,54197,Domnul Florin-Vasile Cîțu:,54949, domnule presedinte stimati colegi agentia nationala pentru dezvoltarea infrastructurii in sanatate tin minte ca acesta a fost unul din proiectele propuse de fostul ministru al sanatatii atunci la investitura vlad voiculescu tin minte ca toti au sarit in sus nu este nevoie de asa ceva acum deodata s a facut nevoie de ce asa am prosperat atat de mult incat ne permitem o agentie oare o simpla directie in cadrul ministerului sanatatii cu ingineri cativa ingineri specialisti nu ar satisface nevoile pentru infrastructura in sanatate agentie inseamna vicepresedinti presedinti stafful si toata cheltuiala de rigoare oare in conditiile astea de saracie noi ne permitem asa ceva va multumesc ,"(4479.0, 4532.0)"
52,Domnul Florin-Vasile Cîțu:,54949,Doamna Diana Iovanovici-Șoșoacă:,55136, va multumesc doamna senator doar ca o clarificare aceasta agentie este in pnrr a fost introdusa acolo deci ea trebuie facuta doamna senator sosoaca ,"(3270.0, 7346.76)"
53,Doamna Diana Iovanovici-Șoșoacă:,55136,Domnul Florin-Vasile Cîțu:,55988, deci ca sa construim spitale ne mai trebuie o agentie agentia nationala pentru dezvoltarea infrastructurii in sanatate sa inteleg ca toate spitalele din romania cand se vor construi pentru fiecare sau vad ca sunt calupuri de cate trei mai infiintam o agentie la cati oameni mai aveti datorii ca sa stim cate agentii veti infiinta asta este curiozitatea mea ok ati introdus o in pnrr parerea mea este ca interesul romaniei e mai important asa ca scoateti l din pnrr si hai sa facem cu tot ceea ce avem si nu mai dati atatea slujbe unora care cotizeaza nonstop la partidele dumneavoastra mai cu para ndaratul mai nu stiu ce ca sa mai facem agentii suntem satui de agentii sau daca tot o infiintati va rog frumos sa le dati salariu doi zero de lei pe luna atat net multumesc ,"(540.0, 716.0)"
54,Domnul Florin-Vasile Cîțu:,55988,Domnul Eugen-Remus Negoi:,56124, multumesc puteati sa faceti amendament la proiectul de lege domnule negoi microfonul central va rog ,"(4201.0, 4202.0)"
55,Domnul Eugen-Remus Negoi:,56124,Domnul Florin-Vasile Cîțu:,57266, multumesc domnule presedinte v as propune sa definim ce inseamna pnrr planul national de redresare si rezilienta si de ce exista acest jalon in pnrr pnrr inseamna ca luam niste bani de la uniunea europeana pe care sa i folosim strict pentru destinatia respectiva in cazul de fata si salut ordonanta de urgenta pentru ca infiintarea agentiei respective este initiata intr adevar de fostii ministri usr vlad voiculescu si ioana mihaila este introdusa in pnrr de fostul ministru al fondurilor europene cristian ghinea pentru ca necesitatea unei astfel de agentii este superioara a ceea ce s a intamplat pana acum in ministerul sanatatii e vorba de construirea de spitale care prin aceasta agentie este garantata e vorba de cel putin trei spitale regionale iar fondurile care vin de la uniunea europeana pentru asa ceva vor fi directionate strict catre constructia aceasta deci practic avem garantia ca ceea ce anuntam acum prin votarea acestei legi se va si intampla cu alte cuvinte grupul usr va vota pentru aceasta initiativa pentru motivele prezentate mai devreme va multumesc ,"(4634.0, 4702.0)"
56,Domnul Florin-Vasile Cîțu:,57266,Domnul Adrian Streinu Cercel:,57411, va multumesc domnul senator daca mai sunt alte interventii da domnul streinu cercel senator cercel va rog ,"(3270.0, 7350.76)"
57,Domnul Adrian Streinu Cercel:,57411,Domnul Florin-Vasile Cîțu:,57586, va multumesc domnule presedinte o singura completare aceasta agentie este in subordinea ministerului sanatatii va multumesc ,"(4201.0, 4202.0)"
58,Domnul Florin-Vasile Cîțu:,57586,Domnul Cristian Bordei:,59220, corect multumesc daca mai sunt alte interventii nu mai sunt am incheiat dezbaterile asupra acestui punct initiativa legislativa ramane la vot final punctul unsprezece al ordinii de zi proiectul de lege privind aprobarea ordonantei de urgenta a guvernului nr saptezeci si cinci doua mii douazeci si doi pentru completarea legii nr optzeci si doi o mie noua sute nouazeci si doi privind rezervele de stat raportul comisiei pentru buget finante activitate bancara si piata de capital este de admitere a proiectului de lege privind aprobarea ordonantei proiectul de lege face parte din categoria legilor ordinare si se adopta cu votul majoritatii senatorilor prezenti senatul este prima camera sesizata incepem dezbaterile daca sunt interventii din partea colegilor senatori va rog din partea usr domnul bordei microfonul central ,"(3448.0, 3458.0)"
59,Domnul Cristian Bordei:,59220,Domnul Florin-Vasile Cîțu:,61737, va multumesc domnule presedinte voi avea o interventie foarte scurta pe marginea faptului ca aceasta ordonanta de urgenta se refera si la participarea romaniei prin intermediul eximbank la fondul de investitii al initiativei celor trei mari e foarte bine ca prin aceasta ordonanta de urgenta se creeaza cadrul legislativ necesar pentru cei care nu stiu initiativa celor trei mari este o platforma politica informala la nivel prezidential care reuneste cele doisprezece state membre ale ue aflate intre marile adriatica baltica si neagra in cadrul acestei platforme in doua mii nouasprezece s a infiintat acest fond de investitii a initiativei celor trei mari fondatorii fiind polonia si romania ulterior s au mai adaugat inca sapte state problema este ca desi fondatorii sunt romania si polonia polonia contribuie cu sapte sute cincizeci de milioane de euro in timp ce romania contribuie cu douazeci de milioane de euro la fel ca tari gen letonia lituania estonia croatia ungaria bulgaria de asemenea statele unite s au alaturat ca parteneri si in doua mii douazeci au promis o investitie de un miliard de dolari la summit ul care a avut loc chiar zilele trecute la riga s a concretizat aceasta promisiune ei anuntand ca vor vira o prima transa de trei sute de milioane de dolari problema la care vreau sa ma refer este ca noua ne place sa vorbim despre romania ca fiind un lider regional si fara indoiala romania are toate premisele calitatile si potentialul pentru a fi un lider regional dar problema este daca vrem intr adevar sa proiectam o imagine de lider regional si daca vrem sa avem statura unui lider regional trebuie sa ne si comportam ca atare ca un lider regional or nu putem sa facem asta in momentul in care noi contribuim cu doar douazeci de milioane de euro la acest fond la care polonia contribuie cu sapte sute cincizeci de milioane de euro deci dupa parerea mea pentru a ne comporta intr adevar ca un lider regional ar trebui ca romania sa mareasca contributia la acest fond acesta fiind de altfel si un instrument prin care companiile romanesti pot fi internationalizate si dezvoltate prin participarea la proiectele care urmeaza sa fie finantate prin fondul respectiv prin urmare va solicit stimati colegi senatori din cadrul partidelor care formeaza coalitia de guvernare sa faceti lobby la nivelul guvernului si administratiei prezidentiale in sprijinul acestui demers care pana la urma are un scop strategic pentru romania va multumesc ,"(4849.0, 5013.0)"
60,Domnul Florin-Vasile Cîțu:,61737,Doamna Liliana Sbîrnea:,62523, va multumesc domnul senator sumele sunt corelate cu proiectele care deja sunt acceptate romania are mai putine proiecte dar initiativa este foarte buna daca mai sunt alte interventii nu incheiem dezbaterile initiativa legislativa ramane la vot final punctul treisprezece propunerea legislativa pentru declararea florii de bujor ca floare nationala a romaniei raportul comisiei pentru administratie publica este de admitere a propunerii legislative propunerea legislativa face parte din categoria legilor ordinare si se adopta cu votul majoritatii senatorilor prezenti senatul este prima camera sesizata deschid dezbaterile din partea psd va rog doamna senator microfonul central da doamna sbirnea va rog ,"(5033.0, 5081.0)"
