,start_text,start_index,end_text,end_index,text,timestamp
1,S T E N O G R A M A,0,şedinţei Senatului din 27 iunie 2022,21, ,"(540.0, 10008.2)"
2,şedinţei Senatului din 27 iunie 2022,21,S U M A R,61, ,"(540.0, 10008.2)"
3,S U M A R,61,S T E N O G R A M A,7046, unu aprobarea prelungirii la saizeci de zile a termenului de dezbatere si adoptare a unor patru initiative legislative doi dezbaterea si adoptarea proiectului de lege privind aprobarea ordonantei de cinci noua urgenta a guvernului nr saptezeci si doi doua mii douazeci si doi pentru modificarea si completarea ordonantei de patruzeci si sase patruzeci si sapte urgenta a guvernului nr saizeci si trei doua mii douazeci si doi privind unele masuri temporare pentru acordarea de sprijin material categoriilor de persoane aflate in situatii de risc de deprivare materiala si sau risc de saracie extrema suportate partial din fonduri externe nerambursabile precum si unele masuri de distribuire a acestuia din legea nr patruzeci si sapte o mie noua sute nouazeci si doi privind organizarea si functionarea curtii constitutionale republicata ,"(1430.0, 1455.0)"
4,S T E N O G R A M A,7046,şedinţei Senatului din 27 iunie 2022,7067, ,"(540.0, 10008.2)"
5,şedinţei Senatului din 27 iunie 2022,7067,Domnul Florin-Vasile Cîțu:,7313, sedinta a inceput la ora cincisprezece noua lucrarile sedintei au fost conduse de domnul florin vasile citu presedintele senatului asistat de domnul ion mocioalca si domnul sorin lavric secretari ai senatului ,"(540.0, 10008.2)"
6,Domnul Florin-Vasile Cîțu:,7313,Domnul Nicolae Neagu:,11664, buna ziua stimati colegi haideti sa incepem sedinta declar deschisa sedinta senatului din douazeci si sapte iunie doua mii douazeci si doi sedinta este condusa de subsemnatul presedintele senatului asistat de domnul mocioalca si domnul mircescu secretari ai senatului raportul comun al comisiei pentru buget finante activitate bancara si piata de capital este de admitere domnule presedinte al comisiei va rog va rog ,"(1080.0, 1086.0)"
7,Domnul Nicolae Neagu:,11664,Domnul Florin-Vasile Cîțu:,14495, multumesc domnule presedinte raportul este comun al comisiei pentru buget finante activitate bancara si piata de capital si comisiei pentru munca familie si protectie sociala privind aprobarea ordonantei de urgenta a guvernului nr saptezeci si doi pentru modificarea si completarea ordonantei de urgenta a guvernului nr saizeci si trei privind unele masuri temporare pentru acordarea de sprijin material categoriilor de persoane aflate in situatii de risc de deprivare materiala si sau risc de saracie extrema suportate partial din fonduri externe nerambursabile precum si unele masuri de distribuire a acestuia proiectul de lege are ca obiect de reglementare masuri temporare pentru acordarea de sprijin material categoriilor sus mentionate suportate partial din fonduri externe nerambursabile precum si unele masuri de distribuire a acestuia astfel se inlocuieste art trei alin din venit net lunar cu expresia venit lunar realizat pentru coroborare cu notiuni utilizate in domeniul fiscalitatii si pentru determinarea corecta a veniturilor de catre ministerul finantelor prin agentia nationala de administrare fiscala se includ categorii de venituri luate in calcul pentru determinarea nivelului veniturilor lunare realizate de catre persoanele fizice potentiale beneficiare ale sprijinului material a urmatoarelor venituri venituri din activitati independente din dreptul de proprietate intelectuala si venituri din premii si jocuri de noroc excluderea din categoria veniturilor realizate a celor neimpozabile intrucat potrivit prevederilor legii nr doua sute sapte privind codul de procedura fiscala acestea nu se declara la organele fiscale excluderea veniturilor realizate din transferul proprietatilor imobiliare avand in vedere ca potrivit legi nr doua sute douazeci si sapte privind codul fiscal in cazul acestora suma de patru sute cincizeci zero de lei reprezinta venit neimpozabil si stabilirea regulilor de determinare a nivelului veniturilor lunare realizate avand in vedere ca potrivit prevederilor codului fiscal veniturile realizate de persoanele fizice din activitati independente drepturi de proprietate intelectuala cedarea folosintei bunurilor investitii si venituri din activitati agricole si altele nu au obligatia angajatorii platitori au obligatia de a depune declaratia privind obligatiile de plata a contributiilor sociale impozitului pe venit si evidenta nominala a persoanelor asigurate lunar sau trimestrial comisia pentru buget finante si comisia pentru munca solicita plenului senatului dezbaterea si adoptarea raportului comun de admitere a proiectului de lege fara amendamente facem precizarea ca proiectul de lege face parte din categoria legilor ordinare senatul fiind prima camera sesizata ,"(1552.0, 1654.0)"
8,Domnul Florin-Vasile Cîțu:,14495,Doamna Diana Iovanovici-Șoșoacă:,15141, va multumesc domnule presedinte stimati colegi pentru ca suntem in format hibrid astazi dupa ce a avut aceasta interventie domnul presedinte nu vom mai avea interventiile de la comisie sau de la guvern vom trece prin dezbateri asa cum erati obisnuiti in sistemul hibrid pentru a putea acoperi cat mai mult din ordinea de zi deci am spus proiectul de comun este de admitere raportul e de admitere proiectul de lege face parte din categoria legilor ordinare senatul este prima camera sesizata incepem dezbaterile pe acest proiect de lege daca sunt interventii doamna senator sosoaca va rog ,"(1667.0, 7350.76)"
9,Doamna Diana Iovanovici-Șoșoacă:,15141,Domnul Florin-Vasile Cîțu:,16872, multumesc frumos ajungem iar la aceleasi discutii sunt niste masuri populiste in care discriminati oamenii saraci ii impartiti in saraci mai putin saraci mai mult decat saraci si asa mai departe vreau sa va intreb ca va raportati la venituri lunare realizate daca sunt mai mici sau egale cu unu cinci sute de lei cel care are unu cinci sute cincizeci lei cu ce este mai bogat fata de cel care are unu cinci sute de lei va raportati la familii cu cel putin doi copii in intretinere ale caror venituri lunare realizate pe membru de familie sunt mai mici sau egale cu sase sute de lei care e diferenta intre sase sute de lei si sase sute cincizeci lei sau sase sute unu lei la fel si la familiile monoparentale dumneavoastra stiti ce inseamna unu cinci sute de lei unu cinci sute de lei probabil ca e spaga pe care o dati la restaurant cand va adunati cu totii in schimb ce oamenii astia trebuie sa traiasca cu unu cinci sute de lei o luna intreaga cum e posibil sa luati astfel de sa aveti astfel de initiative in care discriminati saracii intre ei o sa ajunga sa si dea in cap din cauza dumneavoastra va bateti joc care i diferenta chiar va rog frumos sa mi spuna un reprezentant al guvernului daca este aici intre unu cinci sute si unu cinci sute unu lei intre sase sute si sase sute unu lei ati incercat vreodata sa traiti cu banii astia intr o luna sa vedeti ce inseamna asta este ca si cand vine domnul ciuca si spune sau nu iohannis eh cincizeci de bani sunt si ei o diferenta nu i dai pai chiar va bateti joc de poporul roman in frunte cu presedintele romaniei care numai presedinte al romaniei nu e ori cincizeci de bani ori unu cinci sute este o bataie de joc la adresa poporului roman astea s masuri populiste nu iesiti cu nimic in evidenta decat cu discriminare ,"(540.0, 716.0)"
10,Domnul Florin-Vasile Cîțu:,16872,Domnul Ștefan Pălărie:,17147, va multumesc avem o interventie din online doamna simona elena spataru va rog v auzim va rog doamna spataru nu se aude nimic din pacate nu se aude intrerupem interventia daca mai avem alta interventie din sala domnul palarie ,"(1836.0, 1866.0)"
11,Domnul Ștefan Pălărie:,17147,Domnul Florin-Vasile Cîțu:,18792, multumesc domnule presedinte stimate colege stimati colegi daca tot avem reprezentanti ai guvernului i as intreba in privinta acestui oug care se doreste a fi una dintre multele masuri luate ca pachet de masuri sociale pentru cei afectati de cresterea preturilor si scaderea puterii de cumparare si i as intreba mai ales ca acest program a fost trambitat incepand cu luna februarie cate din cardurile de tichete sociale au fost distribuite catre beneficiari o sa va spun eu care sunt cifrele doi cinci milioane de beneficiari incadrati in randul celor eligibili repet cifra doi cinci milioane de persoane ar trebui sa fie beneficiare ale acestui program stiti cate carduri au fost distribuite de catre posta romana pana la acest moment desi masurile ar fi trebuit sa fie valabile iar banii pe aceste carduri la unu iulie din discutiile purtate cu posta romana cincizeci zero de carduri au fost distribuite cincizeci zero din doi cinci milioane o sa i rog pe cei de la guvern daca sunt aici prezenti sa ne raspunda la intrebare doar ca sa ne motivam votul noi vom vota in favoarea acestei initiative credem ca este una dintre multele multele masuri necesare pentru a combate saracia prin care trece romania astazi dar gasim absolut inadmisibila lentoarea cu care tot executivul se misca in privinta acestui program mult laudat daca cifrele sunt corecte cincizeci zero distribuite din doi cinci milioane in ritmul acesta probabil ca abia in doua mii douazeci si cinci vom avea ultimele carduri distribuite iar asta este absolut inacceptabil asteptam raspunsul de la guvern va multumesc ,"(1887.0, 2000.0)"
12,Domnul Florin-Vasile Cîțu:,18792,Domnul Ion Rotaru:,18987, va multumesc guvernul o sa raspunda in scris cererii domnului senator interventie din partea da domnul rotaru din partea psd microfonul central ,"(3270.0, 7346.76)"
13,Domnul Ion Rotaru:,18987,Domnul Florin-Vasile Cîțu:,20404, multumesc domnule presedinte stimati colegi de fapt noi discutam astazi despre ordonanta aceasta care vine sa clarifice doar cateva lucruri care tin de zona financiara si tin de reglementarea unor termeni intr o formula foarte clara si precisa daca ne intoarcem pe ordonanta precedenta trebuie sa avem in vedere faptul ca sigur toti ne am dori ca sumele care sa fie acordate ca sprijin pentru persoanele care se afla intr o situatie deosebita financiar cu risc de deprivare cu risc de saracie maxima si asa mai departe persoanele eu stiu cu handicap familiile monoparentale si asa mai departe sigur ca ne am dori cu totii sa fie sume mult mai mari decat cele pe care le acordam dar haideti sa avem in vedere faptul ca aceste sume se acorda pana in doua mii douazeci si sapte deci cinci ani de aici inainte voucherele acestea se elibereaza din doua in doua luni e adevarat ca startul a fost destul de anevoios sa spunem asa privind elaborarea cardurilor dar sumele care ar trebui sa fie consumate si folosite pentru luna iulie iunie se vor regasi pe carduri deci nu va fi niciun impediment din punctul asta de vedere cert este faptul ca ar fi trebuit mai mult dar atat permite bugetul atat ne permitem astazi si eu cred ca cei trei milioane de beneficiari care vor folosi aceasta suma vor aprecia efortul pe care l face guvernul astazi de a aloca aceste sume multumesc frumos ,"(540.0, 716.0)"
14,Domnul Florin-Vasile Cîțu:,20404,Doamna Diana Iovanovici-Șoșoacă (din sală):,21451, va multumesc domnule senator daca mai sunt alte interventii din partea colegilor nu mai sunt am incheiat dezbaterile asupra acestui punct al ordinii de zi initiativa legislativa ramane la vot punctul doi proiectul de lege privind aprobarea ordonantei de urgenta a guvernului nr saptezeci si unu doua mii douazeci si doi pentru modificarea art o suta cincizeci si cinci alin raportul comisiei juridice de numiri disciplina imunitati si validari este de admitere a proiectului de lege privind aprobarea ordonantei proiectul de lege face parte din categoria legilor organice si se adopta cu votul majoritatii senatorilor senatul este prima camera sesizata incepem dezbaterile daca sunt interventii nu sunt interventii stimati colegi incheiem dezbaterile generale asupra acestui punct al ordinii de zi si initiativa legislativa ramane la vot final punctul trei proiectul de lege privind aprobarea ordonantei de urgenta a guvernului nr saptezeci si trei doua mii douazeci si doi pentru completarea ,"(7344.76, 7350.76)"
15,Doamna Diana Iovanovici-Șoșoacă (din sală):,21451,Domnul Florin-Vasile Cîțu:,21538, pai nu ne dati cuvantul la acest punct ,"(5049.0, 5049.0)"
16,Domnul Florin-Vasile Cîțu:,21538,Doamna Diana Iovanovici-Șoșoacă:,22349, v am spus am spus am incheiat dezbaterile pe punctul doi doamna bine doamna senator sosoaca un minut la punctul doi dar doar un minut va rog frumos microfonul trei va rog ,"(2193.0, 2474.0)"
17,Doamna Diana Iovanovici-Șoșoacă:,22349,Domnul Florin-Vasile Cîțu:,24036, va multumesc si dupa aceea o sa am o observatie pe procedura acest punct doi incalca de fapt decizia ccr ului prin care se spune foarte clar ca acest curs al prescriptiei nu se mai intrerupe stim foarte bine ce a provocat aceasta ordonanta stim foarte bine doamna scutea procurorul general cum a dat directiva asa pe la toti procurorii sa nu aplice aceasta decizie a ccr ului ce a ajuns ccr ul dupa ce da o decizie care este general valabila vine guvernul si incalca deciziile ccr ului de fapt este mana domnului predoiu aici mare avocat cum este posibil sa veniti dupa ce ccr ul se pronunta asupra acestei probleme sa incalcati ceea ce spune ccr ul ce a ajuns curtea constitutionala cu tot respectul chiar stergem pe jos cu ea si cu deciziile ccr ului aceasta initiativa trebuie sa votati impotriva ei pentru ca incalca dispozitiile curtii constitutionale cum e posibil sa veniti cu ea si sa nu ne mai dati voie sa dezbatem da stiu ca nu vreti dar trebuie dezbatuta pentru ca aici e o problema de incalcare a curtii constitutionale a deciziilor ei si pe procedura cu tot respectul de ce avem format hibrid e cumva pandemie de ce de lene sunt atatia oameni aici in sala care au facut efortul de a veni si sunt din provincie foarte multi de la sute de kilometri pentru ce trebuie sa dea sa vorbeasca prin telefon sa voteze prin telefon nu cred ca este nici pandemie nu este nici stare de alerta nici stare de urgenta si la cati bani ia un demnitar roman cred ca ar putea sa faca efortul sa vina aici ca i se deconteaza deplasarea plus cazarea plus mancarea ,"(2251.0, 2357.0)"
18,Domnul Florin-Vasile Cîțu:,24036,Doamna Diana Iovanovici-Șoșoacă (din sală):,24136, multumesc a fost o decizie a biroului permanent a fost o propunere ,"(4201.0, 4202.0)"
19,Doamna Diana Iovanovici-Șoșoacă (din sală):,24136,Domnul Florin-Vasile Cîțu:,24252, biroul permanent nu se supune legilor acestei tari ,"(5049.0, 5049.0)"
20,Domnul Florin-Vasile Cîțu:,24252,Doamna Diana Iovanovici-Șoșoacă:,25598, va multumesc va multumesc doamna senator va multumesc deci la punctul doi incheiem dezbaterile initiativa ramane la vot final stimati colegi avem in parlamentul romaniei o delegatie a parlamentului albaniei venita la invitatia domnului senator oprea stefan radu lider al grupului parlamentar al psd sunt aici domnul taulant balla domnul ilir pendavinji domnul jurgis cyrbja domnul spiro maliqi domnul ilir tepelena si domnul jonian molla bine ati venit in parlamentul romaniei raportul comisiei pentru munca este de admitere a proiectului de lege privind aprobarea ordonantei proiectul de lege face parte din categoria legilor organice si se adopta cu votul majoritatii senatorilor senatul este prima camera sesizata incepem dezbaterile doamna senator sosoaca va rog microfonul trei ,"(2368.0, 2388.0)"
21,Doamna Diana Iovanovici-Șoșoacă:,25598,Domnul Florin-Vasile Cîțu:,26501, multumesc frumos as dori sa va intreb suntem in pandemie e stare de alerta cate cazuri sunt pe zi de prelungiti pana pe treizeci si unu decembrie doua mii douazeci si doi acum vad ca vin maimutele de un anumit gen si de o anumita factura si de o anumita dispozitie sexuala care dau nu stiu ce variola suntem pe variola suntem pe rosie suntem pe covid pentru ce avem astfel de initiative cand nu mai exista aceste probleme eu zic sa va axati si pe gripa gripa are mai multe cazuri decat covid ul cu tot respectul dumneavoastra ce faceti ne bagati din nou in stare de alerta sau de urgenta de la unu septembrie ca cam asa se aude de prin guvernul dumneavoastra de ce votam astfel de initiative cum sa dai raport de admitere in acest caz cand nu ai baza nu ai baza fundamentata stiintific unde este baza fundamentata stiintific vrem si noi sa o vedem multumesc frumos ,"(540.0, 716.0)"
22,Domnul Florin-Vasile Cîțu:,26501,Domnul Ștefan Pălărie:,26601, va multumesc doamna senator domnul senator palarie din partea usr ,"(3270.0, 7346.76)"
23,Domnul Ștefan Pălărie:,26601,Domnul Florin-Vasile Cîțu:,28340, multumesc domnule presedinte stimate colege stimati colegi noi cei de la usr salutam decizia guvernului de a prelungi masurile de ajutor fata de angajati si angajatori in cazul exceptional in care activitatea firmei este afectata din discutiile purtate cu persoanele afectate atat angajati cat si angajatori am considerat ca este o masura justa la fel cum a fost si in perioada de pandemie oficiala as mai adauga niste cifre mai ales ca s a pus o intrebare aici in sala la care as vrea sa raspund partial si la care dand aceste cifre as vrea sa intorc intrebarea catre ministrul sanatatii domnul rafila in ultimele sapte zile avem cam o suta zero de cazuri de covid in statele unite si am putea spune sigur e o tara indepartata cum ne afecteaza dar avem peste cincizeci zero de cazuri zilnice in germania si avem peste treizeci si cinci zero de cazuri in italia si am vazut din presa in mod recent ca peste cincizeci de zboruri ale companiei aeriene austrian airlines au fost anulate tocmai pentru ca exista o rata foarte mare de imbolnavire in randul angajatilor avand in vedere ca este sezon estival de vacante mobilitatea este foarte crescuta ma astept ca cele o suta sapte cazuri raportate in romania un numar mic ceea ce este foarte bine din pacate sa creasca si atunci asteptam din partea guvernului si mai ales a ministrului rafila sa vedem cum anume ne pregatim pentru ceea ce s ar putea cu tristete sa urmeze in toamna acestui an revenind la initiativa insa asa cum spuneam vom vota in favoarea acestei initiative consideram ca mediul de afaceri angajatii si angajatorii in egala masura trebuie sa fie protejati si salutam aceasta initiativa multumesc ,"(2579.0, 2663.0)"
24,Domnul Florin-Vasile Cîțu:,28340,Domnul Adrian Streinu Cercel:,28453, va multumesc domnule senator daca sunt alte interventii domnul senator cercel ,"(3270.0, 7348.76)"
25,Domnul Adrian Streinu Cercel:,28453,Domnul Florin-Vasile Cîțu:,28794, multumesc domnule presedinte as dori sa va informez ca pandemia nu s a terminat cine si imagineaza ca s a terminat se inseala se raporteaza in tarile din europa cu zecile de mii de cazuri daca va intereseaza grecia in medie noua zero de cazuri pe zi de aici in continuare fiecare judeca multumesc ,"(2676.0, 2692.0)"
26,Domnul Florin-Vasile Cîțu:,28794,Domnul Ștefan Pălărie:,29894, va multumesc domnule senator daca mai sunt alte interventii va rog daca nu mai sunt alte interventii incheiem dezbaterile generale asupra acestui punct al ordinii de zi si initiativa legislativa ramane la vot final punctul patru propunerea legislativa pentru modificarea si completarea legii educatiei nationale nr unu doua mii unsprezece sunteti mai atenti va rog frumos bine domnul senator palarie ,"(540.0, 716.0)"
27,Domnul Ștefan Pălărie:,29894,Domnul Florin-Vasile Cîțu:,31873, domnule presedinte multumesc si imi cer scuze pentru interventia lenta este un subiect adaugat pe ordinea de zi foarte din scurt asta pentru ca in aceasta dimineata la ora noua treizeci a fost convocata sedinta reunita a trei comisii parlamentare pentru a se da un raport din pacate de data aceasta nu sustinem initiativa votul nostru va fi unul de abtinere avem aici o problema pentru faptul ca pe o initiativa pe care o consideram corecta a colegului bogdan matei una de a grabi posibilitatea de a infiinta invatamant specializat catre clasa inclusiv cu profil sportiv din cadrul invatamantului primar o initiativa care si daca ar fi fost promulgata astazi nu ar fi putut sa faca modificari asupra structurii anului scolar si asupra numarului de clase incepand din septembrie ori astazi urgenta cu care a fost votata o lege cu tot cu un amendament nou votat in camera deputatilor am spus ca nu este una benefica iar noi ne am pozitionat in primul rand pentru amanare si pentru o dezbatere parlamentara de comisie autentica nu una pe repede inainte mai mult decat atat tot astazi in cadrul acestei comisii reunite a fost adus un amendament de eliminare a unei litere lit f din art doua sute cincizeci si patru alin care din nou nu stim daca este oportuna nu credem ca este oportuna dar am inteles ca deja exista reactii ale mediului de afaceri care nu gusta si nu apreciaza faptul ca in segmentul de avizare a cadrelor didactice din invatamantul specializat exact mediul de afaceri a fost taiat sau anulat de la a avea un cuvant de spus din acelasi motiv am avut un vot de abtinere si la amendament avem un vot de abtinere noi cei din usr si pentru aceasta initiativa inca o data e pacat ca nu punem pe ordinea de zi subiecte extrem de sensibile le amanam in schimb trecem pe repede inainte cu minimum de dezbatere parlamentara ceva care pare sa vina la ordin din spate de nu stim cine multumesc ,"(2777.0, 2909.0)"
28,Domnul Florin-Vasile Cîțu:,31873,Domnul Constantin-Bogdan Matei:,31968, multumesc domnule senator daca sunt alte interventii va rog ,"(3270.0, 7348.76)"
29,Domnul Constantin-Bogdan Matei:,31968,Domnul Florin-Vasile Cîțu:,32538, multumesc domnule presedinte n am sa fac referire pe fondul initiativei legislative ci un scurt comentariu despre reactiile mediului de afaceri acestea nu sunt eliminate pentru ca clasele pe invatamant dual nu se pot infiinta decat printr o colaborare cu mediul de afaceri asadar n are nicio legatura ceea ce spuneti dumneavoastra la microfonul plenului cu ceea ce s a intamplat in comisie in sensul ca este un amendament care ar fi trebuit eliminat si stim cu totii de ce a fost eliminat va multumesc ,"(2920.0, 2956.0)"
30,Domnul Florin-Vasile Cîțu:,32538,Domnul Marius Humelnicu:,33445, multumim domnule senator matei daca mai sunt nu mai sunt alte interventii atunci incheiem dezbaterile asupra acestui punct si initiativa legislativa ramane la vot final punctul cinci al ordinii de zi propunerea legislativa privind schimbul de date intre sisteme informatice si crearea platformei nationale de interoperabilitate raportul comun al comisiei pentru administratie publica si comisiei pentru comunicatii si tehnologia informatiei este de admitere cu amendamente admise si amendamente respinse a propunerii legislative propunerea legislativa face parte din categoria legilor ordinare se adopta cu votul majoritatii senatorilor prezenti senatul este prima camera sesizata incepem dezbaterile daca sunt interventii in acest moment va rog domnule senator humelnicu a initiator si mai bine ,"(2959.0, 3004.0)"
31,Domnul Marius Humelnicu:,33445,Domnul Florin-Vasile Cîțu:,34952, ca initiator domnule presedinte multumesc domnule presedinte stimati colegi este vorba de un jalon in pnrr planul national de redresare si rezilienta componenta c7 transformare digitala si in programul de guvernare doua mii douazeci si unu doua mii douazeci si patru referitor la simplificarea procedurilor si debirocratizare asigurand in acest fel un cadru adecvat la dispozitia cetateanului menit sa ii faciliteze accesul la servicii oferite de administratia electronica sporirea gradului de interconectare a sistemelor informatice ale institutiilor si autoritatilor publice facilitarea schimbului de date intre institutiile publice si simplificarea proceselor administrative vor conduce la cresterea eficientei eficacitatii actului administrativ prin implementarea principiului doar o singura data datele furnizate prin platforma nationala de interoperabilitate au aceeasi valoare juridica cu datele continute in documentul prezentat fizic care contine sau confirma datele respective a unei copii conforme cu originalul sau a unui document electronic semnat cu semnatura electronica calificata securitatea si confidentialitatea schimbului de date sunt asigurate de catre toti participantii la schimbul de date si de catre adr cetatenii vor beneficia de o administratie publica conectata si eficienta cu proceduri simplificate de o birocratie redusa si timp de asteptare minim grupul psd va vota pentru multumesc domnule presedinte ,"(3014.0, 3101.0)"
32,Domnul Florin-Vasile Cîțu:,34952,Domnul Raoul-Adrian Trifan:,35563, multumesc domnule senator daca sunt alte interventii va rog din partea usr stimati colegi vreau sa va atrag atentia ca avem la balcon invitati in cadrul exercitiului international carpathian blue shield exercitiu de comandament cu participanti din structuri de politie si jandarmerie din finlanda spania estonia franta cipru republica moldova italia olanda portugalia tara gazda fiind romania welcome to the romanian parliament din partea domnului vela este invitatia va rog domnule senator ,"(3270.0, 3276.0)"
