,start_text,start_index,end_text,end_index,text,timestamp
61,Doamna Liliana Sbîrnea:,62523,Domnul Florin-Vasile Cîțu:,64314, multumesc frumos domnule presedinte de sedinta dragi colegi romania in acest moment nu are inca consfintit prin lege o floare nationala ca element de identitate nationala desi au existat de a lungul timpului mai multe initiative in acest sens horticultori de prestigiu de la universitatea de stiinte agronomice si medicina veterinara din bucuresti sustin de mai multi ani ca bujorul are multiple semnificatii pentru poporul roman si ca ar fi specia floricola cea mai potrivita pentru a fi declarata in mod oficial floarea nationala a romaniei dragostea romanilor pentru bujori se regaseste cel mai frecvent si in numele pe care le poarta astfel aproximativ saptezeci zero de persoane au ca prenume numele de bujor si aproximativ treizeci zero de persoane au ca nume de familie numele de bujor initiativa legislativa stipuleaza organizarea anuala a unui festival al bujorului stabileste masuri de protectie a rezervatiilor naturale de bujor existente in tara totodata prevede organizarea periodica la nivel national si al unitatilor administrativ teritoriale a unor expozitii florale care sa marcheze floarea de bujor ca floare nationala asociat in traditia si cultura romaneasca cu puterea dragostei devotamentul sacrificiul si sangele bujorul romanesc a fost ales ca simbol al recunostintei si al respectului pentru veteranii de razboi si veteranii teatrelor de operatii prin purtarea bujorului la rever romanii demonstreaza recunostinta pentru faptele de arme ale militarilor romani din toate timpurile in temeiul celor spuse va rog dragi colegi sa votati aceasta initiativa legislativa prin care bujorul va deveni floarea nationala a romaniei si totodata element de identitate nationala va multumesc ,"(540.0, 716.0)"
62,Domnul Florin-Vasile Cîțu:,64314,Domnul Andrei Postică:,65000, va multumesc doamna senator daca mai sunt alte interventii nu mai sunt incheiem dezbaterile initiativa legislativa ramane la vot final punctul paisprezece propunerea legislativa pentru modificarea si completarea legii nr cincizeci si doi doua mii trei privind transparenta decizionala in administratia publica raportul comisiei pentru administratie publica este de respingere a propunerii legislative cu amendamente respinse propunerea legislativa face parte din categoria legilor ordinare si se adopta cu votul majoritatii senatorilor prezenti senatul este prima camera sesizata interventii domnul senator postica initiatorul am inteles va rog ,"(3270.0, 7350.76)"
63,Domnul Andrei Postică:,65000,Domnul Florin-Vasile Cîțu:,67159, multumesc domnule presedinte prezenta propunere legislativa are in vedere reiterarea importantei transparentei decizionale in administratia publica implicarea societatii civile sau a altor autoritati publice in actele decizionale ale administratiei publice prin informarea acestora asupra proiectelor supuse dezbaterii si prin accesul acestora in cadrul sedintelor de consultare publica reprezinta un act necesar in dezvoltarea societatii in acest moment exista obligativitatea consultarii publice pentru actele normative importante din administratiile publice locale doar daca aceasta consultare este solicitata in scris de catre o asociatie legal constituita sau de catre o alta autoritate publica de aceea este necesar ca efectuarea unei consultari publice conform legii sa nu fie conditionata de primirea unei solicitari scrise in acest sens autoritatea publica locala trebuie sa fie proactiva sa dea dovada de deschidere si in colaborarea cu cetatenii organizand permanent consultari publice si dezbateri din care sa rezulte acte normative destinate cetatenilor si care sa raspunda nevoilor reale asadar propunerea legislativa vizeaza obligarea autoritatilor publice centrale si locale chiar daca acest lucru nu este solicitat de vreo entitate precum si a altor institutii publice de a mentine transparenta decizionala in fata cetatenilor prin organizarea de dezbateri publice pentru acele acte normative care s ar incadra in timpul celor supuse dezbaterilor publice conform legii astfel autoritatile publice locale si judetene sunt obligate sa organizeze intalniri in care sa se dezbata dupa caz proiectele de hotarari privind aprobarea strategiilor proiecte de hotarari privind aprobarea bugetelor proiectele de hotarari privind aprobarea rectificarilor bugetare proiectele de hotarari privind impozitele si taxele locale precum si proiectele de hotarari prin care reglementeaza organizarea si functionarea serviciilor publice indiferent daca acestea au fost solicitate sau nu grupul usr va vota impotriva raportului de respingere multumesc ,"(5262.0, 5397.0)"
64,Domnul Florin-Vasile Cîțu:,67159,Domnul Császár Károly Zsolt:,67220, va multumesc din partea udmr ,"(4201.0, 4202.0)"
65,Domnul Császár Károly Zsolt:,67220,Domnul Florin-Vasile Cîțu:,68646, va multumesc domnule presedinte in ceea ce priveste propunerea legislativa noi consideram ca acest lucru este foarte bine reglementat in legea privind transparenta publica a fost reglementat si pana acum si este foarte ciudat ca aceasta propunere vine cu ideea ca sa se organizeze in cadrul uat urilor cu ocazia prezentarii proiectelor de hotarari dezbateri chiar si atunci cand acest lucru nu se solicita in legea transparentei publice este reglementat foarte clar si sunt stabilite foarte clar termenele la care toti cei interesati si ong si persoane fizice si toata lumea cine are ceva de spus si ceva de adaugat la proiectele initiate sa intervina si sa solicite dezbatere publica sau sa depuna amendamente la proiectul de hotarare respectiv deci este inacceptabil ca in situatia in care le dai posibilitatea oamenilor sa intervina in procesul legislativ la nivel local ei nu vor in termenul legal dar totusi tu sa organizezi dezbateri in acest sens sa dezbati cu cine daca nu vrea nimeni n are nimeni nicio interventie cu cine sa dezbati deci asta ar fi prima intrebare a doua toate proiectele adica toate proiectele de hotarari insirate in acest proiect legislativ si in momentul de fata sunt acte normative la care trebuie respectate toate procedurile privind transparenta in administratia publica va multumesc frumos ,"(540.0, 716.0)"
66,Domnul Florin-Vasile Cîțu:,68646,Domnul Eugen-Remus Negoi:,68799, multumesc domnule senator daca mai sunt alte interventii domn negoi de obicei unul pe dar era initiator ,"(5886.0, 5894.0)"
67,Domnul Eugen-Remus Negoi:,68799,Domnul Florin-Vasile Cîțu:,71102, multumesc domnule presedinte as vrea sa punctez si sa lamuresc in acelasi timp cateva chestiuni e adevarat in momentul acesta legea transparentei decizionale specifica foarte clar ca autoritatile publice sunt obligate sa faca dezbateri publice dar subliniez aici doar daca cineva isi exprima intentia in acest sens deci doar daca un ong sau o alta institutie entitate publica transmite un e mail ca ar vrea sa participe noi ne dorim ca implicarea cetatenilor in viata publica si in deciziile care tin pana la urma de viata lor sa fie cat mai buna cu putinta ne dorim ca autoritatile publice sa fie cat mai proactive si as vrea sa raspund intrebarilor antevorbitorului meu cine va veni daca nu si exprima intentia pai atata timp cat o autoritate publica in speta o primarie isi doreste sa si apropie cetatenii si isi doreste sa explice cat mai bine ce vrea de la cele cinci categorii pe care noi le am prins in aceasta initiativa deci nu e vorba de toate hotararile de consiliu local sau consiliu judetean e vorba doar de cinci categorii foarte importante atunci putem sa spunem putem sa facem un efort ca autoritate publica si sa ii chemam pe fiecare in parte vorbesc de ong uri sau alte autoritati publice care ar fi interesate in adoptarea proiectului de buget de exemplu sau a rectificarii bugetare asta ne dorim sa fim proactivi ca autoritati publice in asa fel incat ulterior sa nu apara discutii ca nu au stiut oamenii as vrea sa va dau un sigur exemplu care s a intamplat in constanta referitor la un regulament de accedere in peninsula in zona peninsulara a municipiului constanta atunci cand primaria municipiului constanta a pus in dezbatere publica e adevarat dar nici macar cetatenii de acolo nu au stiut pentru ca nu a venit nimeni in intampinarea lor sa le spuna vedeti ca vom pune bariere pentru a accede in aceasta zona peninsulara a iesit o intreaga tevatura din cauza asta si atunci ne dorim si pe baza exemplelor acestea ne dorim foarte tare ca institutiile publice primariile in special sa fie proactive si sa vina in intampinarea cetatenilor tocmai de aceea noi ca grup al senatorilor usr vom vota impotriva raportului de respingere va multumesc ,"(5525.0, 5685.0)"
68,Domnul Florin-Vasile Cîțu:,71102,Doamna Diana Iovanovici-Șoșoacă:,71200, va multumesc domnul senator doamna senator sosoaca microfonul trei ,"(2471.0, 7346.76)"
69,Doamna Diana Iovanovici-Șoșoacă:,71200,Domnul Florin-Vasile Cîțu:,73348, s a mentionat aici ca nu sunt oameni interesati sa vina la astfel de dezbateri va contrazic si cand eram in civism si acum ma duc de fiecare data cand aud ca exista un proiect si exista dezbateri indiferent ca le fac primariile sau oricare entitate institutie publica sau privata din pacate in ceea ce priveste primariile in special mi a fost dat sa intalnesc la rovina cu tot respectul pentru pnl aveti un primar la brad care a pus oamenii sa i ia la bataie pe cei care au venit din bucuresti pentru ca erau foarte deranjati de proiectul de la rovina ca se afla ceea ce se intampla acolo mai departe la toate primariile la care am fost foarte rar mi a fost dat sa intalnesc primari si consilii care sa fie deschisi catre cei care vin sa se intereseze de proiecte de ce pentru ca exista aranjamente care nu trebuie sa ajunga la opinia publica asa ca o astfel de initiativa sa o respingeti in conditiile in care civismul in romania este in crestere si este foarte bine ca este in crestere si nu trebuie sa fie numai ong uri sunt oameni care isi manifesta interesul si orice persoana are dreptul sa se intereseze de ceea ce se intampla in comunitatea ei din pacate primarii si toti cei care sunt ar trebui sa fie deschisi catre astfel de dezbateri nu sunt invatati sa si respecte comunitatea si nu accepta astfel de intalniri pentru ca nimeni nu are interesul in politica cel putin pana acum sa isi invete candidatii care au ajuns pe anumite locuri ca mai intai respecti omul cetateanul care te a facut sa ajungi acolo chiar daca nu te a votat pentru ca iti plateste din taxele si impozitele lui salariul si pentru ca asa este normal este o initiativa care trebuie votata si nu ar fi trebuit doar o singura intalnire ci mai multe intalniri daca acest lucru ar fi fost solicitat una doua nesolicitate si restul la solicitarea celorlalti pentru ca asa iar veti da dreptul la abuzuri face o intalnire pe repede inainte nimeni nu stie nimic si a trecut proiectul cum a vrut si comunitatea se trezeste in fata faptului implinit multumesc frumos ,"(540.0, 716.0)"
70,Domnul Florin-Vasile Cîțu:,73348,Domnul Florian-Dorel Bodog:,73443, va multumesc domnul senator bodog din partea psd microfonul trei ,"(3270.0, 7346.76)"
71,Domnul Florian-Dorel Bodog:,73443,Domnul Florin-Vasile Cîțu:,73858, multumesc domnule presedinte in momentul de fata exista acte normative care reglementeaza acest lucru eu sunt foarte deschis sa ascult experientele personale cu privire la orice altceva decat proiectul legislativ dar cred ca nu e in beneficiul nostru al tuturor si nici in beneficiul actului legislativ ceea ce se intampla in momentul de fata multumesc domnule presedinte ,"(5866.0, 5884.0)"
72,Domnul Florin-Vasile Cîțu:,73858,Domnul Raoul-Adrian Trifan:,74589, multumesc domnule senator daca mai sunt si alte interventii nu mai sunt alte interventii incheiem dezbaterile initiativa legislativa ramane la vot final punctul cincisprezece propunerea legislativa pentru instituirea zilei memoriale a holodomorului raportul suplimentar al comisiei pentru administratie publica este de admitere cu amendamente admise a propunerii legislative propunerea legislativa face parte din categoria legilor ordinare si se adopta cu votul majoritatii senatorilor prezenti senatul este prima camera sesizata incepem dezbaterile daca sunt interventii din partea colegilor senatori din partea usr domnul trifan senator trifan ,"(5901.0, 5926.0)"
73,Domnul Raoul-Adrian Trifan:,74589,Domnul Florin-Vasile Cîțu:,75749, multumesc domnule presedinte stimati colegi poporul roman este un popor tolerant si empatic iar cea mai buna dovada pentru acest lucru este modul in care ne am mobilizat cu totii pentru a ajuta refugiatii ucraineni la debutul agresiunii ruse acest proiect in forma modificata si adoptata de comisiile permanente aduce un omagiu victimelor marii foamete din o mie noua sute treizeci si doi si o mie noua sute treizeci si trei de pe teritoriul fostei uniuni sovietice holodomorul caci asa a fost el botezat de catre cei care l au trait a fost o infometare artificiala a populatiei care a omorat milioane de oameni si care a fost pusa in practica de regimul stalinist cu scopul subjugarii totale a popoarelor care nu se lasau dominate de puterea rusa romania are comunitati importante din randul etniilor care au fost victimele holodomorului sa consemnam acest eveniment si sa dam ocazia comunitatilor sa l comemoreze intr un format oficial denota din nou toleranta si empatia romanilor fata de cei care au avut de suferit din cauza hegemoniei istorice ruse in regiunea noastra a europei de est grupul usr va vota pentru raportul de admitere va multumesc ,"(5948.0, 6017.0)"
74,Domnul Florin-Vasile Cîțu:,75749,Domnul Cristian-Augustin Niculescu-Ţâgârlaş:,76459, va multumesc domnule senator daca mai sunt alte interventii nu mai sunt initiativa legislativa ramane la vot final punctul saisprezece propunerea legislativa pentru modificarea legii nr o suta patruzeci si trei doua mii privind prevenirea si combaterea traficului si consumului ilicit de droguri raportul comisiei juridice de numiri disciplina imunitati si validari este de admitere cu amendamente admise a propunerii legislative propunerea legislativa face parte din categoria legilor organice si se adopta cu votul majoritatii senatorilor senatul este prima camera sesizata incepem dezbaterile domnul senator tagarlas va rog microfonul central ,"(6017.0, 6052.0)"
75,Domnul Cristian-Augustin Niculescu-Ţâgârlaş:,76459,Domnul Florin-Vasile Cîțu:,78639, domnule presedinte stimati colegi plec de la o data douazeci si sase sase doua mii douazeci si doi ziua internationala a luptei impotriva abuzului si a traficului ilicit de droguri parca s au potrivit lucrurile astazi discutam despre o tema extrem de serioasa si ieri s a discutat la nivel mondial aceeasi tema ceea ce vreau sa subliniez este faptul ca in momentul de fata in lume si in romania ne aflam intr un razboi intr un razboi extrem de cumplit cu victime colaterale un razboi in care se afla pe de o parte traficantii de droguri iar pe de alta parte tineretul copiii tarii asteia romanii vreau sa va spun ca din toate informatiile din toate statisticile scolile sunt asaltate de traficantii de droguri cluburile toate domeniile sociale sunt afectate de consumul ilicit de stupefiante si acest lucru trebuie sa genereze o atitudine a parlamentului romaniei ii felicit pe colegii mei liberali care au initiat acest proiect de hotarare pentru inasprirea masurilor aplicate traficantilor si producatorilor de substante ilicite asta trebuie sa faca parlamentul romaniei prin actul de legiferare sa transpuna necesitatea societatii printr o dispozitie legala asta este rolul nostru emblematic de altfel vreau sa va spun ca sunt onorat ca aceasta initiativa a trecut de comisia juridica si ca dupa ce va trece si de plenul senatului se va dezbate in camera deputatilor unde nu cred ca vom avea probleme ca aceasta initiativa sa nu treaca si sa avem o lege care sa aduca un plus de rigoare si un plus de autoritate statului roman masurile pe care legea le aduce de inasprire a pedepselor de majorare a limitelor speciale minimale si maximale are un dublu efect unul preventiv ca toata lumea sa stie ca aceasta infractiune este aspru sanctionata si doi de sanctionare a persoanelor vinovate care vor fi constatate de catre instantele de judecata deci aceasta dubla calitate a unui act normativ este atinsa de proiectul de lege motiv pentru care pnl va sustine un astfel de demers care este extrem de onorabil si acopera nevoile societatii romanesti de astazi va multumesc ,"(6068.0, 6176.0)"
76,Domnul Florin-Vasile Cîțu:,78639,Doamna Diana Iovanovici-Șoșoacă:,78771, va multumesc domnule senator daca mai sunt alte interventii doamna senator sosoaca microfonul trei ,"(7344.76, 7350.76)"
77,Doamna Diana Iovanovici-Șoșoacă:,78771,Domnul Florin-Vasile Cîțu:,79922, multumesc da sunt de acord ca e o initiativa buna insa nu acopera nevoile societatii de azi putem sa dam si o suta de ani de puscarie problema este preventia ce se face in viata sociala pentru ca daca o sa va duceti mai ales prin blocurile de la dristor o sa vedeti copii si de noua ani si de zece ani cu seringile langa ei eu personal am gasit habar n au parintii de ei nu se stie nimic ce fac problema este ca deja au ajuns la seringa si in momentul ala puteti sa i dati dumneavoastra si cinci sute de ani de puscarie ca acel copil nu mai este recuperabil atentie deci pe langa aceasta initiativa trebuie obligatoriu sa avem o preventie care chiar sa se realizeze iar toti factorii sa fie implicati nu numai politic ci trebuie colaborari si cu ong uri aici trebuie sa avem si bani de la guvern sa avem si bani de la primarii pentru a plati oamenii care sa poata sa mai salveze astfel de copii sa stiti ca privelistea este cumplita nu o poti uita niciodata si oricare din acei copii poate fi copilul nostru doamne fereste dar nu o rezolvati numai cu articolele astea multumesc frumos ,"(540.0, 716.0)"
78,Domnul Florin-Vasile Cîțu:,79922,Doamna Diana Iovanovici-Șoșoacă:,80719, va multumesc doamna senator daca mai sunt alte interventii la acest punct nu mai sunt incheiem dezbaterile initiativa legislativa ramane la vot final punctul saptesprezece propunerea legislativa pentru completarea legii nr douazeci si unu o mie noua sute nouazeci si unu a cetateniei romane raportul comun al comisiei juridice de numiri disciplina imunitati si validari si al comisiei pentru romanii de pretutindeni este de admitere cu amendamente admise a propunerii legislative propunerea legislativa face parte din categoria legilor organice si se adopta cu votul majoritatii senatorilor senatul este prima camera sesizata incepem dezbaterile daca sunt interventii doamna senator sosoaca vreti sa interveniti da va rog microfonul trei ,"(7344.76, 7350.76)"
79,Doamna Diana Iovanovici-Șoșoacă:,80719,Domnul Florin-Vasile Cîțu:,81141, sa inteleg ca le dam cetatenia si persoanelor care sunt casatorite si convietuiesc cu un cetatean roman in afara granitelor tarii timp de zece ani si cum o demonstram ok sunt casatoriti si daca e o casatorie de convenienta pentru ca si aici da da sunt de convenienta si va spun ca se iau bani in jur intre doi zero si cinci zero de euro pe an cam asta este suma stiati multumesc ,"(6357.0, 6393.0)"
80,Domnul Florin-Vasile Cîțu:,81141,Domnul Radu-Mihai Mihail:,81401, va multumesc acum interesul pentru romania ne flateaza dar nu stiu daca este asa de mare daca nu mai sunt alte interventii aveti o interventie domnule vicepresedinte din partea usr domnul senator radu mihail ,"(7344.76, 7350.76)"
81,Domnul Radu-Mihai Mihail:,81401,Domnul Florin-Vasile Cîțu:,82760, va multumesc domnule presedinte aceasta propunere practic indreapta un lucru care nu functiona bine in ultimele decenii foarte multi romani care au fost siliti sa plece in afara tarii s au casatorit cu persoane din tarile gazda si au construit familii multe familii europene unde am vazut cu ochii mei intalnindu ma cu multe dintre aceste cupluri sunt oameni care iubesc impreuna romania pentru ca au copii care vorbesc limba romana pentru ca si in cazul in care nu stiu inca foarte bine limba romana se intereseaza de ce se intampla in romania si care aspira sa fie romani si cred ca initiativa a fost foarte buna si apreciez ce au facut colegii din psd pentru a pune acest subiect pe ordinea de zi a parlamentului romaniei ce ma bucura si mai mult este ca a fost acceptat amendamentul care a facut aceasta lege operabila operationala pentru ca am observat ca propunerea initiala din pacate era scrisa foarte prost ea de fapt restrangea accesul la cetatenia romana si am venit cu propunerea de amendament care a adus aceasta lege in spiritul pe care il gandeau initiatorii imi pare bine ca am reusit sa colaboram in comisie pe aceasta tema si ca vom avea o legislatie sper votata de noi toti care ne va permite sa avem romani care vor sa fie romani mult mai usor multumesc ,"(6429.0, 6534.0)"
82,Domnul Florin-Vasile Cîțu:,82760,Domnul Robert-Marius Cazanciuc:,82887, multumesc domnule senator domnul vicepresedinte robert cazanciuc vicepresedinte al senatului ,"(3270.0, 4202.0)"
83,Domnul Robert-Marius Cazanciuc:,82887,Domnul Florin-Vasile Cîțu:,85119, multumesc domnule presedinte voiam sa spun cateva ganduri ca initiator al acestui proiect realitatea este ca din pacate un sfert din romania nu mai este in romania ci se afla oriunde va ganditi sau nu in aceasta lume realitatea acestor oameni arata ca e nevoie de solutii pentru ei si am primit de a lungul timpului mai multe propuneri din germania din franta din statele unite de la cetateni americani francezi sau germani indragostiti de romania sigur indragostiti in primul rand de partenerul lor de viata de sot sau de sotie dar indragostiti prin intermediul lor si de romania si m au intrebat noi de ce nu putem deveni cetateni romani daca voi spre exemplu aveti o valoare care se numeste libera circulatie in europa puteti sa va alegeti oriunde vreti domiciliul puteti sa locuiti oriunde vreti in romania nu mai sunteti legati de glie ni se spune de catre diversi parteneri asa este nu mai suntem legati de glie in aceasta realitate eu cred ca romania are de castigat prin faptul ca cei care iubesc romania vor sa devina cetateni romani sigur a spus colegul radu mihail aici faptul ca a fost scrisa cumva gresit initial legea legea avea o expunere de motive din care rezulta foarte clar intentia de a i ajuta pe cei care iubesc romania sa devina cetateni romani dar e bine ca au fost contributii pentru a avea o lege foarte bine scrisa in finalul dezbaterilor din comisia juridica dorinta noastra stimati colegi este de a i face cetateni romani pe cei care si doresc cu adevarat sa iubeasca romania si de a i ajuta nu de a i incurca raman toate celelalte conditii din lege obligatorii si atunci nu incercam sa eludam nu incercam sa tranzactionam cum dureros am auzit putin mai devreme aici daca cineva crede ca o casatorie de zece ani de zile este una care poate fi tranzactionata eu nu am auzit de asa ceva dar recunosc ca ma pot insela nu despre tranzactii este vorba ci despre o facilitate pe care o acordam cetatenilor romani care au ales sa traiasca in strainatate dar vrem sa i ajutam pe cei care aleg sa iubeasca romania va rog sa votati stimati colegi aceasta initiativa multumesc ,"(6549.0, 6698.0)"
84,Domnul Florin-Vasile Cîțu:,85119,Doamna Diana Iovanovici-Șoșoacă:,89497, va multumesc domnule senator si initiator daca mai sunt alte interventii la aceasta initiativa legislativa nu mai sunt incheiem dezbaterile si initiativa legislativa ramane la vot final punctul optsprezece propunerea legislativa pentru completarea legii nr o suta treizeci si opt doua mii patru a imbunatatirilor funciare reexaminare la solicitarea presedintelui romaniei raportul suplimentar al comisiei pentru drepturile omului egalitate de sanse culte si minoritati este de respingere a legii transmise la promulgare in sensul insusirii obiectiunilor din cererea de reexaminare formulata de presedintele romaniei legea face parte din categoria legilor ordinare si se adopta cu votul majoritatii senatorilor senatul este prima camera sesizata daca sunt interventii la aceasta initiativa legislativa doamna senator sosoaca microfonul trei va rog ,"(6948.0, 6970.0)"
