,start_text,start_index,end_text,end_index,text,timestamp,start,end
1,S T E N O G R A M A,0,şedinţei Senatului din 30 mai 2022,21, ,"(0.0, 6255.96)",0.0,6255.96
2,şedinţei Senatului din 30 mai 2022,21,S U M A R,61, ,"(0.0, 6255.96)",0.0,6255.96
3,S U M A R,61,S T E N O G R A M A,5076, unu aprobarea ordinii de zi si a programului de lucru patru cinci saisprezece doi mesaj cu prilejul zilei de unu iunie ziua copilului cinci trei alocutiune cu ocazia zilei nationale a supravietuitorilor de cancer opt patru adoptarea tacita prin implinirea termenului pentru dezbatere si adoptare la douazeci si cinci si doisprezece douazeci si sase mai doua mii douazeci si doi a unor initiative legislative cinci aprobarea transmiterii catre camera deputatilor ca prima camera sesizata a doisprezece unor initiative legislative sase numirea unor membri ai consiliului national de integritate treisprezece sapte propunerea legislativa privind aprobarea procedurii de pregatire pentru reutilizare saisprezece a deseurilor de echipamente electrice si electronice a cerintelor tehnice privind pregatirea pentru reutilizare si a cerintelor de raportare si monitorizare a echipamentelor electrice si electronice reutilizate din legea nr patruzeci si sapte o mie noua sute nouazeci si doi privind organizarea si functionarea curtii constitutionale republicata ,"(1474.96, 1488.96)",1474.96,1488.96
4,S T E N O G R A M A,5076,şedinţei Senatului din 30 mai 2022,5097, ,"(0.0, 6255.96)",0.0,6255.96
5,şedinţei Senatului din 30 mai 2022,5097,Domnul Florin-Vasile Cîțu:,5351, sedinta a inceput la ora cincisprezece zece lucrarile sedintei au fost conduse de domnul florin vasile citu presedintele senatului asistat de domnul eugen pirvulescu si domnul ion narcis mircescu secretari ai senatului ,"(0.0, 6255.96)",0.0,6255.96
6,Domnul Florin-Vasile Cîțu:,5351,Doamna Diana Iovanovici-Șoșoacă:,5966, buna ziua stimati colegi va rog sa luati loc sa incepem sedinta doamnelor si domnilor senatori declar deschisa sedinta plenului senatului de astazi treizeci mai doua mii douazeci si doi va anunt ca din totalul de o suta treizeci si cinci de senatori pana in acest moment si au inregistrat prezenta la lucrari un numar de saptezeci si cinci de senatori sedinta este condusa de subsemnatul presedinte al senatului asistat de domnul senator eugen pirvulescu si domnul senator ion narcis mircescu secretari ai senatului inainte de a incepe sedinta avem o interventie a doamnei senator sosoaca va rog frumos microfonul central ,"(16.0, 26.0)",16.0,26.0
7,Doamna Diana Iovanovici-Șoșoacă:,5966,Domnul Florin-Vasile Cîțu:,6267, buna ziua va multumesc frumos pentru ca mi ati acordat cuvantul am un anunt politic de facut in ceea ce ma priveste de astazi va anunt ca sunt membra a partidului s o s romania va multumesc foarte mult dumnezeu sa binecuvanteze romania si poporul roman ,"(46.4, 65.2)",46.4,65.2
8,Domnul Florin-Vasile Cîțu:,6267,Maria – reprezentant al Boardului Copiilor din România susținut de UNICEF:,7416, va multumesc doamna senator ,"(3026.96, 3041.96)",3026.96,3041.96
9,Maria – reprezentant al Boardului Copiilor din România susținut de UNICEF:,7416,Domnul Florin-Vasile Cîțu:,11497, domnule presedinte al senatului doamnelor si domnilor senatori stimata audienta ma simt onorata sa fiu astazi aici ca reprezentant al boardului copiilor sustinut de unicef romania si al tuturor copiilor din tara am remarcat numeroase initiative care au fost adoptate de parlament in romania in ultimii ani si ma declar incantata sa observ ca lucrurile la noi in tara se schimba incetul cu incetul am norocul de a ma afla astazi aici datorita parintilor si profesorilor mei care mi au oferit sansa de a primi o educatie adecvata si care m au ajutat sa ma dezvolt totusi in romania secolului xxi unul din cinci copii nu termina opt clase si aproape unul din doi adolescenti de cincisprezece ani este analfabet functional adica are dificultati in a intelege un text oare nu merita toti copii din romania sa beneficieze de sansa de a si atinge adevaratul potential educatia nu tine de noroc educatia este un drept este o normalitate de la care nu se admit exceptii va rog sa va ganditi la cauzele problemelor pe care le avem de rezolvat inainte de a cauta solutii ce avem de fapt de rezolvat ganditi va la copiii care nu au familie la cei care nu reusesc sa ajunga la scoala la cei care nu au caldura in scoala lor la cei nu isi permit sa si cumpere nici macar caiete trebuie sa constientizam problemele sa incercam sa ne dam seama care sunt ele cu adevarat si de unde provin educatia nu e doar despre noi copiii ci despre romania noi toti copiii ne dorim sa invatam noi copiii din romania ne dorim stabilitate ne dorim o schimbare nu doar de dragul unei schimbari ne dorim o lege a educatiei stabila si sustenabila atunci cand legiferati ganditi va pe termen lung ganditi va la noi toti ma regasesc in cuvintele academicianului solomon marcus nu este o anomalie faptul ca cele mai frumoase carti de matematica fizica chimie biologie nu sunt cele scolare ci cele extrascolare este oare normal intelept ca actul didactic sa ramana mereu asociat cu plictisul cazna si uratul visez ca ceea ce li se cere elevilor sa nu fie reproducerea unor date ci construirea unui discurs propriu pe o tema inedita stim ca o parte dintre dumneavoastra sunt profesori si va rugam sa ne incurajati in eforturile noastre sa ne simtim cu totii ascultati si intelesi va rugam sa ne incurajati sa gandim ne dorim sa intelegem o informatie si nu doar sa o memoram gandesc deci exist ne dorim sa gandim ca sa putem fi sa fim oameni sa avem un rationament ne dorim aceeasi informatie stiuta de milioane de ori pe de rost sau ne dorim milioane de gandiri cu un ideal comun o tara educata este o tara puternica si echilibrata daca exista copii in romania care nu isi doresc sa fie educati eu nu i am cunoscut inca desi am stat de vorba cu multi dintre cei care nu merg la scoala cu totii ne dorim sa mergem la scoala dar mai ales sa fim noi insine si sa gandim critic oare ne dorim romania superficialitatii sau una a dezvoltarii si initiativei initiativa se naste acolo unde are loc intr o societate in care educatia este pe primul plan in care masurile luate sunt statornice iar intelegerea precede memorarea pentru asta avem nevoie de o lege a educatiei actualizata care sa fie implementata la fel indiferent de majoritatea din parlament sau guvern avem nevoie de materii adaptate la contextul secolului xxi care sa asigure acelasi nivel de educatie si intr o comunitate izolata si in centrul capitalei avem nevoie de investitii in educatie ca acele sute de mii de copii sa mearga la scoala sa invete sa isi finalizeze studiile si sa isi atinga potentialul stim ca dezvoltati legi bune asigurati va ca nu sunt modificate cu fiecare ocazie si ca sunt aplicate uniform in resedintele de judet si in cele mai sarace comunitati toti copii au dreptul la educatie ajutati ne sa fim ajutati ne sa ne dezvoltam sa speram sa analizam sa gandim ajutati ne sa actionam va multumesc ,"(196.96, 355.96)",196.96,355.96
10,Domnul Florin-Vasile Cîțu:,11497,Tudor – reprezentant al Boardului Copiilor din România susținut de UNICEF:,11638, multumim maria il rog acum pe tudor sa vina la microfonul central sa si spuna mesajul sau de ziua copilului ,"(188.96, 4931.96)",188.96,4931.96
11,Tudor – reprezentant al Boardului Copiilor din România susținut de UNICEF:,11638,Domnul Florin-Vasile Cîțu:,16461, domnule presedinte al senatului stimati senatori ma infatisez astazi in fata dumneavoastra nu ca un copil sau un simplu membru al boardului copiilor sustinut de unicef ci ca un reprezentant al tuturor copiilor din aceasta tara este o mare onoare pentru mine ca ma aflu aici este o mare onoare pentru mine ca ma aflu in institutia care emite legile ce ar trebui sa aduca sanatate si educatie tuturor copiilor din tara noastra in numele tuturor copiilor as dori sa va multumesc pentru initiativele si legile care au fost propuse si dezvoltate in ultimii ani totusi cu aceste multumiri vin si cateva solicitari noi copiii din romania va rugam sa insistati asupra implementarii initiativelor propuse in ultimii ani aici intra inclusiv completarile aduse legii educatiei in doua mii douazeci si unu si declaratia de la bucuresti a copiilor din uniunea europeana dezvoltata si adoptata de copiii din intreaga uniune europeana in contextul detinerii de catre romania a presedintiei consiliului ue in doua mii nouasprezece mi ar placea ca in fiecare an sa stim daca legile bune pe care dumneavoastra le ati votat sunt implementate si in beneficiul copiilor cu dizabilitati din familii sarace al copiilor care fac parte din minoritatile etnice al copiilor ucraineni al tuturor copiilor care traiesc in romania trecutul tarii noastre este unul in care exprimarea libera nu a fost incurajata dupa cum bine stim mediul influenteaza fiinta iar fiinta influenteaza mediul traim intr o societate in care majoritatea adultilor din prezent pur si simplu au crescut intr un context care nu a tinut cont de parerile si opiniile lor dar acum ne aflam intr o societate democratica si in ciuda acestui fapt aceste principii vechi inca guverneaza viata multor copii de azi copii reprezinta singura fereastra pe care o avem spre viitorul nostru gandurile acestora sunt o reflectie a lumii de maine cum ar trebui sa progresam ca tara daca incurajam copiii sa gandeasca ca parintii lor ca bunicii lor si i indemnam sa renunte la propriile lor idei opinii si pareri dreptul copiilor la participare prevazut in conventia onu cu privire la drepturile copilului este unul mai putin cunoscut ca dreptul la viata la nationalitate sau la un nume insa este la fel de important art doi trei doisprezece treisprezece saptesprezece nouasprezece treizeci si patru si treizeci si sase din conventia cu privire la drepturile copilului art patruzeci si noua alin ,"(586.96, 652.96)",586.96,652.96
12,Domnul Florin-Vasile Cîțu:,16461,Doamna Nicoleta Pauliuc:,16978, multumesc tudor multumesc participantilor pe copii ii asteptam miercuri la ziua senatului avem senatul junior miercuri deci va asteptam si miercuri multumim pentru participare mergem mai departe la punctul doi alocutiune cu ocazia zilei nationale a supravietuitorilor de cancer stimati colegi o invit la tribuna pe doamna senator nicoleta pauliuc pentru prezentarea alocutiunii cu ocazia zilei nationale a supravietuitorilor de cancer doamna senator ,"(804.96, 819.96)",804.96,819.96
13,Doamna Nicoleta Pauliuc:,16978,Domnul Florin-Vasile Cîțu:,23533, domnule presedinte stimati colegi am inteles astazi ca parlamentul este forumul unde se implinesc visele ii auzeam si pe tinerii nostri spunand ca isi doresc ca prin initiativele noastre sa le indeplinim visele eu cred ca trebuie sa ne luam acest angajament stimati colegi doamnelor si domnilor pentru prima data in romania vom sarbatori la sfarsitul acestei saptamani ziua nationala a supravietuitorilor de cancer in baza unei legi pe care am initiat o si care a fost promovata prin votul dumneavoastra al tuturor parlamentarilor daca nu as fi trecut direct printr un diagnostic oncologic n as fi putut intelege real complexitatea acestei boli si fragilitatea oamenilor care se lupta cu cancerul nu as fi putut sa mi imaginez cata nevoie de implicare si schimbare legislativa este si cat de mult pot veni in intampinare prin simplul fapt ca sunt parlamentar incercati pentru o clipa sa va imaginati ca primiti acum un anunt si vi se spune raspicat ca suferiti de cancer si nu mai aveti foarte multe zile de trait chiar daca desigur statistic nu e exclus sa aveti o minima sansa la viata faceti acest exercitiu si imediat veti pretui mai mult fiecare minut din viata fiecare simbol sau gest de care v ati putea agata pentru a trai o zi in plus sunt aici in sala multi dintre cei care au inteles acest lucru fie ca e vorba de cei care astazi se afla la balcon invingatorii bolii fie ca este vorba de toti cei care au votat legea prin voi a luat viata legea aceasta va multumesc din suflet pentru tot sprijinul pe care mi l ati acordat in promovarea initiativelor legislative referitoare la lupta impotriva acestei cumplite maladii a lumii moderne astazi vreau sa transmitem romanilor un mesaj de solidaritate si determinare in lupta impotriva cancerului vreau sa stie ca lucram serios pentru imbunatatirea conditiilor de viata pentru bolnavi pentru apartinatori si pentru supravietuitorii oncologici vreau sa le promitem aici si acum ca in spatele simbolurilor pe care le promovam azi stau si vor sta mai multe legi si fapte concrete pentru bolnavi apartinatori si supravietuitori cei care sunt astazi invitatii nostri in parlament sunt cei care au refuzat sa fie un numar in statistici ei sunt inca in ring si asteapta de la noi sa i ajutam sa ramana invingatori stimati colegi cancerul nu tine cont de varsta conditie sociala orientare politica fiecare dintre noi intelege cat de grea e aceasta lupta nedreapta fiindca nu exista familie sau grup de prieteni care sa nu fi avut sau sa nu aiba o persoana draga incercata de aceasta boala de cand sunt parlamentar in parlamentul romaniei am initiat saizeci si sapte de proiecte legislative pentru fiecare dintre ele am depus efortul personal pentru ca stiu cat de importanta este increderea oamenilor care mi au dat votul de departe insa cea mai personala initiativa pe care am avut o este legea referitoare la instituirea zilei nationale a supravietuitorilor de cancer in prima duminica a lunii iunie asa cum le am marturisit invingatorilor cu care m am intalnit mai devreme legea s a nascut din sufletul meu din speranta din iubire fata de ceilalti oameni care au trecut printr o astfel de experienta si recunosc din amintirea suferintei prin care am trecut am vazut aceasta lege ca o incheiere a unui cerc care a inceput in momentul diagnosticului pe care l am primit ziua supravietuitorului de cancer nu e doar un simbol e un mod de viata insignele simbol pe care le ati primit cu acel nufar galben le vor aminti bolnavilor de cancer si familiilor lor zi de zi ca au o sansa si ca merita sa lupte pentru ea asa cum noi vom lupta ca ei sa invinga eu o voi purta zi de zi ziua supravietuitorului de cancer va fi o celebrare a vietii o sarbatoare pentru supravietuitori o inspiratie pentru cei diagnosticati recent va fi o sensibilizare a comunitatii cu privire la speranta de supravietuire dupa aceasta boala cronica va fi reamintirea ca viata dupa un diagnostic de cancer este un dar ca totul se simplifica brusc si se concentreaza pe ce e cu adevarat important pe armonie pe optimism pe intelepciune dragi colegi din parlament dragi colegi de viata si de lupta impotriva cancerului cu sprijinul dumneavoastra am reusit mult mai mult decat promovarea unei legi prin care insotitorii bolnavilor de cancer pot beneficia de patruzeci si cinci de zile de concediu platit am reusit un pas spre normalitate aceeasi lege da acces gratuit bolnavilor oncologici si apartinatorilor la consultatii psihologice gratuite de aceea spun mereu ca simbolurile duc mai devreme sau mai tarziu la fapte bune nu in ultimul rand am initiat si dumneavoastra ati votat legea dreptului la uitare un proiect aprobat deja de senat care elimina discriminarile la care sunt supusi supravietuitorii de cancer in privinta accesului la credite la asigurari de sanatate toate acestea dragi colegi sunt fapte concrete si eu stiu ca si dumneavoastra de cate critici ne lovim in fiecare zi ca politicieni si membrii ai parlamentului dar pentru aceste lucruri pe care le am mentionat eu mai devreme dati mi voie in numele supravietuitorilor de cancer ca unul dintre ei sa va multumesc si sa va aplaud eu pe dumneavoastra ati votat pentru viata si pentru speranta ,"(874.96, 1305.96)",874.96,1305.96
14,Domnul Florin-Vasile Cîțu:,23533,Doamna Laura-Mihaela Fulgeanu-Moagher:,27080, multumesc doamna senator la balcon avem invitati supravietuitorii supun votului transmiterea catre camera deputatilor ca prima camera sesizata a initiativei legislative va rog sa votati optzeci si sase de voturi pentru initiativa legislativa a fost transmisa catre camera deputatilor s a aprobat transmiterea domnule fenechiu trecem la numirea unor membrii in consiliul national vreti sa aveti interventia acum sau dupa aceea vreti sa interveniti acum sau dupa votul de la consiliu dupa cni da punctul sase numirea unor membri ai consiliului national de integritate dau cuvantul reprezentantului comisiei juridice pentru a prezenta raportul comisiei privind numirea unor membrii ai consiliului si proiectul de hotarare avem microfonul sapte doamna microfonul sapte da ok ,"(1607.96, 1672.96)",1607.96,1672.96
15,Doamna Laura-Mihaela Fulgeanu-Moagher:,27080,Domnul Florin-Vasile Cîțu:,28675, va multumesc domnule presedinte de sedinta raport pentru numirea unor membri in consiliul national de integritate astazi s a hotarat sa se solicite membrilor grupurilor parlamentare si asociatiei magistratilor desemnarea membrilor titulari respectiv a membrilor supleanti pana la data de douazeci si opt februarie doua mii douazeci si doi in sedinta din treizeci mai doua mii douazeci si doi membrii prezenti ai comisiei juridice au analizat dosarele candidatilor si prevederile legale in materie si au hotarat cu majoritate in unanimitate de voturi avizarea favorabila in vederea numirii acestora de catre plenul senatului pentru functia de membru titular respectiv membru supleant al consiliului national de integritate potrivit art treizeci si cinci din legea nr o suta patruzeci si patru doua mii sapte privind infiintarea organizarea si functionarea agentiei nationale de integritate republicata cu modificarile si completarile ulterioare propunere membrii titulari supleanti doamna tanasica oana cristina membru titular vieriu vlad membru supleant frunzete claudia elena membru titular jijie alexandru madalin membru supleant barbu gabriel membru supleant bacaliuc dan membru titular din actele depuse la dosar s a constatat ca domnii mai sus mentionati au facut dovada implinirii tuturor conditiilor prevazute de lege in sensul celor precizate mai sus membrii comisiei juridice au adoptat un raport favorabil in vederea numirii acestor candidati ca membrii ai consiliului national de integritate va multumesc ,"(1672.96, 1766.96)",1672.96,1766.96
16,Domnul Florin-Vasile Cîțu:,28675,Domnul Virgil Guran:,31386, va multumesc si eu daca sunt interventii daca nu sunt interventii atunci stimati colegi potrivit prevederilor regulamentare va propun ca procedura de vot vot secret electronic pentru numirea unor membrii ai consiliului national de integritate pentru fiecare candidat in parte interventii la procedura de vot propusa ok supun la vot procedura de vot propusa va rog sa votati cu optzeci si noua de voturi pentru si un vot impotriva doamna monica anisie nu are cartela a fost aprobata procedura de vot mergem mai departe supun votului numirea doamnei tanasica oana cristina in calitate de membru titular al consiliului national de integritate desemnata de grupul parlamentar al pnl va rog sa votati este secret domnule senator este secret votul cu saptezeci si sapte de voturi pentru doisprezece impotriva si doua abtineri doamna tanasica a fost votata in calitate de membru titular supun votului numirea doamnei frunzete claudia elena in calitate de membru titular al consiliului national de integritate desemnata de grupul parlamentar al psd va rog sa votati cu saizeci si noua de voturi pentru zece voturi impotriva si cinci abtineri doamna frunzete claudia elena a fost votata in calitate de membru titular supun votului numirea domnului bacaliuc dan in calitate de membru titular al consiliului national de integritate desemnat de grupul parlamentar aur va rog sa votati vedeti domnule senator ca se saptezeci si sapte de voturi pentru un vot impotriva si opt abtineri domnul bacaliuc dan a fost votat supun votului numirea domnului vieriu vlad in calitate de membru supleant al consiliului national de integritate desemnat de grupul parlamentar al pnl va rog sa votati cu saptezeci si patru de voturi pentru sapte voturi impotriva si trei abtineri domnul vieriu vlad a fost votat membru supleant supun votului numirea domnului jijie alexandru madalin in calitate de membru supleant al consiliului national de integritate desemnat de grupul parlamentar al psd va rog sa votati cu saizeci si noua de voturi pentru opt impotriva cinci abtineri domnul jijie a fost votat membru supleant supun votului numirea domnului barbu gabriel in calitate de membru supleant al consiliului national de integritate desemnat de grupul parlamentar usr va rog sa votati cu saptezeci si trei de voturi pentru noua impotriva si patru abtineri domnul barbu gabriel a fost votat in calitate de membru supleant al consiliului national de integritate stimati colegi senatul a hotarat numirea in functii potrivit rezultatului votului exprimat anterior inainte de a trece mai departe domnul senator guran are o interventie si apoi domnul fenechiu pe procedura domnule guran va rog ,"(1766.96, 1994.96)",1766.96,1994.96
17,Domnul Virgil Guran:,31386,Domnul Florin-Vasile Cîțu:,31579, multumesc domnule presedinte buna ziua stimati colegi n o sa va vorbesc despre primari si despre proiecte ca cine stie ce mai interpreteaza presa si iar iese rau ,"(2024.96, 4957.96)",2024.96,4957.96
18,Domnul Florin-Vasile Cîțu:,31579,Domnul Virgil Guran:,31645, le aduceti aminte ,"(0.0, 6255.96)",0.0,6255.96
19,Domnul Virgil Guran:,31645,Domnul Florin-Vasile Cîțu:,32348, dar in schimb va pot spune ca de fiecare data cand sunt in teritoriu acolo unde raspund eu intr un judet frumos apropiat de bucuresti dambovita sa stiti ca vorbesc de bine activitatea parlamentului atat pentru cei care sunt la putere la guvernare cat si pentru cei care sunt in opozitie si le spun ca aici sunt foarte multi oameni seriosi si ca vrem sa facem lucruri bune pentru tara si pentru aceia am si de aceea am invitat tineri din judetul dambovita sunt veniti cu profesorii cu preotul si cu unul dintre cei mai buni primari din romania valentin mihalache si va rog sa i salutam si sa le multumim pentru prezenta ,"(2036.96, 2079.96)",2036.96,2079.96
20,Domnul Florin-Vasile Cîțu:,32348,Domnul Cătălin-Daniel Fenechiu:,32564, bine ati venit in parlamentul romaniei multumim domnului senator domnule lider al partidului national grupului partidului national liberal va rog frumos sa microfonul central ,"(42.879999999999995, 4931.96)",42.879999999999995,4931.96
21,Domnul Cătălin-Daniel Fenechiu:,32564,Domnul Florin-Vasile Cîțu:,33448, multumesc domnule presedinte am doua solicitari prima convenita in comitetul liderilor ca proiectul aflat pe punctul douazeci l296 doua mii douazeci si doi propunerea legislativa privind aprobarea procedurii de pregatire pentru reutilizare a deseurilor de echipamente electrice si electronice a cerintelor tehnice privind pregatirea pentru reutilizare si a cerintelor de raportare si monitorizare a echipamentelor electrice si electronice reutilizate sa fie retrimis la comisie cu termen doua saptamani de zile si o sa va rog sa supuneti la vot si punctul doi completarea ordinii de zi prin introducerea pe ordinea de zi a l288 doua mii douazeci si doi are raport dat chiar in urma cu putina vreme de comisia juridica si comisia economica si propunerea noastra este sa fie introdus pe pozitia trei ordinea urmand sa fie modificata corespunzator multumesc ,"(2096.96, 2165.96)",2096.96,2165.96
22,Domnul Florin-Vasile Cîțu:,33448,"Doamna Domnica-Doina Pârcălabu – secretar de stat la Ministerul Familiei, Tineretului",34775, multumesc domnule lider imediat deci in primul rand supunem la vot asa cum s a stabilit la comitetul liderilor retrimiterea la comisie a punctului douazeci pentru doua saptamani da pentru doua saptamani va rog sa votati cu saizeci si sase de voturi pentru si douazeci impotriva punctul douazeci retrimis la comisie cealalta propunere era ca l228 l228 da doua sute optzeci si opt l288 sa fie introdus la punctul trei pe ordinea de zi va rog sa votati cu saizeci si cinci de voturi pentru doua impotriva nouasprezece abtineri l288 a fost introdus la punctul trei daca nu mai sunt interventii incepem sectiunea a ii a continuam lucrarile si trecem la sectiunea a ii a a ordinii de zi la punctul unu este inscris proiectul de lege privind aprobarea ordonantei de urgenta a guvernului nr cincizeci si sapte doua mii douazeci si doi pentru modificarea si completarea legii nr doua sute doi doua mii doi privind egalitatea de sanse si de tratament intre femei si barbati si pentru modificarea art trei alin declar deschise dezbaterile generale asupra proiectului de lege din partea guvernului va rog pentru prezentarea proiectului de lege microfonul opt va rog ,"(2165.96, 2255.96)",2165.96,2255.96
23,"Doamna Domnica-Doina Pârcălabu – secretar de stat la Ministerul Familiei, Tineretului",34775,și Egalității de Șanse:,34862, ,"(0.0, 6255.96)",0.0,6255.96
