,start_text,start_index,end_text,end_index,text,timestamp,start,end
55,Domnul Florin-Vasile Cîțu:,58535,Domnul Antal István-Loránt:,58862, va multumesc stimati colegi la balcon avem o delegatie din judetul covasna comuna ghelinta la invitatia domnului senator fejer odon bine ati venit in parlamentul romaniei alte interventii domnule antal va rog domnule senator antal microfonul central sau unde doriti ,"(4029.96, 4040.96)",4029.96,4040.96
56,Domnul Antal István-Loránt:,58862,Domnul Florin-Vasile Cîțu:,59809, va multumesc mult domnule presedinte cum ne a explicat domnul secretar de stat acest fond de modernizare este un fond extrem de important de ce este extrem de important pentru ca este dedicat exclusiv investitiilor in domeniul energiei in ultimele luni am avut multe discutii dezbateri pe diferite proiecte legislative care privesc domeniul energiei si de foarte multe ori am spus ce nu s a facut in anii precedenti unde nu a existat curaj in ceea ce priveste eventuale investitii in acest domeniu extrem de important domeniu strategic categoric udmr va vota acest proiect de aprobare a ordonantei de urgenta si ceea ce nu trebuie sa gresim ca sa nu absorbim fondurile care sunt prevazute in acest fond de modernizare avem bani avem acest fond exclusiv pentru domeniul energiei de aici incolo e nevoie de proiecte clare de proiecte curajoase si decizii curajoase politice va multumesc mult ,"(4054.96, 4125.96)",4054.96,4125.96
57,Domnul Florin-Vasile Cîțu:,59809,Domnul Sorin-Ioan Bumb:,59948, va multumesc domnule senator interventie sorin bumb partidul national liberal microfonul doi ,"(4125.96, 4132.96)",4125.96,4132.96
58,Domnul Sorin-Ioan Bumb:,59948,Domnul Florin-Vasile Cîțu:,60930, multumesc domnule presedinte stimati colegi acest fond este foarte important pentru trecerea la energie verde stim foarte bine ca banii proveniti pe aceste certificate le platim tot noi mai ales intreprinderile care folosesc combustibili fosili deci acesti bani fiind platiti tot de noi si trecerea fiind destul de greoaie pentru ca nu putem inlocui investitii de pe o zi pe alta sper ca acest fond sa fie folosit cat mai util in modernizarea instalatiilor si in trecerea pe energie regenerabila in trecerea pe energie verde pe hidrogen si in obtinerea unor investitii care sa ne asigure siguranta sistemului energetic national atat a celui de electricitate cat si siguranta sistemului de gaze pentru ca stim in ce context traim si cred ca este una din prioritatile guvernului si ale noastre ale tuturor ca sa ne obtinem aceasta independenta de aceea pnl va vota pentru aceasta lege fiind o lege foarte importanta multumesc ,"(4135.96, 4208.96)",4135.96,4208.96
59,Domnul Florin-Vasile Cîțu:,60930,Domnul Cristian Bordei:,61056, multumesc domnule senator din partea usr domnul senator bordei va rog microfonul central ,"(2972.96, 4957.96)",2972.96,4957.96
60,Domnul Cristian Bordei:,61056,Domnul Florin-Vasile Cîțu:,63141, multumesc domnule presedinte as vrea sa spun din capul locului ca grupul usr va vota pentru aceasta lege care este extrem de importanta pentru ca in sfarsit se deblocheaza aceste miliarde de euro ale fondului de modernizare care sunt absolut necesare mai ales in acest context de criza energetica in care ne aflam cu aceasta ocazie as vrea totusi sa fac doua precizari in primul rand aceste miliarde de euro zac nefolosite de circa un an de zile tocmai pentru ca nu a existat legislatia necesara si sper ca macar partea care urmeaza de implementat de elaborarea ghidurilor de aplicare si de implementare a tuturor procedurilor necesare accesarii concrete si efective a banilor respectivi se va desfasura cu mult mai mare viteza pentru ca nu ne mai permitem sa pierdem timpul mai ales repet in aceasta situatie foarte critica in care ne aflam cu criza preturilor energiei si razboiul de langa noi necesitatea asigurarii securitatii energetice a romaniei in al doilea rand sper ca proiectele care vor fi finantate prin acest fond de modernizare sa tina cont si de un criteriu esential si anume acela al asigurarii echilibrului dintre productie si consum la nivel national in momentul de fata exista un dezechilibru major productia este concentrata in partea de sud a tarii si exista o parte foarte importanta a consumului in partea de nord a tarii si toate investitiile inclusiv din pnrr merg cu prioritate in continuare in partea de sud facand ca acest dezechilibru sa devina si mai grav sper ca macar proiectele care vor fi finantate prin fondul de modernizare sa se indrepte si spre jumatatea de nord a tarii spre transilvania de exemplu si fac apel la parlamentarii din transilvania si moldova sa se aplece asupra acestui subiect si sa terminam odata cu practica de a folosi drept criteriu decisiv in alocarea unor investitii localitatea de nastere din buletinul unui ministru sau al altor persoane cu putere de decizie la un moment dat va multumesc ,"(4224.96, 4379.96)",4224.96,4379.96
61,Domnul Florin-Vasile Cîțu:,63141,Domnul Dan Dumitrescu – secretar de stat la Ministerului Investițiilor și Proiectelor Europene:,63726, multumesc domnule senator daca nu mai sunt interventii declar incheiate dezbaterile initiativa legislativa ramane la vot final punctul sase al ordinii de zi proiectul de lege pentru aprobarea ordonantei de urgenta a guvernului nr saizeci si unu doua mii douazeci si doi privind unele masuri pentru acordarea de microgranturi si granturi pentru capital de lucru entitatilor din domeniul agroalimentar cu finantare din fonduri externe nerambursabile declar deschise dezbaterile asupra proiectului de lege dau cuvantul reprezentantului guvernului microfonul zece ,"(4379.96, 4384.96)",4379.96,4384.96
62,Domnul Dan Dumitrescu – secretar de stat la Ministerului Investițiilor și Proiectelor Europene:,63726,Domnul Florin-Vasile Cîțu:,64701, va multumesc domnule presedinte pentru acoperirea nevoii exprimate de guvern in pachetul de masuri sprijin pentru romania la nivelul ministerului investitiilor si proiectelor europene au fost identificate resurse financiare in programul operational competitivitate destinate pentru capital de lucru in contextul pandemiei de covid nouasprezece o alocare de o suta cincizeci de milioane de euro ce poate fi decontata prin fedr react eu in cadrul axei patru diferenta pana la trei sute de milioane de euro va fi asigurata prin implicarea mecanismului de supracontractare prevazut de art doisprezece ordonanta de urgenta nr patruzeci doua mii cincisprezece pachetul de sprijin va acoperi nevoia de finantare a unui numar cat mai mare de entitati in cel mai scurt timp pana cel tarziu la data de treizeci sase doua mii douazeci si doi avand in vedere cele prezentate mai sus va propun adoptarea in forma aprobata de guvern ,"(4419.96, 4467.96)",4419.96,4467.96
63,Domnul Florin-Vasile Cîțu:,64701,Domnul George Scarlat:,64812, va multumesc comisia pentru agricultura va rog pentru prezentarea raportului ,"(3865.96, 4957.96)",3865.96,4957.96
64,Domnul George Scarlat:,64812,Domnul Florin-Vasile Cîțu:,66077, multumesc domnule presedinte raportul comun asupra proiectului de lege pentru aprobarea ordonantei de urgenta a guvernului nr saizeci si unu privind unele masuri pentru acordarea de microgranturi si granturi pentru capital de lucru entitatilor din domeniul agroalimentar cu finantare din fonduri externe nerambursabile initiator guvernul romaniei ordonanta are ca obiect de reglementare cadrul procedural de aplicare a acordarii de ajutor de stat sub forma de microgranturi si granturi entitatilor din domeniul agroalimentar microgranturile sub forma de suma forfetara prin intermediul ministerului agriculturii si dezvoltarii rurale granturile pentru capital de lucru sub forma de suma forfetara in procent din cifra de afaceri prin intermediul ministerului antreprenoriatului si turismului comisiile supun spre dezbatere si adoptare plenului senatului raportul comun de admitere si proiectul de lege pentru aprobarea ordonantei de urgenta a guvernului nr saizeci si unu proiectul de lege face parte din categoria legilor ordinare senatul este prima camera sesizata si in sedintele din saptesprezece mai si douazeci si trei mai membrii celor trei comisii au hotarat in unanimitate de voturi sa adopte un raport comun de admitere va multumesc ,"(4478.96, 4552.96)",4478.96,4552.96
65,Domnul Florin-Vasile Cîțu:,66077,Domnul Lucian Trufin:,66192, va multumesc daca sunt interventii microfonul central imediat domnule imediat ,"(2921.96, 4957.96)",2921.96,4957.96
66,Domnul Lucian Trufin:,66192,Domnul Florin-Vasile Cîțu:,67584, stimati colegi agricultura si industria alimentara primesc astazi atentia respectul si sustinerea cuvenita din partea guvernului si parlamentului romaniei propunerea legislativa care face obiectul dezbaterii de astazi nu face nimic altceva decat sa sustina infuzia de capital in fermele si unitatile agroalimentare romanesti oferind o gura de oxigen astfel agriculturii si industriei alimentare romanesti sectoare care au fost grav afectate de pandemia covid nouasprezece dar si de razboiul ruso ucrainean de la granita noastra razboi care ameninta stabilitatea economica dar si securitatea alimentara drept urmare salut initiativa guvernului romaniei de a identifica si aloca o suma de trei sute de milioane de euro din care doua sute cincizeci de milioane pentru granturi pentru capital de lucru agrifood pe masura doi si cincizeci de milioane microgranturi in domeniul agriculturii pe masura unu aceasta ordonanta trebuie apreciata si prin prisma faptului ca initiativa guvernului a fost gandita si implementata intr un timp foarte scurt astfel aceasta suma ar fi fost ramasa necheltuita si pierduta de romania nevoia unui astfel de ajutor este evidentiata de numarul mare de cereri depuse treizeci si unu o suta optsprezece cereri pentru masura unu microgranturi in agricultura si zece opt sute douazeci si sapte de cereri pentru masura doi granturi grupul psd sustine adoptarea acestei initiative multumesc ,"(4564.96, 4672.96)",4564.96,4672.96
67,Domnul Florin-Vasile Cîțu:,67584,Domnul Sebastian Cernic:,67690, multumesc din partea grupului usr domnul cernic ,"(2972.96, 4957.96)",2972.96,4957.96
68,Domnul Sebastian Cernic:,67690,Domnul Florin-Vasile Cîțu:,70006, va multumesc domnule presedinte stimati colegi am sa repet ceea ce capul proiectului si anume ca avem de a face cu un cadru procedural de aplicare a acordarii de ajutor de stat sub forma de microgranturi si granturi pentru capitalul de lucru ce frumos suna insa totul suna bine pe hartie pentru ca guvernul nu a fost in stare sa implementeze nici acest proiect nu stiu daca ati vazut saptamana trecuta acele cozi ale fermierilor la birourile notariale ati vazut si stiri in media stiti de ce s a intamplat acel lucru micii fermieri au luat cu asalt notarii cu o zi inainte de deschiderea sesiunii pentru microgranturi pentru ca au aflat despre o noua hartie care trebuia depusa la dosar si anume o procura notariala au aflat cu o zi inainte de deschiderea sesiunii vedem cum predictibilitatea de care vorbea domnul ministru chesnoiu lipseste cu desavarsire au fost dispuse fonduri pentru zece zero de aplicatii si asa cum spunea bine colegul meu au fost treizeci zero de cereri bugetul prevazut nu a fost raportat la nevoile si potentialul fermierilor si mai mult a creat nemultumiri si discriminare si de ce spun acest lucru e pentru ca in alt program de finantare si anume pe sectorul zootehnic au fost alocati trei sute de milioane de euro insa stim foarte bine ca acei bani nu vor fi atrasi de catre fermieri nu acesta este modul de agricultura de care avem nevoie pentru dezvoltarea romaniei cu siguranta fermierii nu merita aceasta batjocura ii solicit din nou ministrului fugar al agriculturii adrian chesnoiu sa vina la discutii cu senatorii din comisia de specialitate este un mod de lucru si de dialog intre guvern si parlament ministrul a fost invitat oficial sa vina la comisa pentru agricultura sa avem o dezbatere serioasa si aplicata pe cifrele care pot ajuta astazi fermierii romani si agricultura vedem ca pana acum domnul chesnoiu ne sfideaza cu aroganta si dispret partea grava e ca la fel simt si fermierii si agricultorii romani din partea guvernului sfidare usr va vota pentru acest proiect de lege pentru ca nu putem lipsi fermierii de acest sprijin vital dar are mari retineri in ceea ce priveste calitatea legislativa a initiativei si considera ca este loc de mai bine va multumesc mult ,"(4677.96, 4828.96)",4677.96,4828.96
69,Domnul Florin-Vasile Cîțu:,70006,Domnul Nechita-Adrian Oros:,70249, multumesc de la partidul national liberal domnul oros de la dumneavoastra a mai vorbit cineva dumneavoastra la final replica bine dupa domnul oros va rog de la independenti domnul oros ma scuzati ,"(2972.96, 4957.96)",2972.96,4957.96
70,Domnul Nechita-Adrian Oros:,70249,Domnul Florin-Vasile Cîțu:,71282, multumesc domnule presedinte sigur vom vota si noi aceasta initiativa legislativa desi intrebarea pusa de colegul meu ramane pentru ca saptamana trecuta comisia a trimis a retrimis pentru refacere programul national strategic pentru perioada doua mii douazeci si trei doua mii douazeci si sapte e vorba de cincisprezece miliarde de euro iar comisia a avut trei sute saptezeci de observatii si neconformitati la acest program national strategic care totalizeaza repet cincisprezece miliarde de euro pentru strategia agriculturii pana in doua mii douazeci si sapte si atunci intrebarea mea este urmatoarea daca nu reusim sa absorbim acesti bani europeni intr un exercitiu care vine pentru a treia oara si unde calea era batuta cum vom reusi sa absorbim sau fermierii respectivi sa cheltuie acesti bani pentru capital de lucru mai mult cea mai grava observatie a comisiei este ca s a mutat intensitatea de sprijin de la fermierul mic de la ferma de familie de la partea de depozitare si procesare spre cu totul altceva spre alte prioritati multumesc ,"(4850.96, 4925.96)",4850.96,4925.96
71,Domnul Florin-Vasile Cîțu:,71282,Domnul Maricel Popa:,71433, era un drept la replica din partea domnului popa va rog microfonul trei vreti pe central trei ce vreti dumneavoastra trei ,"(4928.96, 4934.96)",4928.96,4934.96
72,Domnul Maricel Popa:,71433,Domnul Florin-Vasile Cîțu:,71762, domnule presedinte stimati colegi oare cat de ipocriti putem fi cand dumneavoastra stimati colegi de la usr cu ministrul dumneavoastra nu ati trecut nici macar un euro pentru irigatii in agricultura si spuneti ca sprijiniti agricultura nu ati fost niste criminali pentru agricultura multumesc ,"(4947.96, 4957.96)",4947.96,4957.96
73,Domnul Florin-Vasile Cîțu:,71762,Domnul George Scarlat:,71912, va multumesc as putea sa dau un drept la replica aici dar nu l dau nu are sens va rog domnul scarlat din partea ,"(4955.96, 4962.96)",4955.96,4962.96
74,Domnul George Scarlat:,71912,Domnul Florin-Vasile Cîțu:,73407, multumesc domnule presedinte ce placute sunt sedintele de plen atunci cand discutam de un sector atat de important dar cunoscandu l asa doar de pe margine vreau stimati colegi sa va spun din capul locului ca vom sustine grupul partidului national va vota acest proiect de lege si vreau sa multumesc public in numele fermierilor si a tuturor antreprenorilor din sectorul agroalimentar ministrului marcel bolos ministrul investitiilor si fondurilor europene pentru ca a gasit aceasta resursa de a finanta acolo unde din nefericire la strigatul de disperare al sectorului alti ministri ar fi trebuit sa gaseasca un sprijin mai mare si multumesc totodata ministrului antreprenoriatului domnul daniel cadariu pentru ca impreuna cu agentia pentru intreprinderi mici si mijlocii si de atragere de investitii si promovare a exportului au reusit sa implementeze aceasta schema astazi in continuare in derulare si bineinteles ca trebuie sa multumesc si domnului ministru al agriculturii pentru ca agentia de plati si interventii in agricultura in aceasta perioada implementeaza aceasta schema de microgranturi pana in cinci zero de euro pentru micii fermieri vom vota inca o data ma repet vom vota pentru cred ca la diverse chiar as putea explica vizavi de sumele prinse in planul national de redresare si rezilienta dar nu cred ca este acum momentul domnule presedinte va multumesc ,"(4976.96, 5055.96)",4976.96,5055.96
75,Domnul Florin-Vasile Cîțu:,73407,Domnul Ion-Narcis Mircescu:,73506, va multumesc domnul senator mircescu un drept la replica inteleg ,"(2972.96, 4957.96)",2972.96,4957.96
76,Domnul Ion-Narcis Mircescu:,73506,Domnul Florin-Vasile Cîțu:,74393, domnul senator popa haideti sa tragem linia mai tarziu si cand folosim cuvinte criminal si alte lucruri sa venim cu lucruri concrete pnrr ul este al guvernului romaniei dumneavoastra sunteti la guvernare criminala ar fi o actiune a guvernantilor care ar duce la neaccesarea fondurilor cum spre exemplu la ministerul transporturilor domnul grindeanu este foarte in urma si de asemenea aveti ministrul agriculturii si aveti peste cincisprezece miliarde pentru agricultura mai devreme un coleg din comisie a spus sunt peste trei sute saptezeci de observatii si neconformitati la care ministerul domnului chesnoiu tace haideti sa vedem ce face domnul chesnoiu cum implementeaza ministri psd programul pe care si l au asumat prin intrarea la guvernare si apoi putem sa lasam tot felul de epitete sa curga unde doriti dumneavoastra ,"(5066.96, 5121.96)",5066.96,5121.96
77,Domnul Florin-Vasile Cîțu:,74393,Domnul Lucian Trufin:,74634, va multumesc domnule popa haideti sa vreti sa mai interveniti domnule trufin dar va rog eu scurt si nu mai dati daca mai dam un drept la replica nu mai terminam deja suntem peste timpul de dezbateri ,"(3865.96, 4957.96)",3865.96,4957.96
78,Domnul Lucian Trufin:,74634,Domnul Florin-Vasile Cîțu:,74665, scurt ,"(4456.96, 5172.96)",4456.96,5172.96
79,Domnul Florin-Vasile Cîțu:,74665,Domnul Lucian Trufin:,74702, va rog ,"(5887.96, 6017.96)",5887.96,6017.96
80,Domnul Lucian Trufin:,74702,Domnul Florin-Vasile Cîțu:,75230, multumesc domnule presedinte diferenta intre haideti sa vedeti si ce se intampla astazi este exact consta in cele trei sute de milioane pe care cei din agricultura si din industria alimentara i au accesat asta este diferenta si asa cum a spus colegul nostru domnul presedinte al comisiei de agricultura sunt trei ministere care s au pus si au dat mana ca intr un termen scurt suma asta care ar fi ramas necheltuita sa vina in industria alimentara si in agricultura multumesc ,"(5149.96, 5183.96)",5149.96,5183.96
81,Domnul Florin-Vasile Cîțu:,75230,Domnul Constantin-Bogdan Matei:,79339, va multumesc incheiem dezbaterile aici proiectul de lege ramane la vot final stimati colegi am epuizat timpul alocat dezbaterilor trecem la vot final va rog frumos sa va introduceti cartelele in aparat sa fiti pregatiti pentru vot deci continuam lucrarile si trecem la exprimarea votului asupra initiativelor legislative avem si cateva dezbatute in sedinta plenului din douazeci si cinci mai respectiv initiative legislative proiecte de hotarare dezbatute astazi deci avem din douazeci si cinci mai si de astazi la punctul unu sectiunea a iii a propunerea legislativa pentru completarea legii nr nouazeci si opt doua mii saisprezece privind achizitiile publice si a legii nr nouazeci si noua doua mii saisprezece privind achizitiile sectoriale microfonul trei microfonul trei ,"(5183.96, 5203.96)",5183.96,5203.96
82,Domnul Constantin-Bogdan Matei:,79339,Domnul Florin-Vasile Cîțu:,79867, in primul rand vreau sa va multumesc stimati colegi patru mai reprezinta singura si prima medalie obtinuta la jocurile olimpice de catre federatia romana de rugby si profit de aceasta ocazie sa i multumesc fostului mare international si actualul presedinte al federatie romane de rugby alin petrache prezent astazi alaturi ,"(5600.96, 5617.96)",5600.96,5617.96
83,Domnul Florin-Vasile Cîțu:,79867,Domnul Constantin-Bogdan Matei:,79984, domnule senator cand este ziua cand este ziua ca nu scrie in titlu cand este ziua ,"(5632.96, 5632.96)",5632.96,5632.96
84,Domnul Constantin-Bogdan Matei:,79984,Domnul Florin-Vasile Cîțu:,80061, scrie in raport patru mai multumesc frumos ,"(3865.96, 5640.96)",3865.96,5640.96
