,start_text,start_index,end_text,end_index,text,timestamp,start,end
24,și Egalității de Șanse:,34862,Domnul Florin-Vasile Cîțu:,36271, multumesc domnule presedinte doamnelor si domnilor senatori sunt doina parcalabu secretar de stat la ministerul familiei tineretului si egalitatii de sanse ordonanta de urgenta nr cincizeci si sapte are ca obiect de reglementare punerea in concordanta a prevederilor legii nr doua sute doi doua mii doi privind statutul de organizare si functionare a agentiei nationale pentru egalitatea de sanse intre femei si barbati cu prevederile ordonantei nr o suta douazeci si unu privind structura guvernului ca urmare a faptului ca aceasta agentie agentia nationala pentru egalitatea de sanse intre femei si barbati a trecut din subordinea ministerului muncii si protectiei sociale in subordinea ministerului familiei tineretului si egalitatii de sanse si au fost stabilite aceste concordante pe de alta parte sunt implementate partial elemente ale directivei nr o mie o suta cincizeci si opt doua mii nouasprezece a uniunii europene privind definirea notiunilor introduse de aceasta directiva iar un alt punct priveste reglementarea modului de salarizare al institutiilor aflate in subordinea ministerului familiei tineretului si egalitatii de sanse in sensul de a si mentine drepturile salariale avute in ministerul muncii si protectiei sociale prin trecerea in coordonarea sau subordonarea noului minister fapt pentru care va rog sa aprobati proiectul de lege privind aprobarea ordonantei de urgenta nr cincizeci si sapte doua mii douazeci si doi va multumesc ,"(2287.96, 2407.96)",2287.96,2407.96
25,Domnul Florin-Vasile Cîțu:,36271,Domnul Ion Rotaru:,36528, va multumesc doamna secretar de stat mergem mai departe dau cuvantul reprezentantului comisiei domnul presedinte al comisiei pentru munca familie si protectie sociala pentru prezentarea raportului va rog ,"(2972.96, 4957.96)",2972.96,4957.96
26,Domnul Ion Rotaru:,36528,Domnul Florin-Vasile Cîțu:,37468, multumesc domnule presedinte comisia pentru munca a luat in dezbatere aceasta propunere de proiect de lege pentru aprobarea ordonantei guvernului nr cincizeci si sapte doua mii douazeci si doi asa cum a precizat si doamna secretar de stat parcalabu vizeaza modul in care este reglementata subordonarea agentiei nationale pentru egalitatea de sanse pentru femei si barbati de la ministerul muncii si solidaritatii sociale la ministerul familiei tineretului si egalitatii de sanse avem avize favorabile de la consiliul legislativ comisia pentru administratie comisia pentru buget si comisia pentru tineret si sport pe cale de consecinta comisia pentru munca a analizat si a adoptat cu majoritate de voturi un raport de admitere a propunerii legislative a proiectului de lege si supunem plenului senatului raportul de admitere si proiectul de lege legea este ordinara senatul fiind prima camera sesizata multumesc ,"(2421.96, 2475.96)",2421.96,2475.96
27,Domnul Florin-Vasile Cîțu:,37468,Doamna Gabriela Crețu:,37604, va multumesc daca avem interventii din partea colegilor senatori da microfonul central da poftiti ,"(3865.96, 4957.96)",3865.96,4957.96
28,Doamna Gabriela Crețu:,37604,Domnul Florin-Vasile Cîțu:,40455, multumesc domnule presedinte stimati colegi cred ca unsprezece articole din tratatele uniunii se refera la egalitatea dintre femei si barbati si era vorba si de transpunerea unor elemente dintr o directiva europeana n a trecut pe la comisia de afaceri europene secretariatul general stie el de ce dar as vrea sa spun cateva cuvinte constitutia spune la art saisprezece ca ne nastem toti egali functiile si demnitatile publice civile sau militare pot fi ocupate in conditiile legii de persoanele care au cetatenia romana si domiciliul in tara si continua statul roman garanteaza egalitatea de sanse intre femei si barbati pentru ocuparea acestor functii si demnitati iar la alin zice ca nimeni nu e mai presus de lege din pacate constitutia nu scrie si ca nimeni nu e mai prejos de lege ceea ce voiam sa spun este ca anes ul acum a fost doar mutat dintr un loc in altul este inca necesar dar nu este si suficient e necesar pentru ca traim intr o societate in care ne nastem egali dar care deja este ierarhizata rolurile sociale sunt deja definite si interiorizate si de femei si de barbati valorile sunt ierarhizate drepturile sunt impartite tratamentele sunt diferite iar aceste definitii trebuie schimbate pentru ca ele nu sunt date ele sunt facute de oameni data trecuta lunea trecuta la celebra dezbatere despre cote chiar ii dadeam exemplu colegului meu de banca de cum si au schimbat tatii modul de a gandi daca acum o suta cincizeci de ani s ar fi gandit doar sa le invete pe fete eventual sa cante la pian si sa fie neveste foarte supuse delicate si bune astazi cred ca nu exista tata in aceasta lume si in aceasta sala cu certitudine care sa nu doreasca ca fiica lui sa urmeze studii sa aiba o profesie sa se simta realizata din acest punct de vedere asa cum tot data trecuta imi amintesc un exemplu daca e vorba de felul in care sunt tratate femeile respectiv sunt tratati barbatii am sa amintesc numai un caz in virtutea ideii de egalitate s a deschis concursul intr un an si pentru femei in invatamantul superior militar si optzeci dintre locuri aproape au fost ocupate de acestea pentru ca erau curajoase pentru ca erau destepte pentru ca au raspuns foarte bine la examen pentru ca au trecut si testele fizice si asa mai departe urmatorul an le am scos de acolo voi incheia ca as putea sa va spun foarte multe lucruri exprimandu mi speranta ca ministerul si agentia vor functiona mai bine decat in trecut si exprimandu mi speranta ca legea privind cotele va trece si de camera astfel incat sa avem in aceasta sala nu doar colegele care au fost preferate de sefii barbati sa avem si destule colege care au fost trimise in parlament de femeile care sunt ca si barbatii cetateni ai romaniei multumesc ,"(2499.96, 2722.96)",2499.96,2722.96
29,Domnul Florin-Vasile Cîțu:,40455,Doamna Diana Iovanovici-Șoșoacă:,40572, va multumesc doamna senator daca mai sunt alte interventii doamna senator sosoaca ,"(2806.96, 4957.96)",2806.96,4957.96
30,Doamna Diana Iovanovici-Șoșoacă:,40572,Domnul Florin-Vasile Cîțu:,41378, multumesc nu as fi intervenit daca as fi vazut ca o tratati de la egal la egal pe doamna senator cretu pentru ca dansa a vorbit lucruri foarte importante insa prea putin ati ascultat o si de aici mergem catre legi pe care le adoptam despre egalitatea de sanse iar dumneavoastra barbatii din pacate nu dati decat sansa de a ajunge la microfon pentru ca sansa de a asculta si de a constientiza ceea ce vi se spune este o sansa undeva cam la distanta de la pamant la soare degeaba adoptati legi daca nu va schimbati efectiv modul de gandire de constientizare si de comportament va multumesc frumos probabil ca odata si odata o sa intelegeti ca de fapt nu poate exista un semn de egal acolo unde exista superioritatea femei multumesc ,"(2747.96, 2806.96)",2747.96,2806.96
31,Domnul Florin-Vasile Cîțu:,41378,Domnul Eugen Dogariu:,42158, va multumesc doamna senator daca mai sunt alte interventii daca nu mai sunt declar inchise dezbaterile initiativa legislativa ramane la vot final vreau sa va anunt ca avem la balcon invitati din partea domnului senator antal lorant un grup de patruzeci si unu de persoane de la casa de ajutor reciproc a pensionarilor din odorheiu secuiesc bine ati venit la parlamentul romaniei declar deschise dezbaterile generale asupra propunerii legislative dau cuvantul initiator avem nu avem guvern nu avem reprezentantul comisiei pentru mediu va rog ,"(2806.96, 2831.96)",2806.96,2831.96
32,Domnul Eugen Dogariu:,42158,Domnul Florin-Vasile Cîțu:,43255, multumesc domnule presedinte in temeiul art o suta noua din regulamentul senatului republicat cu modificarile si completarile ulterioare in sedinta din douazeci si trei mai doua mii douazeci si doi plenul senatului a hotarat trimiterea spre reexaminare a propunerii legislative pentru modificarea si completarea ordonantei de urgenta a guvernului nr nouazeci si doi doua mii douazeci si unu privind regimul deseurilor l216 doua mii douazeci si doi in vederea intocmirii unui raport suplimentar in sedinta din data de treizeci mai doua mii douazeci si doi membrii comisiei pentru mediu au dezbatut propunerea legislativa si au hotarat cu unanimitate de voturi sa adopte un raport suplimentar de admitere cu un amendament admis cuprins in anexa care face parte integranta din prezentul raport in consecinta comisia pentru mediu supune spre dezbatere si adoptare plenului senatului raportul suplimentar de admitere cu un amendament admis si propunerea legislativa in raport cu obiectul de reglementare propunerea legislativa face parte din categoria legilor ordinare senatul fiind prima camera sesizata va multumesc ,"(2867.96, 2921.96)",2867.96,2921.96
33,Domnul Florin-Vasile Cîțu:,43255,Domnul Cătălin-Daniel Fenechiu:,43373, va multumesc si eu interventii domnule senator fenechiu va rog microfonul central ,"(2921.96, 4957.96)",2921.96,4957.96
34,Domnul Cătălin-Daniel Fenechiu:,43373,Domnul Florin-Vasile Cîțu:,44085, multumesc domnule presedinte este o initiativa liberala a colegilor nostri de la camera deputatilor care pornind de la niste realitati care exista in zona protectiei mediului au venit practic cu un proiect care a amendat ordonanta pe doua aspecte pe de o parte in sensul inaspririi amenzilor in cazul anumitor fapte care constituie contraventii pe de alta parte a prevazut confiscarea mijloacelor de transport care servesc la savarsirea contraventiilor de mediu credem ca doar avand grija de mediu putem respira un aer sanatos putem trai intr o tara curata motiv pentru care partidul national liberal va vota pentru aceasta lege multumesc ,"(2932.96, 2972.96)",2932.96,2972.96
35,Domnul Florin-Vasile Cîțu:,44085,Domnul Ion-Dragoș Popescu:,44235, multumesc domnule senator domnule dragos popescu va rog microfonul doi sau vreti central central domnule popescu ,"(2972.96, 2974.96)",2972.96,2974.96
36,Domnul Ion-Dragoș Popescu:,44235,Domnul Florin-Vasile Cîțu:,44872, multumesc domnule presedinte intr adevar este o initiativa buna sunt prevederi care sunt preluate dintr o hotarare de guvern si o aduce la nivel de ordonanta insa vreau sa va reamintesc ca tot anul trecut tot colegii deputati pnl au avut o initiativa care scadea amenzile si care prin amendamente noi aici le am crescut si am prevazut si aceasta fapta de confiscare a mijloacelor de transport sau a vehiculelor ea a trecut de senat si se afla in dezbatere acum la camera deputatilor avem acest mijloc este in camera deputatilor si putem sa grabim daca chiar ne intereseaza multumesc ,"(2987.96, 3026.96)",2987.96,3026.96
37,Domnul Florin-Vasile Cîțu:,44872,Doamna Diana Iovanovici-Șoșoacă:,44982, multumesc daca mai sunt alte interventii doamna senator sosoaca ,"(2806.96, 4957.96)",2806.96,4957.96
38,Doamna Diana Iovanovici-Șoșoacă:,44982,Domnul Florin-Vasile Cîțu:,46134, multumesc cred ca ar trebui sa vorbim in primul rand ce se intampla cu aceste deseuri si de unde sunt aduse vad ca nimeni nu vorbeste de fapt ce se intampla in spatele a tot ceea ce vedem nu stiu daca stiti dar din martie doua mii douazeci si unu mafia napoletana a intrat in romania tocmai cu aceasta mafie a deseurilor daca nu stiti ar fi bine sa vorbiti cu procurori din italia care se ocupa de urmarirea a ceea ce face mafia napoletana in romania si va anunt ca ar trebui ca parchetele sa se implice mai mult pentru ca degeaba dati dumneavoastra aceste legi mafia isi face treaba foarte bine si se pare ca devine mai periculoasa decat in italia daca vreti va stau la dispozitie cu corpul de procurori din italia cu care colaborez de unde am toate informatiile daca va intereseaza cu adevarat ce se intampla in romania si despre deseurile care nu ar trebui sa existe in romania dar care sunt aduse si ascunse in transporturi care spun ca sunt de fapt deseuri permise nu nu sunt deseuri permise sunt aduse in romania iar romania a ajuns groapa de gunoi a deseurilor interzise din europa va multumesc ,"(3041.96, 3132.96)",3041.96,3132.96
39,Domnul Florin-Vasile Cîțu:,46134,Doamna Laura-Iuliana Scântei:,46776, va multumesc doamna senator alte interventii mai avem de la colegii senatori nu mai avem declar incheiate dezbaterile initiativa legislativa ramane la vot final la punctul trei este un proiect care a fost adus in fata proiectul de lege privind aprobarea ordonantei de urgenta a guvernului nr cincizeci si opt doua mii douazeci si doi pentru modificarea si completarea unor acte normative din domeniul protectiei consumatorilor declar deschise dezbaterile generale asupra proiectului dau cuvantul reprezentantului guvernului nu avem comisia juridica reprezentantul comisiei juridice pentru raport microfonul doi ,"(3143.96, 4384.96)",3143.96,4384.96
40,Doamna Laura-Iuliana Scântei:,46776,Domnul Florin-Vasile Cîțu:,48446, buna ziua domnule presedinte va multumesc intr adevar am fost sesizati de catre biroul permanent trei comisii permanente ale senatului comisia juridica comisia economica si comisia pentru antreprenoriat cu adoptarea unui raport comun asupra proiectului de lege privind aprobarea ordonantei de urgenta a guvernului nr cincizeci si opt doua mii douazeci si doi raportul a fost adoptat astazi intr o sedinta convocata inaintea plenului de astazi in care am mediat comisie juridica comisie economica si comisie pentru antreprenoriat cu privire la amendamente care au fost anterior solicitate de catre comisiile economica si pentru antreprenori amendamente care vizau in principal solutii legislative pentru realizarea transparentei fata de consumatori in cazul in care instantele judecatoresti pronunta prin hotarari judecatoresti definitive si constata existenta unor clauze abuzive in contractele comerciale si de asemenea termene clare pentru profesionisti ca atunci cand au fost constatate clauze abuzive in contractele comerciale nu doar sa le anunte pe site ci in acelasi timp in termen de treizeci de zile de la data ramanerii definitive a hotararii judecatoresti care a constatat si dreptul la despagubire restituirea sumelor de bani percepute anterior de catre comerciant in baza acelor clauze abuzive in termen de treizeci de zile profesionistii sa si realizeze aceasta obligatie de restituire a sumelor catre consumatori raportul este un raport de admitere cu amendamente admise votate de majoritatea membrilor celor trei comisii pe care il supunem votului plenului de astazi va multumesc ,"(3173.96, 3280.96)",3173.96,3280.96
41,Domnul Florin-Vasile Cîțu:,48446,Domnul Daniel-Cătălin Zamfir:,48632, va multumesc doamna presedinta a comisiei daca sunt interventii domnul senator zamfir la microfonul central microfonul central microfonul central ,"(2972.96, 4957.96)",2972.96,4957.96
42,Domnul Daniel-Cătălin Zamfir:,48632,Domnul Florin-Vasile Cîțu:,49509, stimati colegi directiva omnibus care iata propune acum schimbarea practic a trei legi in materie de protectia consumatorului suntem pusi astazi in fata acestei ordonante de urgenta pe care va invitam cu drag sa o votati intrucat amendamentele aduse convenite acum impreuna cu cele trei comisii juridica economica si antreprenoriat creeaza o transparenta pe de o parte a consumatorului in legatura cu acest lucru si mai mult decat atat poate lucrul cel mai important creeaza anpc ului parghia de a putea interveni si corecta aceste clauze abuzive inclusiv prin introducerea unei amenzi pe cifra de afaceri considerabila fapt care in mod categoric va diminua posibilitatea bancilor de a mai continua cu aceste clauze abuzive partidul social democrat va vota aceasta initiativa multumim mult ,"(3304.96, 3382.96)",3304.96,3382.96
43,Domnul Florin-Vasile Cîțu:,49509,Doamna Kovács Irina Elisabeta:,50261, va multumesc domnule senator daca mai sunt alte interventii nu mai sunt declar incheiate dezbaterile initiativa legislativa ramane la vot final punctul patru al ordinii de zi propunerea legislativa pentru modificarea si completarea legii nr cinci sute paisprezece din douazeci si opt noiembrie doua mii trei privind organizarea si exercitarea profesiei de consilier juridic cu modificarile si completarile ulterioare declar deschise dezbaterile generale asupra propunerii dau cuvantul initiatorului daca este prezent nu este prezent nici din partea guvernului nu avem avem initiatorul a haideti doamna va rog dar trebuia sa veniti aici in fata haideti in fata vreti microfonul doi sau veniti mai in fata microfonul doi ,"(3399.96, 3437.96)",3399.96,3437.96
44,Doamna Kovács Irina Elisabeta:,50261,Domnul Florin-Vasile Cîțu:,50914, multumesc domnule presedinte avand in vedere faptul ca profesia de consilier juridic impune numeroase restrictii aceasta initiativa legislativa vine sa extinda cadrul de activitati compatibile cu profesia de consilier juridic in acest fel se elimina o discriminare intre profesiile din acelasi domeniu si anume avocati executori judecatoresti magistrati sau notari publici astfel consilierii juridici vor avea dreptul conform acestei initiative legislative sa predea nu doar in invatamantul universitar ci si in invatamantul preuniversitar udmr sustine aceasta initiativa legislativa va multumesc ,"(3442.96, 3496.96)",3442.96,3496.96
45,Domnul Florin-Vasile Cîțu:,50914,Doamna Laura-Iuliana Scântei:,51081, va multumesc si eu din partea guvernului am spus ca nu avem comisia juridica pentru raport microfonul central va rog ,"(3496.96, 3507.96)",3496.96,3507.96
46,Doamna Laura-Iuliana Scântei:,51081,Domnul Florin-Vasile Cîțu:,52137, va multumesc domnule presedinte comisia juridica a fost sesizata de biroul permanent pentru adoptarea unui raport asupra propunerii legislative privind modificarea si completarea legii nr cinci sute paisprezece doua mii trei privind organizarea si exercitarea profesiei de consilier juridic o initiativa apartinand grupurilor parlamentare pnl psd usr si udmr asa cum si initiatorul a precizat anterior scopul acestei initiative este acela de a permite consilierilor juridici sa exercite activitatea didactica si in mediul preuniversitar in legea in vigoare fiind prevazuta doar posibilitatea de a avea activitate didactica in mediul universitar exclusiv consiliul legislativ precum si consiliul economic si social au transmis avize favorabile cu observatii si propuneri care au fost transpuse de comisia juridica in cuprinsul unor amendamente de tehnica legislativa raportul comisiei juridice este un raport de admitere a propunerii legislative cu amendamente admise pe care il supunem plenului senatului va multumesc ,"(3537.96, 3574.96)",3537.96,3574.96
47,Domnul Florin-Vasile Cîțu:,52137,Domnul Cătălin-Daniel Fenechiu:,52259, va multumesc daca sunt interventii domnule senator fenechiu va rog microfonul central ,"(2921.96, 4957.96)",2921.96,4957.96
48,Domnul Cătălin-Daniel Fenechiu:,52259,Domnul Florin-Vasile Cîțu:,53635, multumesc foarte frumos domnule presedinte viata a demonstrat ca e nevoie ca si cei care activeaza in zona consilierilor juridici sa poata fi implicati in alte tipuri de activitati parlamentul a legiferat o legislatie care statueaza introduce educatia juridica in scoli parlamentul a legiferat posibilitatea ca alte profesii juridice sa poata sa exercite profesia de profesor in invatamantul preuniversitar sau in invatamantul juridic de nespecialitate era cat se poate de firesc ca pentru a da eficienta acestor legi sa gasesti corpul de profesionisti necesari care sa poata pe de o parte sa predea in licee sau chiar in scoli pe de alta parte in facultatile care nu sunt de profil juridic masa consilierilor juridici o masa cifrata la circa douazeci zero de persoane in romania este un foarte bun izvor pentru oameni care sa predea educatia juridica pentru oameni care sa predea drept sa predea diverse discipline din zona dreptului in licee comerciale in licee tehnice chiar si in licee teoretice colegi din partidul national liberal au initiat aceasta propunere legislativa grupul partidului national liberal va sustine aceasta lege si le uram succes colegilor consilieri juridici care vor sa activeze in profesiile didactice evident urmand si modulul didactic multumesc ,"(3591.96, 3687.96)",3591.96,3687.96
49,Domnul Florin-Vasile Cîțu:,53635,Domnul Constantin Ștefan – secretar de stat la Ministerul Energiei:,54261, va multumesc domnule senator daca sunt alte interventii nu mai sunt alte interventii declar incheiate dezbaterile initiativa legislativa ramane la vot final punctul cinci proiectul de lege pentru aprobarea ordonantei de urgenta a guvernului nr saizeci doua mii douazeci si doi privind stabilirea cadrului institutional si financiar de implementare si gestionare a fondurilor alocate romaniei prin fondul pentru modernizare precum si pentru modificarea si completarea unor acte normative declar deschise dezbaterile generale asupra proiectului de lege reprezentantul guvernului microfonul noua ,"(4379.96, 4384.96)",4379.96,4384.96
50,Domnul Constantin Ștefan – secretar de stat la Ministerul Energiei:,54261,Domnul Florin-Vasile Cîțu:,56159, multumesc domnule presedinte doamnelor si domnilor senatori proiectul de lege privind aprobarea ordonantei de urgenta nr saizeci doua mii douazeci si doi pentru stabilirea cadrului institutional si financiar de implementare si gestionare a fondurilor pentru instituirea fondului de modernizare acesta aflat la dispozitia romaniei va avea o valoare de aproximativ cincisprezece miliarde de euro provenit din vanzarea certificatelor de emisii de gaze cu efect de sera in perioada doua mii douazeci si unu doua mii douazeci si doi obiectivele fondului pentru modernizare vizeaza tranzitia catre un sistem energetic cu emisii reduse de carbon prin stimularea investitiilor in capacitati de productie de energie electrica din surse regenerabile retele de transport care sa includa si distributia energiei termice in zonele rezidentiale si comerciale interconectari de retele pentru transportul energiei electrice si al gazelor naturale stocarea energiei electrice si eficienta energetica in productia de energie organismele cu atributii in controlul si gestionarea fondurilor pentru modernizare sunt ministerul energiei si consiliul concurentei ministerul energiei va intocmi ghidurile specifice si procedurile necesare pentru derularea proiectelor de investitii am sa va dau cateva date din anul doua mii douazeci si unu cat a incasat romania din vanzarea certificatelor de co din fondul pentru modernizare aproximativ unu o suta saizeci si trei zero zero de euro prin vanzarea a douazeci si unu cinci doi milioane de certificate anul acesta pana pe douazeci si patru cinci romania a incasat aproximativ doua sute optzeci si patru de milioane de euro din vanzarea a aproximativ trei doua sute saizeci si patru zero de certificate ramanand sa mai tranzactioneze pana la finalul anului aproximativ saptesprezece milioane de certificate cu o valoare estimata de unu patru miliarde de euro deci in total pentru anul doua mii douazeci si doi romania va incasa aproximativ unu sapte miliarde de euro va multumesc ,"(3747.96, 3867.96)",3747.96,3867.96
51,Domnul Florin-Vasile Cîțu:,56159,Domnul Antal István-Loránt:,56253, va multumesc din partea comisiei pentru energie microfonul sase ,"(3865.96, 3869.96)",3865.96,3869.96
52,Domnul Antal István-Loránt:,56253,Domnul Florin-Vasile Cîțu:,57504, va multumesc domnule presedinte stimati colegi in urma dezbaterilor care au avut loc in sedintele din douazeci si patru mai doua mii douazeci si doi si treizeci mai doua mii douazeci si doi membrii comisiei pentru energie infrastructura energetica si resurse minerale au analizat proiectul de lege avizele primite si au hotarat cu unanimitatea voturilor senatorilor prezenti sa adopte raport de admitere cu amendamente admise consiliul legislativ a avizat favorabil comisia economica industrii si servicii a adoptat aviz favorabil comisia pentru antreprenoriat si turism a adoptat aviz favorabil comisia pentru buget finante activitate bancara si piata de capital a adoptat aviz favorabil comisia pentru comunicatii si tehnologia informatiei a adoptat aviz favorabil comisia pentru mediu a adoptat aviz favorabil comisia pentru munca familie si protectie sociala a adoptat de asemenea aviz favorabil proiectul de lege face parte din categoria legilor ordinare senatul este prima camera sesizata fata de cele prezentate comisia pentru energie infrastructura energetica si resurse minerale supune plenului senatului pentru dezbatere si adoptare raportul de admitere cu amendamente admise si proiectul de lege va multumesc ,"(3875.96, 3945.96)",3875.96,3945.96
53,Domnul Florin-Vasile Cîțu:,57504,Domnul Ștefan-Radu Oprea:,57593, va multumesc interventii domnule senator oprea va rog ,"(2972.96, 4957.96)",2972.96,4957.96
54,Domnul Ștefan-Radu Oprea:,57593,Domnul Florin-Vasile Cîțu:,58535, multumesc mult domnule presedinte cincisprezece miliarde de euro da cincisprezece miliarde de euro care pot sa intre in sprijinul energiei din romania in retele de transport in modernizarea lor in energii regenerabile eoliene in sprijin pentru agricultorii romani care pot deveni independenti energetic atunci cand sunt in mijlocul campului daca vor avea sprijin pentru a si monta panouri solare cincisprezece miliarde de euro care pot sa ne duca la independenta energetica a romaniei lucru pe care cred ca ni l dorim cu totii romanii au o vorba mai bine acum decat deloc bine ca astazi votam in senat acest proiect de lege referitor la aceasta initiativa referitoare la fondul de modernizare si mi doresc ca in mod intelept sa reusim sa modernizam sistemul energetic national si sa devenim independenti din punct de vedere energetic grupul senatorilor psd va vota aceasta initiativa va multumesc ,"(3956.96, 4029.96)",3956.96,4029.96
